3790_140725_000045_000000	But, besides, how do these gentry know, that, supposing they could trace back their ancestry for one, two, three, or even five hundred years, that then the original stems of these poor families, though they have not kept such elaborate records of their good-for nothingness, as it often proves, were not still deeper rooted?--And how can they be assured, that one hundred years hence, or two, some of those now despised upstart families may not revel in their estates, while their descendants may be reduced to the others' dunghills!--And, perhaps, such is the vanity, as well as changeableness, of human estates, in their turns set up for pride of family, and despise the others!	But, besides, how do these gentry know, that, supposing they could trace back their ancestry for one, two, three, or even five hundred years, that then the original stems of these poor families, though they have not kept such elaborate records of their good for nothingness, as it often proves, were not still deeper rooted?--And how can they be assured, that one hundred years hence, or two, some of those now despised upstart families may not revel in their estates, while their descendants may be reduced to the others' dunghills!--And, perhaps, such is the vanity, as well as changeableness, of human estates, in their turns set up for pride of family, and despise the others!	false	1204.13	1242.13	16
3790_140725_000046_000000	These reflections occurred to my thoughts, made serious by my master's indisposition, and this proud letter of the lowly Lady Davers, against the high-minded Pamela.	These reflections occurred to my thoughts, made serious by my master's indisposition, and this proud letter of the lowly Lady Davers, against the high minded Pamela.	true	1242.77	1251.49	14
3790_140725_000046_000001	Lowly, I say, because she could stoop to such vain pride; and high-minded I, because I hope I am too proud ever to do the like!--But, after all, poor wretches that we be! we scarce know what we are, much less what we shall be!--But, once more pray I to be kept from the sinful pride of a high estate.	Lowly, I say, because she could stoop to such vain pride; and high minded I, because I hope I am too proud ever to do the like!--But, after all, poor wretches that we be! we scarce know what we are, much less what we shall be!--But, once more pray I to be kept from the sinful pride of a high estate.	false	1252.01	1269.82	17
3790_140725_000047_000000	On this occasion I recall the following lines, which I have read; where the poet argues in a much better manner:--	On this occasion I recall the following lines, which I have read; where the poet argues in a much better manner:--	true	1270.64	1276.3	16
3790_140725_000048_000000	"------------Wise Providence Does various parts for various minds dispense: The meanest slaves, or those who hedge and ditch, Are useful, by their sweat, to feed the rich. The rich, in due return, impart their store; Which comfortably feeds the lab'ring poor. Nor let the rich the lowest slave disdain: He's equally a link of Nature's chain: Labours to the same end, joins in one view; And both alike the will divine pursue; And, at the last, are levell'd, king and slave, Without distinction, in the silent grave."	"------------Wise Providence Does various parts for various minds dispense: The meanest slaves, or those who hedge and ditch, Are useful, by their sweat, to feed the rich. The rich, in due return, impart their store; Which comfortably feeds the lab'ring poor. Nor let the rich the lowest slave disdain: He's equally a link of Nature's chain: Labours to the same end, joins in one view; And both alike the will divine pursue; And, at the last, are levell'd, king and slave, Without distinction, in the silent grave."	false	1277.18	1310.11	21.240671
3790_140725_000049_000000	Wednesday morning.	Wednesday morning.	true	1310.24	1311.61	19.157991
3790_140725_000050_000000	My master sent me a message just now, that he was so much better, that he would take a turn, after breakfast, in the chariot, and would have me give him my company.	My master sent me a message just now, that he was so much better, that he would take a turn, after breakfast, in the chariot, and would have me give him my company.	true	1312.34	1320.67	19
3790_140725_000050_000001	I hope I shall know how to be humble, and comport myself as I should do, under all these favours.	I hope I shall know how to be humble, and comport myself as I should do, under all these favours.	true	1320.95	1325.86	13
3790_140725_000051_000000	Mrs. Jewkes is one of the most obliging creatures in the world; and I have such respects shewn me by every one, as if I was as great as Lady Davers--But now, if this should all end in the sham-marriage!--It cannot be, I hope.	mrs Jewkes is one of the most obliging creatures in the world; and I have such respects shewn me by every one, as if I was as great as Lady Davers-But now, if this should all end in the sham marriage!--It cannot be, I hope.	true	1327.01	1338.85	16
3790_140725_000051_000001	Yet the pride of greatness and ancestry, and such-like, is so strongly set out in Lady Davers's letter, that I cannot flatter myself to be so happy as all these desirable appearances make for me. Should I be now deceived, I should be worse off than ever.	Yet the pride of greatness and ancestry, and such like, is so strongly set out in Lady Davers's letter, that I cannot flatter myself to be so happy as all these desirable appearances make for me. Should I be now deceived, I should be worse off than ever.	false	1338.98	1352.73	16
3790_140725_000051_000002	But I shall see what light this new honour will procure me!--So I'll get ready.	But I shall see what light this new honour will procure me!--So I'll get ready.	true	1352.73	1356.94	23.007845
3790_140725_000051_000003	But I won't, I think, change my garb.	But I won't, I think, change my garb.	true	1357.19	1359.46	20.58194
3790_140725_000051_000004	Should I do it, it would look as if I would be nearer on a level with him: and yet, should I not, it might be thought a disgrace to him: but I will, I think, open the portmanteau, and, for the first time since I came hither, put on my best silk nightgown.	Should I do it, it would look as if I would be nearer on a level with him: and yet, should I not, it might be thought a disgrace to him: but I will, I think, open the portmanteau, and, for the first time since I came hither, put on my best silk nightgown.	false	1359.46	1372.12	14
3790_140725_000051_000005	But then that will be making myself a sort of right to the clothes I had renounced; and I am not yet quite sure I shall have no other crosses to encounter.	But then that will be making myself a sort of right to the clothes I had renounced; and I am not yet quite sure I shall have no other crosses to encounter.	false	1372.52	1380.52	16
3790_140725_000051_000006	So I will go as I am; for, though ordinary, I am as clean as a penny, though I say it.	So I will go as I am; for, though ordinary, I am as clean as a penny, though I say it.	true	1380.59	1385.71	13
3790_140725_000051_000007	So I'll e'en go as I am, except he orders otherwise.	So I'll e'en go as I am, except he orders otherwise.	true	1386.2	1389.34	15.275473
3790_140725_000051_000008	Yet Mrs. Jewkes says, I ought to dress as fine as I can.--But I say, I think not.	Yet mrs Jewkes says, I ought to dress as fine as I can.--But I say, I think not.	true	1389.41	1394.65	19
3790_140725_000051_000009	As my master is up, and at breakfast, I will venture down to ask him how he will have me be.	As my master is up, and at breakfast, I will venture down to ask him how he will have me be.	false	1395.11	1400.82	18.09778
3790_140725_000052_000000	Well, he is kinder and kinder, and, thank God, purely recovered!--How charmingly he looks, to what he did yesterday!	Well, he is kinder and kinder, and, thank God, purely recovered!--How charmingly he looks, to what he did yesterday!	true	1400.82	1406.91	13
3790_140725_000052_000001	Blessed be God for it!	Blessed be God for it!	true	1406.91	1408.42	23
3790_140725_000053_000000	He arose, and came to me, and took me by the hand, and would set me down by him; and he said, My charming girl seemed going to speak.	He arose, and came to me, and took me by the hand, and would set me down by him; and he said, My charming girl seemed going to speak.	true	1408.76	1415.49	13
3790_140725_000053_000001	What would you say?--Sir, said I, (a little ashamed,) I think it is too great an honour to go into the chariot with you.	What would you say?--Sir, said I, (a little ashamed,) I think it is too great an honour to go into the chariot with you.	true	1415.49	1422.19	20
3790_140725_000053_000002	No, my dear Pamela, said he; the pleasure of your company will be greater than the honour of mine; and so say no more on that head.	No, my dear Pamela, said he; the pleasure of your company will be greater than the honour of mine; and so say no more on that head.	false	1422.5	1428.94	13
3790_140725_000054_000000	But, sir, said I, I shall disgrace you to go thus.	But, sir, said I, I shall disgrace you to go thus.	true	1429.31	1432.18	19
3790_140725_000054_000001	You would grace a prince, my fair-one, said the good, kind, kind gentleman! in that dress, or any you shall choose: And you look so pretty, that, if you shall not catch cold in that round-eared cap, you shall go just as you are.	You would grace a prince, my fair one, said the good, kind, kind gentleman! in that dress, or any you shall choose: And you look so pretty, that, if you shall not catch cold in that round eared cap, you shall go just as you are.	true	1432.46	1444.21	17
3790_140725_000054_000002	But, sir, said I, then you'll be pleased to go a bye-way, that it mayn't be seen you do so much honor to your servant.	But, sir, said I, then you'll be pleased to go a bye way, that it mayn't be seen you do so much honor to your servant.	true	1444.43	1450.85	17
3790_140725_000054_000003	O my good girl! said he, I doubt you are afraid of yourself being talked of, more than me: for I hope by degrees to take off the world's wonder, and teach them to expect what is to follow, as a due to my Pamela.	O my good girl! said he, I doubt you are afraid of yourself being talked of, more than me: for I hope by degrees to take off the world's wonder, and teach them to expect what is to follow, as a due to my Pamela.	true	1450.85	1462.27	18
3790_140725_000055_000000	O the dear good man!	O the dear good man!	true	1462.73	1464.36	19
3790_140725_000055_000001	There's for you, my dear father and mother!--Did I not do well now to come back?--O could I get rid of my fears of this sham-marriage, (for all this is not yet inconsistent with that frightful scheme,) I should be too happy!	There's for you, my dear father and mother!--Did I not do well now to come back?--O could I get rid of my fears of this sham marriage, (for all this is not yet inconsistent with that frightful scheme,) I should be too happy!	true	1464.36	1476.01	19
3790_140725_000056_000000	So I came up, with great pleasure, for my gloves: and now wait his kind commands.	So I came up, with great pleasure, for my gloves: and now wait his kind commands.	true	1476.56	1480.72	16
3790_140725_000056_000001	Dear, dear sir! said I to myself, as if I was speaking to him, for God's sake let me have no more trials and reverses; for I could not bear it now, I verily think!	Dear, dear sir! said I to myself, as if I was speaking to him, for God's sake let me have no more trials and reverses; for I could not bear it now, I verily think!	true	1480.82	1490.67	16
3790_140725_000057_000000	At last the welcome message came, that my master was ready; and so I went down as fast as I could; and he, before all the servants, handed me in, as if I was a lady; and then came in himself.	At last the welcome message came, that my master was ready; and so I went down as fast as I could; and he, before all the servants, handed me in, as if I was a lady; and then came in himself.	true	1490.67	1501.45	14
3790_140725_000057_000001	Mrs. Jewkes begged he would take care he did not catch cold, as he had been ill.	mrs Jewkes begged he would take care he did not catch cold, as he had been ill.	true	1501.73	1506.04	17
3790_140725_000057_000002	And I had the pride to hear his new coachman say, to one of his fellow-servants, They are a charming pair, I am sure!	And I had the pride to hear his new coachman say, to one of his fellow servants, They are a charming pair, I am sure!	true	1506.05	1512.25	16
3790_140725_000057_000003	'tis pity they should be parted!--O my dear father and mother!	'tis pity they should be parted!--O my dear father and mother!	true	1512.29	1516.01	19.735512
3790_140725_000057_000004	I fear your girl will grow as proud as any thing!	I fear your girl will grow as proud as any thing!	true	1516.01	1518.88	16
3790_140725_000057_000005	And, especially, you will think I have reason to guard against it, when you read the kind particulars I am going to relate.	And, especially, you will think I have reason to guard against it, when you read the kind particulars I am going to relate.	false	1519.04	1529.97	20.716337
