3790_140725_000024_000001	But Monsieur Colbrand's horse beginning to give way, made a doubt between them: wherefore I said, (hating to be on the road,) if it could be done, I should bear it well enough, I hoped; and that Monsieur Colbrand might leave his horse, when it failed, at some house, and come into the chariot.	But Monsieur Colbrand's horse beginning to give way, made a doubt between them: wherefore I said, (hating to be on the road,) if it could be done, I should bear it well enough, I hoped; and that Monsieur Colbrand might leave his horse, when it failed, at some house, and come into the chariot.	false	603.78	618.19	17
3790_140725_000024_000002	This pleased them both; and, about twelve miles short, he left the horse, and took off his spurs and holsters, etc. and, with abundance of ceremonial excuses, came into the chariot; and I sat the easier for it; for my bones ached sadly with the jolting, and so many miles travelling in so few hours, as I have done, from Sunday night, five o'clock.	This pleased them both; and, about twelve miles short, he left the horse, and took off his spurs and holsters, etc and, with abundance of ceremonial excuses, came into the chariot; and I sat the easier for it; for my bones ached sadly with the jolting, and so many miles travelling in so few hours, as I have done, from Sunday night, five o'clock.	false	618.44	635.98	15
3790_140725_000024_000003	But, for all this, it was eleven o'clock at night, when we came to the village adjacent to my master's; and the horses began to be very much tired, and Robin too: but I said, It would be pity to put up only three miles short of the house.	But, for all this, it was eleven o'clock at night, when we came to the village adjacent to my master's; and the horses began to be very much tired, and Robin too: but I said, It would be pity to put up only three miles short of the house.	false	636.11	651.52	19.741774
3790_140725_000025_000000	So about one we reached the gate; but every body was a-bed.	So about one we reached the gate; but every body was a bed.	true	653.21	656.77	19
3790_140725_000025_000001	But one of the helpers got the keys from Mrs. Jewkes, and opened the gates; and the horses could hardly crawl into the stable.	But one of the helpers got the keys from mrs Jewkes, and opened the gates; and the horses could hardly crawl into the stable.	true	657.02	662.5	17
3790_140725_000025_000002	And I, when I went to get out of the chariot, fell down, and thought I had lost the use of my limbs.	And I, when I went to get out of the chariot, fell down, and thought I had lost the use of my limbs.	false	662.75	668.23	11
3790_140725_000026_000000	Mrs. Jewkes came down with her clothes huddled on, and lifted up her hands and eyes, at my return; but shewed more care of the horses than of me.	mrs Jewkes came down with her clothes huddled on, and lifted up her hands and eyes, at my return; but shewed more care of the horses than of me.	false	668.6	675.67	11
3790_140725_000026_000001	By that time the two maids came; and I made shift to creep in, as well as I could.	By that time the two maids came; and I made shift to creep in, as well as I could.	true	675.98	680.47	16
3790_140725_000027_000000	It seems my poor master was very ill indeed, and had been upon the bed most part of the day; and Abraham (who succeeded John) sat up with him. And he was got into a fine sleep, and heard not the coach come in, nor the noise we made; for his chamber lies towards the garden,--on the other side of the house.	It seems my poor master was very ill indeed, and had been upon the bed most part of the day; and Abraham (who succeeded john) sat up with him. And he was got into a fine sleep, and heard not the coach come in, nor the noise we made; for his chamber lies towards the garden,--on the other side of the house.	true	680.99	697.87	16
3790_140725_000027_000001	Mrs. Jewkes said, He had a feverish complaint, and had been blooded; and, very prudently, ordered Abraham, when he awaked, not to tell him I was come, for fear of surprising him, and augmenting his fever; nor, indeed, to say any thing of me, till she herself broke it to him in the morning, as she should see how he was.	mrs Jewkes said, He had a feverish complaint, and had been blooded; and, very prudently, ordered Abraham, when he awaked, not to tell him I was come, for fear of surprising him, and augmenting his fever; nor, indeed, to say any thing of me, till she herself broke it to him in the morning, as she should see how he was.	true	698.27	714.91	15
3790_140725_000028_000000	So I went to bed with Mrs. Jewkes, after she had caused me to drink almost half a pint of burnt wine, made very rich and cordial, with spices; which I found very refreshing, and set me into a sleep I little hoped for.	So I went to bed with mrs Jewkes, after she had caused me to drink almost half a pint of burnt wine, made very rich and cordial, with spices; which I found very refreshing, and set me into a sleep I little hoped for.	true	716.09	727.12	15
3790_140725_000029_000000	Tuesday morning.	Tuesday morning.	true	728.03	729.4	19.313423
3790_140725_000030_000000	Getting up pretty early, I have written thus far, while Mrs. Jewkes lies snoring in bed, fetching up her last night's disturbance.	Getting up pretty early, I have written thus far, while mrs Jewkes lies snoring in bed, fetching up her last night's disturbance.	true	730.22	736.84	16
3790_140725_000030_000001	I long for her rising, to know how my poor master does.	I long for her rising, to know how my poor master does.	true	737.06	740.14	14
3790_140725_000030_000002	'Tis well for her she can sleep so purely.	'tis well for her she can sleep so purely.	true	740.33	742.725	20
3790_140725_000030_000003	No love, but for herself, will ever break her rest, I am sure.	No love, but for herself, will ever break her rest, I am sure.	true	742.725	746.41	18
3790_140725_000030_000004	I am deadly sore all over, as if I had been soundly beaten.	I am deadly sore all over, as if I had been soundly beaten.	true	746.96	750.12	17
3790_140725_000030_000005	I did not think I could have lived under such fatigue.	I did not think I could have lived under such fatigue.	true	750.12	753.43	21.559153
3790_140725_000031_000000	Mrs. Jewkes, as soon as she got up, went to know how my master did, and he had had a good night; and, having drank plentifully of sack whey, had sweated much; so that his fever had abated considerably.	mrs Jewkes, as soon as she got up, went to know how my master did, and he had had a good night; and, having drank plentifully of sack whey, had sweated much; so that his fever had abated considerably.	true	753.95	764.38	15
3790_140725_000031_000001	She said to him, that he must not be surprised, and she would tell him news.	She said to him, that he must not be surprised, and she would tell him news.	true	764.72	768.33	14
3790_140725_000031_000002	He asked, What?	He asked, What?	true	768.33	769.48	25.529774
3790_140725_000031_000003	And she said, I was come.	And she said, I was come.	true	769.94	771.51	20
3790_140725_000031_000004	He raised himself up in his bed; Can it be? said he--What, already!--She told him I came last night. Monsieur Colbrand coming to inquire of his health, he ordered him to draw near him, and was highly pleased with the account he gave him of the journey, my readiness to come back, and my willingness to reach home that night.	He raised himself up in his bed; Can it be? said he-What, already!--She told him I came last night. Monsieur Colbrand coming to inquire of his health, he ordered him to draw near him, and was highly pleased with the account he gave him of the journey, my readiness to come back, and my willingness to reach home that night.	false	771.51	788.41	16
3790_140725_000031_000005	And he said, Why, these tender fair ones, I think, bear fatigue better than us men.	And he said, Why, these tender fair ones, I think, bear fatigue better than us men.	true	788.6	793.24	20.653673
3790_140725_000031_000006	But she is very good, to give me such an instance of her readiness to oblige me.	But she is very good, to give me such an instance of her readiness to oblige me.	true	793.37	797.14	17
3790_140725_000031_000007	Pray, Mrs. Jewkes, said he, take great care of her health! and let her be a-bed all day.	Pray, mrs Jewkes, said he, take great care of her health! and let her be a bed all day.	true	797.36	801.91	18
3790_140725_000031_000008	She told him I had been up these two hours.	She told him I had been up these two hours.	true	802.01	804.49	16
3790_140725_000031_000009	Ask her, said he, if she will be so good as to make me a visit: If she won't, I'll rise, and go to her.	Ask her, said he, if she will be so good as to make me a visit: If she won't, I'll rise, and go to her.	true	804.65	810.435	17.633299
3790_140725_000031_000010	Indeed, sir, said she, you must be still; and I'll go to her.	Indeed, sir, said she, you must be still; and I'll go to her.	false	810.435	813.67	13
3790_140725_000031_000011	But don't urge her too much, said he, if she be unwilling.	But don't urge her too much, said he, if she be unwilling.	false	814.13	817.33	18.898907
3790_140725_000032_000000	She came to me, and told me all the above; and I said, I would most willingly wait upon him; for, indeed, I longed to see him, and was much grieved he was so ill.--So I went down with her.	She came to me, and told me all the above; and I said, I would most willingly wait upon him; for, indeed, I longed to see him, and was much grieved he was so ill.--So I went down with her.	true	818.45	828.22	15
3790_140725_000032_000001	Will she come?	Will she come?	true	828.53	829.23	29.24964
3790_140725_000032_000002	said he, as I entered the room.	said he, as I entered the room.	false	829.23	830.655	4
3790_140725_000032_000003	Yes, sir, said we; and she said, at the first word, Most willingly.--Sweet excellence! said he.	Yes, sir, said we; and she said, at the first word, Most willingly.--Sweet excellence! said he.	true	830.655	836.05	18
3790_140725_000033_000000	As soon as he saw me, he said, O my beloved Pamela! you have made me quite well.	As soon as he saw me, he said, O my beloved Pamela! you have made me quite well.	true	836.66	841.24	15
3790_140725_000033_000001	I'm concerned to return my acknowledgments to you in so unfit a place and manner; but will you give me your hand?	I'm concerned to return my acknowledgments to you in so unfit a place and manner; but will you give me your hand?	false	841.43	847.03	12
3790_140725_000033_000002	I did, and he kissed it with great eagerness.	I did, and he kissed it with great eagerness.	true	847.4	849.525	18
3790_140725_000033_000003	Sir, said I, you do me too much honour!--I am sorry you are so ill.--I can't be ill, said he, while you are with me.	Sir, said I, you do me too much honour!--I am sorry you are so ill.--I can't be ill, said he, while you are with me.	true	849.525	856.305	19
3790_140725_000033_000004	I am very well already.	I am very well already.	true	856.305	857.77	17
3790_140725_000034_000000	Well, said he, and kissed my hand again, you shall not repent this goodness.	Well, said he, and kissed my hand again, you shall not repent this goodness.	true	858.41	862.3	15
3790_140725_000034_000001	My heart is too full of it to express myself as I ought.	My heart is too full of it to express myself as I ought.	true	862.46	865.27	20.085974
3790_140725_000034_000002	But I am sorry you have had such a fatiguing time of it.--Life is no life without you!	But I am sorry you have had such a fatiguing time of it.--Life is no life without you!	true	865.43	870.03	18.95352
3790_140725_000034_000003	If you had refused me, and yet I had hardly hopes you would oblige me, I should have had a severe fit of it, I believe; for I was taken very oddly, and knew not what to make of myself: but now I shall be well instantly.	If you had refused me, and yet I had hardly hopes you would oblige me, I should have had a severe fit of it, I believe; for I was taken very oddly, and knew not what to make of myself: but now I shall be well instantly.	true	870.03	881.59	17
3790_140725_000034_000004	You need not, Mrs. Jewkes, added he, send for the doctor from Stamford, as we talked yesterday; for this lovely creature is my doctor, as her absence was my disease.	You need not, mrs Jewkes, added he, send for the doctor from Stamford, as we talked yesterday; for this lovely creature is my doctor, as her absence was my disease.	true	881.72	890.62	18
3790_140725_000035_000000	He begged me to sit down by his bed-side, and asked me, if I had obliged him with sending for my former packet?	He begged me to sit down by his bed side, and asked me, if I had obliged him with sending for my former packet?	true	891.32	896.92	15
3790_140725_000035_000001	I said I had, and hoped it would be brought.	I said I had, and hoped it would be brought.	true	896.99	899.43	20.715353
3790_140725_000035_000002	He said it was doubly kind.	He said it was doubly kind.	true	899.43	901.18	23
3790_140725_000036_000000	I would not stay long because of disturbing him.	I would not stay long because of disturbing him.	true	902.45	905.23	19.653837
3790_140725_000036_000001	And he got up in the afternoon, and desired my company; and seemed quite pleased, easy, and much better.	And he got up in the afternoon, and desired my company; and seemed quite pleased, easy, and much better.	true	905.45	910.66	16
3790_140725_000036_000002	He said, Mrs. Jewkes, after this instance of my good Pamela's obligingness in her return, I am sure we ought to leave her entirely at her own liberty; and pray, if she pleases to take a turn in our chariot, or in the garden, or to the town, or wherever she will, let her be left at liberty, and asked no questions; and do you do all in your power to oblige her.	He said, mrs Jewkes, after this instance of my good Pamela's obligingness in her return, I am sure we ought to leave her entirely at her own liberty; and pray, if she pleases to take a turn in our chariot, or in the garden, or to the town, or wherever she will, let her be left at liberty, and asked no questions; and do you do all in your power to oblige her.	true	910.76	929.77	15
3790_140725_000036_000003	She said she would, to be sure.	She said she would, to be sure.	true	929.93	931.78	22.806574
3790_140725_000037_000000	He took my hand, and said, One thing I will tell you, Pamela, because I know you will be glad to hear it, and yet not care to ask me: I had, before you went, taken Williams's bond for the money; for how the poor man had behaved I can't tell, but he could get no bail; and if I have no fresh reason given me, perhaps I shall not exact the payment; and he has been some time at liberty, and now follows his school; but, methinks, I could wish you would not see him at present.	He took my hand, and said, One thing I will tell you, Pamela, because I know you will be glad to hear it, and yet not care to ask me: I had, before you went, taken Williams's bond for the money; for how the poor man had behaved I can't tell, but he could get no bail; and if I have no fresh reason given me, perhaps I shall not exact the payment; and he has been some time at liberty, and now follows his school; but, methinks, I could wish you would not see him at present.	false	932.39	957.4	18
3790_140725_000038_000000	Sir, said I, I will not do any thing to disoblige you wilfully; and I am glad he is at liberty, because I was the occasion of his misfortunes. I durst say no more, though I wanted to plead for the poor gentleman; which, in gratitude, I thought I ought, when I could do him service.	Sir, said I, I will not do any thing to disoblige you wilfully; and I am glad he is at liberty, because I was the occasion of his misfortunes. I durst say no more, though I wanted to plead for the poor gentleman; which, in gratitude, I thought I ought, when I could do him service.	true	958.01	972.31	16
3790_140725_000038_000001	I said, I am sorry, sir, Lady Davers, who loves you so well, should have incurred your displeasure, and that there should be any variance between your honour and her; I hope it was not on my account.	I said, I am sorry, sir, Lady Davers, who loves you so well, should have incurred your displeasure, and that there should be any variance between your honour and her; I hope it was not on my account.	true	972.47	982.72	17
3790_140725_000038_000002	He took out of his waistcoat pocket, as he sat in his gown, his letter-case, and said, Here, Pamela, read that when you go up stairs, and let me have your thoughts upon it; and that will let you into the affair.	He took out of his waistcoat pocket, as he sat in his gown, his letter case, and said, Here, Pamela, read that when you go up stairs, and let me have your thoughts upon it; and that will let you into the affair.	false	983.18	993.43	16
3790_140725_000039_000000	He said he was very heavy of a sudden, and would lie down, and indulge for that day; and if he was better in the morning, would take an airing in the chariot.	He said he was very heavy of a sudden, and would lie down, and indulge for that day; and if he was better in the morning, would take an airing in the chariot.	true	994.13	1002.13	17
3790_140725_000039_000001	And so I took my leave for the present, and went up to my closet, and read the letter he was pleased to put into my hands; which is as follows:--	And so I took my leave for the present, and went up to my closet, and read the letter he was pleased to put into my hands; which is as follows:--	true	1002.29	1008.85	16
3790_140725_000040_000000	'BROTHER,	'BROTHER,	true	1009.94	1010.86	18.838474
3790_140725_000041_000000	'I am very uneasy at what I hear of you; and must write, whether it please you or not, my full mind.	'I am very uneasy at what I hear of you; and must write, whether it please you or not, my full mind.	false	1011.05	1016.47	16
3790_140725_000041_000001	I have had some people with me, desiring me to interpose with you; and they have a greater regard for your honour, than, I am sorry to say it, you have yourself.	I have had some people with me, desiring me to interpose with you; and they have a greater regard for your honour, than, I am sorry to say it, you have yourself.	false	1016.78	1024.78	13
3790_140725_000041_000002	Could I think, that a brother of mine would so meanly run away with my late dear mother's waiting-maid, and keep her a prisoner from all her friends, and to the disgrace of your own?	Could I think, that a brother of mine would so meanly run away with my late dear mother's waiting maid, and keep her a prisoner from all her friends, and to the disgrace of your own?	true	1024.97	1033.75	14
3790_140725_000041_000003	But I thought, when you would not let the wench come to me on my mother's death, that you meant no good.--I blush for you, I'll assure you.	But I thought, when you would not let the wench come to me on my mother's death, that you meant no good.--I blush for you, I'll assure you.	true	1033.94	1040.26	13
3790_140725_000041_000004	The girl was an innocent, good girl; but I suppose that's over with her now, or soon will.	The girl was an innocent, good girl; but I suppose that's over with her now, or soon will.	true	1040.42	1044.83	13
3790_140725_000041_000005	What can you mean by this, let me ask you?	What can you mean by this, let me ask you?	true	1044.83	1046.89	19.4095
3790_140725_000041_000006	Either you will have her for a kept mistress, or for a wife.	Either you will have her for a kept mistress, or for a wife.	true	1047.11	1050.58	17.435867
3790_140725_000041_000007	If the former, there are enough to be had without ruining a poor wench that my mother loved, and who really was a very good girl: and of this you may be ashamed.	If the former, there are enough to be had without ruining a poor wench that my mother loved, and who really was a very good girl: and of this you may be ashamed.	true	1050.62	1058.17	15
3790_140725_000041_000008	As to the other, I dare say you don't think of it; but if you should, you would be utterly inexcusable. Consider, brother, that ours is no upstart family; but is as ancient as the best in the kingdom!	As to the other, I dare say you don't think of it; but if you should, you would be utterly inexcusable. Consider, brother, that ours is no upstart family; but is as ancient as the best in the kingdom!	false	1058.24	1068.31	17
3790_140725_000041_000009	and, for several hundreds of years, it has never been known, that the heirs of it have disgraced themselves by unequal matches: And you know you have been sought to by some of the best families in the nation, for your alliance.	and, for several hundreds of years, it has never been known, that the heirs of it have disgraced themselves by unequal matches: And you know you have been sought to by some of the best families in the nation, for your alliance.	true	1068.56	1080.27	16
3790_140725_000041_000010	It might be well enough, if you were descended of a family of yesterday, or but a remove or two from the dirt you seem so fond of.	It might be well enough, if you were descended of a family of yesterday, or but a remove or two from the dirt you seem so fond of.	true	1080.27	1086.82	15
3790_140725_000041_000011	But, let me tell you, that I, and all mine, will renounce you for ever, if you can descend so meanly; and I shall be ashamed to be called your sister.	But, let me tell you, that I, and all mine, will renounce you for ever, if you can descend so meanly; and I shall be ashamed to be called your sister.	true	1087.07	1095.07	14
3790_140725_000041_000012	A handsome man, as you are, in your person; so happy in the gifts of your mind, that every body courts your company; and possessed of such a noble and clear estate; and very rich in money besides, left you by the best of fathers and mothers, with such ancient blood in your veins, untainted! for you to throw away yourself thus, is intolerable; and it would be very wicked in you to ruin the wench too.	A handsome man, as you are, in your person; so happy in the gifts of your mind, that every body courts your company; and possessed of such a noble and clear estate; and very rich in money besides, left you by the best of fathers and mothers, with such ancient blood in your veins, untainted! for you to throw away yourself thus, is intolerable; and it would be very wicked in you to ruin the wench too.	true	1095.32	1116.26	15
3790_140725_000041_000013	So that I beg you will restore her to her parents, and give her 100L. or so, to make her happy in some honest fellow of her own degree; and that will be doing something, and will also oblige and pacify	So that I beg you will restore her to her parents, and give her one hundred l. or so, to make her happy in some honest fellow of her own degree; and that will be doing something, and will also oblige and pacify	false	1116.26	1127.25	14
3790_140725_000042_000000	'Your much grieved sister.'	'Your much grieved sister.'	true	1127.25	1128.88	20.353325
3790_140725_000043_000000	'If I have written too sharply, consider it is my love to you, and the shame you are bringing upon yourself; and I wish this may have the effect upon you, intended by your very loving sister.'	'If I have written too sharply, consider it is my love to you, and the shame you are bringing upon yourself; and I wish this may have the effect upon you, intended by your very loving sister.'	true	1129.76	1138.87	16
3790_140725_000044_000000	This is a sad letter, my dear father and mother; and one may see how poor people are despised by the proud and the rich! and yet we were all on a foot originally: And many of these gentry, that brag of their ancient blood, would be glad to have it as wholesome, and as really untainted, as ours!--Surely these proud people never think what a short stage life is; and that, with all their vanity; a time is coming, when they shall be obliged to submit to be on a level with us: And true said the philosopher, when he looked upon the skull of a king, and that of a poor man, that he saw no difference between them.	This is a sad letter, my dear father and mother; and one may see how poor people are despised by the proud and the rich! and yet we were all on a foot originally: And many of these gentry, that brag of their ancient blood, would be glad to have it as wholesome, and as really untainted, as ours!--Surely these proud people never think what a short stage life is; and that, with all their vanity; a time is coming, when they shall be obliged to submit to be on a level with us: And true said the philosopher, when he looked upon the skull of a king, and that of a poor man, that he saw no difference between them.	false	1140.11	1172.29	16
3790_140725_000044_000001	Besides, do they not know, that the richest of princes, and the poorest of beggars, are to have one great and tremendous judge, at the last day; who will not distinguish between them, according to their circumstances in life?--But, on the contrary, may make their condemnations the greater, as their neglected opportunities were the greater?	Besides, do they not know, that the richest of princes, and the poorest of beggars, are to have one great and tremendous judge, at the last day; who will not distinguish between them, according to their circumstances in life?--But, on the contrary, may make their condemnations the greater, as their neglected opportunities were the greater?	false	1172.51	1189.75	16
3790_140725_000044_000002	Poor souls! how do I pity their pride!--O keep me, Heaven! from their high condition, if my mind shall ever be tainted with their vice! or polluted with so cruel and inconsiderate a contempt of the humble estate which they behold with so much scorn!	Poor souls! how do I pity their pride!--O keep me, Heaven! from their high condition, if my mind shall ever be tainted with their vice! or polluted with so cruel and inconsiderate a contempt of the humble estate which they behold with so much scorn!	false	1190	1203.37	17
