5712_48848_000060_000010	It was but the other day that one of them had been thrown rudely to the ground through the treachery of a lover, but yet none of them feared treachery from this lover.	It was but the other day that one of them had been thrown rudely to the ground through the treachery of a lover, but yet none of them feared treachery from this lover.
5712_48848_000060_000011	Bell was as sure of her lot in life as though she were already being taken home to her modest house in Guestwick.	Bell was as sure of her lot in life as though she were already being taken home to her modest house in Guestwick.
5712_48848_000061_000000	But Bell was not seated next to her lover.	But Bell was not seated next to her lover.
5712_48848_000061_000002	She had been in no wise ashamed of her love, and had shown it constantly by some little caressing motion of her hand, leaning on his arm, looking into his face, as though she were continually desirous of some palpable assurance of his presence.	She had been in no wise ashamed of her love, and had shown it constantly by some little caressing motion of her hand, leaning on his arm, looking into his face, as though she were continually desirous of some palpable assurance of his presence.
5712_48848_000061_000003	It was not so at all with Bell.	It was not so at all with Bell.
5712_48848_000061_000005	I do not think it would have made her unhappy if some sudden need had required that Crofts should go to India and back before they were married.	I do not think it would have made her unhappy if some sudden need had required that Crofts should go to India and back before they were married.
5712_48848_000061_000008	As her mother was about to go into a new residence, it might be as well that that residence should be fitted to the wants of two persons instead of three.	As her mother was about to go into a new residence, it might be as well that that residence should be fitted to the wants of two persons instead of three.
5712_48848_000061_000009	So they talked about chairs and tables, carpets and kitchens, in a most unromantic, homely, useful manner! A considerable portion of the furniture in the house they were now about to leave belonged to the squire,--or to the house rather, as they were in the habit of saying.	So they talked about chairs and tables, carpets and kitchens, in a most unromantic, homely, useful manner! A considerable portion of the furniture in the house they were now about to leave belonged to the squire,--or to the house rather, as they were in the habit of saying.
5712_48848_000061_000010	The older and more solid things,--articles of household stuff that stand the wear of half a century,--had been in the Small House when they came to it.	The older and more solid things,--articles of household stuff that stand the wear of half a century,--had been in the Small House when they came to it.
5712_48848_000061_000012	In the first month or two they were to live in lodgings, and their goods were to be stored in some friendly warehouse.	In the first month or two they were to live in lodgings, and their goods were to be stored in some friendly warehouse.
5712_48848_000061_000013	Under such circumstances would it not be well that Bell's marriage should be so arranged that the lodging question might not be in any degree complicated by her necessities?	Under such circumstances would it not be well that Bell's marriage should be so arranged that the lodging question might not be in any degree complicated by her necessities?
5712_48848_000061_000014	This was the last suggestion made by Dr. Crofts, induced no doubt by the great encouragement he had received.	This was the last suggestion made by dr Crofts, induced no doubt by the great encouragement he had received.
5712_48848_000062_000000	"That would be hardly possible," said Mrs. Dale.	"That would be hardly possible," said mrs Dale.
5712_48848_000062_000001	"It only wants three weeks;--and with the house in such a condition!"	"It only wants three weeks;--and with the house in such a condition!"
5712_48848_000063_000000	"James is joking," said Bell.	"james is joking," said Bell.
5712_48848_000064_000000	"I was not joking at all," said the doctor.	"I was not joking at all," said the doctor.
5712_48848_000065_000001	"It's just the sort of thing for primitive people to do, like you and Bell.	"It's just the sort of thing for primitive people to do, like you and Bell.
5712_48848_000065_000002	All the same, Bell, I do wish you could have been married from this house."	All the same, Bell, I do wish you could have been married from this house."
5712_48848_000066_000000	"I don't think it will make much difference," said Bell.	"I don't think it will make much difference," said Bell.
5712_48848_000067_000001	It sounds so ugly, being married from lodgings; doesn't it, mamma?"	It sounds so ugly, being married from lodgings; doesn't it, mamma?"
5712_48848_000069_000000	"I shall always call you Dame Commonplace when you're married," said Lily.	"I shall always call you Dame Commonplace when you're married," said Lily.
5712_48848_000070_000000	Then they had tea, and after tea Dr. Crofts got on his horse and rode back to Guestwick.	Then they had tea, and after tea dr Crofts got on his horse and rode back to Guestwick.
5712_48848_000071_000000	"Now may I talk about him?" said Lily, as soon as the door was closed behind his back.	"Now may I talk about him?" said Lily, as soon as the door was closed behind his back.
5712_48848_000072_000000	"No; you may not."	"No; you may not."
5712_48848_000073_000000	"As if I hadn't known it all along!	"As if I hadn't known it all along!
5712_48848_000073_000001	And wasn't it hard to bear that you should have scolded me with such pertinacious austerity, and that I wasn't to say a word in answer!"	And wasn't it hard to bear that you should have scolded me with such pertinacious austerity, and that I wasn't to say a word in answer!"
5712_48848_000074_000000	"I don't remember the austerity," said Mrs. Dale.	"I don't remember the austerity," said mrs Dale.
5712_48848_000075_000000	"Nor yet Lily's silence," said Bell.	"Nor yet Lily's silence," said Bell.
5712_48848_000076_000000	"But it's all settled now," said Lily, "and I'm downright happy.	"But it's all settled now," said Lily, "and I'm downright happy.
5712_48848_000076_000001	I never felt more satisfaction,--never, Bell!"	I never felt more satisfaction,--never, Bell!"
