7000_83708_000034_000004	And the way in which Mr. Benyon urged us on!	And the way in which mr Benyon urged us on!	false	634.65	637.45	21.910688
7000_83708_000034_000005	The perspiration was running off from us in streams--I had never had such a "sweater" before!	The perspiration was running off from us in streams-I had never had such a "sweater" before!	true	637.49	643.63	23.8866
7000_83708_000035_000000	"I do like your kind of bowling, mister," Mr. Benyon would constantly remark.	"I do like your kind of bowling, mister," mr Benyon would constantly remark.	true	643.73	648.58	23.88427
7000_83708_000036_000000	If I had had an equal admiration for his kind of batting we should have been quits, but I had not; at least not then.	If I had had an equal admiration for his kind of batting we should have been quits, but I had not; at least not then.	true	648.77	655.9	21.655304
7000_83708_000037_000000	A little later, looking round the field, I found that Mr. Hawthorn had disappeared, and that Mr. Hedges, stuck in a hedge, was struggling gallantly to reach safety on the other side.	A little later, looking round the field, I found that mr Hawthorn had disappeared, and that mr Hedges, stuck in a hedge, was struggling gallantly to reach safety on the other side.	true	656.66	667.87	23.803465
7000_83708_000037_000001	It was the last ball of Mr. Sapsworth's over.	It was the last ball of mr Sapsworth's over.	false	667.88	670.71	23.815739
7000_83708_000037_000002	Mr. Benyon ran thirteen for a hit to leg.	mr Benyon ran thirteen for a hit to leg.	true	670.71	673.695	27.23432
7000_83708_000037_000003	He made Mr. Barker run them too--it was the proverbial last straw.	He made mr Barker run them too-it was the proverbial last straw.	true	673.695	678.01	23.06559
7000_83708_000037_000004	As Mr. Barker was running the thirteenth run, instead of going to his wicket he dropped his bat--the bat which he had never had a chance to utilise--and bolted off the field as though Satan was behind him.	As mr Barker was running the thirteenth run, instead of going to his wicket he dropped his bat-the bat which he had never had a chance to utilise-and bolted off the field as though Satan was behind him.	true	678.02	689.14	24.981544
7000_83708_000037_000005	Mr. Benyon called out to him, but Mr. Barker neither stopped nor stayed. It seemed that the match was going to resolve itself into a game of single wicket.	mr Benyon called out to him, but mr Barker neither stopped nor stayed. It seemed that the match was going to resolve itself into a game of single wicket.	true	689.18	698.35	26
7000_83708_000038_000000	To make things better, when I came up to bowl I perceived that Mr. Sapsworth's power of endurance had reached its tether.	To make things better, when I came up to bowl one perceived that mr Sapsworth's power of endurance had reached its tether.	false	699.05	705.87	21.235933
7000_83708_000038_000001	The position he had taken up in the field had not much promise of usefulness.	The position he had taken up in the field had not much promise of usefulness.	false	705.87	710.11	23.125553
7000_83708_000038_000002	He first stood close up to the hedge, then he stood in the middle of the hedge, then--I doubt if he _stood_ upon the other side.	He first stood close up to the hedge, then he stood in the middle of the hedge, then-I doubt if he underscore stood underscore upon the other side.	false	710.21	717.975	23.778656
7000_83708_000038_000003	But at least he had vanished from my ken.	But at least he had vanished from my ken.	false	717.975	720.36	22.190134
7000_83708_000038_000004	And I was left alone to bowl to Mr. Benyon.	And I was left alone to bowl to mr Benyon.	true	720.36	723.315	19
7000_83708_000038_000005	That over!	That over!	true	723.315	724.45	27.583593
7000_83708_000039_000000	"I do like your kind of bowling, mister," he observed when, as usual, he sent my first ball out of sight.	"I do like your kind of bowling, mister," he observed when, as usual, he sent my first ball out of sight.	true	725	731.145	21.307112
7000_83708_000039_000001	"Never mind about the ball.	"Never mind about the ball.	true	731.145	732.72	20.145311
7000_83708_000039_000002	I've got one in my pocket you can have."	I've got one in my pocket you can have."	true	732.72	734.95	24.803516
7000_83708_000040_000000	He had.	He had.	true	735.14	736.035	25.524403
7000_83708_000040_000001	He produced it--always from the same pocket.	He produced it-always from the same pocket.	true	736.035	738.675	23.192081
7000_83708_000040_000002	It was about the second thousand.	It was about the second thousand.	true	738.675	740.68	24.948515
7000_83708_000041_000000	"It does warm me so to swipe."	"It does warm me so to swipe."	true	740.99	743.34	21.006618
7000_83708_000041_000001	This he said when he had sent my second ball on a journey to find its brother.	This he said when he had sent my second ball on a journey to find its brother.	true	743.34	747.405	19.910074
7000_83708_000041_000002	Then a ball or two later on, "I call that a tidy smack." The "smack" in question had driven the ball, for anything I know to the contrary, a distance of some five miles or so.	Then a ball or two later on, "I call that a tidy smack." The "smack" in question had driven the ball, for anything I know to the contrary, a distance of some five miles or so.	true	747.405	758.86	23.67332
7000_83708_000042_000000	The next ball I fielded.	The next ball I fielded.	true	758.9	760.605	28.956547
7000_83708_000042_000001	It was the first piece of fielding I had done that day, and that was unintentional.	It was the first piece of fielding I had done that day, and that was unintentional.	false	760.605	765.12	21.88769
7000_83708_000042_000002	It laid me on the ground.	It laid me on the ground.	true	765.12	766.68	21.433434
7000_83708_000042_000003	It was some moments before I recovered myself sufficiently to enable me to look round.	It was some moments before I recovered myself sufficiently to enable me to look round.	true	766.68	771.3	19
7000_83708_000042_000004	When I did so no one was in sight.	When I did so no one was in sight.	false	771.3	773.46	22.298994
7000_83708_000042_000005	I was alone in the field.	I was alone in the field.	true	773.46	775.155	21.796276
7000_83708_000042_000006	The opposite wicket was deserted.	The opposite wicket was deserted.	true	775.155	777.045	25.702723
7000_83708_000042_000007	The bat lay on the ground. And Mr. Benyon had gone!	The bat lay on the ground. And mr Benyon had gone!	true	777.045	780.52	21.398594
7000_83708_000043_000000	THE END.	THE END.	true	781.43	782.74	14.9983015
7000_83708_000044_000000	End of the Project Gutenberg EBook of Amusement Only, by Richard Marsh	End of the Project Gutenberg EBook of Amusement Only, by Richard Marsh	false	783.32	793.89	23.12089
