4490_16002_000023_000009	He was the companion of Dumouriez, he was the friend of Lafayette; he had belonged to the Jacobins' club; Mirabeau had slapped him on the shoulder; Danton had said to him: "Young man!" At the age of four and twenty, in '93, being then M. de Chartres, he had witnessed, from the depth of a box, the trial of Louis XVI., so well named that poor tyrant.	He was the companion of Dumouriez, he was the friend of Lafayette; he had belonged to the Jacobins' club; Mirabeau had slapped him on the shoulder; Danton had said to him: "Young man!" At the age of four and twenty, in 'ninety three, being then m de Chartres, he had witnessed, from the depth of a box, the trial of Louis the sixteenth., so well named that poor tyrant.	false	792.14	818.53	18.922235
4490_16002_000023_000010	The blind clairvoyance of the Revolution, breaking royalty in the King and the King with royalty, did so almost without noticing the man in the fierce crushing of the idea, the vast storm of the Assembly-Tribunal, the public wrath interrogating, Capet not knowing what to reply, the alarming, stupefied vacillation by that royal head beneath that sombre breath, the relative innocence of all in that catastrophe, of those who condemned as well as of the man condemned,--he had looked on those things, he had contemplated that giddiness; he had seen the centuries appear before the bar of the Assembly-Convention; he had beheld, behind Louis XVI., that unfortunate passer-by who was made responsible, the terrible culprit, the monarchy, rise through the shadows; and there had lingered in his soul the respectful fear of these immense justices of the populace, which are almost as impersonal as the justice of God.	The blind clairvoyance of the Revolution, breaking royalty in the King and the King with royalty, did so almost without noticing the man in the fierce crushing of the idea, the vast storm of the Assembly Tribunal, the public wrath interrogating, Capet not knowing what to reply, the alarming, stupefied vacillation by that royal head beneath that sombre breath, the relative innocence of all in that catastrophe, of those who condemned as well as of the man condemned,--he had looked on those things, he had contemplated that giddiness; he had seen the centuries appear before the bar of the Assembly Convention; he had beheld, behind Louis the sixteenth., that unfortunate passer by who was made responsible, the terrible culprit, the monarchy, rise through the shadows; and there had lingered in his soul the respectful fear of these immense justices of the populace, which are almost as impersonal as the justice of God.	false	819.26	883.36	19
4490_16002_000024_000000	The trace left in him by the Revolution was prodigious.	The trace left in him by the Revolution was prodigious.	true	884.39	887.62	13
4490_16002_000024_000001	Its memory was like a living imprint of those great years, minute by minute.	Its memory was like a living imprint of those great years, minute by minute.	true	887.99	892.99	19.86437
4490_16002_000024_000002	One day, in the presence of a witness whom we are not permitted to doubt, he rectified from memory the whole of the letter A in the alphabetical list of the Constituent Assembly.	One day, in the presence of a witness whom we are not permitted to doubt, he rectified from memory the whole of the letter A in the alphabetical list of the Constituent Assembly.	true	894.05	905.14	14
4490_16002_000025_000000	Louis Philippe was a king of the broad daylight.	Louis Philippe was a king of the broad daylight.	true	906.08	908.89	18.267632
4490_16002_000025_000001	While he reigned the press was free, the tribune was free, conscience and speech were free. The laws of September are open to sight.	While he reigned the press was free, the tribune was free, conscience and speech were free. The laws of September are open to sight.	true	909.41	918.4	19.458723
4490_16002_000025_000002	Although fully aware of the gnawing power of light on privileges, he left his throne exposed to the light.	Although fully aware of the gnawing power of light on privileges, he left his throne exposed to the light.	false	918.8	926.08	17
4490_16002_000025_000003	History will do justice to him for this loyalty.	History will do justice to him for this loyalty.	true	926.54	929.65	16
4490_16002_000026_000000	Louis Philippe, like all historical men who have passed from the scene, is to-day put on his trial by the human conscience.	Louis Philippe, like all historical men who have passed from the scene, is to day put on his trial by the human conscience.	false	930.68	937.69	17
4490_16002_000026_000001	His case is, as yet, only in the lower court.	His case is, as yet, only in the lower court.	true	938.12	941.14	20.01309
4490_16002_000027_000000	The hour when history speaks with its free and venerable accent, has not yet sounded for him; the moment has not come to pronounce a definite judgment on this king; the austere and illustrious historian Louis Blanc has himself recently softened his first verdict; Louis Philippe was elected by those two almosts which are called the 221 and 1830, that is to say, by a half-Parliament, and a half-revolution; and in any case, from the superior point of view where philosophy must place itself, we cannot judge him here, as the reader has seen above, except with certain reservations in the name of the absolute democratic principle; in the eyes of the absolute, outside these two rights, the right of man in the first place, the right of the people in the second, all is usurpation; but what we can say, even at the present day, that after making these reserves is, that to sum up the whole, and in whatever manner he is considered, Louis Philippe, taken in himself, and from the point of view of human goodness, will remain, to use the antique language of ancient history, one of the best princes who ever sat on a throne.	The hour when history speaks with its free and venerable accent, has not yet sounded for him; the moment has not come to pronounce a definite judgment on this king; the austere and illustrious historian Louis Blanc has himself recently softened his first verdict; Louis Philippe was elected by those two almosts which are called the two hundred twenty one and eighteen thirty, that is to say, by a half Parliament, and a half revolution; and in any case, from the superior point of view where philosophy must place itself, we cannot judge him here, as the reader has seen above, except with certain reservations in the name of the absolute democratic principle; in the eyes of the absolute, outside these two rights, the right of man in the first place, the right of the people in the second, all is usurpation; but what we can say, even at the present day, that after making these reserves is, that to sum up the whole, and in whatever manner he is considered, Louis Philippe, taken in himself, and from the point of view of human goodness, will remain, to use the antique language of ancient history, one of the best princes who ever sat on a throne.	false	941.24	1021.45	19
4490_16002_000028_000000	What is there against him?	What is there against him?	true	1022.06	1023.73	19
4490_16002_000028_000001	That throne.	That throne.	true	1024.19	1025.74	19.467667
4490_16002_000028_000002	Take away Louis Philippe the king, there remains the man.	Take away Louis Philippe the king, there remains the man.	true	1026.2	1029.94	16
4490_16002_000028_000003	And the man is good.	And the man is good.	true	1030.01	1031.71	18
4490_16002_000028_000004	He is good at times even to the point of being admirable.	He is good at times even to the point of being admirable.	true	1032.05	1035.91	19
4490_16002_000028_000005	Often, in the midst of his gravest souvenirs, after a day of conflict with the whole diplomacy of the continent, he returned at night to his apartments, and there, exhausted with fatigue, overwhelmed with sleep, what did he do?	Often, in the midst of his gravest souvenirs, after a day of conflict with the whole diplomacy of the continent, he returned at night to his apartments, and there, exhausted with fatigue, overwhelmed with sleep, what did he do?	true	1036.67	1051.63	20.361898
4490_16002_000028_000006	He took a death sentence and passed the night in revising a criminal suit, considering it something to hold his own against Europe, but that it was a still greater matter to rescue a man from the executioner.	He took a death sentence and passed the night in revising a criminal suit, considering it something to hold his own against Europe, but that it was a still greater matter to rescue a man from the executioner.	true	1051.82	1065.52	17
4490_16002_000028_000007	He obstinately maintained his opinion against his keeper of the seals; he disputed the ground with the guillotine foot by foot against the crown attorneys, those chatterers of the law, as he called them.	He obstinately maintained his opinion against his keeper of the seals; he disputed the ground with the guillotine foot by foot against the crown attorneys, those chatterers of the law, as he called them.	true	1066.16	1079.35	20
4490_16002_000028_000008	Sometimes the pile of sentences covered his table; he examined them all; it was anguish to him to abandon these miserable, condemned heads.	Sometimes the pile of sentences covered his table; he examined them all; it was anguish to him to abandon these miserable, condemned heads.	true	1079.93	1090.84	18
4490_16002_000028_000009	One day, he said to the same witness to whom we have recently referred: "I won seven last night." During the early years of his reign, the death penalty was as good as abolished, and the erection of a scaffold was a violence committed against the King.	One day, he said to the same witness to whom we have recently referred: "I won seven last night." During the early years of his reign, the death penalty was as good as abolished, and the erection of a scaffold was a violence committed against the King.	true	1091.06	1108.3	17.99264
4490_16002_000028_000010	The Greve having disappeared with the elder branch, a bourgeois place of execution was instituted under the name of the Barriere-Saint-Jacques; "practical men" felt the necessity of a quasi-legitimate guillotine; and this was one of the victories of Casimir Perier, who represented the narrow sides of the bourgeoisie, over Louis Philippe, who represented its liberal sides.	The Greve having disappeared with the elder branch, a bourgeois place of execution was instituted under the name of the Barriere Saint Jacques; "practical men" felt the necessity of a quasi legitimate guillotine; and this was one of the victories of Casimir Perier, who represented the narrow sides of the bourgeoisie, over Louis Philippe, who represented its liberal sides.	false	1108.55	1131.7	17
4490_16002_000028_000011	Louis Philippe annotated Beccaria with his own hand.	Louis Philippe annotated Beccaria with his own hand.	true	1132.01	1135.36	13
4490_16002_000028_000012	After the Fieschi machine, he exclaimed: "What a pity that I was not wounded!	After the Fieschi machine, he exclaimed: "What a pity that I was not wounded!	false	1135.64	1140.97	18
4490_16002_000028_000013	Then I might have pardoned!" On another occasion, alluding to the resistance offered by his ministry, he wrote in connection with a political criminal, who is one of the most generous figures of our day: "His pardon is granted; it only remains for me to obtain it." Louis Philippe was as gentle as Louis IX. and as kindly as Henri IV.	Then I might have pardoned!" On another occasion, alluding to the resistance offered by his ministry, he wrote in connection with a political criminal, who is one of the most generous figures of our day: "His pardon is granted; it only remains for me to obtain it." Louis Philippe was as gentle as Louis the ninth. and as kindly as Henri the fourth.	true	1141.01	1164.97	19.816957
4490_16002_000029_000000	Now, to our mind, in history, where kindness is the rarest of pearls, the man who is kindly almost takes precedence of the man who is great.	Now, to our mind, in history, where kindness is the rarest of pearls, the man who is kindly almost takes precedence of the man who is great.	true	1165.37	1175.23	17
4490_16002_000030_000000	Louis Philippe having been severely judged by some, harshly, perhaps, by others, it is quite natural that a man, himself a phantom at the present day, who knew that king, should come and testify in his favor before history; this deposition, whatever else it may be, is evidently and above all things, entirely disinterested; an epitaph penned by a dead man is sincere; one shade may console another shade; the sharing of the same shadows confers the right to praise it; it is not greatly to be feared that it will ever be said of two tombs in exile: "This one flattered the other."	Louis Philippe having been severely judged by some, harshly, perhaps, by others, it is quite natural that a man, himself a phantom at the present day, who knew that king, should come and testify in his favor before history; this deposition, whatever else it may be, is evidently and above all things, entirely disinterested; an epitaph penned by a dead man is sincere; one shade may console another shade; the sharing of the same shadows confers the right to praise it; it is not greatly to be feared that it will ever be said of two tombs in exile: "This one flattered the other."	false	1175.9	1235.76	18.875973
