4490_16002_000011_000000	Let us return to 1830.	Let us return to eighteen thirty.
4490_16002_000013_000000	Louis Philippe had been handsome, and in his old age he remained graceful; not always approved by the nation, he always was so by the masses; he pleased.	Louis Philippe had been handsome, and in his old age he remained graceful; not always approved by the nation, he always was so by the masses; he pleased.
4490_16002_000014_000000	He went a little to chapel, not at all to the chase, never to the opera. Incorruptible by sacristans, by whippers-in, by ballet-dancers; this made a part of his bourgeois popularity.	He went a little to chapel, not at all to the chase, never to the opera. Incorruptible by sacristans, by whippers in, by ballet dancers; this made a part of his bourgeois popularity.
4490_16002_000014_000001	He had no heart.	He had no heart.
4490_16002_000017_000000	This is his great fault; he was modest in the name of France.	This is his great fault; he was modest in the name of France.
4490_16002_000023_000001	Louis Philippe is 1830 made man.	Louis Philippe is eighteen thirty made man.
4490_16002_000023_000004	He had lived by his own labor.	He had lived by his own labor.
4490_16002_000026_000001	His case is, as yet, only in the lower court.	His case is, as yet, only in the lower court.
4490_16002_000028_000005	Often, in the midst of his gravest souvenirs, after a day of conflict with the whole diplomacy of the continent, he returned at night to his apartments, and there, exhausted with fatigue, overwhelmed with sleep, what did he do?	Often, in the midst of his gravest souvenirs, after a day of conflict with the whole diplomacy of the continent, he returned at night to his apartments, and there, exhausted with fatigue, overwhelmed with sleep, what did he do?
4490_16002_000028_000007	He obstinately maintained his opinion against his keeper of the seals; he disputed the ground with the guillotine foot by foot against the crown attorneys, those chatterers of the law, as he called them.	He obstinately maintained his opinion against his keeper of the seals; he disputed the ground with the guillotine foot by foot against the crown attorneys, those chatterers of the law, as he called them.
