5304_55856_000063_000001	It may be that when Mr. Renshaw, having dodged the bears and eluded the wildcat, returns to his post, he will decide not to continue the paper on the lines at present mapped out.	It may be that when mr Renshaw, having dodged the bears and eluded the wildcat, returns to his post, he will decide not to continue the paper on the lines at present mapped out.	true	612.66	623.17	20.075003
5304_55856_000063_000002	He should be back in about ten weeks."	He should be back in about ten weeks."	true	623.33	625.69	26.997446
5304_55856_000064_000000	"Ten weeks!"	"Ten weeks!"	true	626.18	627.22	23.58761
5304_55856_000065_000000	"Till then, the only thing to do is to wait.	"Till then, the only thing to do is to wait.	true	627.62	630.42	22.492004
5304_55856_000065_000001	You may rely on me to keep a watchful eye on your interests.	You may rely on me to keep a watchful eye on your interests.	true	630.42	633.82	21.497189
5304_55856_000065_000002	When your thoughts tend to take a gloomy turn say to yourselves, 'All is well.	When your thoughts tend to take a gloomy turn say to yourselves, 'All is well.	false	633.86	638.55	23.31018
5304_55856_000065_000003	Smith is keeping a watchful eye on our interests.'"	Smith is keeping a watchful eye on our interests.'"	true	638.55	641.68	22.459469
5304_55856_000066_000000	"All the same, I should like to see this P. Maloney," said Mr. Asher.	"All the same, I should like to see this p Maloney," said mr Asher.	true	642.02	646.39	20.90239
5304_55856_000067_000000	"I shouldn't," said Smith.	"I shouldn't," said Smith.	true	646.82	648.795	19.427912
5304_55856_000067_000001	"I speak in your best interests.	"I speak in your best interests.	true	648.795	650.76	25.940868
5304_55856_000067_000002	P. Maloney is a man of the fiercest passions.	P. Maloney is a man of the fiercest passions.	true	650.76	653.83	18.927149
5304_55856_000067_000003	He cannot brook interference.	He cannot brook interference.	true	653.87	655.84	25.10655
5304_55856_000067_000004	If you should argue with him, there is no knowing what might not happen.	If you should argue with him, there is no knowing what might not happen.	true	655.94	659.71	18
5304_55856_000067_000005	He would be the first to regret any violent action, when once he had cooled off, but-- Of course, if you wish it I could arrange a meeting. No?	He would be the first to regret any violent action, when once he had cooled off, but- Of course, if you wish it I could arrange a meeting. No?	true	659.9	669.34	23.94242
5304_55856_000067_000006	I think you are wise.	I think you are wise.	true	669.41	670.96	19.866304
5304_55856_000067_000007	And now, gentlemen, as I have a good deal of work to get through--	And now, gentlemen, as I have a good deal of work to get through-	true	671.09	674.74	21.327
5304_55856_000068_000000	"All very disturbing to the man of culture and refinement," said Smith, as the door closed behind the last of the malcontents.	"All very disturbing to the man of culture and refinement," said Smith, as the door closed behind the last of the malcontents.	true	675.08	682.36	20.674442
5304_55856_000068_000001	"But I think that we may now consider the line clear.	"But I think that we may now consider the line clear.	true	682.52	685.54	14
5304_55856_000068_000002	I see no further obstacle in our path.	I see no further obstacle in our path.	true	685.61	688.35	24.40627
5304_55856_000068_000003	I fear I have made Comrade Maloney perhaps a shade unpopular with our late contributors, but these things must be.	I fear I have made Comrade Maloney perhaps a shade unpopular with our late contributors, but these things must be.	true	688.35	695.5	20
5304_55856_000068_000004	We must clench our teeth and face them manfully.	We must clench our teeth and face them manfully.	true	695.69	698.92	21
5304_55856_000068_000005	He suffers in an excellent cause."	He suffers in an excellent cause."	false	699.08	718.89	20.832409
