5635_53458_000052_000001	Fashions often change among the earth people, who tire quickly of any one thing.	Fashions often change among the earth people, who tire quickly of any one thing.	true	597.59	601.78	22
5635_53458_000052_000002	When they read in their newspapers and magazines that the style is so-and-so, they never question the matter, but at once obey the mandate of fashion.	When they read in their newspapers and magazines that the style is so and so, they never question the matter, but at once obey the mandate of fashion.	true	602	609.79	22.282099
5635_53458_000052_000003	So you must visit the newspapers and magazines and enchant the types."	So you must visit the newspapers and magazines and enchant the types."	true	610.01	613.75	21.51472
5635_53458_000053_000000	"Enchant the types!" echoed Popopo, in wonder.	"Enchant the types!" echoed Popopo, in wonder.	true	614.84	618.34	22.867264
5635_53458_000054_000000	"Just so.	"Just so.	true	618.83	619.78	21.682806
5635_53458_000054_000001	Make them read that it is no longer the fashion to wear birds upon hats.	Make them read that it is no longer the fashion to wear birds upon hats.	true	620.18	623.65	19
5635_53458_000054_000002	That will afford relief to your poor milliner and at the same time set free thousands of our darling birds who have been so cruelly used."	That will afford relief to your poor milliner and at the same time set free thousands of our darling birds who have been so cruelly used."	true	623.93	631.09	22.100077
5635_53458_000055_000000	Popopo thanked the wise king and followed his advice.	Popopo thanked the wise king and followed his advice.	true	631.76	634.6	21.3961
5635_53458_000056_000000	The office of every newspaper and magazine in the city was visited by the knook, and then he went to other cities, until there was not a publication in the land that had not a "new fashion note" in its pages.	The office of every newspaper and magazine in the city was visited by the knook, and then he went to other cities, until there was not a publication in the land that had not a "new fashion note" in its pages.	false	635.21	645.52	20.451279
5635_53458_000056_000001	Sometimes Popopo enchanted the types, so that whoever read the print would see only what the knook wished them to.	Sometimes Popopo enchanted the types, so that whoever read the print would see only what the knook wished them to.	true	646.01	651.88	19.890276
5635_53458_000056_000002	Sometimes he called upon the busy editors and befuddled their brains until they wrote exactly what he wanted them to.	Sometimes he called upon the busy editors and befuddled their brains until they wrote exactly what he wanted them to.	true	652.31	657.52	16
5635_53458_000056_000003	Mortals seldom know how greatly they are influenced by fairies, knooks and ryls, who often put thoughts into their heads that only the wise little immortals could have conceived.	Mortals seldom know how greatly they are influenced by fairies, knooks and r y l s, who often put thoughts into their heads that only the wise little immortals could have conceived.	false	658.16	666.76	21.644863
5635_53458_000057_000000	The following morning when the poor milliner looked over her newspaper she was overjoyed to read that "no woman could now wear a bird upon her hat and be in style, for the newest fashion required only ribbons and laces."	The following morning when the poor milliner looked over her newspaper she was overjoyed to read that "no woman could now wear a bird upon her hat and be in style, for the newest fashion required only ribbons and laces."	true	667.37	678.34	20
5635_53458_000058_000000	Popopo after this found much enjoyment in visiting every millinery shop he could find and giving new life to the stuffed birds which were carelessly tossed aside as useless.	Popopo after this found much enjoyment in visiting every millinery shop he could find and giving new life to the stuffed birds which were carelessly tossed aside as useless.	true	679.19	688.06	22
5635_53458_000058_000001	And they flew to the fields and forests with songs of thanks to the good knook who had rescued them.	And they flew to the fields and forests with songs of thanks to the good knook who had rescued them.	true	688.46	693.49	21.723616
5635_53458_000059_000000	Sometimes a hunter fires his gun at a bird and then wonders why he did not hit it.	Sometimes a hunter fires his gun at a bird and then wonders why he did not hit it.	true	694.25	698.71	21.109026
5635_53458_000059_000001	But, having read this story, you will understand that the bird must have been a stuffed one from some millinery shop, which cannot, of course, be killed by a gun.	But, having read this story, you will understand that the bird must have been a stuffed one from some millinery shop, which cannot, of course, be killed by a gun.	false	699.11	714.48	23.12913
