3082_165428_000000_000000	In the dead of the night, the rest of the French came on board in canoes, got into the cabin and killed Lewis.	In the dead of the night, the rest of the French came on board in canoes, got into the cabin and killed Lewis.	false	0	1.77	23.731447
3082_165428_000000_000001	They fell on the crew; but, after an hour and a half's dispute, the French were beaten off, and the quarter master, John Cornelius, an Irishman, succeeded Lewis.	They fell on the crew; but, after an hour and a half's dispute, the French were beaten off, and the quarter master, john Cornelius, an Irishman, succeeded Lewis.	false	1.77	6.21	22.44497
3082_165428_000001_000000	--"He was the mildest manner'd man, That ever scuttled ship or cut a throat; With such true breeding of a gentleman, You never could discern his real thought. Pity he loved an adventurous life's variety, He was so great a loss to good society."	--"He was the mildest manner'd man, That ever scuttled ship or cut a throat; With such true breeding of a gentleman, You never could discern his real thought. Pity he loved an adventurous life's variety, He was so great a loss to good society."	false	6.21	18.33	24.095196
3082_165428_000002_000000	THE LIFE, CAREER AND DEATH OF CAPTAIN THOMAS WHITE.	THE LIFE, CAREER AND DEATH OF CAPTAIN THOMAS WHITE.	true	18.33	21.03	22.23182
3082_165428_000003_000000	He was born at Plymouth, where his mother kept a public house.	He was born at Plymouth, where his mother kept a public house.	false	21.03	24.94	26.806225
3082_165428_000003_000001	She took great care of his education, and when he was grown up, as he had an inclination to the sea, procured him the king's letter.	She took great care of his education, and when he was grown up, as he had an inclination to the sea, procured him the king's letter.	true	25.01	31.69	22.790808
3082_165428_000003_000002	After he had served some years on board a man-of-war, he went to Barbadoes, where he married, got into the merchant service, and designed to settle in the island.	After he had served some years on board a man of war, he went to Barbadoes, where he married, got into the merchant service, and designed to settle in the island.	true	32.03	40.12	19.97753
3082_165428_000003_000003	He had the command of the Marygold brigantine given him, in which he made two successful voyages to Guinea and back to Barbadoes.	He had the command of the Marygold brigantine given him, in which he made two successful voyages to Guinea and back to Barbadoes.	false	40.4	46.93	22.15293
3082_165428_000003_000004	In his third, he had the misfortune to be taken by a French pirate, as were several other English ships, the masters and inferior officers of which they detained, being in want of good artists.	In his third, he had the misfortune to be taken by a French pirate, as were several other English ships, the masters and inferior officers of which they detained, being in want of good artists.	false	47.45	57.81	21.763092
3082_165428_000003_000005	The brigantine belonging to White, they kept for their own use, and sunk the vessel they before sailed in; but meeting with a ship on the Guinea coast more fit for their purpose, they went on board her and burnt the brigantine.	The brigantine belonging to White, they kept for their own use, and sunk the vessel they before sailed in; but meeting with a ship on the Guinea coast more fit for their purpose, they went on board her and burnt the brigantine.	false	57.81	69.18	22.141657
3082_165428_000004_000000	It is not my business here to give an account of this French pirate, any farther than Capt.	It is not my business here to give an account of this French pirate, any farther than Capt.	false	69.18	73.65	21.538584
3082_165428_000004_000001	White's story obliges me, though I beg leave to take notice of their barbarity to the English prisoners, for they would set them up as a butt or mark to shoot at; several of whom were thus murdered in cold blood, by way of diversion.	White's story obliges me, though I beg leave to take notice of their barbarity to the English prisoners, for they would set them up as a butt or mark to shoot at; several of whom were thus murdered in cold blood, by way of diversion.	true	73.65	85.89	22.473991
3082_165428_000005_000000	White was marked out for a sacrifice by one of these villains, who, for what reason I know not, had sworn his death, which he escaped thus.	White was marked out for a sacrifice by one of these villains, who, for what reason I know not, had sworn his death, which he escaped thus.	false	85.89	93.07	22
3082_165428_000005_000001	One of the crew, who had a friendship for White, knew this fellow's design to kill him in the night, and therefore advised him to lie between him and the ship's side, with intention to save him; which indeed he did, but was himself shot dead by the murderous villain, who mistook him for White.	One of the crew, who had a friendship for White, knew this fellow's design to kill him in the night, and therefore advised him to lie between him and the ship's side, with intention to save him; which indeed he did, but was himself shot dead by the murderous villain, who mistook him for White.	false	93.23	107.355	23
3082_165428_000006_000000	After some time cruising along the coast, the pirates doubled the Cape of Good Hope, and shaped their course for Madagascar, where, being drunk and mad, they knocked their ship on the head, at the south end of the island, at a place called by the natives Elexa.	After some time cruising along the coast, the pirates doubled the Cape of Good Hope, and shaped their course for Madagascar, where, being drunk and mad, they knocked their ship on the head, at the south end of the island, at a place called by the natives Elexa.	true	107.355	119.775	24
3082_165428_000006_000001	The country thereabouts was governed by a king, named Mafaly.	The country thereabouts was governed by a king, named Mafaly.	false	119.775	122.94	22
3082_165428_000007_000000	When the ship struck, Capt.	When the ship struck, Capt.	false	122.94	124.26	24
3082_165428_000007_000001	White, Capt.	White, Capt.	false	124.26	124.92	14
3082_165428_000007_000002	Boreman, (born in the Isle of Wight, formerly a lieutenant of a man-of-war, but in the merchant service when he fell into the hands of the pirates,) Capt.	Boreman, (born in the Isle of Wight, formerly a lieutenant of a man of war, but in the merchant service when he fell into the hands of the pirates,) Capt.	false	124.92	132.87	22
3082_165428_000007_000003	Bowen and some other prisoners got into the long-boat, and with broken oars and barrel staves, which they found in the bottom of the boat, paddled to Augustin Bay, which is about 14 or 15 leagues from the wreck, where they landed, and were kindly received by the king of Bavaw, (the name of that part of the island) who spoke good English.	Bowen and some other prisoners got into the long boat, and with broken oars and barrel staves, which they found in the bottom of the boat, paddled to Augustin Bay, which is about fourteen or fifteen leagues from the wreck, where they landed, and were kindly received by the king of Bavaw, (the name of that part of the island) who spoke good English.	false	132.87	150.36	23.895145
3082_165428_000008_000000	They stayed here a year and a half at the king's expense, who gave them a plentiful allowance of provision, as was his custom to all white men, who met with any misfortune on his coast.	They stayed here a year and a half at the king's expense, who gave them a plentiful allowance of provision, as was his custom to all white men, who met with any misfortune on his coast.	false	150.36	160.5	24.008602
3082_165428_000008_000001	His humanity not only provided for such, but the first European vessel that came in, he always obliged to take in the unfortunate people, let the vessel be what it would; for he had no notion of any difference between pirates and merchants.	His humanity not only provided for such, but the first European vessel that came in, he always obliged to take in the unfortunate people, let the vessel be what it would; for he had no notion of any difference between pirates and merchants.	true	160.5	173.68	22.730394
3082_165428_000009_000000	At the expiration of the above term, a pirate brigantine came in, on board which the king obliged them to enter, or travel by land to some other place, which they durst not do; and of two evils chose the least, that of going on board the pirate vessel, which was commanded by one William Read, who received them very civilly.	At the expiration of the above term, a pirate brigantine came in, on board which the king obliged them to enter, or travel by land to some other place, which they durst not do; and of two evils chose the least, that of going on board the pirate vessel, which was commanded by one William Read, who received them very civilly.	true	173.75	191.47	22.638018
3082_165428_000010_000000	This commander went along the coast, and picked up what Europeans he could meet with.	This commander went along the coast, and picked up what Europeans he could meet with.	false	191.48	195.255	24.233284
3082_165428_000010_000001	His crew, however, did not exceed 40 men.	His crew, however, did not exceed forty men.	true	195.255	197.73	22.954435
3082_165428_000010_000002	He would have been glad of taking some of the wrecked Frenchmen, but for the barbarity they had used towards the English prisoners.	He would have been glad of taking some of the wrecked Frenchmen, but for the barbarity they had used towards the English prisoners.	false	197.73	204.31	22.115025
3082_165428_000010_000003	However, it was impracticable, for the French pretending to lord it over the natives, whom they began to treat inhumanly, were set upon by them, one half of their number cut off, and the other half made slaves.	However, it was impracticable, for the French pretending to lord it over the natives, whom they began to treat inhumanly, were set upon by them, one half of their number cut off, and the other half made slaves.	true	204.35	217.02	25.910864
3082_165428_000011_000000	Read, with this gang, and a brigantine of 60 tons, steered his course for the Persian Gulf, where they met a grab, (a one masted vessel) of about 200 tons, which was made a prize.	Read, with this gang, and a brigantine of sixty tons, steered his course for the Persian Gulf, where they met a grab, (a one masted vessel) of about two hundred tons, which was made a prize.	true	217.02	228.55	24.186823
3082_165428_000011_000001	They found nothing on board but bale goods, most of which they threw overboard in search of gold, and to make room in the vessel; but as they learned afterwards, they threw over, in their search, what they so greedily hunted after, for there was a considerable quantity of gold concealed in one of the bales they tossed into the sea!	They found nothing on board but bale goods, most of which they threw overboard in search of gold, and to make room in the vessel; but as they learned afterwards, they threw over, in their search, what they so greedily hunted after, for there was a considerable quantity of gold concealed in one of the bales they tossed into the sea!	false	228.83	244.605	23.66741
3082_165428_000012_000000	In this cruise Capt.	In this cruise Capt.	false	244.605	245.73	24.127165
3082_165428_000012_000001	Read fell ill and died, and was succeeded by one James.	Read fell ill and died, and was succeeded by one james.	true	245.73	248.92	21.270424
3082_165428_000012_000002	The brigantine being small, crazy and worm-eaten, they shaped their course for the island of Mayotta, where they took out the masts of the brigantine, fitted up the grab, and made a ship of her.	The brigantine being small, crazy and worm eaten, they shaped their course for the island of Mayotta, where they took out the masts of the brigantine, fitted up the grab, and made a ship of her.	false	249.2	258.99	26.421837
3082_165428_000012_000003	Here they took in a quantity of fresh provisions, which are in this island very plentiful and very cheap, and found a twelve-oared boat, which formerly belonged to the Ruby East Indiaman, which had been lost there.	Here they took in a quantity of fresh provisions, which are in this island very plentiful and very cheap, and found a twelve oared boat, which formerly belonged to the Ruby East Indiaman, which had been lost there.	false	258.99	270.39	22
3082_165428_000013_000000	They stayed here all the monsoon time, which is about six months; after which they resolved for Madagascar.	They stayed here all the monsoon time, which is about six months; after which they resolved for Madagascar.	true	270.39	275.91	20
3082_165428_000013_000001	As they came in with the land, they spied a sail coming round from the east side of the island.	As they came in with the land, they spied a sail coming round from the east side of the island.	true	275.91	279.825	16
3082_165428_000013_000002	They gave chase on both sides, so that they soon met.	They gave chase on both sides, so that they soon met.	true	279.825	282.525	23.860825
3082_165428_000013_000003	They hailed each other and receiving the same answer from each vessel, viz.	They hailed each other and receiving the same answer from each vessel, viz.	true	282.525	286.26	18
3082_165428_000013_000004	_from the seas,_ they joined company.	underscore from the seas,underscore they joined company.	false	286.26	288.6	19
3082_165428_000014_000000	This vessel was a small French ship, laden with liquors from Martinico, first commanded by one Fourgette, to trade with the pirates for slaves, at Ambonavoula, on the east side of the island, in the latitude of 17 deg.	This vessel was a small French ship, laden with liquors from Martinico, first commanded by one Fourgette, to trade with the pirates for slaves, at Ambonavoula, on the east side of the island, in the latitude of seventeen d e g.	false	288.6	300.855	21.608995
3082_165428_000014_000001	30 min. and was by them taken after the following manner.	thirty minutes. and was by them taken after the following manner.	false	300.855	304.68	25
3082_165428_000015_000000	The pirates, who were headed by George Booth, now commander of the ship, went on board, (as they had often done,) to the number of ten, and carried money with them under pretence of purchasing what they wanted. This Booth had formerly been gunner of a pirate ship, called the Dolphin.	The pirates, who were headed by George Booth, now commander of the ship, went on board, (as they had often done,) to the number of ten, and carried money with them under pretence of purchasing what they wanted. This Booth had formerly been gunner of a pirate ship, called the Dolphin.	true	304.68	317.97	21
3082_165428_000015_000001	Capt.	Capt.	false	317.97	318.84	9
3082_165428_000015_000002	Fourgette was pretty much upon his guard, and searched every man as he came over the side, and a pair of pocket pistols were found upon a Dutchman, who was the first that entered.	Fourgette was pretty much upon his guard, and searched every man as he came over the side, and a pair of pocket pistols were found upon a Dutchman, who was the first that entered.	false	318.84	327.72	23.584383
3082_165428_000015_000003	The captain told him that _he was a rogue, and had a design upon his ship_, and the pirates pretended to be so angry with this fellow's offering to come on board with arms, that they threatened to knock him on the head, and tossing him roughly into the boat, ordered him ashore, though they had before taken an oath on the Bible, either to carry the ship, or die in the undertaking.	The captain told him that underscore he was a rogue, and had a design upon his ship underscore, and the pirates pretended to be so angry with this fellow's offering to come on board with arms, that they threatened to knock him on the head, and tossing him roughly into the boat, ordered him ashore, though they had before taken an oath on the Bible, either to carry the ship, or die in the undertaking.	false	327.72	347.26	23
3082_165428_000016_000000	They were all searched, but they however contrived to get on board four pistols, which were all the arms they had for the enterprise, though Fourgette had 20 hands on board, and his small arms on the awning, to be in readiness.	They were all searched, but they however contrived to get on board four pistols, which were all the arms they had for the enterprise, though Fourgette had twenty hands on board, and his small arms on the awning, to be in readiness.	true	347.33	359.89	23.428549
3082_165428_000017_000000	The captain invited them into the cabin to dinner, but Booth chose to dine with the petty officer, though one Johnson, Isaac and another, went down.	The captain invited them into the cabin to dinner, but Booth chose to dine with the petty officer, though one Johnson, Isaac and another, went down.	true	360.02	368.445	24.48507
3082_165428_000017_000001	Booth was to give the watchword, which was _hurrah_.	Booth was to give the watchword, which was underscore hurrah underscore.	false	368.445	371.61	25.888613
3082_165428_000017_000002	Standing near the awning, and being a nimble fellow, at one spring he threw himself upon it, drew the arms to him, fired his pistol among the men, one of whom he wounded, (who jumping overboard was lost) and gave the signal.	Standing near the awning, and being a nimble fellow, at one spring he threw himself upon it, drew the arms to him, fired his pistol among the men, one of whom he wounded, (who jumping overboard was lost) and gave the signal.	true	371.61	384.28	22.643631
3082_165428_000018_000000	Three, I said, were in the cabin, and seven upon deck, who with handspikes and the arms seized, secured the ship's crew.	Three, I said, were in the cabin, and seven upon deck, who with handspikes and the arms seized, secured the ship's crew.	true	384.29	389.97	22.841091
3082_165428_000018_000001	The captain and his two mates, who were at dinner in the cabin, hearing the pistol, fell upon Johnson, and stabbed him in several places with their forks, but they being silver, did him no great damage.	The captain and his two mates, who were at dinner in the cabin, hearing the pistol, fell upon Johnson, and stabbed him in several places with their forks, but they being silver, did him no great damage.	false	389.97	399.42	19
3082_165428_000018_000002	Fourgette snatched his piece, which he snapped at Isaac's breast several times, but it would not go off.	Fourgette snatched his piece, which he snapped at Isaac's breast several times, but it would not go off.	false	399.42	404.715	24.110788
3082_165428_000018_000003	At last, finding his resistance vain, he submitted, and the pirates set him, and those of his men who would not join them, on shore, allowing him to take his books, papers, and whatever else he claimed as belonging to himself; and besides treating him very humanely, gave him several casks of liquor, with arms and powder, to purchase provisions in the country.	At last, finding his resistance vain, he submitted, and the pirates set him, and those of his men who would not join them, on shore, allowing him to take his books, papers, and whatever else he claimed as belonging to himself; and besides treating him very humanely, gave him several casks of liquor, with arms and powder, to purchase provisions in the country.	false	404.715	423.19	21.633766
3082_165428_000019_000000	I hope this digression, as it was in a manner needful, will be excused. I shall now proceed.	I hope this digression, as it was in a manner needful, will be excused. I shall now proceed.	true	423.2	428.46	24.075409
3082_165428_000020_000000	After they had taken in the Dolphin's company, which were on the island, and increased their crew, by that means, to the number of 80 hands, they sailed to St. Mary's, where Capt.	After they had taken in the Dolphin's company, which were on the island, and increased their crew, by that means, to the number of eighty hands, they sailed to saint Mary's, where Capt.	false	428.46	437.28	19
3082_165428_000020_000001	Mosson's ship lay at anchor, between the island and the main.	Mosson's ship lay at anchor, between the island and the main.	true	437.28	440.625	26.031197
3082_165428_000020_000002	This gentleman and his whole ship's company had been cut off at the instigation of Ort-Vantyle, a Dutchman of New-York.	This gentleman and his whole ship's company had been cut off at the instigation of Ort Vantyle, a Dutchman of New York.	true	440.625	447.375	24.554403
3082_165428_000021_000000	Out of her they took water casks and other necessaries; which having done, they designed for the river Methelage, on the west side of Madagascar, in the lat. of 16 degrees or thereabouts, to salt up provisions and to proceed to the East Indies, cruise off the islands of St. John, and lie in wait for the Moor ships from Mocha.	Out of her they took water casks and other necessaries; which having done, they designed for the river Methelage, on the west side of Madagascar, in the lat. of sixteen degrees or thereabouts, to salt up provisions and to proceed to the East Indies, cruise off the islands of saint John, and lie in wait for the Moor ships from Mocha.	false	447.375	464.73	18
3082_165428_000022_000000	In their way to Methelage they fell in (as I have said) with the pirate, on board of which was Capt.	In their way to Methelage they fell in (as I have said) with the pirate, on board of which was Capt.	false	464.73	470.07	23.77146
3082_165428_000022_000001	White.	White.	true	470.07	470.565	26.551302
3082_165428_000022_000002	They joined company, came to an anchor together in the above named river, where they had cleaned, salted and took in their provisions, and were ready to go to sea, when a large ship appeared in sight, and stood into the same river.	They joined company, came to an anchor together in the above named river, where they had cleaned, salted and took in their provisions, and were ready to go to sea, when a large ship appeared in sight, and stood into the same river.	true	470.565	482.025	21
3082_165428_000023_000000	The pirates knew not whether she was a merchantman or man-of-war.	The pirates knew not whether she was a merchantman or man of war.	true	482.025	485.44	20
3082_165428_000023_000001	She had been the latter, belonging to the French king, and could mount 50 guns; but being taken by the English, she was bought by some London merchants, and fitted out from that port to slave at Madagascar, and go to Jamaica.	She had been the latter, belonging to the French king, and could mount fifty guns; but being taken by the English, she was bought by some London merchants, and fitted out from that port to slave at Madagascar, and go to Jamaica.	true	485.6	498.07	25.135517
3082_165428_000023_000002	The captain was a young, inexperienced man, who was put in with a nurse.	The captain was a young, inexperienced man, who was put in with a nurse.	true	498.14	502.155	24.809217
3082_165428_000024_000000	The pirates sent their boats to speak with them, but the ship firing at them, they concluded it a man of war, and rowed ashore; the grab standing in, and not keeping her wind so well as the French built ship, run among a parcel of mangroves, and a stump piercing her bottom, she sunk: the other run aground, let go her anchor, and came to no damage, for the tide of flood fetched her off.	The pirates sent their boats to speak with them, but the ship firing at them, they concluded it a man of war, and rowed ashore; the grab standing in, and not keeping her wind so well as the French built ship, run among a parcel of mangroves, and a stump piercing her bottom, she sunk: the other run aground, let go her anchor, and came to no damage, for the tide of flood fetched her off.	false	502.155	522.39	24
3082_165428_000025_000000	The captain of the Speaker, for that was the name of the ship which frightened the pirates, was not a little vain of having forced these two vessels ashore, though he did not know whether they were pirates or merchantmen, and could not help expressing himself in these words: "How will my name ring on the exchange, when it is known I have run two pirates aground;" which gave handle to a satirical return from one of his men after he was taken, who said, "Lord! how our captain's name will ring on the exchange, when it is heard, he frightened two pirate ships ashore, and was taken by their two boats afterwards."	The captain of the Speaker, for that was the name of the ship which frightened the pirates, was not a little vain of having forced these two vessels ashore, though he did not know whether they were pirates or merchantmen, and could not help expressing himself in these words: "How will my name ring on the exchange, when it is known I have run two pirates aground;" which gave handle to a satirical return from one of his men after he was taken, who said, "Lord! how our captain's name will ring on the exchange, when it is heard, he frightened two pirate ships ashore, and was taken by their two boats afterwards."	false	522.39	551.685	19
