3082_165428_000026_000000	When the Speaker came within shot, she fired several times at the two vessels; and when she came to anchor, several more into the country, which alarmed the negroes, who, acquainting their king, he would allow him no trade, till the pirates living ashore, and who had a design on his ship, interceded for them, telling the king, they were their countrymen, and what had happened was through a mistake, it being a custom among them to fire their guns by way of respect, and it was owing to the gunner of the ship's negligence that they fired shot.	When the Speaker came within shot, she fired several times at the two vessels; and when she came to anchor, several more into the country, which alarmed the negroes, who, acquainting their king, he would allow him no trade, till the pirates living ashore, and who had a design on his ship, interceded for them, telling the king, they were their countrymen, and what had happened was through a mistake, it being a custom among them to fire their guns by way of respect, and it was owing to the gunner of the ship's negligence that they fired shot.	false	551.685	578.31	23.670107
3082_165428_000027_000000	The captain of the Speaker sent his purser ashore, to go up the country to the king, who lived about 24 miles from the coast, to carry a couple of small arms inlaid with gold, a couple of brass blunderbusses, and a pair of pistols, as presents, and to require trade.	The captain of the Speaker sent his purser ashore, to go up the country to the king, who lived about twenty four miles from the coast, to carry a couple of small arms inlaid with gold, a couple of brass blunderbusses, and a pair of pistols, as presents, and to require trade.	true	578.31	591.795	21
3082_165428_000027_000001	As soon as the purser was ashore, he was taken prisoner, by one Tom Collins, a Welshman, born in Pembroke, who lived on shore, and had belonged to the Charming Mary, of Barbadoes, which went out with a commission but was converted to a pirate.	As soon as the purser was ashore, he was taken prisoner, by one Tom Collins, a Welshman, born in Pembroke, who lived on shore, and had belonged to the Charming Mary, of Barbadoes, which went out with a commission but was converted to a pirate.	true	591.795	603.825	22.57611
3082_165428_000027_000002	He told the purser he was his prisoner, and must answer the damage done to two merchants who were slaving.	He told the purser he was his prisoner, and must answer the damage done to two merchants who were slaving.	true	603.825	608.985	20
3082_165428_000027_000003	The purser answered, that he was not commander; that the captain was a hot rash youth, put into business by his friends, which he did not understand; but however, satisfaction should be made.	The purser answered, that he was not commander; that the captain was a hot rash youth, put into business by his friends, which he did not understand; but however, satisfaction should be made.	true	608.985	619.17	23.492884
3082_165428_000027_000004	He was carried by Collins on board Booth's ship, where, at first, he was talked to in pretty strong terms; but after a while very civilly used, and the next morning sent up to the king with a guide, and peace made for him.	He was carried by Collins on board Booth's ship, where, at first, he was talked to in pretty strong terms; but after a while very civilly used, and the next morning sent up to the king with a guide, and peace made for him.	false	619.17	631.905	25.140427
3082_165428_000028_000000	The king allowed them trade, and sent down the usual presents, a couple of oxen between twenty and thirty people laden with rice, and as many more with the country liquor, called _toke_.	The king allowed them trade, and sent down the usual presents, a couple of oxen between twenty and thirty people laden with rice, and as many more with the country liquor, called underscore toke underscore.	false	631.905	641.79	23
3082_165428_000029_000000	The captain then settled the factory on the shore side, and began to buy slaves and provisions.	The captain then settled the factory on the shore side, and began to buy slaves and provisions.	true	641.79	647.13	19
3082_165428_000029_000001	The pirates were among them, and had opportunities of sounding the men, and knowing in what posture the ship lay.	The pirates were among them, and had opportunities of sounding the men, and knowing in what posture the ship lay.	true	647.13	653.265	18
3082_165428_000029_000002	They found by one Hugh Man, belonging to the Speaker, that there were not above 40 men on board, and that they had lost the second mate and 20 hands in the long boat, on the coast, before they came into this harbor, but that they kept a good look out, and had their guns ready primed.	They found by one Hugh Man, belonging to the Speaker, that there were not above forty men on board, and that they had lost the second mate and twenty hands in the long boat, on the coast, before they came into this harbor, but that they kept a good look out, and had their guns ready primed.	false	653.265	668.04	23.227745
3082_165428_000029_000003	However, he, for a hundred pounds, undertook to wet all the priming, and assist in taking the ship.	However, he, for a hundred pounds, undertook to wet all the priming, and assist in taking the ship.	true	668.04	673.66	25.010078
3082_165428_000030_000000	After some days the captain of the Speaker came on shore, and was received with great civility by the heads of the pirates, having agreed before to make satisfaction.	After some days the captain of the Speaker came on shore, and was received with great civility by the heads of the pirates, having agreed before to make satisfaction.	true	673.73	682.51	22.99389
3082_165428_000030_000001	In a day or two after, he was invited by them to eat a barbacued shoat, which invitation he accepted.	In a day or two after, he was invited by them to eat a barbacued shoat, which invitation he accepted.	true	682.73	689.13	23.171858
3082_165428_000030_000002	After dinner, Capt.	After dinner, Capt.	false	689.13	690.18	17
3082_165428_000030_000003	Bowen, who was, I have already said, a prisoner on board the French pirate, but now become one of the fraternity, and master of the grab, went out, and returned with a case of pistols in his hand, and told the Captain of the Speaker, whose name I won't mention, that he was his prisoner.	Bowen, who was, I have already said, a prisoner on board the French pirate, but now become one of the fraternity, and master of the grab, went out, and returned with a case of pistols in his hand, and told the Captain of the Speaker, whose name I won't mention, that he was his prisoner.	true	690.18	706.155	23.197956
3082_165428_000030_000004	He asked, upon what account?	He asked, upon what account?	true	706.155	708.1	27
3082_165428_000030_000005	Bowen answered, "they wanted his ship, his was a good one, and they were resolved to have her, to make amends for the damage he had done them."	Bowen answered, "they wanted his ship, his was a good one, and they were resolved to have her, to make amends for the damage he had done them."	true	708.47	716.16	22.223269
3082_165428_000031_000000	[Illustration: _Hugh Man wetting the Priming of the Guns._]	[Illustration: underscore Hugh Man wetting the Priming of the Guns.underscore]	false	716.16	716.325	-20
3082_165428_000032_000000	In the mean while his boat's crew, and the rest of his men ashore, were told by others of the pirates, who were drinking with them, that they were also prisoners: some of them answered, _Zounds, we don't trouble our heads what we are, let's have t'other bowl of punch_.	In the mean while his boat's crew, and the rest of his men ashore, were told by others of the pirates, who were drinking with them, that they were also prisoners: some of them answered, underscore Zounds, we don't trouble our heads what we are, let's have t'other bowl of punch underscore.	false	716.325	729.99	23.608566
3082_165428_000033_000000	A watchword was given, and no boat to be admitted on board the ship. This word, which was for that night, _Coventry_, was known to them.	A watchword was given, and no boat to be admitted on board the ship. This word, which was for that night, underscore Coventry underscore, was known to them.	false	729.99	736.74	23.661175
3082_165428_000033_000001	At 8 o'clock they manned the twelve-oared boat, and the one they found at Mayotta, with 24 men, and set out for the ship.	At eight o'clock they manned the twelve oared boat, and the one they found at Mayotta, with twenty four men, and set out for the ship.	true	736.74	743.415	28.3572
3082_165428_000033_000002	When they were put off, the captain of the Speaker desired them to come back, as he wanted to speak with them.	When they were put off, the captain of the Speaker desired them to come back, as he wanted to speak with them.	false	743.415	748.8	25.64118
3082_165428_000033_000003	Capt.	Capt.	false	748.8	749.31	30.192387
3082_165428_000033_000004	Booth asked what he wanted!	Booth asked what he wanted!	true	749.31	750.735	22.131336
3082_165428_000033_000005	He said, "they could never take his ship." "Then," said Booth, "we'll die in or alongside of her."--"But," replied the captain, "if you will go with safety, don't board on the larboard side, for there is a gun out of the steerage loaded with partridge, which will clear the decks." They thanked him, and proceeded.	He said, "they could never take his ship." "Then," said Booth, "we'll die in or alongside of her."--"But," replied the captain, "if you will go with safety, don't board on the larboard side, for there is a gun out of the steerage loaded with partridge, which will clear the decks." They thanked him, and proceeded.	false	750.735	768.315	24.964363
3082_165428_000034_000000	When they were near the ship they were hailed, and the answer was, _the Coventry_.	When they were near the ship they were hailed, and the answer was, underscore the Coventry underscore.	false	768.315	771.69	19
3082_165428_000034_000001	"All well," said the mate, "get the lights over the side;" but spying the second boat, he asked what boat that was?	"All well," said the mate, "get the lights over the side;" but spying the second boat, he asked what boat that was?	true	771.69	777.18	23.848738
3082_165428_000034_000002	One answered it was a raft of water, another that it was a boat of beef; this disagreement in the answers made the mate suspicious, who cried out--_Pirates, take to your arms my lads_, and immediately clapped a match to a gun, which, as the priming was before wet by the treachery of Hugh Man, only fizzed.	One answered it was a raft of water, another that it was a boat of beef; this disagreement in the answers made the mate suspicious, who cried out-underscore Pirates, take to your arms my lads underscore, and immediately clapped a match to a gun, which, as the priming was before wet by the treachery of Hugh Man, only fizzed.	false	777.18	793.875	24.055107
3082_165428_000034_000003	They boarded in the instant, and made themselves masters of her, without the loss of a man on either side.	They boarded in the instant, and made themselves masters of her, without the loss of a man on either side.	true	793.875	799.335	20
3082_165428_000035_000000	The next day they put necessary provisions on board the French built ship, and gave her to the captain of the Speaker, and those men who would go off with him, among whom was Man, who had betrayed his ship; for the pirates had both paid him the 100_l_ agreed, and kept his secret.	The next day they put necessary provisions on board the French built ship, and gave her to the captain of the Speaker, and those men who would go off with him, among whom was Man, who had betrayed his ship; for the pirates had both paid him the one hundred underscore l underscore agreed, and kept his secret.	false	799.335	814.425	23.688921
3082_165428_000035_000001	The captain having thus lost his ship, sailed in that which the pirates gave him, for Johanna, where he fell ill and died with grief.	The captain having thus lost his ship, sailed in that which the pirates gave him, for Johanna, where he fell ill and died with grief.	false	814.425	822.495	24.262037
3082_165428_000036_000000	The pirates having here victualled, they sailed for the Bay of St. Augustine, where they took in between 70 and 80 men, who had belonged to the ship Alexander, commanded by Capt.	The pirates having here victualled, they sailed for the Bay of saint Augustine, where they took in between seventy and eighty men, who had belonged to the ship Alexander, commanded by Capt.	false	822.495	832.5	22.269382
3082_165428_000036_000001	James, a pirate.	james, a pirate.	true	832.5	833.74	24.4211
3082_165428_000036_000002	They also took up her guns, and mounted the Speaker with 54, which made up their number, and 240 men, besides slaves, of which they had about 20.	They also took up her guns, and mounted the Speaker with fifty four, which made up their number, and two hundred forty men, besides slaves, of which they had about twenty.	false	833.93	843.6	25.521496
3082_165428_000037_000000	From hence they sailed for the East Indies, but stopped at Zanguebar for fresh provisions, where the Portuguese had once a settlement, but now inhabited by Arabians.	From hence they sailed for the East Indies, but stopped at Zanguebar for fresh provisions, where the Portuguese had once a settlement, but now inhabited by Arabians.	false	843.6	852.79	21.148464
3082_165428_000037_000001	Some of them went ashore with the captain to buy provisions.	Some of them went ashore with the captain to buy provisions.	true	852.8	855.525	18.86533
3082_165428_000037_000002	The captain was sent for by the governor, who went with about 14 in company.	The captain was sent for by the governor, who went with about fourteen in company.	false	855.525	859.75	24.151764
3082_165428_000037_000003	They passed through the guard, and when they had entered the governor's house, they were all cut off; and, at the same time, others who were in different houses of the town were set upon, which made them fly to the shore.	They passed through the guard, and when they had entered the governor's house, they were all cut off; and, at the same time, others who were in different houses of the town were set upon, which made them fly to the shore.	false	859.82	870.61	23.586828
3082_165428_000037_000004	The long-boat, which lay off a grappling, was immediately put in by those who looked after her.	The long boat, which lay off a grappling, was immediately put in by those who looked after her.	true	870.74	875.61	23.69622
3082_165428_000037_000005	There were not above half a dozen of the pirates who brought their arms ashore, but they plied them so well, for they were in the boat, that most of the men got into her.	There were not above half a dozen of the pirates who brought their arms ashore, but they plied them so well, for they were in the boat, that most of the men got into her.	false	875.61	883.96	20
3082_165428_000037_000006	The quarter-master ran down sword in hand, and though he was attacked by many, he behaved himself so well, that he got into a little canoe, put off, and reached the long-boat.	The quarter master ran down sword in hand, and though he was attacked by many, he behaved himself so well, that he got into a little canoe, put off, and reached the long boat.	true	884.06	892.89	21.88081
3082_165428_000038_000000	In the interim, the little fort the Arabians had, played upon the ship, which returned the salute very warmly.	In the interim, the little fort the Arabians had, played upon the ship, which returned the salute very warmly.	true	892.89	898.08	17
3082_165428_000038_000001	Thus they got on board, with the loss of Captain Booth and 20 men, and set sail for the East Indies.	Thus they got on board, with the loss of Captain Booth and twenty men, and set sail for the East Indies.	false	898.08	902.91	21.11021
3082_165428_000038_000002	When they were under sail, they went to voting for a new captain, and the quarter-master, who had behaved so well in the last affair with the Arabians, was chosen; but he declining all command the crew made choice of Bowen for captain, Pickering to succeed him as master, Samuel Herault, a Frenchman, for quarter-master, and Nathaniel North for captain quarter-master.	When they were under sail, they went to voting for a new captain, and the quarter master, who had behaved so well in the last affair with the Arabians, was chosen; but he declining all command the crew made choice of Bowen for captain, Pickering to succeed him as master, Samuel Herault, a Frenchman, for quarter master, and Nathaniel North for captain quarter master.	false	902.91	922.425	22.900028
3082_165428_000039_000000	Things being thus settled, they came to the mouth of the Red Sea, and fell in with 13 sail of Moor ships, which they kept company with the greater part of the day, but afraid to venture on them, as they took them for Portuguese men-of-war.	Things being thus settled, they came to the mouth of the Red Sea, and fell in with thirteen sail of Moor ships, which they kept company with the greater part of the day, but afraid to venture on them, as they took them for Portuguese men of war.	true	922.425	933.49	20
3082_165428_000039_000001	At length part were for boarding, and advised it.	At length part were for boarding, and advised it.	true	933.53	936.315	23.59316
3082_165428_000039_000002	The captain though he said little, did not seem inclined, for he was but a young pirate, though an old commander of a merchantman. Those who pushed for boarding, then desired Captain Boreman, already mentioned, to take the command; but he said he would not be a usurper; that nobody was more fit for it than he who had it; that for his part he would stand by his fuzil, and went forward to the forecastle with such as would have him take the command, to be ready to board; on which the captain's quarter-master said, if they were resolved to engage, their captain, (whose representative he was) did not want resolution; therefore ordered them to get their tacks on board (for they had already made a clear ship) and get ready for boarding; which they accordingly did, and coming up with the sternmost ship, they fired a broadside into her, which killed two Moors, clapped her on board and carried her; but night coming on, they made only this prize, which yielded them L500 per man.	The captain though he said little, did not seem inclined, for he was but a young pirate, though an old commander of a merchantman. Those who pushed for boarding, then desired Captain Boreman, already mentioned, to take the command; but he said he would not be a usurper; that nobody was more fit for it than he who had it; that for his part he would stand by his fuzil, and went forward to the forecastle with such as would have him take the command, to be ready to board; on which the captain's quarter master said, if they were resolved to engage, their captain, (whose representative he was) did not want resolution; therefore ordered them to get their tacks on board (for they had already made a clear ship) and get ready for boarding; which they accordingly did, and coming up with the sternmost ship, they fired a broadside into her, which killed two Moors, clapped her on board and carried her; but night coming on, they made only this prize, which yielded them l five hundred per man.	false	936.315	987.25	23
3082_165428_000039_000003	From hence they sailed to the coast of Malabar.	From hence they sailed to the coast of Malabar.	true	987.35	989.25	18.276138
3082_165428_000039_000004	The adventures of these pirates on this coast are already set down in Captain Bowen's life, to which I refer the reader, and shall only observe, that Captain White was all this time before the mast, being a forced man from the beginning.	The adventures of these pirates on this coast are already set down in Captain Bowen's life, to which I refer the reader, and shall only observe, that Captain White was all this time before the mast, being a forced man from the beginning.	true	989.25	1000.58	21
3082_165428_000040_000000	Bowen's crew dispersing, Captain White went to Methelage, where he lived ashore with the king, not having an opportunity of getting off the island, till another pirate ship, called the Prosperous, commanded by one Howard, who had been bred a lighterman on the river Thames, came in. This ship was taken at Augustin, by some pirates from shore, and the crew of their long-boat, which joined them, at the instigation of one Ranten, boatswain's mate, who sent for water.	Bowen's crew dispersing, Captain White went to Methelage, where he lived ashore with the king, not having an opportunity of getting off the island, till another pirate ship, called the Prosperous, commanded by one Howard, who had been bred a lighterman on the river Thames, came in. This ship was taken at Augustin, by some pirates from shore, and the crew of their long boat, which joined them, at the instigation of one Ranten, boatswain's mate, who sent for water.	true	1000.58	1022.99	20
3082_165428_000040_000001	They came on board in the night and surprised her, though not without resistance, in which the captain and chief mate were killed, and several others wounded.	They came on board in the night and surprised her, though not without resistance, in which the captain and chief mate were killed, and several others wounded.	true	1022.99	1030.71	22.813177
3082_165428_000041_000000	Those who were ashore with Captain White, resolving to enter in this ship, determined him to go also, rather than be left alone with the natives, hoping, by some accident or other, to have an opportunity of returning home.	Those who were ashore with Captain White, resolving to enter in this ship, determined him to go also, rather than be left alone with the natives, hoping, by some accident or other, to have an opportunity of returning home.	true	1030.71	1041.52	20
3082_165428_000041_000001	He continued on board this ship, in which he was made quarter-master, till they met with, and all went on board of Bowen, as is set down in his life, in which ship he continued after Bowen left them.	He continued on board this ship, in which he was made quarter master, till they met with, and all went on board of Bowen, as is set down in his life, in which ship he continued after Bowen left them.	false	1041.53	1052.58	24.625357
3082_165428_000041_000002	At Port Dolphin he went _off_ in the boats to fetch some of the crew left ashore, the ship being blown to sea the night before.	At Port Dolphin he went underscore off underscore in the boats to fetch some of the crew left ashore, the ship being blown to sea the night before.	false	1052.58	1058.67	24.487942
3082_165428_000041_000003	The ship not being able to get in, and he supposing her gone to the west side of the island, as they had formerly proposed, he steered that course in his boat with 26 men.	The ship not being able to get in, and he supposing her gone to the west side of the island, as they had formerly proposed, he steered that course in his boat with twenty six men.	false	1058.67	1067.74	22
3082_165428_000041_000004	They touched at Augustin, expecting the ship, but she not appearing in a week, the time they waited, the king ordered them to be gone, telling them they imposed on him with lies, for he did not believe they had any ship: however he gave them fresh provision: they took in water, and made for Methelage.	They touched at Augustin, expecting the ship, but she not appearing in a week, the time they waited, the king ordered them to be gone, telling them they imposed on him with lies, for he did not believe they had any ship: however he gave them fresh provision: they took in water, and made for Methelage.	true	1067.78	1082.46	22
3082_165428_000041_000005	Here as Captain White was known to the king, they were kindly received, and staid about a fortnight in expectation of the ship, but she not appearing they raised their boat a streak, salted the provision the king gave them, put water aboard, and stood for the north end of the island, designing to go round, believing their ship might be at the island of St. Mary.	Here as Captain White was known to the king, they were kindly received, and staid about a fortnight in expectation of the ship, but she not appearing they raised their boat a streak, salted the provision the king gave them, put water aboard, and stood for the north end of the island, designing to go round, believing their ship might be at the island of saint Mary.	true	1082.46	1100.65	24.479742
3082_165428_000041_000006	When they came to the north end, the current, which sets to the N.W. for eight months in the year, was so strong they found it impossible to get round.	When they came to the north end, the current, which sets to the n w for eight months in the year, was so strong they found it impossible to get round.	false	1100.93	1108.54	21.451908
3082_165428_000041_000007	Wherefore they got into a harbor, of which there are many for small vessels.	Wherefore they got into a harbor, of which there are many for small vessels.	true	1108.7	1112.8	20.029943
3082_165428_000041_000008	Here they stayed about three weeks or a month, when part of the crew were for burning the boat, and travelling over land to a black king of their acquaintance, whose name was Reberimbo, who lived at a place called Manangaromasigh, in lat.	Here they stayed about three weeks or a month, when part of the crew were for burning the boat, and travelling over land to a black king of their acquaintance, whose name was Reberimbo, who lived at a place called Manangaromasigh, in lat.	false	1112.87	1125.18	21
3082_165428_000041_000009	15 deg. or thereabouts.	fifteen d e g. or thereabouts.	false	1125.18	1127.11	19
