3328_168626_000023_000004	This took place in the depths of a forest, at night, in winter, far from all human sight; she was a child of eight: no one but God saw that sad thing at the moment.	This took place in the depths of a forest, at night, in winter, far from all human sight; she was a child of eight: no one but God saw that sad thing at the moment.	false	774.38	788.35	20.09345
3328_168626_000024_000000	And her mother, no doubt, alas!	And her mother, no doubt, alas!	true	788.84	791.11	19
3328_168626_000025_000000	For there are things that make the dead open their eyes in their graves.	For there are things that make the dead open their eyes in their graves.	true	791.15	795.1	17
3328_168626_000026_000000	She panted with a sort of painful rattle; sobs contracted her throat, but she dared not weep, so afraid was she of the Thenardier, even at a distance: it was her custom to imagine the Thenardier always present.	She panted with a sort of painful rattle; sobs contracted her throat, but she dared not weep, so afraid was she of the Thenardier, even at a distance: it was her custom to imagine the Thenardier always present.	false	795.65	811.21	19.919783
3328_168626_000027_000000	However, she could not make much headway in that manner, and she went on very slowly.	However, she could not make much headway in that manner, and she went on very slowly.	true	811.49	817.24	18.76659
3328_168626_000027_000001	In spite of diminishing the length of her stops, and of walking as long as possible between them, she reflected with anguish that it would take her more than an hour to return to Montfermeil in this manner, and that the Thenardier would beat her.	In spite of diminishing the length of her stops, and of walking as long as possible between them, she reflected with anguish that it would take her more than an hour to return to Montfermeil in this manner, and that the Thenardier would beat her.	false	817.37	831.28	16
3328_168626_000027_000002	This anguish was mingled with her terror at being alone in the woods at night; she was worn out with fatigue, and had not yet emerged from the forest.	This anguish was mingled with her terror at being alone in the woods at night; she was worn out with fatigue, and had not yet emerged from the forest.	true	831.44	841.39	20
3328_168626_000027_000003	On arriving near an old chestnut-tree with which she was acquainted, made a last halt, longer than the rest, in order that she might get well rested; then she summoned up all her strength, picked up her bucket again, and courageously resumed her march, but the poor little desperate creature could not refrain from crying, "O my God! my God!"	On arriving near an old chestnut tree with which she was acquainted, made a last halt, longer than the rest, in order that she might get well rested; then she summoned up all her strength, picked up her bucket again, and courageously resumed her march, but the poor little desperate creature could not refrain from crying, "O my God! my God!"	false	842	865.9	20.347378
3328_168626_000028_000000	At that moment she suddenly became conscious that her bucket no longer weighed anything at all: a hand, which seemed to her enormous, had just seized the handle, and lifted it vigorously.	At that moment she suddenly became conscious that her bucket no longer weighed anything at all: a hand, which seemed to her enormous, had just seized the handle, and lifted it vigorously.	true	866.48	877.72	20.578793
3328_168626_000028_000001	She raised her head.	She raised her head.	true	878.12	879.58	22.912779
3328_168626_000028_000002	A large black form, straight and erect, was walking beside her through the darkness; it was a man who had come up behind her, and whose approach she had not heard.	A large black form, straight and erect, was walking beside her through the darkness; it was a man who had come up behind her, and whose approach she had not heard.	true	879.68	889.51	18
3328_168626_000028_000003	This man, without uttering a word, had seized the handle of the bucket which she was carrying.	This man, without uttering a word, had seized the handle of the bucket which she was carrying.	true	889.94	895.54	16.820065
3328_168626_000029_000000	There are instincts for all the encounters of life.	There are instincts for all the encounters of life.	false	896.42	900.82	24.732153
3328_168626_000030_000000	The child was not afraid.	The child was not afraid.	false	901.04	908.22	19.988785
3328_168626_000031_000000	CHAPTER VI--WHICH POSSIBLY PROVES BOULATRUELLE'S INTELLIGENCE	CHAPTER six-WHICH POSSIBLY PROVES BOULATRUELLE'S INTELLIGENCE	false	908.22	919.11	19.544165
