3816_19585_000006_000000	CHAPTER IV.	CHAPTER four.
3816_19585_000007_000000	Is it not unaccountable that, in the midst of all my increased veneration for my patron, the first tumult of my emotion was scarcely subsided, before the old question that had excited my conjectures recurred to my mind, Was he the murderer?	Is it not unaccountable that, in the midst of all my increased veneration for my patron, the first tumult of my emotion was scarcely subsided, before the old question that had excited my conjectures recurred to my mind, Was he the murderer?
3816_19585_000007_000001	It was a kind of fatal impulse, that seemed destined to hurry me to my destruction.	It was a kind of fatal impulse, that seemed destined to hurry me to my destruction.
3816_19585_000007_000003	That was as completely accounted for from the consideration of his excessive sensibility in matters of honour, as it would have been upon the supposition of the most atrocious guilt.	That was as completely accounted for from the consideration of his excessive sensibility in matters of honour, as it would have been upon the supposition of the most atrocious guilt.
3816_19585_000007_000004	Knowing, as he did, that such a charge had once been connected with his name, he would of course be perpetually uneasy, and suspect some latent insinuation at every possible opportunity.	Knowing, as he did, that such a charge had once been connected with his name, he would of course be perpetually uneasy, and suspect some latent insinuation at every possible opportunity.
3816_19585_000007_000005	He would doubt and fear, lest every man with whom he conversed harboured the foulest suspicion against him.	He would doubt and fear, lest every man with whom he conversed harboured the foulest suspicion against him.
3816_19585_000007_000006	In my case he found that I was in possession of some information, more than he was aware of, without its being possible for him to decide to what it amounted, whether I had heard a just or unjust, a candid or calumniatory tale.	In my case he found that I was in possession of some information, more than he was aware of, without its being possible for him to decide to what it amounted, whether I had heard a just or unjust, a candid or calumniatory tale.
3816_19585_000008_000000	The fluctuating state of my mind produced a contention of opposite principles, that by turns usurped dominion over my conduct.	The fluctuating state of my mind produced a contention of opposite principles, that by turns usurped dominion over my conduct.
3816_19585_000008_000002	Mr. Falkland, who was most painfully alive to every thing that related to his honour, saw these variations, and betrayed his consciousness of them now in one manner, and now in another, frequently before I was myself aware, sometimes almost before they existed.	mr Falkland, who was most painfully alive to every thing that related to his honour, saw these variations, and betrayed his consciousness of them now in one manner, and now in another, frequently before I was myself aware, sometimes almost before they existed.
3816_19585_000008_000003	The situation of both was distressing; we were each of us a plague to the other; and I often wondered, that the forbearance and benignity of my master was not at length exhausted, and that he did not determine to thrust from him for ever so incessant an observer.	The situation of both was distressing; we were each of us a plague to the other; and I often wondered, that the forbearance and benignity of my master was not at length exhausted, and that he did not determine to thrust from him for ever so incessant an observer.
3816_19585_000008_000005	I had some consolation in the midst of my restlessness.	I had some consolation in the midst of my restlessness.
3816_19585_000008_000006	Curiosity is a principle that carries its pleasures, as well as its pains, along with it.	Curiosity is a principle that carries its pleasures, as well as its pains, along with it.
3816_19585_000008_000008	But to Mr. Falkland there was no consolation.	But to mr Falkland there was no consolation.
3816_19585_000008_000009	What he endured in the intercourse between us appeared to be gratuitous evil.	What he endured in the intercourse between us appeared to be gratuitous evil.
3816_19585_000008_000010	He had only to wish that there was no such person as myself in the world, and to curse the hour when his humanity led him to rescue me from my obscurity, and place me in his service.	He had only to wish that there was no such person as myself in the world, and to curse the hour when his humanity led him to rescue me from my obscurity, and place me in his service.
3816_19585_000009_000001	The constant state of vigilance and suspicion in which my mind was retained, worked a very rapid change in my character.	The constant state of vigilance and suspicion in which my mind was retained, worked a very rapid change in my character.
3816_19585_000009_000002	It seemed to have all the effect that might have been expected from years of observation and experience.	It seemed to have all the effect that might have been expected from years of observation and experience.
3816_19585_000009_000003	The strictness with which I endeavoured to remark what passed in the mind of one man, and the variety of conjectures into which I was led, appeared, as it were, to render me a competent adept in the different modes in which the human intellect displays its secret workings.	The strictness with which I endeavoured to remark what passed in the mind of one man, and the variety of conjectures into which I was led, appeared, as it were, to render me a competent adept in the different modes in which the human intellect displays its secret workings.
3816_19585_000009_000005	As to his guilt, I could scarcely bring myself to doubt that in some way or other, sooner or later, I should arrive at the knowledge of that, if it really existed.	As to his guilt, I could scarcely bring myself to doubt that in some way or other, sooner or later, I should arrive at the knowledge of that, if it really existed.
3816_19585_000010_000001	I shall come soon enough to the story of my own misery.	I shall come soon enough to the story of my own misery.
3816_19585_000010_000002	I have already said, that one of the motives which induced me to the penning of this narrative, was to console myself in my insupportable distress.	I have already said, that one of the motives which induced me to the penning of this narrative, was to console myself in my insupportable distress.
3816_19585_000010_000004	While I recollect or describe past scenes, which occurred in a more favourable period of my life, my attention is called off for a short interval, from the hopeless misfortune in which I am at present involved.	While I recollect or describe past scenes, which occurred in a more favourable period of my life, my attention is called off for a short interval, from the hopeless misfortune in which I am at present involved.
3816_19585_000010_000005	The man must indeed possess an uncommon portion of hardness of heart, who can envy me so slight a relief.--To proceed.	The man must indeed possess an uncommon portion of hardness of heart, who can envy me so slight a relief.--To proceed.
3816_19585_000011_000000	For some time after the explanation which had thus taken place between me and Mr. Falkland, his melancholy, instead of being in the slightest degree diminished by the lenient hand of time, went on perpetually to increase.	For some time after the explanation which had thus taken place between me and mr Falkland, his melancholy, instead of being in the slightest degree diminished by the lenient hand of time, went on perpetually to increase.
3816_19585_000011_000002	It was no longer practicable wholly to conceal them from the family, and even from the neighbourhood.	It was no longer practicable wholly to conceal them from the family, and even from the neighbourhood.
3816_19585_000011_000003	He would sometimes, without any previous notice, absent himself from his house for two or three days, unaccompanied by servant or attendant.	He would sometimes, without any previous notice, absent himself from his house for two or three days, unaccompanied by servant or attendant.
3816_19585_000011_000005	But it was impossible that a man of Mr. Falkland's distinction and fortune should long continue in such a practice, without its being discovered what was become of him; though a considerable part of our county was among the wildest and most desolate districts that are to be found in South Britain.	But it was impossible that a man of mr Falkland's distinction and fortune should long continue in such a practice, without its being discovered what was become of him; though a considerable part of our county was among the wildest and most desolate districts that are to be found in South Britain.
3816_19585_000011_000006	Mr. Falkland was sometimes seen climbing among the rocks, reclining motionless for hours together upon the edge of a precipice, or lulled into a kind of nameless lethargy of despair by the dashing of the torrents.	mr Falkland was sometimes seen climbing among the rocks, reclining motionless for hours together upon the edge of a precipice, or lulled into a kind of nameless lethargy of despair by the dashing of the torrents.
3816_19585_000011_000007	He would remain for whole nights together under the naked cope of heaven, inattentive to the consideration either of place or time; insensible to the variations of the weather, or rather seeming to be delighted with that uproar of the elements, which partially called off his attention from the discord and dejection that occupied his own mind.	He would remain for whole nights together under the naked cope of heaven, inattentive to the consideration either of place or time; insensible to the variations of the weather, or rather seeming to be delighted with that uproar of the elements, which partially called off his attention from the discord and dejection that occupied his own mind.
3816_19585_000012_000000	At first, when we received intelligence at any time of the place to which Mr. Falkland had withdrawn himself, some person of his household, Mr. Collins or myself, but most generally myself, as I was always at home, and always, in the received sense of the word, at leisure, went to him to persuade him to return.	At first, when we received intelligence at any time of the place to which mr Falkland had withdrawn himself, some person of his household, mr Collins or myself, but most generally myself, as I was always at home, and always, in the received sense of the word, at leisure, went to him to persuade him to return.
3816_19585_000012_000001	But, after a few experiments, we thought it advisable to desist, and leave him to prolong his absence, or to terminate it, as might happen to suit his own inclination.	But, after a few experiments, we thought it advisable to desist, and leave him to prolong his absence, or to terminate it, as might happen to suit his own inclination.
3816_19585_000012_000003	At one time he would suddenly yield to his humble, venerable friend, murmuring grievously at the constraint that was put upon him, but without spirit enough even to complain of it with energy.	At one time he would suddenly yield to his humble, venerable friend, murmuring grievously at the constraint that was put upon him, but without spirit enough even to complain of it with energy.
3816_19585_000012_000004	At another time, even though complying, he would suddenly burst out in a paroxysm of resentment.	At another time, even though complying, he would suddenly burst out in a paroxysm of resentment.
3816_19585_000012_000005	Upon these occasions there was something inconceivably, savagely terrible in his anger, that gave to the person against whom it was directed the most humiliating and insupportable sensations.	Upon these occasions there was something inconceivably, savagely terrible in his anger, that gave to the person against whom it was directed the most humiliating and insupportable sensations.
3816_19585_000012_000006	Me he always treated, at these times, with fierceness, and drove me from him with a vehemence lofty, emphatical, and sustained, beyond any thing of which I should have thought human nature to be capable.	Me he always treated, at these times, with fierceness, and drove me from him with a vehemence lofty, emphatical, and sustained, beyond any thing of which I should have thought human nature to be capable.
3816_19585_000012_000007	These sallies seemed always to constitute a sort of crisis in his indisposition; and, whenever he was induced to such a premature return, he would fall immediately after into a state of the most melancholy inactivity, in which he usually continued for two or three days.	These sallies seemed always to constitute a sort of crisis in his indisposition; and, whenever he was induced to such a premature return, he would fall immediately after into a state of the most melancholy inactivity, in which he usually continued for two or three days.
