3224_168198_000013_000001	This strict inquiry Portugues saw from the hollow of a tree, wherein he lay hid; and upon their return he made the best of his way to del Golpho Triste, forty leagues from Campechy, where he arrived within a fortnight after his escape: during which time, as also afterwards, he endured extreme hunger and thirst, having no other provision with him than a small calabaca with a little water: besides the fears of falling again into the hands of the Spaniards.	This strict inquiry Portugues saw from the hollow of a tree, wherein he lay hid; and upon their return he made the best of his way to del Golpho Triste, forty leagues from Campechy, where he arrived within a fortnight after his escape: during which time, as also afterwards, he endured extreme hunger and thirst, having no other provision with him than a small calabaca with a little water: besides the fears of falling again into the hands of the Spaniards.	false	675.08	700.75	23.837637
3224_168198_000013_000002	He eat nothing but a few shell-fish, which he found among the rocks near the seashore; and being obliged to pass some rivers, not knowing well how to swim, he found at last an old board which the waves had driven ashore, wherein were a few great nails; these he took, and with no small labour whetted on a stone, till he had made them like knives, though not so well; with these, and nothing else, he cut down some branches of trees, which with twigs and osiers he joined together, and made as well as he could a boat to waft him over the rivers: thus arriving at the Cape of Golpho Triste, as was said, he found a vessel of pirates, comrades of his own, lately come from Jamaica.	He eat nothing but a few shell fish, which he found among the rocks near the seashore; and being obliged to pass some rivers, not knowing well how to swim, he found at last an old board which the waves had driven ashore, wherein were a few great nails; these he took, and with no small labour whetted on a stone, till he had made them like knives, though not so well; with these, and nothing else, he cut down some branches of trees, which with twigs and osiers he joined together, and made as well as he could a boat to waft him over the rivers: thus arriving at the Cape of Golpho Triste, as was said, he found a vessel of pirates, comrades of his own, lately come from Jamaica.	false	700.91	739.81	23
3224_168198_000014_000000	To these he related all his adversities and misfortunes, and withal desired they would fit him with a boat and twenty men, with which company alone he promised to return to Campechy, and assault the ship that was in the river, by which he had been taken fourteen days before. They presently granted his request, and equipped him a boat accordingly. With this small company he set out to execute his design, which he bravely performed eight days after he left Golpho Triste; for being arrived at Campechy, with an undaunted courage, and without any noise, he assaulted the said ship: those on board thought it was a boat from land that came to bring contraband goods, and so were in no posture of defence; which opportunity the pirates laying hold of, assaulted them so resolutely, that in a little time they compelled the Spaniards to surrender.	To these he related all his adversities and misfortunes, and withal desired they would fit him with a boat and twenty men, with which company alone he promised to return to Campechy, and assault the ship that was in the river, by which he had been taken fourteen days before. They presently granted his request, and equipped him a boat accordingly. With this small company he set out to execute his design, which he bravely performed eight days after he left Golpho Triste; for being arrived at Campechy, with an undaunted courage, and without any noise, he assaulted the said ship: those on board thought it was a boat from land that came to bring contraband goods, and so were in no posture of defence; which opportunity the pirates laying hold of, assaulted them so resolutely, that in a little time they compelled the Spaniards to surrender.	false	740.72	787.2	22
3224_168198_000015_000000	Being masters of the ship, they immediately weighed anchor and set sail from the port, lest they should be pursued by other vessels.	Being masters of the ship, they immediately weighed anchor and set sail from the port, lest they should be pursued by other vessels.	true	787.2	794.02	22.446295
3224_168198_000015_000001	This they did with the utmost joy, seeing themselves possessors of so brave a ship; especially Portugues, who by a second turn of fortune was become rich and powerful again, who was so lately in that same vessel a prisoner, condemned to be hanged.	This they did with the utmost joy, seeing themselves possessors of so brave a ship; especially Portugues, who by a second turn of fortune was become rich and powerful again, who was so lately in that same vessel a prisoner, condemned to be hanged.	false	794.06	808.57	20
3224_168198_000015_000002	With this purchase he designed greater things, which he might have done, since there remained in the vessel so great a quantity of rich merchandise, though the plate had been sent to the city: but while he was making his voyage to Jamaica, near the isle of Pinos, on the south of Cuba, a terrible storm arose, which drove against the Jardines rocks, where she was lost; but Portugues, with his companions, escaped in a canoe, in which he arrived at Jamaica, where it was not long ere he went on new adventures, but was never fortunate after.	With this purchase he designed greater things, which he might have done, since there remained in the vessel so great a quantity of rich merchandise, though the plate had been sent to the city: but while he was making his voyage to Jamaica, near the isle of Pinos, on the south of Cuba, a terrible storm arose, which drove against the Jardines rocks, where she was lost; but Portugues, with his companions, escaped in a canoe, in which he arrived at Jamaica, where it was not long ere he went on new adventures, but was never fortunate after.	false	808.67	838.89	22
3224_168198_000016_000000	Nor less considerable are the actions of another pirate who now lives at Jamaica, who on several occasions has performed very surprising things. He was born at Groninghen in the United Provinces.	Nor less considerable are the actions of another pirate who now lives at Jamaica, who on several occasions has performed very surprising things. He was born at Groninghen in the United Provinces.	false	838.89	854.73	19.139688
3224_168198_000016_000001	His own name not being known, his companions gave him that of Roche Brasiliano, by reason of his long residence in Brasil: hence he was forced to fly, when the Portuguese retook those countries from the Dutch, several nations then inhabiting at Brasil (as English, French, Dutch, and others), being constrained to seek new fortunes.	His own name not being known, his companions gave him that of Roche Brasiliano, by reason of his long residence in Brasil: hence he was forced to fly, when the Portuguese retook those countries from the Dutch, several nations then inhabiting at Brasil (as English, French, Dutch, and others), being constrained to seek new fortunes.	false	854.73	864.78	20.412136
