3224_168198_000000_000000	CHAPTER V	CHAPTER five	true	24.285	25.65	23.799536
3224_168198_000001_000000	_How the pirates arm their vessels, and regulate their voyages._	underscore How the pirates arm their vessels, and regulate their voyages.underscore	false	25.65	32.88	25.232052
3224_168198_000002_000000	BEFORE the pirates go to sea, they give notice to all concerned, of the day on which they are to embark; obliging each man to bring so many pounds of powder and ball as they think necessary.	BEFORE the pirates go to sea, they give notice to all concerned, of the day on which they are to embark; obliging each man to bring so many pounds of powder and ball as they think necessary.	false	32.88	43.42	21
3224_168198_000002_000001	Being all come aboard, they consider where to get provisions, especially flesh, seeing they scarce eat anything else; and of this the most common sort is pork; the next food is tortoises, which they salt a little: sometimes they rob such or such hog-yards, where the Spaniards often have a thousand head of swine together.	Being all come aboard, they consider where to get provisions, especially flesh, seeing they scarce eat anything else; and of this the most common sort is pork; the next food is tortoises, which they salt a little: sometimes they rob such or such hog yards, where the Spaniards often have a thousand head of swine together.	true	43.88	62.59	23.298857
3224_168198_000002_000002	They come to these places in the night, and having beset the keeper's lodge, they force him to rise, and give them as many heads as they desire, threatening to kill him if he refuses, or makes any noise; and these menaces are oftentimes executed on the miserable swine-keepers, or any other person that endeavours to hinder their robberies.	They come to these places in the night, and having beset the keeper's lodge, they force him to rise, and give them as many heads as they desire, threatening to kill him if he refuses, or makes any noise; and these menaces are oftentimes executed on the miserable swine keepers, or any other person that endeavours to hinder their robberies.	false	62.84	81.4	21
3224_168198_000003_000000	Having got flesh sufficient for their voyage, they return to their ship: here they allow, twice a day, every one as much as he can eat, without weight or measure; nor does the steward of the vessel give any more flesh, or anything else, to the captain, than to the meanest mariner. The ship being well victualled, they deliberate whither they shall go to seek their desperate fortunes, and likewise agree upon certain articles, which are put in writing, which every one is bound to observe; and all of them, or the chiefest part, do set their hands to it.	Having got flesh sufficient for their voyage, they return to their ship: here they allow, twice a day, every one as much as he can eat, without weight or measure; nor does the steward of the vessel give any more flesh, or anything else, to the captain, than to the meanest mariner. The ship being well victualled, they deliberate whither they shall go to seek their desperate fortunes, and likewise agree upon certain articles, which are put in writing, which every one is bound to observe; and all of them, or the chiefest part, do set their hands to it.	false	82.16	113.14	24.246023
3224_168198_000003_000001	Here they set down distinctly what sums of money each particular person ought to have for that voyage, the fund of all the payments being what is gotten by the whole expedition; for otherwise it is the same law among these people as with other pirates.	Here they set down distinctly what sums of money each particular person ought to have for that voyage, the fund of all the payments being what is gotten by the whole expedition; for otherwise it is the same law among these people as with other pirates.	false	113.3	126.465	20
3224_168198_000003_000002	No prey, no pay.	No prey, no pay.	true	126.465	128.71	25.068724
3224_168198_000003_000003	First, therefore, they mention how much the captain is to have for his ship; next, the salary of the carpenter, or shipwright, who careened, mended, and rigged the vessel: this commonly amounts to one hundred or one hundred and fifty pieces of eight, according to the agreement.	First, therefore, they mention how much the captain is to have for his ship; next, the salary of the carpenter, or shipwright, who careened, mended, and rigged the vessel: this commonly amounts to one hundred or one hundred and fifty pieces of eight, according to the agreement.	true	128.72	142.93	22.84514
3224_168198_000003_000004	Afterwards, for provisions and victualling, they draw out of the same common stock about two hundred pieces of eight; also a salary for the surgeon, and his chest of medicaments, which usually is rated at two hundred or two hundred and fifty pieces of eight.	Afterwards, for provisions and victualling, they draw out of the same common stock about two hundred pieces of eight; also a salary for the surgeon, and his chest of medicaments, which usually is rated at two hundred or two hundred and fifty pieces of eight.	true	143.12	156.69	21
3224_168198_000003_000005	Lastly, they agree what rate each one ought to have that is either wounded or maimed in his body, suffering the loss of any limb; as, for the loss of a right arm, six hundred pieces of eight, or six slaves; for the left arm, five hundred pieces of eight, or five slaves; for a right leg, five hundred pieces of eight, or five slaves; for the left leg, four hundred pieces of eight, or four slaves; for an eye, one hundred pieces of eight, or one slave; for a finger, the same as for an eye.	Lastly, they agree what rate each one ought to have that is either wounded or maimed in his body, suffering the loss of any limb; as, for the loss of a right arm, six hundred pieces of eight, or six slaves; for the left arm, five hundred pieces of eight, or five slaves; for a right leg, five hundred pieces of eight, or five slaves; for the left leg, four hundred pieces of eight, or four slaves; for an eye, one hundred pieces of eight, or one slave; for a finger, the same as for an eye.	true	156.69	185.8	23.462505
3224_168198_000003_000006	All which sums are taken out of the common stock of what is gotten by their piracy, and a very exact and equal dividend is made of the remainder.	All which sums are taken out of the common stock of what is gotten by their piracy, and a very exact and equal dividend is made of the remainder.	true	186.11	193.66	21
3224_168198_000003_000007	They have also regard to qualities and places: thus the captain, or chief, is allotted five or six portions, to what the ordinary seamen have: the master's mate only two, and other officers proportionately to their employ: after which, they draw equal parts from the highest to the lowest mariner, the boys not being omitted, who draw half a share; because when they take a better vessel than their own, it is in the boys' duty to fire their former vessel, and then retire to the prize.	They have also regard to qualities and places: thus the captain, or chief, is allotted five or six portions, to what the ordinary seamen have: the master's mate only two, and other officers proportionately to their employ: after which, they draw equal parts from the highest to the lowest mariner, the boys not being omitted, who draw half a share; because when they take a better vessel than their own, it is in the boys' duty to fire their former vessel, and then retire to the prize.	false	194	220.54	23.949102
3224_168198_000004_000000	They observe among themselves very good orders; for in the prizes which they take, it is severely prohibited, to every one, to take anything to themselves: hence all they take is equally divided, as hath been said before: yea, they take a solemn oath to each other, not to conceal the least thing they find among the prizes; and if any one is found false to the said oath, he is immediately turned out of the society.	They observe among themselves very good orders; for in the prizes which they take, it is severely prohibited, to every one, to take anything to themselves: hence all they take is equally divided, as hath been said before: yea, they take a solemn oath to each other, not to conceal the least thing they find among the prizes; and if any one is found false to the said oath, he is immediately turned out of the society.	false	221.33	243.61	22
3224_168198_000004_000001	They are very civil and charitable to each other; so that if any one wants what another has, with great willingness they give it one to another.	They are very civil and charitable to each other; so that if any one wants what another has, with great willingness they give it one to another.	false	243.86	251.17	23
3224_168198_000004_000002	As soon as these pirates have taken a prize, they immediately set ashore the prisoners, detaining only some few, for their own help and service: whom, also, they release, after two or three years.	As soon as these pirates have taken a prize, they immediately set ashore the prisoners, detaining only some few, for their own help and service: whom, also, they release, after two or three years.	false	251.24	261.31	19
3224_168198_000004_000003	They refresh themselves at one island or another, but especially at those on the south of Cuba; here they careen their vessels, while some hunt, and others cruise in canoes for prizes.	They refresh themselves at one island or another, but especially at those on the south of Cuba; here they careen their vessels, while some hunt, and others cruise in canoes for prizes.	true	261.71	271.21	22
3224_168198_000005_000000	The inhabitants of New Spain and Campechy lade their best merchandize in ships of great bulk: the vessels from Campechy sail in the winter to Caraccas, Trinity isles, and that of Margarita, and return back again in the summer.	The inhabitants of New Spain and Campechy lade their best merchandize in ships of great bulk: the vessels from Campechy sail in the winter to Caraccas, Trinity isles, and that of Margarita, and return back again in the summer.	false	272.39	286.45	24.173416
3224_168198_000005_000001	The pirates knowing these seasons (being very diligent in their inquiries) always cruise between the places above-mentioned; but in case they light on no considerable booty, they commonly undertake some more hazardous enterprises: one remarkable instance of which I shall here give you.	The pirates knowing these seasons (being very diligent in their inquiries) always cruise between the places above mentioned; but in case they light on no considerable booty, they commonly undertake some more hazardous enterprises: one remarkable instance of which I shall here give you.	true	286.7	302.2	21
3224_168198_000006_000000	A certain pirate called Pierre Francois, or Peter Francis, waiting a long time at sea with his boat and twenty-six men, for the ships that were to return from Maracaibo to Campechy, and not being able to find any prey, at last he resolved to direct his course to Rancheiras, near the River de la Plata, in 12 deg. and a half north latitude.	A certain pirate called Pierre Francois, or peter Francis, waiting a long time at sea with his boat and twenty six men, for the ships that were to return from Maracaibo to Campechy, and not being able to find any prey, at last he resolved to direct his course to Rancheiras, near the River de la Plata, in twelve d e g. and a half north latitude.	false	302.57	323.44	23
3224_168198_000006_000001	Here lies a rich bank of pearl, to the fishery whereof they yearly sent from Carthagena twelve vessels with a man-of-war for their defence.	Here lies a rich bank of pearl, to the fishery whereof they yearly sent from Carthagena twelve vessels with a man of war for their defence.	false	323.66	331.93	21.50892
3224_168198_000006_000002	Every vessel has at least two negroes in it, who are very dextrous in diving to the depth of six fathoms, where they find good store of pearls.	Every vessel has at least two negroes in it, who are very dextrous in diving to the depth of six fathoms, where they find good store of pearls.	true	332.57	340.57	23.564186
3224_168198_000006_000003	On this fleet, called the pearl-fleet, Pierre Francois resolved to venture, rather than go home empty; they then rid at anchor at the mouth of the River de la Hacha, the man-of-war scarce half a league distant from the small ships, and the wind very calm.	On this fleet, called the pearl fleet, Pierre Francois resolved to venture, rather than go home empty; they then rid at anchor at the mouth of the River de la Hacha, the man of war scarce half a league distant from the small ships, and the wind very calm.	false	340.97	355.9	22
3224_168198_000006_000004	Having spied them in this posture, he presently pulled down his sails, and rowed along the coast feigning to be a Spanish vessel coming from Maracaibo; but no sooner was he come to the pearl-bank, when suddenly he assaulted the vice-admiral of eight guns and sixty men, commanding them to surrender.	Having spied them in this posture, he presently pulled down his sails, and rowed along the coast feigning to be a Spanish vessel coming from Maracaibo; but no sooner was he come to the pearl bank, when suddenly he assaulted the vice admiral of eight guns and sixty men, commanding them to surrender.	true	356.03	372.76	18
3224_168198_000006_000005	The Spaniards made a good defence for some time, but at last were forced to submit.	The Spaniards made a good defence for some time, but at last were forced to submit.	false	372.83	377.98	22.16557
3224_168198_000007_000000	Having thus taken the vice-admiral, he resolved to attempt the man-of-war, with which addition he hoped to master the rest of the fleet: to this end he presently sunk his own boat, putting forth the Spanish colours, and weighed anchor with a little wind which then began to stir, having with threats and promises compelled most of the Spaniards to assist him: but so soon as the man-of-war perceived one of his fleet to sail, he did so too, fearing lest the mariners designed to run away with the riches they had on board.	Having thus taken the vice admiral, he resolved to attempt the man of war, with which addition he hoped to master the rest of the fleet: to this end he presently sunk his own boat, putting forth the Spanish colours, and weighed anchor with a little wind which then began to stir, having with threats and promises compelled most of the Spaniards to assist him: but so soon as the man of war perceived one of his fleet to sail, he did so too, fearing lest the mariners designed to run away with the riches they had on board.	false	378.83	408.49	22.99375
3224_168198_000007_000001	The pirate on this immediately gave over the enterprise, thinking themselves unable to encounter force to force: hereupon they endeavoured to get out of the river and gain the open seas, by making as much sail as they could; which the man-of-war perceiving, he presently gave them chase, but the pirates having laid on too much sail, and a gust of wind suddenly rising, their main-mast was brought by the board, which disabled them from escaping.	The pirate on this immediately gave over the enterprise, thinking themselves unable to encounter force to force: hereupon they endeavoured to get out of the river and gain the open seas, by making as much sail as they could; which the man of war perceiving, he presently gave them chase, but the pirates having laid on too much sail, and a gust of wind suddenly rising, their main mast was brought by the board, which disabled them from escaping.	true	408.65	433.06	21
3224_168198_000008_000000	This unhappy event much encouraged those in the man-of-war, they gaining upon the pirates every moment, and at last overtook them; but finding they had twenty-two sound men, the rest being either killed or wounded, resolved to defend themselves as long as possible; this they performed very courageously for some time, till they were forced by the man-of-war, on condition that they should not be used as slaves to carry stones, or be employed in other labours for three or four years, as they served their negroes, but that they should be set safe ashore on free land.	This unhappy event much encouraged those in the man of war, they gaining upon the pirates every moment, and at last overtook them; but finding they had twenty two sound men, the rest being either killed or wounded, resolved to defend themselves as long as possible; this they performed very courageously for some time, till they were forced by the man of war, on condition that they should not be used as slaves to carry stones, or be employed in other labours for three or four years, as they served their negroes, but that they should be set safe ashore on free land.	false	433.82	464.32	20
3224_168198_000008_000001	On these articles they yielded with all they had taken, which was worth, in pearls alone, above 100,000 pieces of eight, besides the vessel, provisions, goods, &c.	On these articles they yielded with all they had taken, which was worth, in pearls alone, above one hundred thousand pieces of eight, besides the vessel, provisions, goods, and c.	false	464.51	475.47	23.689535
3224_168198_000008_000002	All of which would have made this a greater prize than he could desire, which he had certainly carried off, if his main-mast had not been lost, as we said before.	All of which would have made this a greater prize than he could desire, which he had certainly carried off, if his main mast had not been lost, as we said before.	true	475.47	483.88	22.945698
3224_168198_000009_000000	Another bold attempt like this, no less remarkable, I shall also give you.	Another bold attempt like this, no less remarkable, I shall also give you.	true	484.55	488.47	22
3224_168198_000009_000001	A certain pirate of Portugal, thence called Bartholomew Portugues, was cruising in a boat of thirty men and four small guns from Jamaica, upon the Cape de Corriente in Cuba, where he met a great ship from Maracaibo and Carthagena, bound for the Havannah, well provided with twenty great guns and seventy men, passengers and mariners; this ship he presently assaulted, which they on board as resolutely defended.	A certain pirate of Portugal, thence called Bartholomew Portugues, was cruising in a boat of thirty men and four small guns from Jamaica, upon the Cape de Corriente in Cuba, where he met a great ship from Maracaibo and Carthagena, bound for the Havannah, well provided with twenty great guns and seventy men, passengers and mariners; this ship he presently assaulted, which they on board as resolutely defended.	true	488.81	514.06	24.426521
3224_168198_000009_000002	The pirate escaping the first encounter, resolved to attack her more vigorously than before, seeing he had yet suffered no great damage: this he performed with so much resolution, that at last, after a long and dangerous fight, he became master of it.	The pirate escaping the first encounter, resolved to attack her more vigorously than before, seeing he had yet suffered no great damage: this he performed with so much resolution, that at last, after a long and dangerous fight, he became master of it.	false	514.19	529	21
3224_168198_000009_000003	The Portuguese lost only ten men, and had four wounded; so that he had still remaining twenty fighting men, whereas the Spaniards had double the number.	The Portuguese lost only ten men, and had four wounded; so that he had still remaining twenty fighting men, whereas the Spaniards had double the number.	true	529.13	537.52	20
3224_168198_000009_000004	Having possessed themselves of the ship, the wind being contrary to return to Jamaica, they resolved to steer to Cape St. Anthony (which lies west of Cuba), there to repair and take in fresh water, of which they were then in great want.	Having possessed themselves of the ship, the wind being contrary to return to Jamaica, they resolved to steer to Cape saint Anthony (which lies west of Cuba), there to repair and take in fresh water, of which they were then in great want.	true	538.37	550.57	23
3224_168198_000010_000000	Being very near the cape abovesaid, they unexpectedly met with three great ships coming from New Spain, and bound for the Havannah; by these not being able to escape, they were easily retaken, both ship and pirates, and all made prisoners, and stripped of all the riches they had taken but just before.	Being very near the cape abovesaid, they unexpectedly met with three great ships coming from New Spain, and bound for the Havannah; by these not being able to escape, they were easily retaken, both ship and pirates, and all made prisoners, and stripped of all the riches they had taken but just before.	false	551	567.58	22
3224_168198_000010_000001	The cargo consisted in 120,000 weight of cocoa-nuts, the chief ingredient of chocolate, and 70,000 pieces of eight.	The cargo consisted in one hundred twenty thousand weight of cocoa nuts, the chief ingredient of chocolate, and seventy thousand pieces of eight.	false	567.92	575.89	20.34495
3224_168198_000010_000002	Two days after this misfortune, there arose a great storm, which separated the ships from one another.	Two days after this misfortune, there arose a great storm, which separated the ships from one another.	true	576.14	581.65	21
3224_168198_000010_000003	The great vessel, where the pirates were, arrived at Campechy, where many considerable merchants came and saluted the captain; these presently knew the Portuguese pirate, being infamous for the many insolencies, robberies and murders he had committed on their coasts, which they kept fresh in their memory.	The great vessel, where the pirates were, arrived at Campechy, where many considerable merchants came and saluted the captain; these presently knew the Portuguese pirate, being infamous for the many insolencies, robberies and murders he had committed on their coasts, which they kept fresh in their memory.	false	581.84	597.79	22
3224_168198_000011_000000	The next day after their arrival, the magistrates of the city sent to demand the prisoners from on board the ship, in order to punish them according to their deserts; but fearing the captain of the pirates should make his escape (as he had formerly done, being their prisoner once before) they judged it safer to leave him guarded on ship-board for the present, while they erected a gibbet to hang him on the next day, without any other process than to lead him from the ship to his punishment; the rumour of which was presently brought to Bartholomew Portugues, whereby he sought all possible means to escape that night: with this design he took two earthen jars, wherein the Spaniards carry wine from Spain to the West Indies, and stopped them very well, intending to use them for swimming, as those unskilled in that art do corks or empty bladders; having made this necessary preparation, he waited when all should be asleep; but not being able to escape his sentinel's vigilance, he stabbed him with a knife he had secretly purchased, and then threw himself into the sea with the earthen jars before-mentioned, by the help of which, though he never learned to swim, he reached the shore, and immediately took to the woods, where he hid himself for three days, not daring to appear, eating no other food than wild herbs.	The next day after their arrival, the magistrates of the city sent to demand the prisoners from on board the ship, in order to punish them according to their deserts; but fearing the captain of the pirates should make his escape (as he had formerly done, being their prisoner once before) they judged it safer to leave him guarded on ship board for the present, while they erected a gibbet to hang him on the next day, without any other process than to lead him from the ship to his punishment; the rumour of which was presently brought to Bartholomew Portugues, whereby he sought all possible means to escape that night: with this design he took two earthen jars, wherein the Spaniards carry wine from Spain to the West Indies, and stopped them very well, intending to use them for swimming, as those unskilled in that art do corks or empty bladders; having made this necessary preparation, he waited when all should be asleep; but not being able to escape his sentinel's vigilance, he stabbed him with a knife he had secretly purchased, and then threw himself into the sea with the earthen jars before mentioned, by the help of which, though he never learned to swim, he reached the shore, and immediately took to the woods, where he hid himself for three days, not daring to appear, eating no other food than wild herbs.	false	598.19	669.18	22
3224_168198_000012_000000	[Illustration: "'PORTUGUES MADE THE BEST OF HIS WAY TO DEL GOLPHO TRISTE'"--_Page 46_]	[Illustration: "'p o r t u g u e s MADE THE BEST OF HIS WAY TO DEL g o l p h o TRISTE'"--underscore Page forty six underscore]	false	669.18	669.99	5
3224_168198_000013_000000	Those of the city next day made diligent search for him in the woods, where they concluded him to be.	Those of the city next day made diligent search for him in the woods, where they concluded him to be.	true	669.99	674.77	21
