329_862_000031_000003	I will creep forward and possess myself of the steel caps of two of these drunkards, and if I can get a couple of cloaks so much the better."	I will creep forward and possess myself of the steel caps of two of these drunkards, and if I can get a couple of cloaks so much the better."	true	670.305	678.55	17
329_862_000032_000000	There was no difficulty about the caps, and by dint of unbuckling the cloaks and rolling their wearers gently over, Walter succeeded at last in obtaining two of them.	There was no difficulty about the caps, and by dint of unbuckling the cloaks and rolling their wearers gently over, Walter succeeded at last in obtaining two of them.	true	679.28	688.93	18
329_862_000032_000001	He also picked up a sword for Ralph--his own still hung in its sheath--and then he joined his companion, and the two putting on the steel caps and cloaks walked quietly to the gate.	He also picked up a sword for Ralph-his own still hung in its sheath-and then he joined his companion, and the two putting on the steel caps and cloaks walked quietly to the gate.	true	689	700.3	21
329_862_000032_000002	There were none on guard, and they issued unmolested into the town.	There were none on guard, and they issued unmolested into the town.	true	700.55	704.71	18
329_862_000032_000003	Here all was revelry.	Here all was revelry.	true	705.08	706.78	18.907347
329_862_000032_000004	Bonfires blazed in the streets.	Bonfires blazed in the streets.	true	706.88	709.2	15
329_862_000032_000005	Hogsheads of wine, with the heads knocked out, stood before many of the houses for all to help themselves who wished.	Hogsheads of wine, with the heads knocked out, stood before many of the houses for all to help themselves who wished.	true	709.2	716.13	15
329_862_000032_000006	Drunken soldiers reeled along shouting snatches of songs, and the burghers in the highest state of hilarity thronged the ways.	Drunken soldiers reeled along shouting snatches of songs, and the burghers in the highest state of hilarity thronged the ways.	true	716.13	724.32	14
329_862_000033_000000	"First of all, Ralph, we will have a drink of wine, for I am chilled to the bone."	"First of all, Ralph, we will have a drink of wine, for I am chilled to the bone."	true	724.32	729.66	19
329_862_000034_000000	"Aye, and so am I," Ralph replied.	"Aye, and so am I," Ralph replied.	false	729.66	732.45	20.56798
329_862_000034_000001	"I got hot enough climbing that rope, but now the cold has got hold of me again, and my teeth are chattering in my head."	"I got hot enough climbing that rope, but now the cold has got hold of me again, and my teeth are chattering in my head."	true	732.45	740.02	14
329_862_000035_000000	Picking up one of the fallen vessels by a cask they dipped it in and took a long draught of wine; then, turning off from the principal streets, they made their way by quiet lanes down to one of the gates.	Picking up one of the fallen vessels by a cask they dipped it in and took a long draught of wine; then, turning off from the principal streets, they made their way by quiet lanes down to one of the gates.	false	740.6	756.13	17
329_862_000035_000001	To their dismay they found that this was closed.	To their dismay they found that this was closed.	true	756.47	759.735	17.88779
329_862_000035_000002	The French commanders knew that Sir Walter Manny or Salisbury might ere this be pressing forward to relieve the town, and that, finding that it had fallen, they might attempt to recapture it by a sudden attack.	The French commanders knew that Sir Walter Manny or Salisbury might ere this be pressing forward to relieve the town, and that, finding that it had fallen, they might attempt to recapture it by a sudden attack.	false	759.735	774.1	19
329_862_000035_000003	While permitting therefore the usual licence, after a successful assault, to the main body of their forces, they had placed a certain number of their best troops on the walls, giving them a handsome largess to make up for their loss of the festivities.	While permitting therefore the usual licence, after a successful assault, to the main body of their forces, they had placed a certain number of their best troops on the walls, giving them a handsome largess to make up for their loss of the festivities.	true	774.29	790.78	16
329_862_000036_000000	At first Walter and his friend feared that their retreat was cut off for the night, but several other people presently arrived, and the officer on guard said, coming out, "You must wait a while; the last batch have only just gone, and I cannot keep opening and closing the gate; in half an hour I will let you out."	At first Walter and his friend feared that their retreat was cut off for the night, but several other people presently arrived, and the officer on guard said, coming out, "You must wait a while; the last batch have only just gone, and I cannot keep opening and closing the gate; in half an hour I will let you out."	true	791.57	811.51	20
329_862_000037_000000	Before that time elapsed some fifty or sixty people, anxious to return to their villages, gathered round the gate.	Before that time elapsed some fifty or sixty people, anxious to return to their villages, gathered round the gate.	true	811.97	819.43	24.958076
329_862_000038_000000	"Best lay aside your steel cap, Ralph, before we join them," Walter said.	"Best lay aside your steel cap, Ralph, before we join them," Walter said.	true	819.62	824.41	22.730814
329_862_000038_000001	"In the dim light of that lamp none will notice that we have head-gear, but if it were to glint upon the steel cap the officer might take us for deserters and question us as to who we are."	"In the dim light of that lamp none will notice that we have head gear, but if it were to glint upon the steel cap the officer might take us for deserters and question us as to who we are."	true	824.48	838.66	20
329_862_000039_000000	Presently the officer came out from the guard-room again.	Presently the officer came out from the guard room again.	true	838.94	842.32	23.254076
329_862_000039_000001	There was a forward movement of the little crowd, and Walter and Ralph closed in to their midst.	There was a forward movement of the little crowd, and Walter and Ralph closed in to their midst.	true	842.51	849.1	22
329_862_000039_000002	The gates were opened, and without any question the villagers passed out, and the gates were shut instantly behind them.	The gates were opened, and without any question the villagers passed out, and the gates were shut instantly behind them.	true	849.11	856.66	25
329_862_000040_000000	Walter and his comrade at once started at a brisk pace and walked all night in the direction of Hennebon.	Walter and his comrade at once started at a brisk pace and walked all night in the direction of Hennebon.	false	856.76	863.74	20
329_862_000040_000001	Their clothes soon dried, and elated at their escape from danger they struggled on briskly.	Their clothes soon dried, and elated at their escape from danger they struggled on briskly.	true	864.44	870.16	19.802399
329_862_000040_000002	When morning broke they entered a wood, and lay there till evening, as they feared to continue their journey lest they might fall into the hands of some roving band of French horse.	When morning broke they entered a wood, and lay there till evening, as they feared to continue their journey lest they might fall into the hands of some roving band of French horse.	true	870.44	881.89	19
329_862_000040_000003	They were, too, dog-tired, and were asleep a few minutes after they lay down.	They were, too, dog tired, and were asleep a few minutes after they lay down.	true	882.32	887.5	20
329_862_000040_000004	The sun was setting when they awoke, and as soon as it was dark they resumed their journey.	The sun was setting when they awoke, and as soon as it was dark they resumed their journey.	true	887.57	893.17	15
329_862_000041_000000	"I don't know what you feel, Master Walter, but I am well-nigh famished. It is thirty-six hours since I swallowed a bit of food, just as the French were moving to the attack.	"I don't know what you feel, Master Walter, but I am well nigh famished. It is thirty six hours since I swallowed a bit of food, just as the French were moving to the attack.	false	893.72	906.67	21
329_862_000041_000001	Hard blows I don't mind--I have been used to it; but what with fighting, and being in the water for five or six hours, and climbing up that endless rope, and walking all night on an empty stomach, it does not suit me at all."	Hard blows I don't mind-I have been used to it; but what with fighting, and being in the water for five or six hours, and climbing up that endless rope, and walking all night on an empty stomach, it does not suit me at all."	false	906.71	923.2	19
329_862_000042_000000	"I feel ravenous too, Ralph, but there is no help for it.	"I feel ravenous too, Ralph, but there is no help for it.	true	923.57	927.855	25.231026
329_862_000042_000001	We shall eat nothing till we are within the walls of Hennebon, and that will be by daylight tomorrow if all goes well.	We shall eat nothing till we are within the walls of Hennebon, and that will be by daylight tomorrow if all goes well.	true	927.855	936.19	15
329_862_000042_000002	Draw your belt an inch or two tighter, it will help to keep out the wolf."	Draw your belt an inch or two tighter, it will help to keep out the wolf."	true	936.2	941.29	24.90441
329_862_000043_000000	They kept on all night, and in the morning saw to their delight the towers of Hennebon in the distance.	They kept on all night, and in the morning saw to their delight the towers of Hennebon in the distance.	true	942.53	948.52	18
329_862_000043_000001	It was well that it was no further, for both were so exhausted from want of food that they could with difficulty drag their legs along.	It was well that it was no further, for both were so exhausted from want of food that they could with difficulty drag their legs along.	true	948.65	957.88	22
329_862_000044_000000	Upon entering the town Walter made his way at once to the quarters of the leader.	Upon entering the town Walter made his way at once to the quarters of the leader.	true	957.89	962.865	16
329_862_000044_000001	Sir Walter had just risen, and was delighted at the sight of his esquire.	Sir Walter had just risen, and was delighted at the sight of his esquire.	true	962.865	967.27	21.179125
329_862_000045_000000	"I had given you up for dead," he exclaimed.	"I had given you up for dead," he exclaimed.	true	967.73	970.72	23.606148
329_862_000045_000001	"By what miracle could you have escaped?	"By what miracle could you have escaped?	true	970.85	973.29	23
329_862_000045_000002	Are you alone?"	Are you alone?"	false	973.29	974.59	20.607426
329_862_000046_000000	"I have with me only my faithful follower Ralph Smith, who is below; but, Sir Walter, for mercy's sake order that some food be placed before us, or we shall have escaped from the French only to die of hunger here. We have tasted nought since the attack on Vannes began.	"I have with me only my faithful follower Ralph Smith, who is below; but, Sir Walter, for mercy's sake order that some food be placed before us, or we shall have escaped from the French only to die of hunger here. We have tasted nought since the attack on Vannes began.	true	974.93	994.09	21
329_862_000046_000001	Have any beside us escaped?"	Have any beside us escaped?"	true	994.22	996.85	22.343746
329_862_000047_000000	"Lord Stafford contrived, with two or three others, to cut their way out by a postern-gate, bringing with them Robert of Artois, who is grievously wounded.	"Lord Stafford contrived, with two or three others, to cut their way out by a postern gate, bringing with them Robert of Artois, who is grievously wounded.	false	997.1	1007	21
329_862_000047_000001	None others, save you and your man-at-arms, have made their way here."	None others, save you and your man at arms, have made their way here."	true	1007	1011.61	12
329_862_000048_000000	In a few minutes a cold capon, several manchets of bread, and a stoop of wine were placed before Walter, while Ralph's wants were attended to below.	In a few minutes a cold capon, several manchets of bread, and a stoop of wine were placed before Walter, while Ralph's wants were attended to below.	true	1012.34	1023.31	21
329_862_000048_000001	When he had satisfied his hunger the young esquire related his adventures to Sir Walter and several other knights and nobles, who had by this time gathered in the room.	When he had satisfied his hunger the young esquire related his adventures to Sir Walter and several other knights and nobles, who had by this time gathered in the room.	false	1023.56	1033.33	16
329_862_000049_000000	"In faith, Master Somers, you have got well out of your scrape," Sir Walter exclaimed.	"In faith, Master Somers, you have got well out of your scrape," Sir Walter exclaimed.	false	1033.55	1040.08	23
329_862_000049_000001	"Had I been in your place I should assuredly have perished, for I would a thousand times rather meet death sword in hand, than drop down into the deep hole of that well.	"Had I been in your place I should assuredly have perished, for I would a thousand times rather meet death sword in hand, than drop down into the deep hole of that well.	true	1040.09	1051.87	15
329_862_000049_000002	And your brains served you shrewdly in devising a method of escape.	And your brains served you shrewdly in devising a method of escape.	true	1051.91	1056.22	12
329_862_000049_000003	What say you, gentlemen?"	What say you, gentlemen?"	true	1056.22	1057.87	18
329_862_000050_000000	All present joined in expressions of praise at the lad's coolness and presence of mind.	All present joined in expressions of praise at the lad's coolness and presence of mind.	true	1058	1064.59	22
329_862_000051_000000	"You are doing well, young sir," the English leader went on, "and have distinguished yourself on each occasion on which we have been engaged. I shall be proud when the time comes to bestow upon you myself the order of knighthood if our king does not take the matter off my hands."	"You are doing well, young sir," the English leader went on, "and have distinguished yourself on each occasion on which we have been engaged. I shall be proud when the time comes to bestow upon you myself the order of knighthood if our king does not take the matter off my hands."	true	1065.14	1083.43	17
329_862_000052_000000	A little later Robert of Artois died of his wounds and disappointment at the failure of his hopes.	A little later Robert of Artois died of his wounds and disappointment at the failure of his hopes.	false	1083.89	1091.08	19
329_862_000053_000000	In October King Edward himself set sail with a great army, and landing in Brittany early in November marched forward through the country and soon reduced Ploermel, Malestrail, Redon, and the rest of the province in the vicinity of Vannes, and then laid siege to that town.	In October King Edward himself set sail with a great army, and landing in Brittany early in November marched forward through the country and soon reduced Ploermel, Malestrail, Redon, and the rest of the province in the vicinity of Vannes, and then laid siege to that town.	false	1091.72	1110.04	17
329_862_000053_000001	As his force was far more than sufficient for the siege, the Earls of Norfolk and Warwick were despatched in the direction of Nantes to reconnoitre the country and clear it of any small bodies of the enemy they might encounter.	As his force was far more than sufficient for the siege, the Earls of Norfolk and Warwick were despatched in the direction of Nantes to reconnoitre the country and clear it of any small bodies of the enemy they might encounter.	false	1110.14	1125.87	20
329_862_000053_000002	In the meantime Edward opened negotiations with many of the Breton lords, who, seeing that such powerful aid had arrived for the cause of the Countess of Montford, were easily persuaded to change sides.	In the meantime Edward opened negotiations with many of the Breton lords, who, seeing that such powerful aid had arrived for the cause of the Countess of Montford, were easily persuaded to change sides.	true	1125.87	1139.54	21
329_862_000053_000003	Among them were the lords of Clisson, Moheac, Machecoul, Retz, and many others of less importance.	Among them were the lords of Clisson, Moheac, Machecoul, Retz, and many others of less importance.	false	1139.54	1148.77	26.299314
329_862_000054_000000	The Count of Valentinois, who commanded the garrison of Vannes, supported the siege with great courage and fortitude, knowing that Charles of Blois and the King of France were collecting a great army for his relief.	The Count of Valentinois, who commanded the garrison of Vannes, supported the siege with great courage and fortitude, knowing that Charles of Blois and the King of France were collecting a great army for his relief.	false	1149.14	1163.92	21.740623
329_862_000054_000001	Uniting their forces they advanced towards the town.	Uniting their forces they advanced towards the town.	true	1164.11	1167.55	20
329_862_000054_000002	Before the force of the French, 40,000 strong, the Earl of Norfolk had fallen back and rejoined the king, but even after this junction the French forces exceeded those of Edward fourfold.	Before the force of the French, forty thousand strong, the Earl of Norfolk had fallen back and rejoined the king, but even after this junction the French forces exceeded those of Edward fourfold.	true	1167.62	1180.69	21
329_862_000054_000003	They advanced towards Vannes and formed a large entrenched camp near that of the English, who thus, while still besieging Vannes, were themselves enclosed by a vastly superior force.	They advanced towards Vannes and formed a large entrenched camp near that of the English, who thus, while still besieging Vannes, were themselves enclosed by a vastly superior force.	false	1180.7	1193.44	15
329_862_000054_000004	The King of France himself arrived at the French camp.	The King of France himself arrived at the French camp.	true	1193.54	1196.58	18
329_862_000054_000005	The French, although so greatly superior, made no motion toward attacking the English, but appeared bent upon either starving them out or forcing them to attack the strongly entrenched position occupied by the French.	The French, although so greatly superior, made no motion toward attacking the English, but appeared bent upon either starving them out or forcing them to attack the strongly entrenched position occupied by the French.	true	1196.58	1209.76	19
329_862_000055_000000	Provisions were indeed running short in the English camp, and the arrival of supplies from England was cut off by a strong fleet under Don Louis, which cruised off the coast and captured all vessels arriving with stores.	Provisions were indeed running short in the English camp, and the arrival of supplies from England was cut off by a strong fleet under Don Louis, which cruised off the coast and captured all vessels arriving with stores.	false	1210.22	1224.67	19.726822
329_862_000055_000001	At this moment two legates, the Cardinal Bishop of Preneste and the Cardinal Bishop of Tusculum, arrived from the pope and strove to mediate between the two sovereigns and to bring about a cessation of hostilities, pointing out to them the scandal and desolation which their rivalry caused in Christendom, the waste of noble lives, the devastation of once happy provinces, and the effusion of innocent blood.	At this moment two legates, the Cardinal Bishop of Preneste and the Cardinal Bishop of Tusculum, arrived from the pope and strove to mediate between the two sovereigns and to bring about a cessation of hostilities, pointing out to them the scandal and desolation which their rivalry caused in Christendom, the waste of noble lives, the devastation of once happy provinces, and the effusion of innocent blood.	false	1224.77	1254.58	21
329_862_000055_000002	Going from camp to camp they exhorted, prayed, and reproached the rival sovereigns, urging that while Christians were shedding each other's blood in vain, the infidels were daily waxing bolder and more insolent.	Going from camp to camp they exhorted, prayed, and reproached the rival sovereigns, urging that while Christians were shedding each other's blood in vain, the infidels were daily waxing bolder and more insolent.	true	1254.74	1268.56	19
329_862_000055_000003	Their arguments would have been but of little use had either of the monarchs felt sure of victory.	Their arguments would have been but of little use had either of the monarchs felt sure of victory.	false	1268.69	1274.68	18
329_862_000055_000004	King Edward, however, felt that his position was growing desperate, for starvation was staring him in the face, and only by a victory over an immensely superior force in a strongly entrenched position could he extricate himself.	King Edward, however, felt that his position was growing desperate, for starvation was staring him in the face, and only by a victory over an immensely superior force in a strongly entrenched position could he extricate himself.	true	1274.84	1289.47	19
329_862_000055_000005	Upon the part of the French, however, circumstances were occurring which rendered them anxious for a release from their position, for they were not without their share of suffering.	Upon the part of the French, however, circumstances were occurring which rendered them anxious for a release from their position, for they were not without their share of suffering.	true	1289.63	1300.72	19
329_862_000055_000006	While the English army lay on a hill the French camp was pitched on low ground.	While the English army lay on a hill the French camp was pitched on low ground.	true	1300.82	1306.27	19
329_862_000055_000007	An unusually wet season had set in with bitterly cold wind.	An unusually wet season had set in with bitterly cold wind.	true	1306.37	1310.68	14
329_862_000055_000008	The rain was incessant, a pestilence had destroyed a vast number of their horses, and their encampment was flooded.	The rain was incessant, a pestilence had destroyed a vast number of their horses, and their encampment was flooded.	true	1310.78	1318.27	16
329_862_000055_000009	Their forces were therefore obligated to spread themselves over the neighbouring fields, and a sudden attack by the English might have been fatal.	Their forces were therefore obligated to spread themselves over the neighbouring fields, and a sudden attack by the English might have been fatal.	true	1318.4	1327.15	19
329_862_000056_000000	Thus distress pressed upon both commanders, and the pope's legates found their exertions at last crowned with success.	Thus distress pressed upon both commanders, and the pope's legates found their exertions at last crowned with success.	true	1327.37	1335.76	18
329_862_000056_000001	A suspension of hostilities was agreed to, and the Dukes of Burgundy and Bourbon on the one side and the Earls of Lancaster, Northampton, and Salisbury on the other, met as commissioners and agreed to a convention by which a general truce was to be made from the date of the treaty to the following Michaelmas, and to be prolonged from that day for the full term of three years.	A suspension of hostilities was agreed to, and the Dukes of Burgundy and Bourbon on the one side and the Earls of Lancaster, Northampton, and Salisbury on the other, met as commissioners and agreed to a convention by which a general truce was to be made from the date of the treaty to the following Michaelmas, and to be prolonged from that day for the full term of three years.	true	1336.16	1361.08	18
329_862_000056_000002	It was agreed that the truce should embrace not only the sovereigns, but all the adherents of each of them.	It was agreed that the truce should embrace not only the sovereigns, but all the adherents of each of them.	true	1361.57	1367.71	21.35616
329_862_000056_000003	The truce was to hold good in Brittany between all parties, and the city of Vannes was to be given into the hands of the cardinals to dispose of as they chose.	The truce was to hold good in Brittany between all parties, and the city of Vannes was to be given into the hands of the cardinals to dispose of as they chose.	false	1367.75	1377.91	17
329_862_000056_000004	It was specially provided that in the case of any of the adherents of either party in the Duchies of Gascony and Brittany waging war against each other, neither of the monarchs should either directly or indirectly meddle therewith, nor should the truce be at all broken thereby.	It was specially provided that in the case of any of the adherents of either party in the Duchies of Gascony and Brittany waging war against each other, neither of the monarchs should either directly or indirectly meddle therewith, nor should the truce be at all broken thereby.	false	1378.01	1396.39	17
329_862_000057_000000	Immediately the treaty was signed, on the 19th of January, 1343, the King of France dismissed his army, and Edward sailed for England with the greater part of his troops.	Immediately the treaty was signed, on the nineteenth of January, thirteen forty three, the King of France dismissed his army, and Edward sailed for England with the greater part of his troops.	false	1396.67	1408.38	22.531693
329_862_000057_000001	The Countess of Montford and her son accompanied him, and the possessions of her husband in Brittany were left to the guardianship of her partisans, with a small but choice body of English troops.	The Countess of Montford and her son accompanied him, and the possessions of her husband in Brittany were left to the guardianship of her partisans, with a small but choice body of English troops.	true	1408.38	1419.31	19
