329_862_000058_000000	The towns which had fallen into their hands and still remained were Brest, Quimper-Corentin, Quimperle, Redon, and Guerande; Vannes was handed over to them by the cardinals, and Hennebon, of course, remained in their possession.	The towns which had fallen into their hands and still remained were Brest, Quimper Corentin, Quimperle, Redon, and Guerande; Vannes was handed over to them by the cardinals, and Hennebon, of course, remained in their possession.	false	1419.86	1434.58	22.142038
329_862_000059_000000	Walter returned to England with Sir Walter Manny, and on reaching London was received with delight by his old friends Geoffrey Ward and Giles Fletcher, who were never tired of listening to his tales of the wars. Dame Vernon also received him with great kindness, and congratulated him warmly upon the very favourable account which Sir Walter Manny had given of his zeal and gallantry.	Walter returned to England with Sir Walter Manny, and on reaching London was received with delight by his old friends Geoffrey Ward and Giles Fletcher, who were never tired of listening to his tales of the wars. Dame Vernon also received him with great kindness, and congratulated him warmly upon the very favourable account which Sir Walter Manny had given of his zeal and gallantry.	false	1434.77	1461.43	21
329_862_000060_000000	The time now for a while passed very quietly.	The time now for a while passed very quietly.	true	1461.74	1464.66	21
329_862_000060_000001	Walter and the other young squires practised diligently, under the instructions of Sir Walter, at knightly exercises.	Walter and the other young squires practised diligently, under the instructions of Sir Walter, at knightly exercises.	true	1464.66	1471.9	18
329_862_000060_000002	Walter learned to bear himself well on horseback and to tilt in the ring.	Walter learned to bear himself well on horseback and to tilt in the ring.	true	1472.12	1476.7	20.296513
329_862_000060_000003	He was already a skilful swordsman, but he spared no pains to improve himself with his weapons.	He was already a skilful swordsman, but he spared no pains to improve himself with his weapons.	true	1476.77	1483	21
329_862_000060_000004	The court was a gay one, and Walter, as a favoured esquire of one of the foremost knights there, was admitted to all that took place.	The court was a gay one, and Walter, as a favoured esquire of one of the foremost knights there, was admitted to all that took place.	true	1483.04	1490.95	17
329_862_000060_000005	His courtly education, of course, included dancing, and when he went down, as he often did, for a long chat with his old friends, Geoffrey often said, laughing, that he was growing such a fine gentleman that he hardly liked to sit in his presence; but although changed in manner, Walter continued to be, as before, a frank, manly young fellow, and free from the affectations which were so general among the young men of the court.	His courtly education, of course, included dancing, and when he went down, as he often did, for a long chat with his old friends, Geoffrey often said, laughing, that he was growing such a fine gentleman that he hardly liked to sit in his presence; but although changed in manner, Walter continued to be, as before, a frank, manly young fellow, and free from the affectations which were so general among the young men of the court.	false	1491.26	1532.64	22.425142
