7169_89735_000049_000000	"How so--too far?"	"How so-too far?"	true	586.85	588.7	25.173002
7169_89735_000050_000000	"You might attract the attention of the Lone Wolf.	"You might attract the attention of the Lone Wolf.	true	589.1	591.555	24.244957
7169_89735_000050_000001	They say he's on the prowl once more."	They say he's on the prowl once more."	true	591.555	593.77	24.460302
7169_89735_000051_000000	The American laughed a trace contemptuously.	The American laughed a trace contemptuously.	true	593.84	596.56	32.077793
7169_89735_000051_000001	Lanyard's fingers tightened on his knife and fork; otherwise he made no sign.	Lanyard's fingers tightened on his knife and fork; otherwise he made no sign.	true	596.57	601.06	23.920914
7169_89735_000051_000002	A sidelong glance into a mirror at his elbow showed Roddy still absorbed in the Daily Mail.	A sidelong glance into a mirror at his elbow showed Roddy still absorbed in the Daily Mail.	true	601.16	606.04	18
7169_89735_000052_000000	The girl bent forward with a look of eager interest.	The girl bent forward with a look of eager interest.	true	606.26	609.22	21.382257
7169_89735_000053_000000	"The Lone Wolf?	"The Lone Wolf?	true	609.32	610.41	24.576231
7169_89735_000053_000001	Who is that?"	Who is that?"	true	610.41	611.29	27.78521
7169_89735_000054_000000	"You don't know him in America, mademoiselle?"	"You don't know him in America, mademoiselle?"	true	611.66	613.51	21.669926
7169_89735_000055_000000	"No...."	"no..."	true	613.91	614.71	24.835289
7169_89735_000056_000000	"The Lone Wolf, my dear Lucia," the valetudinarian explained in a dryly humourous tone, "is the sobriquet fastened by some imaginative French reporter upon a celebrated criminal who seems to have made himself something of a pest over here, these last few years.	"The Lone Wolf, my dear Lucia," the valetudinarian explained in a dryly humourous tone, "is the sobriquet fastened by some imaginative French reporter upon a celebrated criminal who seems to have made himself something of a pest over here, these last few years.	false	615.11	629.145	17
7169_89735_000056_000001	Nobody knows anything definite about him, apparently, but he operates in a most individual way and keeps the police busy trying to guess where he'll strike next."	Nobody knows anything definite about him, apparently, but he operates in a most individual way and keeps the police busy trying to guess where he'll strike next."	true	629.145	637.545	25.642927
7169_89735_000057_000000	The girl breathed an incredulous exclamation.	The girl breathed an incredulous exclamation.	true	637.545	640.18	20.225388
7169_89735_000058_000000	"But I assure you!" De Morbihan protested.	"But I assure you!" De Morbihan protested.	true	640.31	642.615	18.205868
7169_89735_000058_000001	"The rogue has had a wonderfully successful career, thanks to his dispensing with confederates and confining his depredations to jewels and similar valuables, portable and easy to convert into cash.	"The rogue has had a wonderfully successful career, thanks to his dispensing with confederates and confining his depredations to jewels and similar valuables, portable and easy to convert into cash.	true	642.615	652.71	23.744139
7169_89735_000058_000002	Yet," he added, nodding sagely, "one isn't afraid to predict his race is almost run." "You don't tell me!" the older man exclaimed.	Yet," he added, nodding sagely, "one isn't afraid to predict his race is almost run." "You don't tell me!" the older man exclaimed.	true	652.71	661.035	26.51276
7169_89735_000058_000003	"Have they picked up the scent--at last?"	"Have they picked up the scent-at last?"	true	661.035	663.04	34.048298
7169_89735_000059_000000	"The man is known," De Morbihan affirmed.	"The man is known," De Morbihan affirmed.	true	663.29	666.22	19.505386
7169_89735_000060_000000	By now the conversation had caught the interest of several loitering waiters, who were listening open-mouthed.	By now the conversation had caught the interest of several loitering waiters, who were listening open mouthed.	false	666.35	672	22
7169_89735_000060_000001	Even Roddy seemed a bit startled, and for once forgot to make business with his newspaper; but his wondering stare was exclusively for De Morbihan.	Even Roddy seemed a bit startled, and for once forgot to make business with his newspaper; but his wondering stare was exclusively for De Morbihan.	false	672	679.83	23.14077
7169_89735_000061_000000	Lanyard put down knife and fork, swallowed a final mouthful of Haut Brion, and lighted a cigarette with the hand of a man who knew not the meaning of nerves.	Lanyard put down knife and fork, swallowed a final mouthful of Haut Brion, and lighted a cigarette with the hand of a man who knew not the meaning of nerves.	false	679.83	687.87	18
7169_89735_000062_000000	"Garcon!" he called quietly; and ordered coffee and cigars, with a liqueur to follow....	"Garcon!" he called quietly; and ordered coffee and cigars, with a liqueur to follow....	false	687.87	692.8	24.07323
7169_89735_000063_000000	"Known!" the American exclaimed.	"Known!" the American exclaimed.	true	692.87	695.085	24.027739
7169_89735_000063_000001	"They've caught him, eh?"	"They've caught him, eh?"	false	695.085	696.87	24.318464
7169_89735_000064_000000	"I didn't say that," De Morbihan laughed; "but the mystery is no more--in certain quarters."	"I didn't say that," De Morbihan laughed; "but the mystery is no more-in certain quarters."	true	696.87	701.77	23.250204
7169_89735_000065_000000	"Who is he, then?"	"Who is he, then?"	true	701.87	702.91	28.224438
7169_89735_000066_000000	"That--monsieur will pardon me--I'm not yet free to state.	"That-monsieur will pardon me-I'm not yet free to state.	false	703.1	706.95	24.635489
7169_89735_000066_000001	Indeed, I may be indiscreet in saying as much as I do.	Indeed, I may be indiscreet in saying as much as I do.	true	706.95	710.23	22.413683
7169_89735_000066_000002	Yet, among friends..."	Yet, among friends..."	true	710.45	712.44	21.64068
7169_89735_000067_000000	His shrug implied that, as far as _he_ was concerned, waiters were unhuman and the other guests of the establishment non-existent.	His shrug implied that, as far as underscore he underscore was concerned, waiters were unhuman and the other guests of the establishment non-existent.	false	712.44	721.12	21.893896
7169_89735_000068_000000	"But," the American persisted, "perhaps you can tell us how they got on his track?"	"But," the American persisted, "perhaps you can tell us how they got on his track?"	true	721.28	725.56	26.280058
7169_89735_000069_000000	"It wasn't difficult," said De Morbihan: "indeed, quite simple.	"It wasn't difficult," said De Morbihan: "indeed, quite simple.	true	725.57	728.8	27.428608
7169_89735_000069_000001	This tone of depreciation is becoming, for it was my part to suggest the solution to my friend, the Chief of the Surete.	This tone of depreciation is becoming, for it was my part to suggest the solution to my friend, the Chief of the Surete.	true	728.99	734.56	18
7169_89735_000069_000002	He had been annoyed and distressed, had even spoken of handing in his resignation because of his inability to cope with this gentleman, the Lone Wolf.	He had been annoyed and distressed, had even spoken of handing in his resignation because of his inability to cope with this gentleman, the Lone Wolf.	true	735.08	742.18	21
7169_89735_000069_000003	And since he is my friend, I too was distressed on his behalf, and badgered my poor wits until they chanced upon an idea which led us to the light."	And since he is my friend, I too was distressed on his behalf, and badgered my poor wits until they chanced upon an idea which led us to the light."	true	742.46	750.03	26.305315
7169_89735_000070_000000	"You won't tell us?" the girl protested, with a little moue of disappointment, as the Frenchman paused provokingly.	"You won't tell us?" the girl protested, with a little moue of disappointment, as the Frenchman paused provokingly.	false	750.03	756.07	27.648539
7169_89735_000071_000000	"Perhaps I shouldn't.	"Perhaps I shouldn't.	true	756.41	757.665	23.482529
7169_89735_000071_000001	And yet--why not?	And yet-why not?	true	757.665	759.43	26.224537
7169_89735_000071_000002	As I say, it was elementary reasoning--a mere matter of logical deduction and elimination.	As I say, it was elementary reasoning-a mere matter of logical deduction and elimination.	true	759.65	764.8	19.476042
7169_89735_000071_000003	One made up one's mind the Lone Wolf must be a certain sort of man; the rest was simply sifting France for the man to fit the theory, and then watching him until he gave himself away."	One made up one's mind the Lone Wolf must be a certain sort of man; the rest was simply sifting France for the man to fit the theory, and then watching him until he gave himself away."	true	764.81	773.53	23.87212
7169_89735_000072_000000	"You don't imagine we're going to let you stop there?"	"You don't imagine we're going to let you stop there?"	true	774.02	776.175	27.6016
7169_89735_000072_000001	The American demanded in an aggrieved tone.	The American demanded in an aggrieved tone.	false	776.175	778.69	26
7169_89735_000073_000000	"No?	"No?	true	778.82	779.385	31.55313
7169_89735_000073_000001	I must continue?	I must continue?	true	779.385	780.52	29.919657
7169_89735_000073_000002	Very well: I confess to some little pride.	Very well: I confess to some little pride.	true	780.77	783.495	24.444578
7169_89735_000073_000003	It was a feat.	It was a feat.	true	783.495	784.485	24.992512
7169_89735_000073_000004	He is cunning, that one!"	He is cunning, that one!"	true	784.485	785.98	33.046535
7169_89735_000074_000000	De Morbihan paused and shifted sideways in his chair, grinning like a mischievous child.	De Morbihan paused and shifted sideways in his chair, grinning like a mischievous child.	true	786.29	791.47	22.515997
7169_89735_000075_000000	By this manoeuvre, thanks to the arrangement of mirrors lining the walls, he commanded an indirect view of Lanyard; a fact of which the latter was not unaware, though his expression remained unchanged as he sat--with a corner of his eye reserved for Roddy--speculating whether De Morbihan were telling the truth or only boasting for his own glorification.	By this manoeuvre, thanks to the arrangement of mirrors lining the walls, he commanded an indirect view of Lanyard; a fact of which the latter was not unaware, though his expression remained unchanged as he sat-with a corner of his eye reserved for Roddy-speculating whether De Morbihan were telling the truth or only boasting for his own glorification.	false	791.54	809.8	24
7169_89735_000076_000000	"Do go on--please!" the girl begged prettily.	"Do go on-please!" the girl begged prettily.	true	810.05	813.1	26.978132
7169_89735_000077_000000	"I can deny you nothing, mademoiselle....	"I can deny you nothing, mademoiselle....	true	813.32	815.325	20.374027
7169_89735_000077_000001	Well, then!	Well, then!	true	815.325	815.835	25.165545
7169_89735_000077_000002	From what little was known of this mysterious creature, one readily inferred he must be a bachelor, with no close friends.	From what little was known of this mysterious creature, one readily inferred he must be a bachelor, with no close friends.	true	815.835	822.22	22
7169_89735_000077_000003	That is clear, I trust?"	That is clear, I trust?"	true	822.29	823.81	30.243773
7169_89735_000078_000000	"Too deep for me, my friend," the elderly man confessed.	"Too deep for me, my friend," the elderly man confessed.	true	823.94	827.26	26.68338
7169_89735_000079_000000	"Impenetrable reticence," the Count expounded, sententious--and enjoying himself hugely--"isn't possible in the human relations.	"Impenetrable reticence," the Count expounded, sententious-and enjoying himself hugely-"isn't possible in the human relations.	true	827.3	835.27	24.665304
7169_89735_000079_000001	Sooner or later one is doomed to share one's secrets, however reluctantly, even unconsciously, with a wife, a mistress, a child, or with some trusted friend.	Sooner or later one is doomed to share one's secrets, however reluctantly, even unconsciously, with a wife, a mistress, a child, or with some trusted friend.	false	835.43	844.18	23
7169_89735_000079_000002	And a secret between two is--a prolific breeder of platitudes!	And a secret between two is-a prolific breeder of platitudes!	true	844.49	848.655	31.288477
7169_89735_000079_000003	Granted this line of reasoning, the Lone Wolf is of necessity not only unmarried but practically friendless.	Granted this line of reasoning, the Lone Wolf is of necessity not only unmarried but practically friendless.	true	848.655	854.82	23.502806
7169_89735_000079_000004	Other attributes of his will obviously comprise youth, courage, imagination, a rather high order of intelligence, and a social position--let us say, rather, an ostensible business--enabling him to travel at will hither and yon without exciting comment.	Other attributes of his will obviously comprise youth, courage, imagination, a rather high order of intelligence, and a social position-let us say, rather, an ostensible business-enabling him to travel at will hither and yon without exciting comment.	false	854.82	869.22	24.033285
7169_89735_000079_000005	So far, good!	So far, good!	true	869.22	870.58	27.209469
7169_89735_000079_000006	My friend the Chief of the Surete forthwith commissioned his agents to seek such an one, and by this means several fine fish were enmeshed in the net of suspicion, carefully scrutinized, and one by one let go--all except one, the veritable man.	My friend the Chief of the Surete forthwith commissioned his agents to seek such an one, and by this means several fine fish were enmeshed in the net of suspicion, carefully scrutinized, and one by one let go-all except one, the veritable man.	false	870.59	884.52	24.417885
7169_89735_000079_000007	Him they sedulously watched, shadowing him across Europe and back again.	Him they sedulously watched, shadowing him across Europe and back again.	true	884.52	888.555	24
7169_89735_000079_000008	He was in Berlin at the time of the famous Rheinart robbery, though he compassed that coup without detection; he was in Vienna when the British embassy there was looted, but escaped by a clever ruse and managed to dispose of his plunder before the agents of the Surete could lay hands on him; recently he has been in London, and there he made love to, and ran away with, the diamonds of a certain lady of some eminence.	He was in Berlin at the time of the famous Rheinart robbery, though he compassed that coup without detection; he was in Vienna when the British embassy there was looted, but escaped by a clever ruse and managed to dispose of his plunder before the agents of the Surete could lay hands on him; recently he has been in London, and there he made love to, and ran away with, the diamonds of a certain lady of some eminence.	false	888.555	909.85	21
7169_89735_000079_000009	You have heard of Madame Omber, eh?" Now by Roddy's expression it was plain that, if Madame Omber's name wasn't strange in his hearing, at least he found this news about her most surprising.	You have heard of Madame Omber, eh?" Now by Roddy's expression it was plain that, if Madame Omber's name wasn't strange in his hearing, at least he found this news about her most surprising.	true	909.92	920.71	23.122879
7169_89735_000079_000010	He was frankly staring, with a slackened jaw and with stupefaction in his blank blue eyes.	He was frankly staring, with a slackened jaw and with stupefaction in his blank blue eyes.	true	920.9	926.26	25.186255
7169_89735_000080_000000	Lanyard gently pinched the small end of a cigar, dipped it into his coffee, and lighted it with not so much as a suspicion of tremor.	Lanyard gently pinched the small end of a cigar, dipped it into his coffee, and lighted it with not so much as a suspicion of tremor.	true	926.36	933.97	23.805126
7169_89735_000080_000001	His brain, however, was working rapidly in effort to determine whether De Morbihan meant this for warning, or was simply narrating an amusing yarn founded on advance information and amplified by an ingenious imagination.	His brain, however, was working rapidly in effort to determine whether De Morbihan meant this for warning, or was simply narrating an amusing yarn founded on advance information and amplified by an ingenious imagination.	true	934.07	945.675	15
7169_89735_000080_000002	For by now the news of the Omber affair must have thrilled many a Continental telegraph-wire....	For by now the news of the Omber affair must have thrilled many a Continental telegraph wire....	true	945.675	950.46	22.576061
7169_89735_000081_000000	"Madame Omber--of course!" the American agreed thoughtfully.	"Madame Omber-of course!" the American agreed thoughtfully.	true	950.46	954.1	24.894506
7169_89735_000081_000001	"Everyone has heard of her wonderful jewels.	"Everyone has heard of her wonderful jewels.	true	954.26	956.025	22
7169_89735_000081_000002	The real marvel is that the Lone Wolf neglected so shining a mark as long as he did."	The real marvel is that the Lone Wolf neglected so shining a mark as long as he did."	true	956.025	960.4	19
7169_89735_000082_000000	"But truly so, monsieur!"	"But truly so, monsieur!"	false	960.56	962.4	22.145603
7169_89735_000083_000000	"And they caught him at it, eh?"	"And they caught him at it, eh?"	false	962.4	964.11	27.146408
7169_89735_000084_000000	"Not precisely: but he left a clue--and London, to boot--with such haste as would seem to indicate he knew his cunning hand had, for once, slipped."	"Not precisely: but he left a clue-and London, to boot-with such haste as would seem to indicate he knew his cunning hand had, for once, slipped."	true	964.11	973.62	25.657206
7169_89735_000085_000000	"Then they'll nab him soon?"	"Then they'll nab him soon?"	false	973.62	975.36	20.466427
7169_89735_000086_000000	"Ah, monsieur, one must say no more!" De Morbihan protested.	"Ah, monsieur, one must say no more!" De Morbihan protested.	false	975.36	979.11	20.235947
7169_89735_000086_000001	"Rest assured the Chief of the Surete has laid his plans: his web is spun, and so artfully that I think our unsociable outlaw will soon be making friends in the Prison of the Sante....	"Rest assured the Chief of the Surete has laid his plans: his web is spun, and so artfully that I think our unsociable outlaw will soon be making friends in the Prison of the Sante....	false	979.11	989.01	24.632984
7169_89735_000086_000002	But now we must adjourn.	But now we must adjourn.	true	989.01	990.375	25.72926
7169_89735_000086_000003	One is sorry.	One is sorry.	true	990.375	991.245	27.933365
7169_89735_000086_000004	It has been so very pleasant...."	It has been so very pleasant...."	true	991.245	993.43	24.145777
7169_89735_000087_000000	A waiter conjured the bill from some recess of his waistcoat and served it on a clean plate to the American.	A waiter conjured the bill from some recess of his waistcoat and served it on a clean plate to the American.	true	993.5	999.19	25.387985
7169_89735_000087_000001	Another ran bawling for the vestiaire.	Another ran bawling for the vestiaire.	true	999.32	1001.26	25
7169_89735_000087_000002	Roddy glued his gaze afresh to the Daily Mail.	Roddy glued his gaze afresh to the Daily Mail.	true	1001.69	1004.41	21.52428
7169_89735_000087_000003	The party rose.	The party rose.	true	1004.41	1005.52	24.785538
7169_89735_000088_000000	Lanyard noticed that the American signed instead of settling the bill with cash, indicating that he resided at Troyon's as well as dined there.	Lanyard noticed that the American signed instead of settling the bill with cash, indicating that he resided at Troyon's as well as dined there.	true	1005.86	1012.95	18
7169_89735_000088_000001	And the adventurer found time to reflect that it was odd for such as he to seek that particular establishment in preference to the palatial modern hostelries of the Rive Droit--before De Morbihan, ostensibly for the first time espying Lanyard, plunged across the room with both hands outstretched and a cry of joyous surprise not really justified by their rather slight acquaintanceship.	And the adventurer found time to reflect that it was odd for such as he to seek that particular establishment in preference to the palatial modern hostelries of the Rive Droit-before De Morbihan, ostensibly for the first time espying Lanyard, plunged across the room with both hands outstretched and a cry of joyous surprise not really justified by their rather slight acquaintanceship.	false	1012.95	1032.7	24
7169_89735_000089_000000	"Ah!	"Ah!	true	1032.7	1033.92	26.062632
7169_89735_000089_000001	Ah!" he clamoured vivaciously.	Ah!" he clamoured vivaciously.	false	1033.92	1035.19	21.951792
7169_89735_000089_000002	"It is Monsieur Lanyard, who knows all about paintings!	"It is Monsieur Lanyard, who knows all about paintings!	true	1035.19	1037.67	22
7169_89735_000089_000003	But this is delightful, my friend--one grand pleasure!	But this is delightful, my friend-one grand pleasure!	true	1037.67	1040.38	27.601532
7169_89735_000089_000004	You must know my friends....	You must know my friends....	true	1040.38	1041.39	21
7169_89735_000089_000005	But come!"	But come!"	true	1041.39	1042.07	29.74746
7169_89735_000090_000000	And seizing Lanyard's hands, when that one somewhat reluctantly rose in response to this surprisingly over-exuberant greeting, he dragged him willy-nilly from behind his table.	And seizing Lanyard's hands, when that one somewhat reluctantly rose in response to this surprisingly over exuberant greeting, he dragged him willy nilly from behind his table.	false	1042.07	1050.75	17
7169_89735_000091_000000	"And you are American, too.	"And you are American, too.	true	1050.75	1051.96	22
7169_89735_000091_000001	Certainly you must know one another. Mademoiselle Bannon--with your permission--my friend, Monsieur Lanyard. And Monsieur Bannon--an old, dear friend, with whom you will share a passion for the beauties of art."	Certainly you must know one another. Mademoiselle Bannon-with your permission-my friend, Monsieur Lanyard. And Monsieur Bannon-an old, dear friend, with whom you will share a passion for the beauties of art."	false	1051.96	1061.38	20.372892
7169_89735_000092_000000	The hand of the American, when Lanyard clasped it, was cold, as cold as ice; and as their eyes met that abominable cough laid hold of the man, as it were by the nape of his neck, and shook him viciously.	The hand of the American, when Lanyard clasped it, was cold, as cold as ice; and as their eyes met that abominable cough laid hold of the man, as it were by the nape of his neck, and shook him viciously.	true	1061.38	1072.33	22.904493
7169_89735_000092_000001	Before it had finished with him, his sensitively coloured face was purple, and he was gasping, breathless--and infuriated.	Before it had finished with him, his sensitively coloured face was purple, and he was gasping, breathless-and infuriated.	true	1072.43	1079.03	26.587736
7169_89735_000093_000000	"Monsieur Bannon," De Morbihan explained disconnectedly--"it is most distressing--I tell him he should not stop in Paris at this season--"	"Monsieur Bannon," De Morbihan explained disconnectedly-"it is most distressing-I tell him he should not stop in Paris at this season-"	true	1079.03	1086.16	22.526398
7169_89735_000094_000000	"It is nothing!" the American interposed brusquely between paroxysms.	"It is nothing!" the American interposed brusquely between paroxysms.	true	1086.35	1090.36	28.688091
7169_89735_000095_000000	"But our winter climate, monsieur--it is not fit for those in the prime of health--"	"But our winter climate, monsieur-it is not fit for those in the prime of health-"	true	1090.64	1094.38	26.04685
7169_89735_000096_000000	"It is I who am unfit!" Bannon snapped, pressing a handkerchief to his lips--"unfit to live!" he amended venomously.	"It is I who am unfit!" Bannon snapped, pressing a handkerchief to his lips-"unfit to live!" he amended venomously.	false	1094.38	1100.98	25.287123
7169_89735_000097_000000	Lanyard murmured some conventional expression of sympathy.	Lanyard murmured some conventional expression of sympathy.	true	1101.32	1104.32	24.47704
7169_89735_000097_000001	Through it all he was conscious of the regard of the girl.	Through it all he was conscious of the regard of the girl.	true	1104.32	1107.1	21.418127
7169_89735_000097_000002	Her soft brown eyes met his candidly, with a look cool in its composure, straightforward in its enquiry, neither bold nor mock-demure.	Her soft brown eyes met his candidly, with a look cool in its composure, straightforward in its enquiry, neither bold nor mock demure.	true	1107.11	1114.62	24.761261
7169_89735_000097_000003	And if they were the first to fall, it was with an effect of curiosity sated, without hint of discomfiture....	And if they were the first to fall, it was with an effect of curiosity sated, without hint of discomfiture....	true	1114.62	1120.12	25.578238
7169_89735_000097_000004	And somehow the adventurer felt himself measured, classified, filed away.	And somehow the adventurer felt himself measured, classified, filed away.	true	1120.16	1124.36	22.986773
