7169_89735_000098_000000	Between amusement and pique he continued to stare while the elderly American recovered his breath and De Morbihan jabbered on with unfailing vivacity; and he thought that this closer scrutiny discovered in her face contours suggesting maturity of thought beyond her apparent years--which were somewhat less than the sum of Lanyard's--and with this the suggestion of an elusive, provoking quality of wistful languor, a hint of patient melancholy....	Between amusement and pique he continued to stare while the elderly American recovered his breath and De Morbihan jabbered on with unfailing vivacity; and he thought that this closer scrutiny discovered in her face contours suggesting maturity of thought beyond her apparent years-which were somewhat less than the sum of Lanyard's-and with this the suggestion of an elusive, provoking quality of wistful languor, a hint of patient melancholy....	true	1124.36	1146.55	22
7169_89735_000099_000000	"We are off for a glimpse of Montmartre," De Morbihan was explaining--"Monsieur Bannon and I. He has not seen Paris in twenty years, he tells me.	"We are off for a glimpse of Montmartre," De Morbihan was explaining-"Monsieur Bannon and i He has not seen Paris in twenty years, he tells me.	false	1146.77	1154.3	23.789942
7169_89735_000099_000001	Well, it will be amusing to show him what changes have taken place in all that time.	Well, it will be amusing to show him what changes have taken place in all that time.	true	1154.3	1158.32	22.138098
7169_89735_000099_000002	One regrets mademoiselle is too fatigued to accompany us.	One regrets mademoiselle is too fatigued to accompany us.	true	1158.32	1161.51	22
7169_89735_000099_000003	But you, my friend--now if you would consent to make our third, it would be most amiable of you."	But you, my friend-now if you would consent to make our third, it would be most amiable of you."	true	1161.51	1166.26	25.079782
7169_89735_000100_000000	"I'm sorry," Lanyard excused himself; "but as you see, I am only just in from the railroad, a long and tiresome journey.	"I'm sorry," Lanyard excused himself; "but as you see, I am only just in from the railroad, a long and tiresome journey.	true	1166.3	1172.53	25.258911
7169_89735_000100_000001	You are very good, but I--"	You are very good, but I-"	true	1172.57	1173.69	20.862604
7169_89735_000101_000000	"Good!" De Morbihan exclaimed with violence.	"Good!" De Morbihan exclaimed with violence.	true	1173.69	1175.68	23.661955
7169_89735_000101_000001	"I?	"I?	true	1175.68	1176.27	35.800064
7169_89735_000101_000002	On the contrary, I am a very selfish man; I seek but to afford myself the pleasure of your company.	On the contrary, I am a very selfish man; I seek but to afford myself the pleasure of your company.	false	1176.27	1181.12	24
7169_89735_000101_000003	You lead such a busy life, my friend, romping about Europe, here one day, God-knows-where the next, that one must make one's best of your spare moments.	You lead such a busy life, my friend, romping about Europe, here one day, God knows where the next, that one must make one's best of your spare moments.	true	1181.12	1188.94	21
7169_89735_000101_000004	You will join us, surely?"	You will join us, surely?"	true	1188.94	1190.41	23.851204
7169_89735_000102_000000	"Really I cannot to-night.	"Really I cannot to night.	true	1190.63	1191.97	33.26304
7169_89735_000102_000001	Another time perhaps, if you'll excuse me."	Another time perhaps, if you'll excuse me."	true	1191.97	1194.22	28.70579
7169_89735_000103_000000	"But it is always this way!" De Morbihan explained to his friends with a vast show of mock indignation.	"But it is always this way!" De Morbihan explained to his friends with a vast show of mock indignation.	true	1194.44	1199.47	19
7169_89735_000103_000001	"'Another time, perhaps'--his invariable excuse!	"'Another time, perhaps'--his invariable excuse!	true	1199.6	1202.54	23.04481
7169_89735_000103_000002	I tell you, not two men in all Paris have any real acquaintance with this gentleman whom all Paris knows!	I tell you, not two men in all Paris have any real acquaintance with this gentleman whom all Paris knows!	true	1202.54	1207.66	19
7169_89735_000103_000003	His reserve is proverbial--'as distant as Lanyard,' we say on the boulevards!" And turning again to the adventurer, meeting his cold stare with the De Morbihan grin of quenchless effrontery--"As you will, my friend!" he granted.	His reserve is proverbial-'as distant as Lanyard,' we say on the boulevards!" And turning again to the adventurer, meeting his cold stare with the De Morbihan grin of quenchless effrontery-"As you will, my friend!" he granted.	false	1207.73	1218.75	22.270363
7169_89735_000103_000004	"But should you change your mind--well, you'll have no trouble finding us.	"But should you change your mind-well, you'll have no trouble finding us.	true	1218.75	1222.1	22.800678
7169_89735_000103_000005	Ask any place along the regular route.	Ask any place along the regular route.	true	1222.1	1223.98	18
7169_89735_000103_000006	We see far too little of one another, monsieur--and I am most anxious to have a little chat with you."	We see far too little of one another, monsieur-and I am most anxious to have a little chat with you."	false	1223.98	1228.57	23.199993
7169_89735_000104_000000	"It will be an honour," Lanyard returned formally....	"It will be an honour," Lanyard returned formally....	true	1228.85	1231.45	24.036499
7169_89735_000105_000000	In his heart he was pondering several most excruciating methods of murdering the man.	In his heart he was pondering several most excruciating methods of murdering the man.	true	1231.82	1236.1	22.1541
7169_89735_000105_000001	What did he mean?	What did he mean?	true	1236.32	1237.34	23.591076
7169_89735_000105_000002	How much did he know?	How much did he know?	true	1237.34	1238.41	20.65699
7169_89735_000105_000003	If he knew anything, he must mean ill, for assuredly he could not be ignorant of Roddy's business, or that every other word he uttered was rivetting suspicion on Lanyard of identity with the Lone Wolf, or that Roddy was listening with all his ears and staring into the bargain!	If he knew anything, he must mean ill, for assuredly he could not be ignorant of Roddy's business, or that every other word he uttered was rivetting suspicion on Lanyard of identity with the Lone Wolf, or that Roddy was listening with all his ears and staring into the bargain!	true	1238.41	1251.49	17
7169_89735_000106_000000	Decidedly something must be done to silence this animal, should it turn out he really did know anything!	Decidedly something must be done to silence this animal, should it turn out he really did know anything!	true	1251.65	1256.29	22.520565
7169_89735_000107_000000	It was only after profound reflection over his liqueur (while Roddy devoured his Daily Mail and washed it down with a third bottle of Bass) that Lanyard summoned the maitre-d'hotel and asked for a room.	It was only after profound reflection over his liqueur (while Roddy devoured his Daily Mail and washed it down with a third bottle of Bass) that Lanyard summoned the maitre d'hotel and asked for a room.	false	1256.33	1266.56	23.998323
7169_89735_000108_000000	It would never do to fix the doubts of the detective by going elsewhere that night.	It would never do to fix the doubts of the detective by going elsewhere that night.	true	1266.56	1270.47	23.710094
7169_89735_000108_000001	But, fortunately, Lanyard knew that warren which was Troyon's as no one else knew it; Roddy would find it hard to detain him, should events seem to advise an early departure.	But, fortunately, Lanyard knew that warren which was Troyon's as no one else knew it; Roddy would find it hard to detain him, should events seem to advise an early departure.	false	1270.47	1289.31	21.351189
