7169_89735_000000_000000	When at length his conveyance drew up at the historic corner, Lanyard alighting could have rubbed his eyes to see the windows of Troyon's all bright with electric light.	When at length his conveyance drew up at the historic corner, Lanyard alighting could have rubbed his eyes to see the windows of Troyon's all bright with electric light.	false	0	4.98	23.915432
7169_89735_000001_000000	Somehow, and most unreasonably, he had always believed the place would go to the hands of the house-wrecker unchanged.	Somehow, and most unreasonably, he had always believed the place would go to the hands of the house wrecker unchanged.	false	4.98	6.99	24.76027
7169_89735_000002_000000	A smart portier ducked out, seized his luggage, and offered an umbrella.	A smart portier ducked out, seized his luggage, and offered an umbrella.	false	6.99	8.04	24.522882
7169_89735_000002_000001	Lanyard composed his features to immobility as he entered the hotel, of no mind to let the least flicker of recognition be detected in his eyes when they should re-encounter familiar faces.	Lanyard composed his features to immobility as he entered the hotel, of no mind to let the least flicker of recognition be detected in his eyes when they should re encounter familiar faces.	false	8.04	14.97	25.847353
7169_89735_000003_000000	And this was quite as well: for--again--the first he saw was Roddy.	And this was quite as well: for-again-the first he saw was Roddy.	false	14.97	16.905	24.900301
7169_89735_000004_000000	III	three	true	16.905	17.53	24.159758
7169_89735_000005_000000	A POINT OF INTERROGATION	A POINT OF INTERROGATION	true	17.63	19.87	23.846518
7169_89735_000006_000000	The man from Scotland Yard had just surrendered hat, coat, and umbrella to the vestiaire and was turning through swinging doors to the dining-room.	The man from Scotland Yard had just surrendered hat, coat, and umbrella to the vestiaire and was turning through swinging doors to the dining room.	true	19.97	27.16	23.238754
7169_89735_000006_000001	Again, embracing Lanyard, his glance seemed devoid of any sort of intelligible expression; and if its object needed all his self-possession in that moment, it was to dissemble relief rather than dismay.	Again, embracing Lanyard, his glance seemed devoid of any sort of intelligible expression; and if its object needed all his self possession in that moment, it was to dissemble relief rather than dismay.	true	27.38	38.86	24.546337
7169_89735_000006_000002	An accent of the fortuitous distinguished this second encounter too persuasively to excuse further misgivings.	An accent of the fortuitous distinguished this second encounter too persuasively to excuse further misgivings.	true	39.08	44.52	22
7169_89735_000006_000003	What the adventurer himself hadn't known till within the last ten minutes, that he was coming to Troyon's, Roddy couldn't possibly have anticipated; ergo, whatever the detective's business, it had nothing to do with Lanyard.	What the adventurer himself hadn't known till within the last ten minutes, that he was coming to Troyon's, Roddy couldn't possibly have anticipated; ergo, whatever the detective's business, it had nothing to do with Lanyard.	false	44.52	56.56	24.130466
7169_89735_000007_000000	Furthermore, before quitting the lobby, Roddy paused long enough to instruct the vestiaire to have a fire laid in his room.	Furthermore, before quitting the lobby, Roddy paused long enough to instruct the vestiaire to have a fire laid in his room.	true	56.66	63.04	24.521692
7169_89735_000008_000000	So he was stopping at Troyon's--and didn't care who knew it!	So he was stopping at Troyon's-and didn't care who knew it!	false	63.17	66.285	27.638535
7169_89735_000009_000000	His doubts altogether dissipated by this incident, Lanyard followed his natural enemy into the dining-room with an air as devil-may-care as one could wish and so impressive that the maitre-d'hotel abandoned the detective to the mercies of one of his captains and himself hastened to seat Lanyard and take his order.	His doubts altogether dissipated by this incident, Lanyard followed his natural enemy into the dining room with an air as devil may care as one could wish and so impressive that the maitre d'hotel abandoned the detective to the mercies of one of his captains and himself hastened to seat Lanyard and take his order.	true	66.285	81.93	19
7169_89735_000010_000000	This last disposed of; Lanyard surrendered himself to new impressions--of which the first proved a bit disheartening.	This last disposed of; Lanyard surrendered himself to new impressions-of which the first proved a bit disheartening.	true	81.93	88.36	26.611029
7169_89735_000011_000000	However impulsively, he hadn't resought Troyon's without definite intent, to wit, to gain some clue, however slender, to the mystery of that wretched child, Marcel.	However impulsively, he hadn't resought Troyon's without definite intent, to wit, to gain some clue, however slender, to the mystery of that wretched child, Marcel.	true	88.55	97.72	23.20003
7169_89735_000011_000001	But now it appeared he had procrastinated fatally: Time and Change had left little other than the shell of the Troyon's he remembered.	But now it appeared he had procrastinated fatally: Time and Change had left little other than the shell of the Troyon's he remembered.	true	97.97	104.92	22.718237
7169_89735_000011_000002	Papa Troyon was gone; Madame no longer occupied the desk of the caisse; enquiries, so discreetly worded as to be uncompromising, elicited from the maitre-d'hotel the information that the house had been under new management these eighteen months; the old proprietor was dead, and his widow had sold out lock, stock and barrel, and retired to the country--it was not known exactly where.	Papa Troyon was gone; Madame no longer occupied the desk of the caisse; enquiries, so discreetly worded as to be uncompromising, elicited from the maitre d'hotel the information that the house had been under new management these eighteen months; the old proprietor was dead, and his widow had sold out lock, stock and barrel, and retired to the country-it was not known exactly where.	true	105.08	125.26	25.036207
7169_89735_000011_000003	And with the new administration had come fresh decorations and furnishings as well as a complete change of personnel: not even one of the old waiters remained.	And with the new administration had come fresh decorations and furnishings as well as a complete change of personnel: not even one of the old waiters remained.	true	125.48	133.33	22.71056
7169_89735_000012_000000	"'All, all are gone, the old familiar faces,'" Lanyard quoted in vindictive melancholy--"damn 'em!"	"'All, all are gone, the old familiar faces,'" Lanyard quoted in vindictive melancholy-"damn 'em!"	true	133.55	140.32	24.89411
7169_89735_000013_000000	Happily, it was soon demonstrated that the cuisine was being maintained on its erstwhile plane of excellence: one still had that comfort....	Happily, it was soon demonstrated that the cuisine was being maintained on its erstwhile plane of excellence: one still had that comfort....	false	140.84	148.15	23
7169_89735_000014_000000	Other impressions, less ultimate, proved puzzling, disconcerting, and paradoxically reassuring.	Other impressions, less ultimate, proved puzzling, disconcerting, and paradoxically reassuring.	true	148.4	153.795	24.578093
7169_89735_000015_000000	Lanyard commanded a fair view of Roddy across the waist of the room. The detective had ordered a meal that matched his aspect well--both of true British simplicity.	Lanyard commanded a fair view of Roddy across the waist of the room. The detective had ordered a meal that matched his aspect well-both of true British simplicity.	true	153.795	162.85	23.888765
7169_89735_000015_000001	He was a square-set man with a square jaw, cold blue eyes, a fat nose, a thin-lipped trap of a mouth, a face as red as rare beefsteak.	He was a square set man with a square jaw, cold blue eyes, a fat nose, a thin lipped trap of a mouth, a face as red as rare beefsteak.	false	163.1	171.31	23.147245
7169_89735_000015_000002	His dinner comprised a cut from the joint, boiled potatoes, brussels sprouts, a bit of cheese, a bottle of Bass. He ate slowly, chewing with the doggedness of a strong character hampered by a weak digestion, and all the while kept eyes fixed to an issue of the Paris edition of the London Daily Mail, with an effect of concentration quite too convincing.	His dinner comprised a cut from the joint, boiled potatoes, brussels sprouts, a bit of cheese, a bottle of Bass. He ate slowly, chewing with the doggedness of a strong character hampered by a weak digestion, and all the while kept eyes fixed to an issue of the Paris edition of the London Daily Mail, with an effect of concentration quite too convincing.	false	171.47	190.51	25
7169_89735_000016_000000	Now one doesn't read the Paris edition of the London Daily Mail with tense excitement.	Now one doesn't read the Paris edition of the London Daily Mail with tense excitement.	true	190.94	195.615	23.186392
7169_89735_000016_000001	Humanly speaking, it can't be done.	Humanly speaking, it can't be done.	true	195.615	197.53	28.836683
7169_89735_000017_000000	Where, then, was the object of this so sedulously dissembled interest?	Where, then, was the object of this so sedulously dissembled interest?	true	197.75	202.21	24.533249
7169_89735_000018_000000	Lanyard wasn't slow to read this riddle to his satisfaction--in as far, that is, as it was satisfactory to feel still more certain that Roddy's quarry was another than himself.	Lanyard wasn't slow to read this riddle to his satisfaction-in as far, that is, as it was satisfactory to feel still more certain that Roddy's quarry was another than himself.	false	202.67	212.38	22.55071
7169_89735_000019_000000	Despite the lateness of the hour, which had by now turned ten o'clock, the restaurant had a dozen tables or so in the service of guests pleasantly engaged in lengthening out an agreeable evening with dessert, coffee, liqueurs and cigarettes.	Despite the lateness of the hour, which had by now turned ten o'clock, the restaurant had a dozen tables or so in the service of guests pleasantly engaged in lengthening out an agreeable evening with dessert, coffee, liqueurs and cigarettes.	true	212.39	225.34	23
7169_89735_000019_000001	The majority of these were in couples, but at a table one removed from Roddy's sat a party of three; and Lanyard noticed, or fancied, that the man from Scotland Yard turned his newspaper only during lulls in the conversation in this quarter.	The majority of these were in couples, but at a table one removed from Roddy's sat a party of three; and Lanyard noticed, or fancied, that the man from Scotland Yard turned his newspaper only during lulls in the conversation in this quarter.	true	225.53	238.99	23
7169_89735_000020_000000	Of the three, one might pass for an American of position and wealth: a man of something more than sixty years, with an execrable accent, a racking cough, and a thin, patrician cast of features clouded darkly by the expression of a soul in torment, furrowed, seamed, twisted--a mask of mortal anguish.	Of the three, one might pass for an American of position and wealth: a man of something more than sixty years, with an execrable accent, a racking cough, and a thin, patrician cast of features clouded darkly by the expression of a soul in torment, furrowed, seamed, twisted-a mask of mortal anguish.	false	239.24	256.33	24.56193
7169_89735_000020_000001	And once, when this one looked up and casually encountered Lanyard's gaze, the adventurer was shocked to find himself staring into eyes like those of a dead man: eyes of a grey so light that at a little distance the colour of the irises blended indistinguishably with their whites, leaving visible only the round black points of pupils abnormally distended and staring, blank, fixed, passionless, beneath lashless lids.	And once, when this one looked up and casually encountered Lanyard's gaze, the adventurer was shocked to find himself staring into eyes like those of a dead man: eyes of a grey so light that at a little distance the colour of the irises blended indistinguishably with their whites, leaving visible only the round black points of pupils abnormally distended and staring, blank, fixed, passionless, beneath lashless lids.	false	256.52	280.45	22
7169_89735_000021_000000	For the instant they seemed to explore Lanyard's very soul with a look of remote and impersonal curiosity; then they fell away; and when next the adventurer looked, the man had turned to attend to some observation of one of his companions.	For the instant they seemed to explore Lanyard's very soul with a look of remote and impersonal curiosity; then they fell away; and when next the adventurer looked, the man had turned to attend to some observation of one of his companions.	true	280.79	293.14	23
7169_89735_000022_000000	On his right sat a girl who might be his daughter; for not only was she, too, hall-marked American, but she was far too young to be the other's wife.	On his right sat a girl who might be his daughter; for not only was she, too, hall marked American, but she was far too young to be the other's wife.	true	293.42	301.98	24.476633
7169_89735_000022_000001	A demure, old-fashioned type; well-poised but unassuming; fetchingly gowned and with sufficient individuality of taste but not conspicuously; a girl with soft brown hair and soft brown eyes; pretty, not extravagantly so when her face was in repose, but with a slow smile that rendered her little less than beautiful: in all (Lanyard thought) the kind of woman that is predestined to comfort mankind, whose strongest instinct is the maternal.	A demure, old-fashioned type; well poised but unassuming; fetchingly gowned and with sufficient individuality of taste but not conspicuously; a girl with soft brown hair and soft brown eyes; pretty, not extravagantly so when her face was in repose, but with a slow smile that rendered her little less than beautiful: in all (Lanyard thought) the kind of woman that is predestined to comfort mankind, whose strongest instinct is the maternal.	true	301.98	328.09	23.876677
7169_89735_000023_000000	She took little part in the conversation, seldom interrupting what was practically a duologue between her putative father and the third of their party.	She took little part in the conversation, seldom interrupting what was practically a duologue between her putative father and the third of their party.	false	328.13	335.95	25.861973
7169_89735_000024_000000	This last was one, whom Lanyard was sure he knew, though he could see no more than the back of Monsieur le Comte Remy de Morbihan.	This last was one, whom Lanyard was sure he knew, though he could see no more than the back of Monsieur le Comte Remy de Morbihan.	false	336.05	343.23	21.240606
7169_89735_000025_000000	And he wondered with a thrill of amusement if it were possible that Roddy was on the trail of that tremendous buck.	And he wondered with a thrill of amusement if it were possible that Roddy was on the trail of that tremendous buck.	false	343.23	348.61	18
7169_89735_000025_000001	If so, it would be a chase worth following--a diversion rendered the more exquisite to Lanyard by the spice of novelty, since for once he would figure as a dispassionate bystander.	If so, it would be a chase worth following-a diversion rendered the more exquisite to Lanyard by the spice of novelty, since for once he would figure as a dispassionate bystander.	true	348.68	358.36	22
7169_89735_000026_000000	The name of Comte Remy de Morbihan, although unrecorded in the Almanach de Gotha, was one to conjure with in the Paris of his day and generation.	The name of Comte Remy de Morbihan, although unrecorded in the Almanach de Gotha, was one to conjure with in the Paris of his day and generation.	true	358.64	366.61	21
7169_89735_000026_000001	He claimed the distinction of being at once the homeliest, one of the wealthiest, and the most-liked man in France.	He claimed the distinction of being at once the homeliest, one of the wealthiest, and the most liked man in France.	true	366.74	372.76	25.66328
7169_89735_000027_000000	As to his looks, good or bad, they were said to prove infallibly fatal with women, while not a few men, perhaps for that reason, did their possessor the honour to imitate them.	As to his looks, good or bad, they were said to prove infallibly fatal with women, while not a few men, perhaps for that reason, did their possessor the honour to imitate them.	true	372.8	382.69	23.796473
7169_89735_000027_000001	The revues burlesqued him; Sem caricatured him; Forain counterfeited him extensively in that inimitable series of Monday morning cartoons for Le Figaro: one said "De Morbihan" instinctively at sight of that stocky figure, short and broad, topped by a chubby, moon-like mask with waxed moustaches, womanish eyes, and never-failing grin.	The revues burlesqued him; s e m caricatured him; Forain counterfeited him extensively in that inimitable series of Monday morning cartoons for Le Figaro: one said "De Morbihan" instinctively at sight of that stocky figure, short and broad, topped by a chubby, moon like mask with waxed moustaches, womanish eyes, and never failing grin.	false	382.73	402.46	24
7169_89735_000028_000000	A creature of proverbial good-nature and exhaustless vitality, his extraordinary popularity was due to the equally extraordinary extravagance with which he supported that latest Gallic fad, "le Sport." The Parisian Rugby team was his pampered protege, he was an active member of the Tennis Club, maintained not only a flock of automobiles but a famous racing stable, rode to hounds, was a good field gun, patronized aviation and motor-boat racing, risked as many maximums during the Monte Carlo season as the Grand Duke Michael himself, and was always ready to whet rapiers or burn a little harmless powder of an early morning in the Parc aux Princes.	A creature of proverbial good nature and exhaustless vitality, his extraordinary popularity was due to the equally extraordinary extravagance with which he supported that latest Gallic fad, "le Sport." The Parisian Rugby team was his pampered protege, he was an active member of the Tennis Club, maintained not only a flock of automobiles but a famous racing stable, rode to hounds, was a good field gun, patronized aviation and motor boat racing, risked as many maximums during the Monte Carlo season as the Grand Duke Michael himself, and was always ready to whet rapiers or burn a little harmless powder of an early morning in the Parc aux Princes.	false	402.53	436.14	24.237509
7169_89735_000029_000000	But there were ugly whispers current with respect to the sources of his fabulous wealth.	But there were ugly whispers current with respect to the sources of his fabulous wealth.	false	436.14	440.58	27.074986
7169_89735_000029_000001	Lanyard, for one, wouldn't have thought him the properest company or the best Parisian cicerone for an ailing American gentleman blessed with independent means and an attractive daughter.	Lanyard, for one, wouldn't have thought him the properest company or the best Parisian cicerone for an ailing American gentleman blessed with independent means and an attractive daughter.	true	440.58	449.74	22
7169_89735_000030_000000	Paris, on the other hand--Paris who forgives everything to him who contributes to her amusement--adored Comte Remy de Morbihan ...	Paris, on the other hand-Paris who forgives everything to him who contributes to her amusement-adored Comte Remy de Morbihan ...	false	450.08	458.13	24.302683
7169_89735_000031_000000	But perhaps Lanyard was prejudiced by his partiality for Americans, a sentiment the outgrowth of the years spent in New York with Bourke.	But perhaps Lanyard was prejudiced by his partiality for Americans, a sentiment the outgrowth of the years spent in New York with Bourke.	true	458.13	465.46	26
7169_89735_000031_000001	He even fancied that between his spirit and theirs existed some subtle bond of sympathy.	He even fancied that between his spirit and theirs existed some subtle bond of sympathy.	true	465.47	470.35	20
7169_89735_000031_000002	For all he knew he might himself be American...	For all he knew he might himself be American...	true	470.42	472.755	20.410383
7169_89735_000032_000000	For some time Lanyard strained to catch something of the conversation that seemed to hold so much of interest for Roddy, but without success because of the hum of voices that filled the room.	For some time Lanyard strained to catch something of the conversation that seemed to hold so much of interest for Roddy, but without success because of the hum of voices that filled the room.	true	472.755	482.2	23
7169_89735_000032_000001	In time, however, the gathering began to thin out, until at length there remained only this party of three, Lanyard enjoying a most delectable salad, and Roddy puffing a cigar (with such a show of enjoyment that Lanyard suspected him of the sin of smuggling) and slowly gulping down a second bottle of Bass.	In time, however, the gathering began to thin out, until at length there remained only this party of three, Lanyard enjoying a most delectable salad, and Roddy puffing a cigar (with such a show of enjoyment that Lanyard suspected him of the sin of smuggling) and slowly gulping down a second bottle of Bass.	true	482.39	499.39	23
7169_89735_000033_000000	Under these conditions the talk between De Morbihan and the Americans became public property.	Under these conditions the talk between De Morbihan and the Americans became public property.	true	499.4	503.95	27
7169_89735_000034_000000	The first remark overheard by Lanyard came from the elderly American, following a pause and a consultation of his watch.	The first remark overheard by Lanyard came from the elderly American, following a pause and a consultation of his watch.	true	504.41	511.12	23.248966
7169_89735_000035_000000	"Quarter to eleven," he announced.	"Quarter to eleven," he announced.	true	511.13	512.955	25.707584
7169_89735_000036_000000	"Plenty of time," said De Morbihan cheerfully.	"Plenty of time," said De Morbihan cheerfully.	true	512.955	515.145	24
7169_89735_000036_000001	"That is," he amended, "if mademoiselle isn't bored ..."	"That is," he amended, "if mademoiselle isn't bored ..."	true	515.145	518.23	20.648977
7169_89735_000037_000000	The girl's reply, accompanied by a pretty inclination of her head toward the Frenchman, was lost in the accents of the first speaker--a strong and sonorous voice, in strange contrast with his ravaged appearance and distressing cough.	The girl's reply, accompanied by a pretty inclination of her head toward the Frenchman, was lost in the accents of the first speaker-a strong and sonorous voice, in strange contrast with his ravaged appearance and distressing cough.	true	518.66	531.37	22.763422
7169_89735_000038_000000	"Don't let that worry you," he advised cheerfully.	"Don't let that worry you," he advised cheerfully.	true	531.59	533.86	20.554567
7169_89735_000038_000001	"Lucia's accustomed to keeping late hours with me; and who ever heard of a young and pretty woman being bored on the third day of her first visit to Paris?"	"Lucia's accustomed to keeping late hours with me; and who ever heard of a young and pretty woman being bored on the third day of her first visit to Paris?"	true	533.87	541.15	20
7169_89735_000039_000000	He pronounced the name with the hard C of the Italian tongue, as though it were spelled Luchia.	He pronounced the name with the hard C of the Italian tongue, as though it were spelled Luchia.	false	541.46	546.315	24.544624
7169_89735_000040_000000	"To be sure," laughed the Frenchman; "one suspects it will be long before mademoiselle loses interest in the rue de la Paix."	"To be sure," laughed the Frenchman; "one suspects it will be long before mademoiselle loses interest in the rue de la Paix."	true	546.315	552.21	23.907976
7169_89735_000041_000000	"You may well, when such beautiful things come from it," said the girl. "See what we found there to-day."	"You may well, when such beautiful things come from it," said the girl. "See what we found there to day."	true	552.21	557.35	24.9436
7169_89735_000042_000000	She slipped a ring from her hand and passed it to De Morbihan.	She slipped a ring from her hand and passed it to De Morbihan.	false	557.66	561.12	25.30527
7169_89735_000043_000000	There followed silence for an instant, then an exclamation from the Frenchman:	There followed silence for an instant, then an exclamation from the Frenchman:	true	561.12	564.82	25
7169_89735_000044_000000	"But it is superb!	"But it is superb!	true	564.98	566.325	26.473783
7169_89735_000044_000001	Accept, mademoiselle, my compliments.	Accept, mademoiselle, my compliments.	true	566.325	568.35	24.5476
7169_89735_000044_000002	It is worthy even of you."	It is worthy even of you."	true	568.35	569.865	20.778334
7169_89735_000045_000000	She flushed prettily as she nodded smiling acknowledgement.	She flushed prettily as she nodded smiling acknowledgement.	true	569.865	573.09	22
7169_89735_000046_000000	"Ah, you Americans!" De Morbihan sighed.	"Ah, you Americans!" De Morbihan sighed.	false	573.09	575.8	29.330814
7169_89735_000046_000001	"You fill us with envy: you have the souls of poets and the wealth of princes!"	"You fill us with envy: you have the souls of poets and the wealth of princes!"	true	575.93	579.88	24.495985
7169_89735_000047_000000	"But we must come to Paris to find beautiful things for our women-folk!"	"But we must come to Paris to find beautiful things for our women folk!"	true	579.92	583.695	25.919834
7169_89735_000048_000000	"Take care, though, lest you go too far, Monsieur Bannon."	"Take care, though, lest you go too far, Monsieur Bannon."	true	583.695	586.72	25.44027
