731_366_000022_000002	He could not any longer delay his departure; but as his journey to London might be followed, even sooner than he now conjectured, by his longer voyage, he entreated me to bestow as much of my society on him as I could spare.	He could not any longer delay his departure; but as his journey to London might be followed, even sooner than he now conjectured, by his longer voyage, he entreated me to bestow as much of my society on him as I could spare.	false	821.07	837.55	23.121498
731_366_000022_000003	He besought me, therefore, to leave my solitary isle and to meet him at Perth, that we might proceed southwards together.	He besought me, therefore, to leave my solitary isle and to meet him at Perth, that we might proceed southwards together.	true	838.46	846.49	27
731_366_000022_000004	This letter in a degree recalled me to life, and I determined to quit my island at the expiration of two days.	This letter in a degree recalled me to life, and I determined to quit my island at the expiration of two days.	true	847.16	854.62	27.053392
731_366_000022_000005	Yet, before I departed, there was a task to perform, on which I shuddered to reflect; I must pack up my chemical instruments, and for that purpose I must enter the room which had been the scene of my odious work, and I must handle those utensils the sight of which was sickening to me.	Yet, before I departed, there was a task to perform, on which I shuddered to reflect; I must pack up my chemical instruments, and for that purpose I must enter the room which had been the scene of my odious work, and I must handle those utensils the sight of which was sickening to me.	true	855.44	877.93	21.541306
731_366_000022_000006	The next morning, at daybreak, I summoned sufficient courage and unlocked the door of my laboratory.	The next morning, at daybreak, I summoned sufficient courage and unlocked the door of my laboratory.	false	878.72	885.91	22.652452
731_366_000022_000007	The remains of the half-finished creature, whom I had destroyed, lay scattered on the floor, and I almost felt as if I had mangled the living flesh of a human being.	The remains of the half finished creature, whom I had destroyed, lay scattered on the floor, and I almost felt as if I had mangled the living flesh of a human being.	false	886.82	899.26	22.364258
731_366_000022_000008	I paused to collect myself and then entered the chamber.	I paused to collect myself and then entered the chamber.	true	899.84	903.91	27.18669
731_366_000022_000009	With trembling hand I conveyed the instruments out of the room, but I reflected that I ought not to leave the relics of my work to excite the horror and suspicion of the peasants; and I accordingly put them into a basket, with a great quantity of stones, and laying them up, determined to throw them into the sea that very night; and in the meantime I sat upon the beach, employed in cleaning and arranging my chemical apparatus.	With trembling hand I conveyed the instruments out of the room, but I reflected that I ought not to leave the relics of my work to excite the horror and suspicion of the peasants; and I accordingly put them into a basket, with a great quantity of stones, and laying them up, determined to throw them into the sea that very night; and in the meantime I sat upon the beach, employed in cleaning and arranging my chemical apparatus.	true	904.76	934.18	23.495764
731_366_000023_000000	Nothing could be more complete than the alteration that had taken place in my feelings since the night of the appearance of the daemon.	Nothing could be more complete than the alteration that had taken place in my feelings since the night of the appearance of the daemon.	true	935.6	943.36	19
731_366_000023_000001	I had before regarded my promise with a gloomy despair as a thing that, with whatever consequences, must be fulfilled; but I now felt as if a film had been taken from before my eyes and that I for the first time saw clearly.	I had before regarded my promise with a gloomy despair as a thing that, with whatever consequences, must be fulfilled; but I now felt as if a film had been taken from before my eyes and that I for the first time saw clearly.	false	944.21	961.09	24.16775
731_366_000023_000002	The idea of renewing my labours did not for one instant occur to me; the threat I had heard weighed on my thoughts, but I did not reflect that a voluntary act of mine could avert it.	The idea of renewing my labours did not for one instant occur to me; the threat I had heard weighed on my thoughts, but I did not reflect that a voluntary act of mine could avert it.	false	961.85	974.47	26.315172
731_366_000023_000003	I had resolved in my own mind that to create another like the fiend I had first made would be an act of the basest and most atrocious selfishness, and I banished from my mind every thought that could lead to a different conclusion.	I had resolved in my own mind that to create another like the fiend I had first made would be an act of the basest and most atrocious selfishness, and I banished from my mind every thought that could lead to a different conclusion.	true	975.26	991.45	24.280357
731_366_000024_000000	Between two and three in the morning the moon rose; and I then, putting my basket aboard a little skiff, sailed out about four miles from the shore.	Between two and three in the morning the moon rose; and I then, putting my basket aboard a little skiff, sailed out about four miles from the shore.	true	992.48	1003.24	20.415173
731_366_000024_000001	The scene was perfectly solitary; a few boats were returning towards land, but I sailed away from them.	The scene was perfectly solitary; a few boats were returning towards land, but I sailed away from them.	false	1003.7	1011.01	21.77009
731_366_000024_000002	I felt as if I was about the commission of a dreadful crime and avoided with shuddering anxiety any encounter with my fellow creatures.	I felt as if I was about the commission of a dreadful crime and avoided with shuddering anxiety any encounter with my fellow creatures.	true	1011.26	1020.55	21.638647
731_366_000024_000003	At one time the moon, which had before been clear, was suddenly overspread by a thick cloud, and I took advantage of the moment of darkness and cast my basket into the sea; I listened to the gurgling sound as it sank and then sailed away from the spot.	At one time the moon, which had before been clear, was suddenly overspread by a thick cloud, and I took advantage of the moment of darkness and cast my basket into the sea; I listened to the gurgling sound as it sank and then sailed away from the spot.	false	1021.37	1040.02	22.08515
731_366_000024_000004	The sky became clouded, but the air was pure, although chilled by the northeast breeze that was then rising.	The sky became clouded, but the air was pure, although chilled by the northeast breeze that was then rising.	true	1040.72	1047.91	24.07564
731_366_000024_000005	But it refreshed me and filled me with such agreeable sensations that I resolved to prolong my stay on the water, and fixing the rudder in a direct position, stretched myself at the bottom of the boat.	But it refreshed me and filled me with such agreeable sensations that I resolved to prolong my stay on the water, and fixing the rudder in a direct position, stretched myself at the bottom of the boat.	true	1049.03	1061.95	24.031786
731_366_000024_000006	Clouds hid the moon, everything was obscure, and I heard only the sound of the boat as its keel cut through the waves; the murmur lulled me, and in a short time I slept soundly.	Clouds hid the moon, everything was obscure, and I heard only the sound of the boat as its keel cut through the waves; the murmur lulled me, and in a short time I slept soundly.	true	1062.8	1076.05	23.792505
731_366_000024_000007	I do not know how long I remained in this situation, but when I awoke I found that the sun had already mounted considerably.	I do not know how long I remained in this situation, but when I awoke I found that the sun had already mounted considerably.	true	1076.96	1085.74	18.52044
731_366_000024_000008	The wind was high, and the waves continually threatened the safety of my little skiff.	The wind was high, and the waves continually threatened the safety of my little skiff.	true	1086.62	1092.13	19.287863
731_366_000024_000009	I found that the wind was northeast and must have driven me far from the coast from which I had embarked.	I found that the wind was northeast and must have driven me far from the coast from which I had embarked.	false	1092.95	1098.97	22.00572
731_366_000024_000010	I endeavoured to change my course but quickly found that if I again made the attempt the boat would be instantly filled with water.	I endeavoured to change my course but quickly found that if I again made the attempt the boat would be instantly filled with water.	false	1099.13	1106.95	25
731_366_000024_000011	Thus situated, my only resource was to drive before the wind.	Thus situated, my only resource was to drive before the wind.	true	1107.68	1112.02	20.770155
731_366_000024_000012	I confess that I felt a few sensations of terror.	I confess that I felt a few sensations of terror.	true	1112.57	1115.86	21.60978
731_366_000024_000013	I had no compass with me and was so slenderly acquainted with the geography of this part of the world that the sun was of little benefit to me.	I had no compass with me and was so slenderly acquainted with the geography of this part of the world that the sun was of little benefit to me.	true	1116.59	1125.52	23.707626
731_366_000024_000014	I might be driven into the wide Atlantic and feel all the tortures of starvation or be swallowed up in the immeasurable waters that roared and buffeted around me.	I might be driven into the wide Atlantic and feel all the tortures of starvation or be swallowed up in the immeasurable waters that roared and buffeted around me.	true	1126.07	1136.41	23.37626
731_366_000024_000015	I had already been out many hours and felt the torment of a burning thirst, a prelude to my other sufferings.	I had already been out many hours and felt the torment of a burning thirst, a prelude to my other sufferings.	true	1136.96	1144.39	22.767694
731_366_000024_000016	I looked on the heavens, which were covered by clouds that flew before the wind, only to be replaced by others; I looked upon the sea; it was to be my grave. "Fiend," I exclaimed, "your task is already fulfilled!" I thought of Elizabeth, of my father, and of Clerval--all left behind, on whom the monster might satisfy his sanguinary and merciless passions.	I looked on the heavens, which were covered by clouds that flew before the wind, only to be replaced by others; I looked upon the sea; it was to be my grave. "Fiend," I exclaimed, "your task is already fulfilled!" I thought of Elizabeth, of my father, and of Clerval-all left behind, on whom the monster might satisfy his sanguinary and merciless passions.	false	1144.94	1176.64	20.866644
731_366_000024_000017	This idea plunged me into a reverie so despairing and frightful that even now, when the scene is on the point of closing before me forever, I shudder to reflect on it.	This idea plunged me into a reverie so despairing and frightful that even now, when the scene is on the point of closing before me forever, I shudder to reflect on it.	false	1177.25	1189.6	22.809935
731_366_000025_000000	Some hours passed thus; but by degrees, as the sun declined towards the horizon, the wind died away into a gentle breeze and the sea became free from breakers.	Some hours passed thus; but by degrees, as the sun declined towards the horizon, the wind died away into a gentle breeze and the sea became free from breakers.	true	1190.96	1203.28	20.119768
731_366_000025_000001	But these gave place to a heavy swell; I felt sick and hardly able to hold the rudder, when suddenly I saw a line of high land towards the south.	But these gave place to a heavy swell; I felt sick and hardly able to hold the rudder, when suddenly I saw a line of high land towards the south.	true	1203.89	1214.17	20.759352
731_366_000026_000000	Almost spent, as I was, by fatigue and the dreadful suspense I endured for several hours, this sudden certainty of life rushed like a flood of warm joy to my heart, and tears gushed from my eyes.	Almost spent, as I was, by fatigue and the dreadful suspense I endured for several hours, this sudden certainty of life rushed like a flood of warm joy to my heart, and tears gushed from my eyes.	false	1214.69	1228.66	22.373306
731_366_000027_000000	How mutable are our feelings, and how strange is that clinging love we have of life even in the excess of misery!	How mutable are our feelings, and how strange is that clinging love we have of life even in the excess of misery!	false	1229.03	1237.75	22.470478
731_366_000027_000001	I constructed another sail with a part of my dress and eagerly steered my course towards the land. It had a wild and rocky appearance, but as I approached nearer I easily perceived the traces of cultivation.	I constructed another sail with a part of my dress and eagerly steered my course towards the land. It had a wild and rocky appearance, but as I approached nearer I easily perceived the traces of cultivation.	true	1238.39	1252.9	24.417786
731_366_000027_000002	I saw vessels near the shore and found myself suddenly transported back to the neighbourhood of civilized man.	I saw vessels near the shore and found myself suddenly transported back to the neighbourhood of civilized man.	true	1253.42	1260.76	21.599669
731_366_000027_000003	I carefully traced the windings of the land and hailed a steeple which I at length saw issuing from behind a small promontory. As I was in a state of extreme debility, I resolved to sail directly towards the town, as a place where I could most easily procure nourishment.	I carefully traced the windings of the land and hailed a steeple which I at length saw issuing from behind a small promontory. As I was in a state of extreme debility, I resolved to sail directly towards the town, as a place where I could most easily procure nourishment.	false	1261.49	1279.93	22.756441
731_366_000027_000004	Fortunately I had money with me.	Fortunately I had money with me.	true	1280.33	1282.87	28.023842
731_366_000028_000000	As I turned the promontory I perceived a small neat town and a good harbour, which I entered, my heart bounding with joy at my unexpected escape.	As I turned the promontory I perceived a small neat town and a good harbour, which I entered, my heart bounding with joy at my unexpected escape.	true	1284.29	1295.29	26.540049
731_366_000029_000000	As I was occupied in fixing the boat and arranging the sails, several people crowded towards the spot.	As I was occupied in fixing the boat and arranging the sails, several people crowded towards the spot.	true	1295.72	1302.43	25.147001
731_366_000029_000001	They seemed much surprised at my appearance, but instead of offering me any assistance, whispered together with gestures that at any other time might have produced in me a slight sensation of alarm.	They seemed much surprised at my appearance, but instead of offering me any assistance, whispered together with gestures that at any other time might have produced in me a slight sensation of alarm.	true	1302.92	1316.86	22.865454
731_366_000029_000002	As it was, I merely remarked that they spoke English, and I therefore addressed them in that language.	As it was, I merely remarked that they spoke English, and I therefore addressed them in that language.	true	1317.56	1324.21	23.379204
731_366_000029_000003	"My good friends," said I, "will you be so kind as to tell me the name of this town and inform me where I am?"	"My good friends," said I, "will you be so kind as to tell me the name of this town and inform me where I am?"	false	1324.82	1332.52	22.038328
731_366_000030_000000	"You will know that soon enough," replied a man with a hoarse voice. "Maybe you are come to a place that will not prove much to your taste, but you will not be consulted as to your quarters, I promise you."	"You will know that soon enough," replied a man with a hoarse voice. "Maybe you are come to a place that will not prove much to your taste, but you will not be consulted as to your quarters, I promise you."	false	1333.73	1347.25	24.385002
731_366_000031_000000	I was exceedingly surprised on receiving so rude an answer from a stranger, and I was also disconcerted on perceiving the frowning and angry countenances of his companions.	I was exceedingly surprised on receiving so rude an answer from a stranger, and I was also disconcerted on perceiving the frowning and angry countenances of his companions.	false	1348.7	1360.27	20
731_366_000031_000001	"Why do you answer me so roughly?" I replied.	"Why do you answer me so roughly?" I replied.	true	1361.3	1364.53	23.158749
731_366_000031_000002	"Surely it is not the custom of Englishmen to receive strangers so inhospitably."	"Surely it is not the custom of Englishmen to receive strangers so inhospitably."	true	1364.69	1369.84	22.17619
731_366_000032_000000	"I do not know," said the man, "what the custom of the English may be, but it is the custom of the Irish to hate villains." While this strange dialogue continued, I perceived the crowd rapidly increase.	"I do not know," said the man, "what the custom of the English may be, but it is the custom of the Irish to hate villains." While this strange dialogue continued, I perceived the crowd rapidly increase.	true	1371.05	1387.3	23.83846
731_366_000032_000001	Their faces expressed a mixture of curiosity and anger, which annoyed and in some degree alarmed me.	Their faces expressed a mixture of curiosity and anger, which annoyed and in some degree alarmed me.	true	1387.58	1395.31	23.69094
731_366_000033_000000	I inquired the way to the inn, but no one replied.	I inquired the way to the inn, but no one replied.	true	1395.83	1400.26	20.31693
731_366_000033_000001	I then moved forward, and a murmuring sound arose from the crowd as they followed and surrounded me, when an ill-looking man approaching tapped me on the shoulder and said, "Come, sir, you must follow me to Mr. Kirwin's to give an account of yourself."	I then moved forward, and a murmuring sound arose from the crowd as they followed and surrounded me, when an ill looking man approaching tapped me on the shoulder and said, "Come, sir, you must follow me to mr Kirwin's to give an account of yourself."	true	1400.87	1418.08	21.396317
731_366_000034_000000	"Who is Mr. Kirwin?	"Who is mr Kirwin?	true	1419.62	1421.17	21.74028
731_366_000034_000001	Why am I to give an account of myself?	Why am I to give an account of myself?	true	1421.51	1424.14	29
731_366_000034_000002	Is not this a free country?"	Is not this a free country?"	false	1424.45	1426.26	23.349846
731_366_000035_000000	"Ay, sir, free enough for honest folks.	"Ay, sir, free enough for honest folks.	false	1426.26	1430.65	20.879463
731_366_000035_000001	Mr. Kirwin is a magistrate, and you are to give an account of the death of a gentleman who was found murdered here last night."	mr Kirwin is a magistrate, and you are to give an account of the death of a gentleman who was found murdered here last night."	false	1431.02	1438.39	24
731_366_000036_000000	This answer startled me, but I presently recovered myself.	This answer startled me, but I presently recovered myself.	true	1439.66	1444.21	23.558495
731_366_000036_000001	I was innocent; that could easily be proved; accordingly I followed my conductor in silence and was led to one of the best houses in the town. I was ready to sink from fatigue and hunger, but being surrounded by a crowd, I thought it politic to rouse all my strength, that no physical debility might be construed into apprehension or conscious guilt. Little did I then expect the calamity that was in a few moments to overwhelm me and extinguish in horror and despair all fear of ignominy or death.	I was innocent; that could easily be proved; accordingly I followed my conductor in silence and was led to one of the best houses in the town. I was ready to sink from fatigue and hunger, but being surrounded by a crowd, I thought it politic to rouse all my strength, that no physical debility might be construed into apprehension or conscious guilt. Little did I then expect the calamity that was in a few moments to overwhelm me and extinguish in horror and despair all fear of ignominy or death.	false	1444.85	1482.52	22.011509
731_366_000036_000002	I must pause here, for it requires all my fortitude to recall the memory of the frightful events which I am about to relate, in proper detail, to my recollection.	I must pause here, for it requires all my fortitude to recall the memory of the frightful events which I am about to relate, in proper detail, to my recollection.	false	1483.31	1496.34	23.045128
