7828_105179_000000_000000	Chapter XXIV	Chapter twenty four	false	0.39	2.76	24.109766
7828_105179_000001_000000	The Tommies	The Tommies	false	2.76	22.93	23.618305
7828_105179_000002_000000	Daylight overtook them after they had entered the gorge, but, tired as they all were with the exception of Tarzan, they realized that they must keep on at all costs until they found a spot where they might ascend the precipitous side of the gorge to the floor of the plateau above.	Daylight overtook them after they had entered the gorge, but, tired as they all were with the exception of Tarzan, they realized that they must keep on at all costs until they found a spot where they might ascend the precipitous side of the gorge to the floor of the plateau above.	false	23.36	38.17	25
7828_105179_000002_000001	Tarzan and Otobu were both equally confident that the Xujans would not follow them beyond the gorge, but though they scanned every inch of the frowning cliffs upon either hand noon came and there was still no indication of any avenue of escape to right or left.	Tarzan and Otobu were both equally confident that the Xujans would not follow them beyond the gorge, but though they scanned every inch of the frowning cliffs upon either hand noon came and there was still no indication of any avenue of escape to right or left.	false	38.6	55	23.886488
7828_105179_000002_000002	There were places where the ape-man alone might have negotiated the ascent but none where the others could hope successfully to reach the plateau, nor where Tarzan, powerful and agile as he was, could have ventured safely to carry them aloft.	There were places where the ape man alone might have negotiated the ascent but none where the others could hope successfully to reach the plateau, nor where Tarzan, powerful and agile as he was, could have ventured safely to carry them aloft.	true	55.16	68.62	21.769133
7828_105179_000003_000000	For half a day the ape-man had been either carrying or supporting Smith-Oldwick and now, to his chagrin, he saw that the girl was faltering.	For half a day the ape man had been either carrying or supporting Smith Oldwick and now, to his chagrin, he saw that the girl was faltering.	false	68.93	77.14	25.12479
7828_105179_000003_000001	He had realized well how much she had undergone and how greatly the hardships and dangers and the fatigue of the past weeks must have told upon her vitality.	He had realized well how much she had undergone and how greatly the hardships and dangers and the fatigue of the past weeks must have told upon her vitality.	true	77.51	85.96	19
7828_105179_000003_000002	He saw how bravely she attempted to keep up, yet how often she stumbled and staggered as she labored through the sand and gravel of the gorge.	He saw how bravely she attempted to keep up, yet how often she stumbled and staggered as she labored through the sand and gravel of the gorge.	true	86.39	93.49	19.160656
7828_105179_000003_000003	Nor could he help but admire her fortitude and the uncomplaining effort she was making to push on.	Nor could he help but admire her fortitude and the uncomplaining effort she was making to push on.	true	93.95	99.61	23.936237
7828_105179_000004_000000	The Englishman must have noticed her condition too, for some time after noon, he stopped suddenly and sat down in the sand.	The Englishman must have noticed her condition too, for some time after noon, he stopped suddenly and sat down in the sand.	false	100.49	107.5	22.366173
7828_105179_000004_000001	"It's no use," he said to Tarzan.	"It's no use," he said to Tarzan.	true	107.78	110.14	24.13482
7828_105179_000004_000002	"I can go no farther.	"I can go no farther.	true	110.18	111.67	25.846994
7828_105179_000004_000003	Miss Kircher is rapidly weakening.	Miss Kircher is rapidly weakening.	false	111.98	114.13	29.588026
7828_105179_000004_000004	You will have to go on without me."	You will have to go on without me."	true	114.17	115.96	28.911098
7828_105179_000005_000000	"No," said the girl, "we cannot do that.	"No," said the girl, "we cannot do that.	true	116.15	119.53	28.509636
7828_105179_000005_000001	We have all been through so much together and the chances of our escape are still so remote that whatever comes, let us remain together, unless," and she looked up at Tarzan, "you, who have done so much for us to whom you are under no obligations, will go on without us.	We have all been through so much together and the chances of our escape are still so remote that whatever comes, let us remain together, unless," and she looked up at Tarzan, "you, who have done so much for us to whom you are under no obligations, will go on without us.	true	119.69	136	22.385609
7828_105179_000005_000002	I for one wish that you would.	I for one wish that you would.	false	136.52	138.64	24.861431
7828_105179_000005_000003	It must be as evident to you as it is to me that you cannot save us, for though you succeeded in dragging us from the path of our pursuers, even your great strength and endurance could never take one of us across the desert waste which lies between here and the nearest fertile country."	It must be as evident to you as it is to me that you cannot save us, for though you succeeded in dragging us from the path of our pursuers, even your great strength and endurance could never take one of us across the desert waste which lies between here and the nearest fertile country."	true	138.92	155.38	23.32167
7828_105179_000006_000000	The ape-man returned her serious look with a smile.	The ape man returned her serious look with a smile.	true	156.11	159.07	23
7828_105179_000006_000001	"You are not dead," he said to her, "nor is the lieutenant, nor Otobu, nor myself.	"You are not dead," he said to her, "nor is the lieutenant, nor Otobu, nor myself.	true	159.44	165.28	24.01481
7828_105179_000006_000002	One is either dead or alive, and until we are dead we should plan only upon continuing to live.	One is either dead or alive, and until we are dead we should plan only upon continuing to live.	false	165.47	172.06	19.69681
7828_105179_000006_000003	Because we remain here and rest is no indication that we shall die here.	Because we remain here and rest is no indication that we shall die here.	true	172.25	176.26	23.986393
7828_105179_000006_000004	I cannot carry you both to the country of the Wamabos, which is the nearest spot at which we may expect to find game and water, but we shall not give up on that account.	I cannot carry you both to the country of the Wamabos, which is the nearest spot at which we may expect to find game and water, but we shall not give up on that account.	false	176.54	185.2	23.822908
7828_105179_000006_000005	So far we have found a way.	So far we have found a way.	true	185.48	187.27	24.757233
7828_105179_000006_000006	Let us take things as they come.	Let us take things as they come.	true	187.43	189.22	33.03648
7828_105179_000006_000007	Let us rest now because you and Lieutenant Smith-Oldwick need the rest, and when you are stronger we will go on again."	Let us rest now because you and Lieutenant Smith Oldwick need the rest, and when you are stronger we will go on again."	true	189.29	196.36	23.901667
7828_105179_000007_000000	"But the Xujans--?" she asked, "may they not follow us here?"	"But the Xujans-?" she asked, "may they not follow us here?"	false	196.7	200.68	23.538723
7828_105179_000008_000000	"Yes," he said, "they probably will.	"Yes," he said, "they probably will.	true	201.17	203.77	23.51515
7828_105179_000008_000001	But we need not be concerned with them until they come."	But we need not be concerned with them until they come."	true	203.93	206.92	22.55389
7828_105179_000009_000000	"I wish," said the girl, "that I possessed your philosophy but I am afraid it is beyond me."	"I wish," said the girl, "that I possessed your philosophy but I am afraid it is beyond me."	true	207.08	213.01	26.06756
7828_105179_000010_000000	"You were not born and reared in the jungle by wild beasts and among wild beasts, or you would possess, as I do, the fatalism of the jungle."	"You were not born and reared in the jungle by wild beasts and among wild beasts, or you would possess, as I do, the fatalism of the jungle."	true	213.11	222.25	21.207329
7828_105179_000011_000000	And so they moved to the side of the gorge beneath the shade of an overhanging rock and lay down in the hot sand to rest.	And so they moved to the side of the gorge beneath the shade of an overhanging rock and lay down in the hot sand to rest.	true	222.8	229.57	20.488789
7828_105179_000011_000001	Numa wandered restlessly to and fro and finally, after sprawling for a moment close beside the ape-man, rose and moved off up the gorge to be lost to view a moment later beyond the nearest turn.	Numa wandered restlessly to and fro and finally, after sprawling for a moment close beside the ape man, rose and moved off up the gorge to be lost to view a moment later beyond the nearest turn.	true	229.82	242.11	24.297348
7828_105179_000012_000000	For an hour the little party rested and then Tarzan suddenly rose and, motioning the others to silence, listened.	For an hour the little party rested and then Tarzan suddenly rose and, motioning the others to silence, listened.	true	242.45	250	21.810677
7828_105179_000012_000001	For a minute he stood motionless, his keen ears acutely receptive to sounds so faint and distant that none of the other three could detect the slightest break in the utter and deathlike quiet of the gorge. Finally the ape-man relaxed and turned toward them.	For a minute he stood motionless, his keen ears acutely receptive to sounds so faint and distant that none of the other three could detect the slightest break in the utter and deathlike quiet of the gorge. Finally the ape man relaxed and turned toward them.	false	250.49	265.99	25.582842
7828_105179_000012_000002	"What is it?" asked the girl.	"What is it?" asked the girl.	true	266.3	268.21	32.144073
7828_105179_000013_000000	"They are coming," he replied.	"They are coming," he replied.	true	268.85	270.97	23.939945
7828_105179_000013_000001	"They are yet some distance away, though not far, for the sandaled feet of the men and the pads of the lions make little noise upon the soft sands."	"They are yet some distance away, though not far, for the sandaled feet of the men and the pads of the lions make little noise upon the soft sands."	true	271.04	279.67	22.027828
7828_105179_000014_000000	"What shall we do--try to go on?" asked Smith-Oldwick.	"What shall we do-try to go on?" asked Smith Oldwick.	true	279.98	283.42	23.036165
7828_105179_000014_000001	"I believe I could make a go of it now for a short way.	"I believe I could make a go of it now for a short way.	true	283.52	286.63	21.116829
7828_105179_000014_000002	I am much rested.	I am much rested.	true	286.91	288.315	26.250168
7828_105179_000014_000003	How about you Miss Kircher?"	How about you Miss Kircher?"	true	288.315	289.84	30.27261
7828_105179_000015_000000	"Oh, yes," she said, "I am much stronger.	"Oh, yes," she said, "I am much stronger.	true	290.33	293.79	24.402435
7828_105179_000015_000001	Yes, surely I can go on."	Yes, surely I can go on."	true	293.79	295.72	28.72644
7828_105179_000016_000000	Tarzan knew that neither of them quite spoke the truth, that people do not recover so quickly from utter exhaustion, but he saw no other way and there was always the hope that just beyond the next turn would be a way out of the gorge.	Tarzan knew that neither of them quite spoke the truth, that people do not recover so quickly from utter exhaustion, but he saw no other way and there was always the hope that just beyond the next turn would be a way out of the gorge.	true	296.33	309.37	21.85952
7828_105179_000017_000000	"You help the lieutenant, Otobu," he said, turning to the black, "and I will carry Miss Kircher," and though the girl objected, saying that he must not waste his strength, he lifted her lightly in his arms and moved off up the canyon, followed by Otobu and the Englishman.	"You help the lieutenant, Otobu," he said, turning to the black, "and I will carry Miss Kircher," and though the girl objected, saying that he must not waste his strength, he lifted her lightly in his arms and moved off up the canyon, followed by Otobu and the Englishman.	false	309.86	324.54	23.561752
7828_105179_000017_000001	They had gone no great distance when the others of the party became aware of the sounds of pursuit, for now the lions were whining as though the fresh scent spoor of their quarry had reached their nostrils.	They had gone no great distance when the others of the party became aware of the sounds of pursuit, for now the lions were whining as though the fresh scent spoor of their quarry had reached their nostrils.	true	324.54	335.14	20.535446
7828_105179_000018_000000	"I wish that your Numa would return," said the girl.	"I wish that your Numa would return," said the girl.	true	335.39	338.32	22.007654
7828_105179_000019_000000	"Yes," said Tarzan, "but we shall have to do the best we can without him.	"Yes," said Tarzan, "but we shall have to do the best we can without him.	true	338.63	342.61	23.76544
7828_105179_000019_000001	I should like to find some place where we can barricade ourselves against attack from all sides.	I should like to find some place where we can barricade ourselves against attack from all sides.	true	343.01	348.01	21
7828_105179_000019_000002	Possibly then we might hold them off.	Possibly then we might hold them off.	true	348.29	351.01	21.289236
7828_105179_000019_000003	Smith-Oldwick is a good shot and if there are not too many men he might be able to dispose of them provided they can only come at him one at a time.	Smith Oldwick is a good shot and if there are not too many men he might be able to dispose of them provided they can only come at him one at a time.	true	351.17	359.17	22.823944
7828_105179_000019_000004	The lions don't bother me so much. Sometimes they are stupid animals, and I am sure that these that pursue us, and who are so dependent upon the masters that have raised and trained them, will be easily handled after the warriors are disposed of."	The lions don't bother me so much. Sometimes they are stupid animals, and I am sure that these that pursue us, and who are so dependent upon the masters that have raised and trained them, will be easily handled after the warriors are disposed of."	true	359.57	373.03	24.105255
7828_105179_000020_000000	"You think there is some hope, then?" she asked.	"You think there is some hope, then?" she asked.	false	373.79	376.75	30.753345
7828_105179_000021_000000	"We are still alive," was his only answer.	"We are still alive," was his only answer.	true	376.94	379.59	26.713371
7828_105179_000022_000000	"There," he said presently, "I thought I recalled this very spot." He pointed toward a fragment that had evidently fallen from the summit of the cliff and which now lay imbedded in the sand a few feet from the base.	"There," he said presently, "I thought I recalled this very spot." He pointed toward a fragment that had evidently fallen from the summit of the cliff and which now lay imbedded in the sand a few feet from the base.	false	379.59	392.71	23.116138
7828_105179_000022_000001	It was a jagged fragment of rock which rose some ten feet above the surface of the sand, leaving a narrow aperture between it and the cliff behind.	It was a jagged fragment of rock which rose some ten feet above the surface of the sand, leaving a narrow aperture between it and the cliff behind.	true	393.11	401.38	22.506115
7828_105179_000022_000002	Toward this they directed their steps and when finally they reached their goal they found a space about two feet wide and ten feet long between the rock and the cliff.	Toward this they directed their steps and when finally they reached their goal they found a space about two feet wide and ten feet long between the rock and the cliff.	true	401.66	411.01	23.266323
7828_105179_000022_000003	To be sure it was open at both ends but at least they could not be attacked upon all sides at once.	To be sure it was open at both ends but at least they could not be attacked upon all sides at once.	true	411.2	417.25	27
7828_105179_000023_000000	They had scarcely concealed themselves before Tarzan's quick ears caught a sound upon the face of the cliff above them, and looking up he saw a diminutive monkey perched upon a slight projection--an ugly-faced little monkey who looked down upon them for a moment and then scampered away toward the south in the direction from which their pursuers were coming.	They had scarcely concealed themselves before Tarzan's quick ears caught a sound upon the face of the cliff above them, and looking up he saw a diminutive monkey perched upon a slight projection-an ugly faced little monkey who looked down upon them for a moment and then scampered away toward the south in the direction from which their pursuers were coming.	false	417.62	436	25.511118
7828_105179_000023_000001	Otobu had seen the monkey too.	Otobu had seen the monkey too.	true	436.31	438.22	24.68442
7828_105179_000023_000002	"He will tell the parrots," said the black, "and the parrots will tell the madmen."	"He will tell the parrots," said the black, "and the parrots will tell the madmen."	true	438.38	442.9	24.52558
7828_105179_000024_000000	"It is all the same," replied Tarzan; "the lions would have found us here.	"It is all the same," replied Tarzan; "the lions would have found us here.	true	443.51	447.31	21.15374
7828_105179_000024_000001	We could not hope to hide from them."	We could not hope to hide from them."	true	447.44	449.35	23.108435
7828_105179_000025_000000	He placed Smith-Oldwick, with his pistol, at the north opening of their haven and told Otobu to stand with his spear at the Englishman's shoulder, while he himself prepared to guard the southern approach. Between them he had the girl lie down in the sand.	He placed Smith Oldwick, with his pistol, at the north opening of their haven and told Otobu to stand with his spear at the Englishman's shoulder, while he himself prepared to guard the southern approach. Between them he had the girl lie down in the sand.	false	449.84	463.06	23.193605
7828_105179_000025_000001	"You will be safe there in the event that they use their spears," he said.	"You will be safe there in the event that they use their spears," he said.	false	463.37	467.29	23.68847
7828_105179_000026_000000	The minutes that dragged by seemed veritable eternities to Bertha Kircher and then at last, and almost with relief, she knew that the pursuers were upon them.	The minutes that dragged by seemed veritable eternities to Bertha Kircher and then at last, and almost with relief, she knew that the pursuers were upon them.	true	467.78	478.005	23.234423
7828_105179_000026_000001	She heard the angry roaring of the lions and the cries of the madmen.	She heard the angry roaring of the lions and the cries of the madmen.	true	478.005	481.69	19.217464
7828_105179_000026_000002	For several minutes the men seemed to be investigating the stronghold which their quarry had discovered. She could hear them both to the north and south and then from where she lay she saw a lion charging for the ape-man before her. She saw the giant arm swing back with the curved saber and she saw it fall with terrific velocity and meet the lion as he rose to grapple with the man, cleaving his skull as cleanly as a butcher opens up a sheep.	For several minutes the men seemed to be investigating the stronghold which their quarry had discovered. She could hear them both to the north and south and then from where she lay she saw a lion charging for the ape man before her. She saw the giant arm swing back with the curved saber and she saw it fall with terrific velocity and meet the lion as he rose to grapple with the man, cleaving his skull as cleanly as a butcher opens up a sheep.	false	482.06	507.88	22.440392
7828_105179_000027_000000	Then she heard footsteps running rapidly toward Smith-Oldwick and, as his pistol spoke, there was a scream and the sound of a falling body.	Then she heard footsteps running rapidly toward Smith Oldwick and, as his pistol spoke, there was a scream and the sound of a falling body.	true	508.04	516.34	25.384764
7828_105179_000027_000001	Evidently disheartened by the failure of their first attempt the assaulters drew off, but only for a short time.	Evidently disheartened by the failure of their first attempt the assaulters drew off, but only for a short time.	true	516.68	523.63	24.376589
7828_105179_000027_000002	Again they came, this time a man opposing Tarzan and a lion seeking to overcome Smith-Oldwick.	Again they came, this time a man opposing Tarzan and a lion seeking to overcome Smith Oldwick.	true	524	529.75	29
7828_105179_000027_000003	Tarzan had cautioned the young Englishman not to waste his cartridges upon the lions and it was Otobu with the Xujan spear who met the beast, which was not subdued until both he and Smith-Oldwick had been mauled, and the latter had succeeded in running the point of the saber the girl had carried, into the beast's heart.	Tarzan had cautioned the young Englishman not to waste his cartridges upon the lions and it was Otobu with the Xujan spear who met the beast, which was not subdued until both he and Smith Oldwick had been mauled, and the latter had succeeded in running the point of the saber the girl had carried, into the beast's heart.	false	530.06	549.04	23.795485
7828_105179_000027_000004	The man who opposed Tarzan inadvertently came too close in an attempt to cut at the ape-man's head, with the result that an instant later his corpse lay with the neck broken upon the body of the lion.	The man who opposed Tarzan inadvertently came too close in an attempt to cut at the ape man's head, with the result that an instant later his corpse lay with the neck broken upon the body of the lion.	false	549.35	560.59	24.22228
7828_105179_000028_000000	Once again the enemy withdrew, but again only for a short time, and now they came in full force, the lions and the men, possibly a half dozen of each, the men casting their spears and the lions waiting just behind, evidently for the signal to charge.	Once again the enemy withdrew, but again only for a short time, and now they came in full force, the lions and the men, possibly a half dozen of each, the men casting their spears and the lions waiting just behind, evidently for the signal to charge.	false	560.81	577.66	22.536825
7828_105179_000029_000000	"Is this the end?" asked the girl.	"Is this the end?" asked the girl.	true	577.85	580.21	25.157412
7828_105179_000030_000000	"No," cried the ape-man, "for we still live!"	"No," cried the ape man, "for we still live!"	false	580.31	583.8	21.603607
7828_105179_000031_000000	The words had scarcely passed his lips when the remaining warriors, rushing in, cast their spears simultaneously from both sides.	The words had scarcely passed his lips when the remaining warriors, rushing in, cast their spears simultaneously from both sides.	true	583.8	591.22	18
7828_105179_000031_000001	In attempting to shield the girl, Tarzan received one of the shafts in the shoulder, and so heavily had the weapon been hurled that it bore him backward to the ground.	In attempting to shield the girl, Tarzan received one of the shafts in the shoulder, and so heavily had the weapon been hurled that it bore him backward to the ground.	true	591.53	600.43	21.630709
7828_105179_000031_000002	Smith-Oldwick fired his pistol twice when he too was struck down, the weapon entering his right leg midway between hip and knee.	Smith Oldwick fired his pistol twice when he too was struck down, the weapon entering his right leg midway between hip and knee.	true	600.77	608.29	24.863169
7828_105179_000031_000003	Only Otobu remained to face the enemy, for the Englishman, already weak from his wounds and from the latest mauling he had received at the claws of the lion, had lost consciousness as he sank to the ground with this new hurt.	Only Otobu remained to face the enemy, for the Englishman, already weak from his wounds and from the latest mauling he had received at the claws of the lion, had lost consciousness as he sank to the ground with this new hurt.	false	608.63	621.73	23.54773
7828_105179_000032_000000	As he fell his pistol dropped from his fingers, and the girl, seeing, snatched it up.	As he fell his pistol dropped from his fingers, and the girl, seeing, snatched it up.	true	622.1	628	23.36252
7828_105179_000032_000001	As Tarzan struggled to rise, one of the warriors leaped full upon his breast and bore him back as, with fiendish shrieks, he raised the point of his saber above the other's heart. Before he could drive it home the girl leveled Smith-Oldwick's pistol and fired point-blank at the fiend's face.	As Tarzan struggled to rise, one of the warriors leaped full upon his breast and bore him back as, with fiendish shrieks, he raised the point of his saber above the other's heart. Before he could drive it home the girl leveled Smith Oldwick's pistol and fired point blank at the fiend's face.	false	628.25	645.16	23.784418
7828_105179_000033_000000	Simultaneously there broke upon the astonished ears of both attackers and attacked a volley of shots from the gorge.	Simultaneously there broke upon the astonished ears of both attackers and attacked a volley of shots from the gorge.	true	645.56	652.75	24.278341
7828_105179_000033_000001	With the sweetness of the voice of an angel from heaven the Europeans heard the sharp-barked commands of an English noncom.	With the sweetness of the voice of an angel from heaven the Europeans heard the sharp barked commands of an English noncom.	true	653.09	660.31	21.853357
