7828_105179_000033_000002	Even above the roars of the lions and the screams of the maniacs, those beloved tones reached the ears of Tarzan and the girl at the very moment that even the ape-man had given up the last vestige of hope.	Even above the roars of the lions and the screams of the maniacs, those beloved tones reached the ears of Tarzan and the girl at the very moment that even the ape man had given up the last vestige of hope.	false	660.8	672.165	23.603058
7828_105179_000034_000000	Rolling the body of the warrior to one side Tarzan struggled to his feet, the spear still protruding from his shoulder.	Rolling the body of the warrior to one side Tarzan struggled to his feet, the spear still protruding from his shoulder.	true	672.165	679.03	23.90716
7828_105179_000034_000001	The girl rose too, and as Tarzan wrenched the weapon from his flesh and stepped out from behind the concealment of their refuge, she followed at his side.	The girl rose too, and as Tarzan wrenched the weapon from his flesh and stepped out from behind the concealment of their refuge, she followed at his side.	false	679.31	687.73	23.270857
7828_105179_000034_000002	The skirmish that had resulted in their rescue was soon over.	The skirmish that had resulted in their rescue was soon over.	false	688.07	691.57	22.648195
7828_105179_000034_000003	Most of the lions escaped but all of the pursuing Xujans had been slain.	Most of the lions escaped but all of the pursuing Xujans had been slain.	false	691.73	695.89	22.04956
7828_105179_000034_000004	As Tarzan and the girl came into full view of the group, a British Tommy leveled his rifle at the ape-man.	As Tarzan and the girl came into full view of the group, a British Tommy leveled his rifle at the ape man.	false	696.32	702.61	26.849518
7828_105179_000034_000005	Seeing the fellow's actions and realizing instantly the natural error that Tarzan's yellow tunic had occasioned the girl sprang between him and the soldier.	Seeing the fellow's actions and realizing instantly the natural error that Tarzan's yellow tunic had occasioned the girl sprang between him and the soldier.	false	702.83	711.16	23.313236
7828_105179_000034_000006	"Don't shoot," she cried to the latter, "we are both friends."	"Don't shoot," she cried to the latter, "we are both friends."	true	711.35	714.91	22.909193
7828_105179_000035_000000	"Hold up your hands, you, then," he commanded Tarzan.	"Hold up your hands, you, then," he commanded Tarzan.	true	715.22	718.51	22.113989
7828_105179_000035_000001	"I ain't taking no chances with any duffer with a yellow shirt."	"I ain't taking no chances with any duffer with a yellow shirt."	false	718.7	722.11	22.15209
7828_105179_000036_000000	At this juncture the British sergeant who had been in command of the advance guard approached and when Tarzan and the girl spoke to him in English, explaining their disguises, he accepted their word, since they were evidently not of the same race as the creatures which lay dead about them.	At this juncture the British sergeant who had been in command of the advance guard approached and when Tarzan and the girl spoke to him in English, explaining their disguises, he accepted their word, since they were evidently not of the same race as the creatures which lay dead about them.	true	722.3	737.44	21.349195
7828_105179_000036_000001	Ten minutes later the main body of the expedition came into view.	Ten minutes later the main body of the expedition came into view.	false	737.72	741.13	18.045265
7828_105179_000036_000002	Smith-Oldwick's wounds were dressed, as well as were those of the ape-man, and in half an hour they were on their way to the camp of their rescuers.	Smith Oldwick's wounds were dressed, as well as were those of the ape man, and in half an hour they were on their way to the camp of their rescuers.	true	741.23	749.14	24.106823
7828_105179_000037_000000	That night it was arranged that the following day Smith-Oldwick and Bertha Kircher should be transported to British headquarters near the coast by aeroplane, the two planes attached to the expeditionary force being requisitioned for the purpose.	That night it was arranged that the following day Smith Oldwick and Bertha Kircher should be transported to British headquarters near the coast by aeroplane, the two planes attached to the expeditionary force being requisitioned for the purpose.	true	749.48	763.15	25.529682
7828_105179_000037_000001	Tarzan and Otobu declined the offers of the British captain to accompany his force overland on the return march as Tarzan explained that his country lay to the west, as did Otobu's, and that they would travel together as far as the country of the Wamabos.	Tarzan and Otobu declined the offers of the British captain to accompany his force overland on the return march as Tarzan explained that his country lay to the west, as did Otobu's, and that they would travel together as far as the country of the Wamabos.	true	763.52	778.12	25.575516
7828_105179_000038_000000	"You are not going back with us, then?" asked the girl.	"You are not going back with us, then?" asked the girl.	true	778.61	781.57	32.25581
7828_105179_000039_000000	"No," replied the ape-man.	"No," replied the ape man.	true	781.58	783.43	24.078793
7828_105179_000039_000001	"My home is upon the west coast.	"My home is upon the west coast.	false	783.71	785.65	28.796627
7828_105179_000039_000002	I will continue my journey in that direction."	I will continue my journey in that direction."	true	785.81	788.44	28.040102
7828_105179_000040_000000	She cast appealing eyes toward him.	She cast appealing eyes toward him.	true	788.69	791.17	31.34432
7828_105179_000040_000001	"You will go back into that terrible jungle?" she asked.	"You will go back into that terrible jungle?" she asked.	true	791.84	795.07	22.518007
7828_105179_000040_000002	"We shall never see you again?"	"We shall never see you again?"	true	795.44	797.23	22.021389
7828_105179_000041_000000	He looked at her a moment in silence.	He looked at her a moment in silence.	true	797.99	800.08	22.010464
7828_105179_000041_000001	"Never," he said, and without another word turned and walked away.	"Never," he said, and without another word turned and walked away.	true	800.45	804.61	20.582777
7828_105179_000042_000000	In the morning Colonel Capell came from the base camp in one of the planes that was to carry Smith-Oldwick and the girl to the east. Tarzan was standing some distance away as the ship landed and the officer descended to the ground.	In the morning Colonel Capell came from the base camp in one of the planes that was to carry Smith Oldwick and the girl to the east. Tarzan was standing some distance away as the ship landed and the officer descended to the ground.	true	804.89	817.3	24.858574
7828_105179_000042_000001	He saw the colonel greet his junior in command of the advance detachment, and then he saw him turn toward Bertha Kircher who was standing a few paces behind the captain.	He saw the colonel greet his junior in command of the advance detachment, and then he saw him turn toward Bertha Kircher who was standing a few paces behind the captain.	true	817.61	826.62	24.76676
7828_105179_000042_000002	Tarzan wondered how the German spy felt in this situation, especially when she must know that there was one there who knew her real status.	Tarzan wondered how the German spy felt in this situation, especially when she must know that there was one there who knew her real status.	true	826.62	834.01	19
7828_105179_000042_000003	He saw Colonel Capell walk toward her with outstretched hands and smiling face and, although he could not hear the words of his greeting, he saw that it was friendly and cordial to a degree.	He saw Colonel Capell walk toward her with outstretched hands and smiling face and, although he could not hear the words of his greeting, he saw that it was friendly and cordial to a degree.	true	834.47	844.24	23
7828_105179_000043_000000	Tarzan turned away scowling, and if any had been close by they might have heard a low growl rumble from his chest.	Tarzan turned away scowling, and if any had been close by they might have heard a low growl rumble from his chest.	true	844.58	851.38	22.043358
7828_105179_000043_000001	He knew that his country was at war with Germany and that not only his duty to the land of his fathers, but also his personal grievance against the enemy people and his hatred of them, demanded that he expose the girl's perfidy, and yet he hesitated, and because he hesitated he growled--not at the German spy but at himself for his weakness.	He knew that his country was at war with Germany and that not only his duty to the land of his fathers, but also his personal grievance against the enemy people and his hatred of them, demanded that he expose the girl's perfidy, and yet he hesitated, and because he hesitated he growled-not at the German spy but at himself for his weakness.	true	851.78	873.28	25.819794
7828_105179_000044_000000	He did not see her again before she entered a plane and was borne away toward the east.	He did not see her again before she entered a plane and was borne away toward the east.	false	873.71	878.23	22
7828_105179_000044_000001	He bid farewell to Smith-Oldwick and received again the oft-repeated thanks of the young Englishman.	He bid farewell to Smith Oldwick and received again the oft repeated thanks of the young Englishman.	false	878.6	884.52	22.653273
7828_105179_000044_000002	And then he saw him too borne aloft in the high circling plane and watched until the ship became a speck far above the eastern horizon to disappear at last high in air.	And then he saw him too borne aloft in the high circling plane and watched until the ship became a speck far above the eastern horizon to disappear at last high in air.	false	884.52	894.79	21
7828_105179_000045_000000	The Tommies, their packs and accouterments slung, were waiting the summons to continue their return march.	The Tommies, their packs and accouterments slung, were waiting the summons to continue their return march.	true	895.19	901.66	25.776154
7828_105179_000045_000001	Colonel Capell had, through a desire to personally observe the stretch of country between the camp of the advance detachment and the base, decided to march back his troops.	Colonel Capell had, through a desire to personally observe the stretch of country between the camp of the advance detachment and the base, decided to march back his troops.	false	902.06	912.1	24.548965
7828_105179_000045_000002	Now that all was in readiness for departure he turned to Tarzan.	Now that all was in readiness for departure he turned to Tarzan.	true	912.38	916.54	19.873037
7828_105179_000045_000003	"I wish you would come back with us, Greystoke," he said, "and if my appeal carries no inducement possibly that of Smith-Oldwick and the young lady who just left us may.	"I wish you would come back with us, Greystoke," he said, "and if my appeal carries no inducement possibly that of Smith Oldwick and the young lady who just left us may.	true	916.82	926.14	25.597443
7828_105179_000045_000004	They asked me to urge you to return to civilization."	They asked me to urge you to return to civilization."	true	926.36	929.41	23.636047
7828_105179_000046_000000	"No;" said Tarzan, "I shall go my own way.	"No;" said Tarzan, "I shall go my own way.	true	929.45	932.38	21.643904
7828_105179_000046_000001	Miss Kircher and Lieutenant Smith-Oldwick were only prompted by a sense of gratitude in considering my welfare."	Miss Kircher and Lieutenant Smith Oldwick were only prompted by a sense of gratitude in considering my welfare."	true	932.75	939.16	26.394514
7828_105179_000047_000000	"Miss Kircher?" exclaimed Capell and then he laughed, "You know her then as Bertha Kircher, the German spy?"	"Miss Kircher?" exclaimed Capell and then he laughed, "You know her then as Bertha Kircher, the German spy?"	false	939.53	946.69	27.289257
7828_105179_000048_000000	Tarzan looked at the other a moment in silence.	Tarzan looked at the other a moment in silence.	false	946.88	949.33	21.160046
7828_105179_000048_000001	It was beyond him to conceive that a British officer should thus laconically speak of an enemy spy whom he had had within his power and permitted to escape.	It was beyond him to conceive that a British officer should thus laconically speak of an enemy spy whom he had had within his power and permitted to escape.	true	949.61	958.785	21.73217
7828_105179_000048_000002	"Yes," he replied, "I knew that she was Bertha Kircher, the German spy?"	"Yes," he replied, "I knew that she was Bertha Kircher, the German spy?"	true	958.785	963.4	26.664295
7828_105179_000049_000000	"Is that all you knew?" asked Capell.	"Is that all you knew?" asked Capell.	false	963.92	966.81	32.25019
7828_105179_000050_000000	"That is all," said the ape-man.	"That is all," said the ape man.	true	966.81	968.65	18
7828_105179_000051_000000	"She is the Honorable Patricia Canby," said Capell, "one of the most valuable members of the British Intelligence Service attached to the East African forces.	"She is the Honorable Patricia Canby," said Capell, "one of the most valuable members of the British Intelligence Service attached to the East African forces.	false	969.11	977.65	21.362225
7828_105179_000051_000001	Her father and I served in India together and I have known her ever since she was born.	Her father and I served in India together and I have known her ever since she was born.	true	977.84	982.54	18.507946
7828_105179_000052_000000	"Why, here's a packet of papers she took from a German officer and has been carrying it through all her vicissitudes--single-minded in the performance of her duty.	"Why, here's a packet of papers she took from a German officer and has been carrying it through all her vicissitudes-single minded in the performance of her duty.	false	982.55	991.54	23.441622
7828_105179_000052_000001	Look!	Look!	true	991.67	992.47	29.889612
7828_105179_000052_000002	I haven't yet had time to examine them but as you see here is a military sketch map, a bundle of reports, and the diary of one Hauptmann Fritz Schneider."	I haven't yet had time to examine them but as you see here is a military sketch map, a bundle of reports, and the diary of one Hauptmann Fritz Schneider."	false	992.6	1001.83	21.558725
7828_105179_000053_000000	"The diary of Hauptmann Fritz Schneider!" repeated Tarzan in a constrained voice.	"The diary of Hauptmann Fritz Schneider!" repeated Tarzan in a constrained voice.	true	1002.08	1006.54	23.792107
7828_105179_000053_000001	"May I see it, Capell?	"May I see it, Capell?	false	1006.73	1008.45	33.69725
7828_105179_000053_000002	He is the man who murdered Lady Greystoke."	He is the man who murdered Lady Greystoke."	true	1008.45	1011.06	20.539673
7828_105179_000054_000000	The Englishman handed the little volume over to the other without a word.	The Englishman handed the little volume over to the other without a word.	true	1011.06	1014.73	15
7828_105179_000054_000001	Tarzan ran through the pages quickly looking for a certain date--the date that the horror had been committed--and when he found it he read rapidly.	Tarzan ran through the pages quickly looking for a certain date-the date that the horror had been committed-and when he found it he read rapidly.	false	1015.07	1024.15	23.077518
7828_105179_000054_000002	Suddenly a gasp of incredulity burst from his lips.	Suddenly a gasp of incredulity burst from his lips.	false	1024.46	1028.07	24.545277
7828_105179_000054_000003	Capell looked at him questioningly.	Capell looked at him questioningly.	true	1028.07	1029.79	25
7828_105179_000055_000000	"God!" exclaimed the ape-man.	"God!" exclaimed the ape man.	false	1030.19	1032.01	26.449972
7828_105179_000055_000001	"Can this be true?	"Can this be true?	true	1032.08	1033.48	32.946392
7828_105179_000055_000002	Listen!" and he read an excerpt from the closely written page:	Listen!" and he read an excerpt from the closely written page:	true	1033.58	1037.38	23.943352
7828_105179_000056_000000	"'Played a little joke on the English pig.	"'Played a little joke on the English pig.	true	1037.84	1040.34	22.389206
7828_105179_000056_000001	When he comes home he will find the burned body of his wife in her boudoir--but he will only think it is his wife.	When he comes home he will find the burned body of his wife in her boudoir-but he will only think it is his wife.	false	1040.34	1046.83	21.949026
7828_105179_000056_000002	Had von Goss substitute the body of a dead Negress and char it after putting Lady Greystoke's rings on it--Lady G will be of more value to the High Command alive than dead.'"	Had von Goss substitute the body of a dead Negress and char it after putting Lady Greystoke's rings on it-Lady G will be of more value to the High Command alive than dead.'"	true	1046.9	1056.85	19.892593
7828_105179_000057_000000	"She lives!" cried Tarzan.	"She lives!" cried Tarzan.	true	1057.22	1059.61	26.202188
7828_105179_000058_000000	"Thank God!" exclaimed Capell.	"Thank God!" exclaimed Capell.	false	1059.98	1062.18	26.2309
7828_105179_000058_000001	"And now?"	"And now?"	true	1062.18	1063	37.200344
7828_105179_000059_000000	"I will return with you, of course.	"I will return with you, of course.	true	1063.4	1065.31	31.966452
7828_105179_000059_000001	How terribly I have wronged Miss Canby, but how could I know?	How terribly I have wronged Miss Canby, but how could I know?	true	1065.71	1069.42	21.299864
7828_105179_000059_000002	I even told Smith-Oldwick, who loves her, that she was a German spy.	I even told Smith Oldwick, who loves her, that she was a German spy.	true	1069.7	1073.86	24.789703
7828_105179_000060_000000	"Not only must I return to find my wife but I must right this wrong."	"Not only must I return to find my wife but I must right this wrong."	true	1074.23	1078.6	28.774752
7828_105179_000061_000000	"Don't worry about that," said Capell, "she must have convinced him that she is no enemy spy, for just before they left this morning he told me she had promised to marry him."	"Don't worry about that," said Capell, "she must have convinced him that she is no enemy spy, for just before they left this morning he told me she had promised to marry him."	false	1079.06	1089.15	25.116713
7828_105179_000062_000000	Note: I have made the following changes to the text:	Note: I have made the following changes to the text:	false	1089.15	1089.27	1
7828_105179_000063_000000	PAGE LINE ORIGINAL CHANGED TO 25 10 noislessly noiselessly 40 34 hole bole 41 45 later latter 53 43 but "but 66 19 half-smiled half-smile 69 45 to many too many 75 16 fine find 81 3 forth fourth 86 14 hoplessly hopelessly 86 42 interferred interfered 93 15 born borne 101 40 Englishman Englishmen 108 16 divertisements divertissements 110 29 asid said 127 14 apppreciate appreciate 128 45 fuseluge fuselage 138 25 as the at the 142 34 girls' girl's 146 44 sourroundings, surroundings, 148 30 spirit on spirit of 149 33 upon upon. 153 3 immediately immediate 153 39 nothwithstanding notwithstanding 159 43 "The The 163 45 known know 171 8 one the on the 172 8 sandled sandaled 175 2 junlgle jungle 181 46 swifty swiftly 189 23 not, not. 198 45 "Come," Come," 219 1 still sill 225 21 sigh or sigh of 227 20 occasionaly occasionally 228 5 gazing grazing 234 24 prisoners.	PAGE LINE ORIGINAL CHANGED TO twenty five ten noislessly noiselessly forty thirty four hole bole forty one forty five later latter fifty three forty three but "but sixty six nineteen half smiled half smile sixty nine forty five to many too many seventy five sixteen fine find eighty one three forth fourth eighty six fourteen hoplessly hopelessly eighty six forty two interferred interfered ninety three fifteen born borne one hundred one forty Englishman Englishmen one hundred eight sixteen divertisements divertissements one hundred ten twenty nine a s i d said one hundred twenty seven fourteen apppreciate appreciate one hundred twenty eight forty five fuseluge fuselage one hundred thirty eight twenty five as the at the one hundred forty two thirty four girls' girl's one hundred forty six forty four sourroundings, surroundings, one hundred forty eight thirty spirit on spirit of one hundred forty nine thirty three upon upon. one hundred fifty three three immediately immediate one hundred fifty three thirty nine nothwithstanding notwithstanding one hundred fifty nine forty three "The The one hundred sixty three forty five known know one hundred seventy one eight one the on the one hundred seventy two eight sandled sandaled one hundred seventy five two junlgle jungle one hundred eighty one forty six swifty swiftly one hundred eighty nine twenty three not, not. one hundred ninety eight forty five "Come," Come," two hundred nineteen one still sill two hundred twenty five twenty one sigh or sigh of two hundred twenty seven twenty occasionaly occasionally two hundred twenty eight five gazing grazing two hundred thirty four twenty four prisoners.	false	1089.27	1096.86	22.152643
7828_105179_000063_000001	prisoners. 237 11 qiuckly quickly 237 16 opproached approached 243 16 is his in his 244 32 second seconds	prisoners. two hundred thirty seven eleven qiuckly quickly two hundred thirty seven sixteen opproached approached two hundred forty three sixteen is his in his two hundred forty four thirty two second seconds	false	1096.86	1099.89	23.58145
