1769_143484_000000_000000	O man, whatever country you may belong to, whatever your opinions may be, attend to my words; you shall hear your history such as I think I have read it, not in books composed by those like you, for they are liars, but in the book of nature which never lies.	O man, whatever country you may belong to, whatever your opinions may be, attend to my words; you shall hear your history such as I think I have read it, not in books composed by those like you, for they are liars, but in the book of nature which never lies.	false	0	13.395	21.61163
1769_143484_000000_000001	All that I shall repeat after her, must be true, without any intermixture of falsehood, but where I may happen, without intending it, to introduce my own conceits.	All that I shall repeat after her, must be true, without any intermixture of falsehood, but where I may happen, without intending it, to introduce my own conceits.	false	13.395	14.67	20.751816
1769_143484_000000_000002	The times I am going to speak of are very remote.	The times I am going to speak of are very remote.	false	14.67	15.12	21
1769_143484_000000_000003	How much you are changed from what you once were!	How much you are changed from what you once were!	false	15.12	15.12	
1769_143484_000000_000004	'Tis in a manner the life of your species that I am going to write, from the qualities which you have received, and which your education and your habits could deprave, but could not destroy.	'tis in a manner the life of your species that I am going to write, from the qualities which you have received, and which your education and your habits could deprave, but could not destroy.	false	15.12	20.28	23.87924
1769_143484_000000_000005	There is, I am sensible, an age at which every individual of you would choose to stop; and you will look out for the age at which, had you your wish, your species had stopped.	There is, I am sensible, an age at which every individual of you would choose to stop; and you will look out for the age at which, had you your wish, your species had stopped.	false	20.28	26.91	24.510283
1769_143484_000000_000006	Uneasy at your present condition for reasons which threaten your unhappy posterity with still greater uneasiness, you will perhaps wish it were in your power to go back; and this sentiment ought to be considered, as the panegyric of your first parents, the condemnation of your contemporaries, and a source of terror to all those who may have the misfortune of succeeding you.	Uneasy at your present condition for reasons which threaten your unhappy posterity with still greater uneasiness, you will perhaps wish it were in your power to go back; and this sentiment ought to be considered, as the panegyric of your first parents, the condemnation of your contemporaries, and a source of terror to all those who may have the misfortune of succeeding you.	false	26.91	40.47	21.887634
1769_143484_000001_000000	DISCOURSE FIRST PART	DISCOURSE FIRST PART	true	40.47	42.19	23.396784
1769_143484_000002_000000	However important it may be, in order to form a proper judgment of the natural state of man, to consider him from his origin, and to examine him, as it were, in the first embryo of the species; I shall not attempt to trace his organization through its successive approaches to perfection: I shall not stop to examine in the animal system what he might have been in the beginning, to become at last what he actually is; I shall not inquire whether, as Aristotle thinks, his neglected nails were no better at first than crooked talons; whether his whole body was not, bear-like, thick covered with rough hair; and whether, walking upon all-fours, his eyes, directed to the earth, and confined to a horizon of a few paces extent, did not at once point out the nature and limits of his ideas.	However important it may be, in order to form a proper judgment of the natural state of man, to consider him from his origin, and to examine him, as it were, in the first embryo of the species; I shall not attempt to trace his organization through its successive approaches to perfection: I shall not stop to examine in the animal system what he might have been in the beginning, to become at last what he actually is; I shall not inquire whether, as Aristotle thinks, his neglected nails were no better at first than crooked talons; whether his whole body was not, bear like, thick covered with rough hair; and whether, walking upon all fours, his eyes, directed to the earth, and confined to a horizon of a few paces extent, did not at once point out the nature and limits of his ideas.	true	43.34	89.59	22.934395
1769_143484_000002_000001	I could only form vague, and almost imaginary, conjectures on this subject.	I could only form vague, and almost imaginary, conjectures on this subject.	true	90.29	94.72	22.553085
1769_143484_000002_000002	Comparative anatomy has not as yet been sufficiently improved; neither have the observations of natural philosophy been sufficiently ascertained, to establish upon such foundations the basis of a solid system.	Comparative anatomy has not as yet been sufficiently improved; neither have the observations of natural philosophy been sufficiently ascertained, to establish upon such foundations the basis of a solid system.	true	94.91	107.14	21.722391
1769_143484_000002_000003	For this reason, without having recourse to the supernatural informations with which we have been favoured on this head, or paying any attention to the changes, that must have happened in the conformation of the interior and exterior parts of man's body, in proportion as he applied his members to new purposes, and took to new aliments, I shall suppose his conformation to have always been, what we now behold it; that he always walked on two feet, made the same use of his hands that we do of ours, extended his looks over the whole face of nature, and measured with his eyes the vast extent of the heavens.	For this reason, without having recourse to the supernatural informations with which we have been favoured on this head, or paying any attention to the changes, that must have happened in the conformation of the interior and exterior parts of man's body, in proportion as he applied his members to new purposes, and took to new aliments, I shall suppose his conformation to have always been, what we now behold it; that he always walked on two feet, made the same use of his hands that we do of ours, extended his looks over the whole face of nature, and measured with his eyes the vast extent of the heavens.	false	107.51	143.8	22.026009
1769_143484_000003_000000	If I strip this being, thus constituted, of all the supernatural gifts which he may have received, and of all the artificial faculties, which we could not have acquired but by slow degrees; if I consider him, in a word, such as he must have issued from the hands of nature; I see an animal less strong than some, and less active than others, but, upon the whole, the most advantageously organized of any; I see him satisfying the calls of hunger under the first oak, and those of thirst at the first rivulet; I see him laying himself down to sleep at the foot of the same tree that afforded him his meal; and behold, this done, all his wants are completely supplied.	If I strip this being, thus constituted, of all the supernatural gifts which he may have received, and of all the artificial faculties, which we could not have acquired but by slow degrees; if I consider him, in a word, such as he must have issued from the hands of nature; I see an animal less strong than some, and less active than others, but, upon the whole, the most advantageously organized of any; I see him satisfying the calls of hunger under the first oak, and those of thirst at the first rivulet; I see him laying himself down to sleep at the foot of the same tree that afforded him his meal; and behold, this done, all his wants are completely supplied.	false	144.35	185.38	23.275988
1769_143484_000004_000000	The earth left to its own natural fertility and covered with immense woods, that no hatchet ever disfigured, offers at every step food and shelter to every species of animals.	The earth left to its own natural fertility and covered with immense woods, that no hatchet ever disfigured, offers at every step food and shelter to every species of animals.	true	186.47	197.29	25.359095
1769_143484_000004_000001	Men, dispersed among them, observe and imitate their industry, and thus rise to the instinct of beasts; with this advantage, that, whereas every species of beasts is confined to one peculiar instinct, man, who perhaps has not any that particularly belongs to him, appropriates to himself those of all other animals, and lives equally upon most of the different aliments, which they only divide among themselves; a circumstance which qualifies him to find his subsistence, with more ease than any of them.	Men, dispersed among them, observe and imitate their industry, and thus rise to the instinct of beasts; with this advantage, that, whereas every species of beasts is confined to one peculiar instinct, man, who perhaps has not any that particularly belongs to him, appropriates to himself those of all other animals, and lives equally upon most of the different aliments, which they only divide among themselves; a circumstance which qualifies him to find his subsistence, with more ease than any of them.	true	197.42	228.76	22.723783
1769_143484_000005_000000	Men, accustomed from their infancy to the inclemency of the weather, and to the rigour of the different seasons; inured to fatigue, and obliged to defend, naked and without arms, their life and their prey against the other wild inhabitants of the forest, or at least to avoid their fury by flight, acquire a robust and almost unalterable habit of body; the children, bringing with them into the world the excellent constitution of their parents, and strengthening it by the same exercises that first produced it, attain by this means all the vigour that the human frame is capable of.	Men, accustomed from their infancy to the inclemency of the weather, and to the rigour of the different seasons; inured to fatigue, and obliged to defend, naked and without arms, their life and their prey against the other wild inhabitants of the forest, or at least to avoid their fury by flight, acquire a robust and almost unalterable habit of body; the children, bringing with them into the world the excellent constitution of their parents, and strengthening it by the same exercises that first produced it, attain by this means all the vigour that the human frame is capable of.	false	229.82	264.01	23.168312
1769_143484_000005_000001	Nature treats them exactly in the same manner that Sparta treated the children of her citizens; those who come well formed into the world she renders strong and robust, and destroys all the rest; differing in this respect from our societies, in which the state, by permitting children to become burdensome to their parents, murders them all without distinction, even in the wombs of their mothers.	Nature treats them exactly in the same manner that Sparta treated the children of her citizens; those who come well formed into the world she renders strong and robust, and destroys all the rest; differing in this respect from our societies, in which the state, by permitting children to become burdensome to their parents, murders them all without distinction, even in the wombs of their mothers.	false	264.17	286.9	22.526447
1769_143484_000006_000000	The body being the only instrument that savage man is acquainted with, he employs it to different uses, of which ours, for want of practice, are incapable; and we may thank our industry for the loss of that strength and agility, which necessity obliges him to acquire.	The body being the only instrument that savage man is acquainted with, he employs it to different uses, of which ours, for want of practice, are incapable; and we may thank our industry for the loss of that strength and agility, which necessity obliges him to acquire.	false	287.66	302.89	22.43046
1769_143484_000006_000001	Had he a hatchet, would his hand so easily snap off from an oak so stout a branch?	Had he a hatchet, would his hand so easily snap off from an oak so stout a branch?	false	303.23	308.2	23.580317
1769_143484_000006_000002	Had he a sling, would it dart a stone to so great a distance? Had he a ladder, would he run so nimbly up a tree?	Had he a sling, would it dart a stone to so great a distance? Had he a ladder, would he run so nimbly up a tree?	false	308.39	315.46	19.769608
1769_143484_000006_000003	Had he a horse, would he with such swiftness shoot along the plain?	Had he a horse, would he with such swiftness shoot along the plain?	true	315.65	319.63	25.080818
1769_143484_000006_000004	Give civilized man but time to gather about him all his machines, and no doubt he will be an overmatch for the savage: but if you have a mind to see a contest still more unequal, place them naked and unarmed one opposite to the other; and you will soon discover the advantage there is in perpetually having all our forces at our disposal, in being constantly prepared against all events, and in always carrying ourselves, as it were, whole and entire about us.	Give civilized man but time to gather about him all his machines, and no doubt he will be an overmatch for the savage: but if you have a mind to see a contest still more unequal, place them naked and unarmed one opposite to the other; and you will soon discover the advantage there is in perpetually having all our forces at our disposal, in being constantly prepared against all events, and in always carrying ourselves, as it were, whole and entire about us.	true	319.91	347.29	22.008036
1769_143484_000007_000000	Hobbes would have it that man is naturally void of fear, and always intent upon attacking and fighting.	Hobbes would have it that man is naturally void of fear, and always intent upon attacking and fighting.	true	347.75	353.38	20.605476
1769_143484_000007_000001	An illustrious philosopher thinks on the contrary, and Cumberland and Puffendorff likewise affirm it, that nothing is more fearful than man in a state of nature, that he is always in a tremble, and ready to fly at the first motion he perceives, at the first noise that strikes his ears.	An illustrious philosopher thinks on the contrary, and Cumberland and Puffendorff likewise affirm it, that nothing is more fearful than man in a state of nature, that he is always in a tremble, and ready to fly at the first motion he perceives, at the first noise that strikes his ears.	false	353.54	369.64	24.339457
1769_143484_000007_000002	This, indeed, may be very true in regard to objects with which he is not acquainted; and I make no doubt of his being terrified at every new sight that presents itself, as often as he cannot distinguish the physical good and evil which he may expect from it, nor compare his forces with the dangers he has to encounter; circumstances that seldom occur in a state of nature, where all things proceed in so uniform a manner, and the face of the earth is not liable to those sudden and continual changes occasioned in it by the passions and inconstancies of collected bodies.	This, indeed, may be very true in regard to objects with which he is not acquainted; and I make no doubt of his being terrified at every new sight that presents itself, as often as he cannot distinguish the physical good and evil which he may expect from it, nor compare his forces with the dangers he has to encounter; circumstances that seldom occur in a state of nature, where all things proceed in so uniform a manner, and the face of the earth is not liable to those sudden and continual changes occasioned in it by the passions and inconstancies of collected bodies.	false	369.83	403.27	24.176859
1769_143484_000007_000003	But savage man living among other animals without any society or fixed habitation, and finding himself early under a necessity of measuring his strength with theirs, soon makes a comparison between both, and finding that he surpasses them more in address, than they surpass him in strength, he learns not to be any longer in dread of them.	But savage man living among other animals without any society or fixed habitation, and finding himself early under a necessity of measuring his strength with theirs, soon makes a comparison between both, and finding that he surpasses them more in address, than they surpass him in strength, he learns not to be any longer in dread of them.	true	403.67	425.17	21.379066
1769_143484_000007_000004	Turn out a bear or a wolf against a sturdy, active, resolute savage, (and this they all are,) provided with stones and a good stick; and you will soon find that the danger is at least equal on both sides, and that after several trials of this kind, wild beasts, who are not fond of attacking each other, will not be very fond of attacking man, whom they have found every whit as wild as themselves.	Turn out a bear or a wolf against a sturdy, active, resolute savage, (and this they all are,) provided with stones and a good stick; and you will soon find that the danger is at least equal on both sides, and that after several trials of this kind, wild beasts, who are not fond of attacking each other, will not be very fond of attacking man, whom they have found every whit as wild as themselves.	false	425.36	450.64	22.775986
1769_143484_000007_000005	As to animals who have really more strength than man has address, he is, in regard to them, what other weaker species are, who find means to subsist notwithstanding; he has even this great advantage over such weaker species, that being equally fleet with them, and finding on every tree an almost inviolable asylum, he is always at liberty to take it or leave it, as he likes best, and of course to fight or to fly, whichever is most agreeable to him.	As to animals who have really more strength than man has address, he is, in regard to them, what other weaker species are, who find means to subsist notwithstanding; he has even this great advantage over such weaker species, that being equally fleet with them, and finding on every tree an almost inviolable asylum, he is always at liberty to take it or leave it, as he likes best, and of course to fight or to fly, whichever is most agreeable to him.	false	450.8	480.96	23.566547
1769_143484_000007_000006	To this we may add that no animal naturally makes war upon man, except in the case of self-defence or extreme hunger; nor ever expresses against him any of these violent antipathies, which seem to indicate that some particular species are intended by nature for the food of others.	To this we may add that no animal naturally makes war upon man, except in the case of self defence or extreme hunger; nor ever expresses against him any of these violent antipathies, which seem to indicate that some particular species are intended by nature for the food of others.	false	480.96	497.74	23.266115
1769_143484_000008_000000	But there are other more formidable enemies, and against which man is not provided with the same means of defence; I mean natural infirmities, infancy, old age, and sickness of every kind, melancholy proofs of our weakness, whereof the two first are common to all animals, and the last chiefly attends man living in a state of society.	But there are other more formidable enemies, and against which man is not provided with the same means of defence; I mean natural infirmities, infancy, old age, and sickness of every kind, melancholy proofs of our weakness, whereof the two first are common to all animals, and the last chiefly attends man living in a state of society.	false	498.26	519.96	23.202341
1769_143484_000008_000001	It is even observable in regard to infancy, that the mother being able to carry her child about with her, wherever she goes, can perform the duty of a nurse with a great deal less trouble, than the females of many other animals, who are obliged to be constantly going and coming with no small labour and fatigue, one way to look out for their own subsistence, and another to suckle and feed their young ones.	It is even observable in regard to infancy, that the mother being able to carry her child about with her, wherever she goes, can perform the duty of a nurse with a great deal less trouble, than the females of many other animals, who are obliged to be constantly going and coming with no small labour and fatigue, one way to look out for their own subsistence, and another to suckle and feed their young ones.	false	519.96	543.79	22.613052
1769_143484_000008_000002	True it is that, if the woman happens to perish, her child is exposed to the greatest danger of perishing with her; but this danger is common to a hundred other species, whose young ones require a great deal of time to be able to provide for themselves; and if our infancy is longer than theirs, our life is longer likewise; so that, in this respect too, all things are in a manner equal; not but that there are other rules concerning the duration of the first age of life, and the number of the young of man and other animals, but they do not belong to my subject.	True it is that, if the woman happens to perish, her child is exposed to the greatest danger of perishing with her; but this danger is common to a hundred other species, whose young ones require a great deal of time to be able to provide for themselves; and if our infancy is longer than theirs, our life is longer likewise; so that, in this respect too, all things are in a manner equal; not but that there are other rules concerning the duration of the first age of life, and the number of the young of man and other animals, but they do not belong to my subject.	false	544.01	578.02	21.410683
1769_143484_000008_000003	With old men, who stir and perspire but little, the demand for food diminishes with their abilities to provide it; and as a savage life would exempt them from the gout and the rheumatism, and old age is of all ills that which human assistance is least capable of alleviating, they would at last go off, without its being perceived by others that they ceased to exist, and almost without perceiving it themselves.	With old men, who stir and perspire but little, the demand for food diminishes with their abilities to provide it; and as a savage life would exempt them from the gout and the rheumatism, and old age is of all ills that which human assistance is least capable of alleviating, they would at last go off, without its being perceived by others that they ceased to exist, and almost without perceiving it themselves.	false	578.48	604.06	22.359438
1769_143484_000009_000000	In regard to sickness, I shall not repeat the vain and false declamations made use of to discredit medicine by most men, while they enjoy their health; I shall only ask if there are any solid observations from which we may conclude that in those countries where the healing art is most neglected, the mean duration of man's life is shorter than in those where it is most cultivated?	In regard to sickness, I shall not repeat the vain and false declamations made use of to discredit medicine by most men, while they enjoy their health; I shall only ask if there are any solid observations from which we may conclude that in those countries where the healing art is most neglected, the mean duration of man's life is shorter than in those where it is most cultivated?	false	604.94	626.23	23.842695
1769_143484_000009_000001	And how is it possible this should be the case, if we inflict more diseases upon ourselves than medicine can supply us with remedies!	And how is it possible this should be the case, if we inflict more diseases upon ourselves than medicine can supply us with remedies!	false	626.54	634.03	21.297262
1769_143484_000009_000002	The extreme inequalities in the manner of living of the several classes of mankind, the excess of idleness in some, and of labour in others, the facility of irritating and satisfying our sensuality and our appetites, the too exquisite and out of the way aliments of the rich, which fill them with fiery juices, and bring on indigestions, the unwholesome food of the poor, of which even, bad as it is, they very often fall short, and the want of which tempts them, every opportunity that offers, to eat greedily and overload their stomachs; watchings, excesses of every kind, immoderate transports of all the passions, fatigues, waste of spirits, in a word, the numberless pains and anxieties annexed to every condition, and which the mind of man is constantly a prey to; these are the fatal proofs that most of our ills are of our own making, and that we might have avoided them all by adhering to the simple, uniform and solitary way of life prescribed to us by nature.	The extreme inequalities in the manner of living of the several classes of mankind, the excess of idleness in some, and of labour in others, the facility of irritating and satisfying our sensuality and our appetites, the too exquisite and out of the way aliments of the rich, which fill them with fiery juices, and bring on indigestions, the unwholesome food of the poor, of which even, bad as it is, they very often fall short, and the want of which tempts them, every opportunity that offers, to eat greedily and overload their stomachs; watchings, excesses of every kind, immoderate transports of all the passions, fatigues, waste of spirits, in a word, the numberless pains and anxieties annexed to every condition, and which the mind of man is constantly a prey to; these are the fatal proofs that most of our ills are of our own making, and that we might have avoided them all by adhering to the simple, uniform and solitary way of life prescribed to us by nature.	false	634.4	695.89	22.593964
