1769_143484_000009_000003	Allowing that nature intended we should always enjoy good health, I dare almost affirm that a state of reflection is a state against nature, and that the man who meditates is a depraved animal.	Allowing that nature intended we should always enjoy good health, I dare almost affirm that a state of reflection is a state against nature, and that the man who meditates is a depraved animal.	true	696.59	707.71	21.396662
1769_143484_000009_000004	We need only call to mind the good constitution of savages, of those at least whom we have not destroyed by our strong liquors; we need only reflect, that they are strangers to almost every disease, except those occasioned by wounds and old age, to be in a manner convinced that the history of human diseases might be easily composed by pursuing that of civil societies.	We need only call to mind the good constitution of savages, of those at least whom we have not destroyed by our strong liquors; we need only reflect, that they are strangers to almost every disease, except those occasioned by wounds and old age, to be in a manner convinced that the history of human diseases might be easily composed by pursuing that of civil societies.	true	707.93	728.38	22.863604
1769_143484_000009_000005	Such at least was the opinion of Plato, who concluded from certain remedies made use of or approved by Podalyrus and Macaon at the Siege of Troy, that several disorders, which these remedies were found to bring on in his days, were not known among men at that remote period.	Such at least was the opinion of Plato, who concluded from certain remedies made use of or approved by Podalyrus and Macaon at the Siege of Troy, that several disorders, which these remedies were found to bring on in his days, were not known among men at that remote period.	false	728.81	744.46	22.025394
1769_143484_000010_000000	Man therefore, in a state of nature where there are so few sources of sickness, can have no great occasion for physic, and still less for physicians; neither is the human species more to be pitied in this respect, than any other species of animals.	Man therefore, in a state of nature where there are so few sources of sickness, can have no great occasion for physic, and still less for physicians; neither is the human species more to be pitied in this respect, than any other species of animals.	true	744.98	759.28	22.758905
1769_143484_000010_000001	Ask those who make hunting their recreation or business, if in their excursions they meet with many sick or feeble animals.	Ask those who make hunting their recreation or business, if in their excursions they meet with many sick or feeble animals.	true	759.56	766.87	23.853205
1769_143484_000010_000002	They meet with many carrying the marks of considerable wounds, that have been perfectly well healed and closed up; with many, whose bones formerly broken, and whose limbs almost torn off, have completely knit and united, without any other surgeon but time, any other regimen but their usual way of living, and whose cures were not the less perfect for their not having been tortured with incisions, poisoned with drugs, or worn out by diet and abstinence.	They meet with many carrying the marks of considerable wounds, that have been perfectly well healed and closed up; with many, whose bones formerly broken, and whose limbs almost torn off, have completely knit and united, without any other surgeon but time, any other regimen but their usual way of living, and whose cures were not the less perfect for their not having been tortured with incisions, poisoned with drugs, or worn out by diet and abstinence.	true	767	793.54	23.511417
1769_143484_000010_000003	In a word, however useful medicine well administered may be to us who live in a state of society, it is still past doubt, that if, on the one hand, the sick savage, destitute of help, has nothing to hope from nature, on the other, he has nothing to fear but from his disease; a circumstance, which oftens renders his situation preferable to ours.	In a word, however useful medicine well administered may be to us who live in a state of society, it is still past doubt, that if, on the one hand, the sick savage, destitute of help, has nothing to hope from nature, on the other, he has nothing to fear but from his disease; a circumstance, which oftens renders his situation preferable to ours.	false	793.94	815.47	22.744108
1769_143484_000011_000000	Let us therefore beware of confounding savage man with the men, whom we daily see and converse with.	Let us therefore beware of confounding savage man with the men, whom we daily see and converse with.	false	816.5	823	22.274664
1769_143484_000011_000001	Nature behaves towards all animals left to her care with a predilection, that seems to prove how jealous she is of that prerogative.	Nature behaves towards all animals left to her care with a predilection, that seems to prove how jealous she is of that prerogative.	true	823.16	830.74	21.73672
1769_143484_000011_000002	The horse, the cat, the bull, nay the ass itself, have generally a higher stature, and always a more robust constitution, more vigour, more strength and courage in their forests than in our houses; they lose half these advantages by becoming domestic animals; it looks as if all our attention to treat them kindly, and to feed them well, served only to bastardize them.	The horse, the cat, the bull, nay the ass itself, have generally a higher stature, and always a more robust constitution, more vigour, more strength and courage in their forests than in our houses; they lose half these advantages by becoming domestic animals; it looks as if all our attention to treat them kindly, and to feed them well, served only to bastardize them.	true	830.93	854.05	24.52352
1769_143484_000011_000003	It is thus with man himself.	It is thus with man himself.	true	854.54	856.57	22.212332
1769_143484_000011_000004	In proportion as he becomes sociable and a slave to others, he becomes weak, fearful, mean-spirited, and his soft and effeminate way of living at once completes the enervation of his strength and of his courage.	In proportion as he becomes sociable and a slave to others, he becomes weak, fearful, mean spirited, and his soft and effeminate way of living at once completes the enervation of his strength and of his courage.	false	856.85	869.11	21.883757
1769_143484_000011_000005	We may add, that there must be still a wider difference between man and man in a savage and domestic condition, than between beast and beast; for as men and beasts have been treated alike by nature, all the conveniences with which men indulge themselves more than they do the beasts tamed by them, are so many particular causes which make them degenerate more sensibly.	We may add, that there must be still a wider difference between man and man in a savage and domestic condition, than between beast and beast; for as men and beasts have been treated alike by nature, all the conveniences with which men indulge themselves more than they do the beasts tamed by them, are so many particular causes which make them degenerate more sensibly.	true	869.81	893.77	22.595718
1769_143484_000012_000000	Nakedness therefore, the want of houses, and of all these unnecessaries, which we consider as so very necessary, are not such mighty evils in respect to these primitive men, and much less still any obstacle to their preservation.	Nakedness therefore, the want of houses, and of all these unnecessaries, which we consider as so very necessary, are not such mighty evils in respect to these primitive men, and much less still any obstacle to their preservation.	true	895.22	909.88	22.126244
1769_143484_000012_000001	Their skins, it is true, are destitute of hair; but then they have no occasion for any such covering in warm climates; and in cold climates they soon learn to apply to that use those of the animals they have conquered; they have but two feet to run with, but they have two hands to defend themselves with, and provide for all their wants; it costs them perhaps a great deal of time and trouble to make their children walk, but the mothers carry them with ease; an advantage not granted to other species of animals, with whom the mother, when pursued, is obliged to abandon her young ones, or regulate her steps by theirs.	Their skins, it is true, are destitute of hair; but then they have no occasion for any such covering in warm climates; and in cold climates they soon learn to apply to that use those of the animals they have conquered; they have but two feet to run with, but they have two hands to defend themselves with, and provide for all their wants; it costs them perhaps a great deal of time and trouble to make their children walk, but the mothers carry them with ease; an advantage not granted to other species of animals, with whom the mother, when pursued, is obliged to abandon her young ones, or regulate her steps by theirs.	false	910.13	946.21	22.96059
1769_143484_000012_000002	In short, unless we admit those singular and fortuitous concurrences of circumstances, which I shall speak of hereafter, and which, it is very possible, may never have existed, it is evident, in every state of the question, that the man, who first made himself clothes and built himself a cabin, supplied himself with things which he did not much want, since he had lived without them till then; and why should he not have been able to support in his riper years, the same kind of life, which he had supported from his infancy?	In short, unless we admit those singular and fortuitous concurrences of circumstances, which I shall speak of hereafter, and which, it is very possible, may never have existed, it is evident, in every state of the question, that the man, who first made himself clothes and built himself a cabin, supplied himself with things which he did not much want, since he had lived without them till then; and why should he not have been able to support in his riper years, the same kind of life, which he had supported from his infancy?	false	947.39	976.33	22.727297
1769_143484_000013_000000	Alone, idle, and always surrounded with danger, savage man must be fond of sleep, and sleep lightly like other animals, who think but little, and may, in a manner, be said to sleep all the time they do not think: self-preservation being almost his only concern, he must exercise those faculties most, which are most serviceable in attacking and in defending, whether to subdue his prey, or to prevent his becoming that of other animals: those organs, on the contrary, which softness and sensuality can alone improve, must remain in a state of rudeness, utterly incompatible with all manner of delicacy; and as his senses are divided on this point, his touch and his taste must be extremely coarse and blunt; his sight, his hearing, and his smelling equally subtle: such is the animal state in general, and accordingly if we may believe travellers, it is that of most savage nations.	Alone, idle, and always surrounded with danger, savage man must be fond of sleep, and sleep lightly like other animals, who think but little, and may, in a manner, be said to sleep all the time they do not think: self preservation being almost his only concern, he must exercise those faculties most, which are most serviceable in attacking and in defending, whether to subdue his prey, or to prevent his becoming that of other animals: those organs, on the contrary, which softness and sensuality can alone improve, must remain in a state of rudeness, utterly incompatible with all manner of delicacy; and as his senses are divided on this point, his touch and his taste must be extremely coarse and blunt; his sight, his hearing, and his smelling equally subtle: such is the animal state in general, and accordingly if we may believe travellers, it is that of most savage nations.	false	977.33	1032.82	21.876287
1769_143484_000013_000001	We must not therefore be surprised, that the Hottentots of the Cape of Good Hope, distinguish with their naked eyes ships on the ocean, at as great a distance as the Dutch can discern them with their glasses; nor that the savages of America should have tracked the Spaniards with their noses, to as great a degree of exactness, as the best dogs could have done; nor that all these barbarous nations support nakedness without pain, use such large quantities of Piemento to give their food a relish, and drink like water the strongest liquors of Europe.	We must not therefore be surprised, that the Hottentots of the Cape of Good Hope, distinguish with their naked eyes ships on the ocean, at as great a distance as the Dutch can discern them with their glasses; nor that the savages of America should have tracked the Spaniards with their noses, to as great a degree of exactness, as the best dogs could have done; nor that all these barbarous nations support nakedness without pain, use such large quantities of Piemento to give their food a relish, and drink like water the strongest liquors of Europe.	false	1032.95	1072.05	23.28064
