1322_137588_000000_000000	Now is there any here, said Arthur, that knoweth King Rience?	Now is there any here, said Arthur, that knoweth King Rience?	false	0	3.51	21.80089
1322_137588_000000_000001	Then answered a knight that hight Naram, Sir, I know the king well; he is a passing good man of his body, as few be living, and a passing proud man, and Sir, doubt ye not he will make war on you with a mighty puissance. Well, said Arthur, I shall ordain for him in short time.	Then answered a knight that hight Naram, Sir, I know the king well; he is a passing good man of his body, as few be living, and a passing proud man, and Sir, doubt ye not he will make war on you with a mighty puissance. Well, said Arthur, I shall ordain for him in short time.	false	3.51	8.16	21.945156
1322_137588_000001_000000	CHAPTER XXVII.	CHAPTER twenty seven.	false	8.16	8.4	-20
1322_137588_000001_000001	How all the children were sent for that were born on May-day, and how Mordred was saved.	How all the children were sent for that were born on May day, and how Mordred was saved.	false	8.4	8.85	48
1322_137588_000002_000000	THEN King Arthur let send for all the children born on May-day, begotten of lords and born of ladies; for Merlin told King Arthur that he that should destroy him should be born on May-day, wherefore he sent for them all, upon pain of death; and so there were found many lords' sons, and all were sent unto the king, and so was Mordred sent by King Lot's wife, and all were put in a ship to the sea, and some were four weeks old, and some less.	THEN King Arthur let send for all the children born on May day, begotten of lords and born of ladies; for Merlin told King Arthur that he that should destroy him should be born on May day, wherefore he sent for them all, upon pain of death; and so there were found many lords' sons, and all were sent unto the king, and so was Mordred sent by King Lot's wife, and all were put in a ship to the sea, and some were four weeks old, and some less.	false	8.85	10.35	9
1322_137588_000002_000001	And so by fortune the ship drave unto a castle, and was all to-riven, and destroyed the most part, save that Mordred was cast up, and a good man found him, and nourished him till he was fourteen year old, and then he brought him to the court, as it rehearseth afterward, toward the end of the Death of Arthur.	And so by fortune the ship drave unto a castle, and was all to riven, and destroyed the most part, save that Mordred was cast up, and a good man found him, and nourished him till he was fourteen year old, and then he brought him to the court, as it rehearseth afterward, toward the end of the Death of Arthur.	false	10.35	16.62	20.605976
1322_137588_000002_000002	So many lords and barons of this realm were displeased, for their children were so lost, and many put the wite on Merlin more than on Arthur; so what for dread and for love, they held their peace.	So many lords and barons of this realm were displeased, for their children were so lost, and many put the wite on Merlin more than on Arthur; so what for dread and for love, they held their peace.	false	16.62	19.8	28.8439
1322_137588_000002_000003	But when the messenger came to King Rience, then was he wood out of measure, and purveyed him for a great host, as it rehearseth after in the book of Balin le Savage, that followeth next after, how by adventure Balin gat the sword.	But when the messenger came to King Rience, then was he wood out of measure, and purveyed him for a great host, as it rehearseth after in the book of Balin le Savage, that followeth next after, how by adventure Balin gat the sword.	false	19.8	23.67	21.56569
1322_137588_000003_000000	Explicit liber primus.	Explicit liber primus.	false	23.67	24.15	25.795727
1322_137588_000003_000001	Incipit liber secundus	Incipit liber secundus	false	24.15	24.63	8
1322_137588_000004_000000	BOOK II.	BOOK two.	true	24.63	25.29	25
1322_137588_000005_000000	CHAPTER I. Of a damosel which came girt with a sword for to find a man of such virtue to draw it out of the scabbard.	CHAPTER one Of a damosel which came girt with a sword for to find a man of such virtue to draw it out of the scabbard.	false	25.29	31.65	21.043844
1322_137588_000006_000000	AFTER the death of Uther Pendragon reigned Arthur his son, the which had great war in his days for to get all England into his hand.	AFTER the death of Uther Pendragon reigned Arthur his son, the which had great war in his days for to get all England into his hand.	true	31.65	39.4	16
1322_137588_000006_000001	For there were many kings within the realm of England, and in Wales, Scotland, and Cornwall.	For there were many kings within the realm of England, and in Wales, Scotland, and Cornwall.	true	39.98	44.59	15
1322_137588_000006_000002	So it befell on a time when King Arthur was at London, there came a knight and told the king tidings how that the King Rience of North Wales had reared a great number of people, and were entered into the land, and burnt and slew the king's true liege people.	So it befell on a time when King Arthur was at London, there came a knight and told the king tidings how that the King Rience of North Wales had reared a great number of people, and were entered into the land, and burnt and slew the king's true liege people.	true	45.53	59.92	22
1322_137588_000006_000003	If this be true, said Arthur, it were great shame unto mine estate but that he were mightily withstood.	If this be true, said Arthur, it were great shame unto mine estate but that he were mightily withstood.	true	60.74	66.94	21.657446
1322_137588_000006_000004	It is truth, said the knight, for I saw the host myself.	It is truth, said the knight, for I saw the host myself.	true	67.7	71.05	20.579775
1322_137588_000006_000005	Well, said the king, let make a cry, that all the lords, knights, and gentlemen of arms, should draw unto a castle called Camelot in those days, and there the king would let make a council-general and a great jousts.	Well, said the king, let make a cry, that all the lords, knights, and gentlemen of arms, should draw unto a castle called Camelot in those days, and there the king would let make a council general and a great jousts.	true	71.84	84.52	20.832256
1322_137588_000007_000000	So when the king was come thither with all his baronage, and lodged as they seemed best, there was come a damosel the which was sent on message from the great lady Lile of Avelion.	So when the king was come thither with all his baronage, and lodged as they seemed best, there was come a damosel the which was sent on message from the great lady Lile of Avelion.	false	86.99	97.03	19
1322_137588_000007_000001	And when she came before King Arthur, she told from whom she came, and how she was sent on message unto him for these causes.	And when she came before King Arthur, she told from whom she came, and how she was sent on message unto him for these causes.	true	97.64	104.62	20
1322_137588_000007_000002	Then she let her mantle fall that was richly furred; and then was she girt with a noble sword whereof the king had marvel, and said, Damosel, for what cause are ye girt with that sword? it beseemeth you not.	Then she let her mantle fall that was richly furred; and then was she girt with a noble sword whereof the king had marvel, and said, Damosel, for what cause are ye girt with that sword? it beseemeth you not.	true	105.5	117.76	20.871443
1322_137588_000007_000003	Now shall I tell you, said the damosel; this sword that I am girt withal doth me great sorrow and cumbrance, for I may not be delivered of this sword but by a knight, but he must be a passing good man of his hands and of his deeds, and without villainy or treachery, and without treason.	Now shall I tell you, said the damosel; this sword that I am girt withal doth me great sorrow and cumbrance, for I may not be delivered of this sword but by a knight, but he must be a passing good man of his hands and of his deeds, and without villainy or treachery, and without treason.	false	118.85	135.01	20.25899
1322_137588_000007_000004	And if I may find such a knight that hath all these virtues, he may draw out this sword out of the sheath, for I have been at King Rience's it was told me there were passing good knights, and he and all his knights have assayed it and none can speed. This is a great marvel, said Arthur, if this be sooth; I will myself assay to draw out the sword, not presuming upon myself that I am the best knight, but that I will begin to draw at your sword in giving example to all the barons that they shall assay everych one after other when I have assayed it.	And if I may find such a knight that hath all these virtues, he may draw out this sword out of the sheath, for I have been at King Rience's it was told me there were passing good knights, and he and all his knights have assayed it and none can speed. This is a great marvel, said Arthur, if this be sooth; I will myself assay to draw out the sword, not presuming upon myself that I am the best knight, but that I will begin to draw at your sword in giving example to all the barons that they shall assay everych one after other when I have assayed it.	true	135.8	168.28	19.86835
1322_137588_000007_000005	Then Arthur took the sword by the sheath and by the girdle and pulled at it eagerly, but the sword would not out.	Then Arthur took the sword by the sheath and by the girdle and pulled at it eagerly, but the sword would not out.	true	169.46	175.6	22.90956
1322_137588_000008_000000	Sir, said the damosel, you need not to pull half so hard, for he that shall pull it out shall do it with little might.	Sir, said the damosel, you need not to pull half so hard, for he that shall pull it out shall do it with little might.	true	176.87	183.88	22.874596
1322_137588_000008_000001	Ye say well, said Arthur; now assay ye all my barons; but beware ye be not defiled with shame, treachery, nor guile.	Ye say well, said Arthur; now assay ye all my barons; but beware ye be not defiled with shame, treachery, nor guile.	true	184.64	192.73	17.760868
1322_137588_000008_000002	Then it will not avail, said the damosel, for he must be a clean knight without villainy, and of a gentle strain of father side and mother side.	Then it will not avail, said the damosel, for he must be a clean knight without villainy, and of a gentle strain of father side and mother side.	true	193.82	201.67	18.337635
1322_137588_000008_000003	Most of all the barons of the Round Table that were there at that time assayed all by row, but there might none speed; wherefore the damosel made great sorrow out of measure, and said, Alas!	Most of all the barons of the Round Table that were there at that time assayed all by row, but there might none speed; wherefore the damosel made great sorrow out of measure, and said, Alas!	true	203.03	214.36	19.818779
1322_137588_000008_000004	I weened in this court had been the best knights without treachery or treason.	I weened in this court had been the best knights without treachery or treason.	true	214.46	218.23	16
1322_137588_000008_000005	By my faith, said Arthur, here are good knights, as I deem, as any be in the world, but their grace is not to help you, wherefore I am displeased.	By my faith, said Arthur, here are good knights, as I deem, as any be in the world, but their grace is not to help you, wherefore I am displeased.	true	218.81	228.73	20.666422
1322_137588_000009_000000	CHAPTER II.	CHAPTER two.	true	231.41	232.26	28.99315
1322_137588_000009_000001	How Balin, arrayed like a poor knight, pulled out the sword, which afterward was the cause of his death.	How Balin, arrayed like a poor knight, pulled out the sword, which afterward was the cause of his death.	false	232.26	234.27	8.536594
1322_137588_000010_000000	THEN fell it so that time there was a poor knight with King Arthur, that had been prisoner with him half a year and more for slaying of a knight, the which was cousin unto King Arthur.	THEN fell it so that time there was a poor knight with King Arthur, that had been prisoner with him half a year and more for slaying of a knight, the which was cousin unto King Arthur.	false	234.27	243.4	19
1322_137588_000010_000001	The name of this knight was called Balin, and by good means of the barons he was delivered out of prison, for he was a good man named of his body, and he was born in Northumberland.	The name of this knight was called Balin, and by good means of the barons he was delivered out of prison, for he was a good man named of his body, and he was born in Northumberland.	true	244.25	254.41	18.972717
1322_137588_000010_000002	And so he went privily into the court, and saw this adventure, whereof it raised his heart, and he would assay it as other knights did, but for he was poor and poorly arrayed he put him not far in press.	And so he went privily into the court, and saw this adventure, whereof it raised his heart, and he would assay it as other knights did, but for he was poor and poorly arrayed he put him not far in press.	true	255.11	266.38	21.341597
1322_137588_000010_000003	But in his heart he was fully assured to do as well, if his grace happed him, as any knight that there was.	But in his heart he was fully assured to do as well, if his grace happed him, as any knight that there was.	true	267.23	273.1	19.886868
1322_137588_000010_000004	And as the damosel took her leave of Arthur and of all the barons, so departing, this knight Balin called unto her, and said, Damosel, I pray you of your courtesy, suffer me as well to assay as these lords; though that I be so poorly clothed, in my heart meseemeth I am fully assured as some of these others, and meseemeth in my heart to speed right well.	And as the damosel took her leave of Arthur and of all the barons, so departing, this knight Balin called unto her, and said, Damosel, I pray you of your courtesy, suffer me as well to assay as these lords; though that I be so poorly clothed, in my heart meseemeth I am fully assured as some of these others, and meseemeth in my heart to speed right well.	true	274.04	295.81	20.564604
1322_137588_000010_000005	The damosel beheld the poor knight, and saw he was a likely man, but for his poor arrayment she thought he should be of no worship without villainy or treachery.	The damosel beheld the poor knight, and saw he was a likely man, but for his poor arrayment she thought he should be of no worship without villainy or treachery.	true	296.87	304.66	15
1322_137588_000010_000006	And then she said unto the knight, Sir, it needeth not to put me to more pain or labour, for it seemeth not you to speed there as other have failed.	And then she said unto the knight, Sir, it needeth not to put me to more pain or labour, for it seemeth not you to speed there as other have failed.	true	305.69	313.69	20
1322_137588_000010_000007	Ah! fair damosel, said Balin, worthiness, and good tatches, and good deeds, are not only in arrayment, but manhood and worship is hid within man's person, and many a worshipful knight is not known unto all people, and therefore worship and hardiness is not in arrayment.	Ah! fair damosel, said Balin, worthiness, and good tatches, and good deeds, are not only in arrayment, but manhood and worship is hid within man's person, and many a worshipful knight is not known unto all people, and therefore worship and hardiness is not in arrayment.	true	314.09	331.36	20.005175
1322_137588_000010_000008	By God, said the damosel, ye say sooth; therefore ye shall assay to do what ye may.	By God, said the damosel, ye say sooth; therefore ye shall assay to do what ye may.	true	332.06	337.21	19.422102
1322_137588_000010_000009	Then Balin took the sword by the girdle and sheath, and drew it out easily; and when he looked on the sword it pleased him much.	Then Balin took the sword by the girdle and sheath, and drew it out easily; and when he looked on the sword it pleased him much.	true	338.45	344.89	24
1322_137588_000010_000010	Then had the king and all the barons great marvel that Balin had done that adventure, and many knights had great despite of Balin.	Then had the king and all the barons great marvel that Balin had done that adventure, and many knights had great despite of Balin.	true	345.86	352.18	17
1322_137588_000010_000011	Certes, said the damosel, this is a passing good knight, and the best that ever I found, and most of worship without treason, treachery, or villainy, and many marvels shall he do.	Certes, said the damosel, this is a passing good knight, and the best that ever I found, and most of worship without treason, treachery, or villainy, and many marvels shall he do.	true	353.3	363.49	19
1322_137588_000010_000012	Now, gentle and courteous knight, give me the sword again.	Now, gentle and courteous knight, give me the sword again.	true	364.01	367.24	18.50025
1322_137588_000010_000013	Nay, said Balin, for this sword will I keep, but it be taken from me with force.	Nay, said Balin, for this sword will I keep, but it be taken from me with force.	true	367.55	372.67	22.204601
1322_137588_000010_000014	Well, said the damosel, ye are not wise to keep the sword from me, for ye shall slay with the sword the best friend that ye have, and the man that ye most love in the world, and the sword shall be your destruction.	Well, said the damosel, ye are not wise to keep the sword from me, for ye shall slay with the sword the best friend that ye have, and the man that ye most love in the world, and the sword shall be your destruction.	true	373.55	384.94	18.364029
1322_137588_000010_000015	I shall take the adventure, said Balin, that God will ordain me, but the sword ye shall not have at this time, by the faith of my body.	I shall take the adventure, said Balin, that God will ordain me, but the sword ye shall not have at this time, by the faith of my body.	false	386.06	394.18	20.218859
1322_137588_000010_000016	Ye shall repent it within short time, said the damosel, for I would have the sword more for your avail than for mine, for I am passing heavy for your sake; for ye will not believe that sword shall be your destruction, and that is great pity. With that the damosel departed, making great sorrow.	Ye shall repent it within short time, said the damosel, for I would have the sword more for your avail than for mine, for I am passing heavy for your sake; for ye will not believe that sword shall be your destruction, and that is great pity. With that the damosel departed, making great sorrow.	false	394.82	411.7	18.139658
1322_137588_000011_000000	Anon after, Balin sent for his horse and armour, and so would depart from the court, and took his leave of King Arthur.	Anon after, Balin sent for his horse and armour, and so would depart from the court, and took his leave of King Arthur.	true	412.91	419.17	20.211496
1322_137588_000011_000001	Nay, said the king, I suppose ye will not depart so lightly from this fellowship, I suppose ye are displeased that I have shewed you unkindness; blame me the less, for I was misinformed against you, but I weened ye had not been such a knight as ye are, of worship and prowess, and if ye will abide in this court among my fellowship, I shall so advance you as ye shall be pleased.	Nay, said the king, I suppose ye will not depart so lightly from this fellowship, I suppose ye are displeased that I have shewed you unkindness; blame me the less, for I was misinformed against you, but I weened ye had not been such a knight as ye are, of worship and prowess, and if ye will abide in this court among my fellowship, I shall so advance you as ye shall be pleased.	false	419.69	441.97	20.053097
1322_137588_000011_000002	God thank your highness, said Balin, your bounty and highness may no man praise half to the value; but at this time I must needs depart, beseeching you alway of your good grace.	God thank your highness, said Balin, your bounty and highness may no man praise half to the value; but at this time I must needs depart, beseeching you alway of your good grace.	false	443.06	453.37	20.500765
1322_137588_000011_000003	Truly, said the king, I am right wroth for your departing; I pray you, fair knight, that ye tarry not long, and ye shall be right welcome to me, and to my barons, and I shall amend all miss that I have done against you; God thank your great lordship, said Balin, and therewith made him ready to depart.	Truly, said the king, I am right wroth for your departing; I pray you, fair knight, that ye tarry not long, and ye shall be right welcome to me, and to my barons, and I shall amend all miss that I have done against you; God thank your great lordship, said Balin, and therewith made him ready to depart.	false	454.13	471.67	21.801191
1322_137588_000011_000004	Then the most part of the knights of the Round Table said that Balin did not this adventure all only by might, but by witchcraft.	Then the most part of the knights of the Round Table said that Balin did not this adventure all only by might, but by witchcraft.	true	472.61	480.25	20.40841
1322_137588_000012_000000	CHAPTER III.	CHAPTER three.	true	482.96	483.84	23.589043
1322_137588_000012_000001	How the Lady of the Lake demanded the knight's head that had won the sword, or the maiden's head.	How the Lady of the Lake demanded the knight's head that had won the sword, or the maiden's head.	false	483.84	485.64	27.439655
1322_137588_000013_000000	THE meanwhile, that this knight was making him ready to depart, there came into the court a lady that hight the Lady of the Lake.	THE meanwhile, that this knight was making him ready to depart, there came into the court a lady that hight the Lady of the Lake.	false	485.64	492.1	20.736347
1322_137588_000013_000001	And she came on horseback, richly beseen, and saluted King Arthur, and there asked him a gift that he promised her when she gave him the sword.	And she came on horseback, richly beseen, and saluted King Arthur, and there asked him a gift that he promised her when she gave him the sword.	true	492.65	500.17	20.115635
1322_137588_000013_000002	That is sooth, said Arthur, a gift I promised you, but I have forgotten the name of my sword that ye gave me.	That is sooth, said Arthur, a gift I promised you, but I have forgotten the name of my sword that ye gave me.	false	500.84	506.95	21.728493
1322_137588_000013_000003	The name of it, said the lady, is Excalibur, that is as much to say as Cut-steel.	The name of it, said the lady, is Excalibur, that is as much to say as Cut steel.	true	507.89	513.42	22.91162
1322_137588_000013_000004	Ye say well, said the king; ask what ye will and ye shall have it, an it lie in my power to give it.	Ye say well, said the king; ask what ye will and ye shall have it, an it lie in my power to give it.	false	513.42	519.49	19.263405
1322_137588_000013_000005	Well, said the lady, I ask the head of the knight that hath won the sword, or else the damosel's head that brought it; I take no force though I have both their heads, for he slew my brother, a good knight and a true, and that gentlewoman was causer of my father's death. Truly, said King Arthur, I may not grant neither of their heads with my worship, therefore ask what ye will else, and I shall fulfil your desire.	Well, said the lady, I ask the head of the knight that hath won the sword, or else the damosel's head that brought it; I take no force though I have both their heads, for he slew my brother, a good knight and a true, and that gentlewoman was causer of my father's death. Truly, said King Arthur, I may not grant neither of their heads with my worship, therefore ask what ye will else, and I shall fulfil your desire.	false	520.52	545.68	19.76139
1322_137588_000013_000006	I will ask none other thing, said the lady.	I will ask none other thing, said the lady.	true	546.98	549.28	20
1322_137588_000013_000007	When Balin was ready to depart, he saw the Lady of the Lake, that by her means had slain Balin's mother, and he had sought her three years; and when it was told him that she asked his head of King Arthur, he went to her straight and said, Evil be you found; ye would have my head, and therefore ye shall lose yours, and with his sword lightly he smote off her head before King Arthur.	When Balin was ready to depart, he saw the Lady of the Lake, that by her means had slain Balin's mother, and he had sought her three years; and when it was told him that she asked his head of King Arthur, he went to her straight and said, Evil be you found; ye would have my head, and therefore ye shall lose yours, and with his sword lightly he smote off her head before King Arthur.	false	550.31	571.81	18.84529
1322_137588_000013_000008	Alas, for shame! said Arthur, why have ye done so?	Alas, for shame! said Arthur, why have ye done so?	true	573.05	576.66	17.942867
1322_137588_000013_000009	ye have shamed me and all my court, for this was a lady that I was beholden to, and hither she came under my safe-conduct; I shall never forgive you that trespass.	ye have shamed me and all my court, for this was a lady that I was beholden to, and hither she came under my safe conduct; I shall never forgive you that trespass.	false	576.66	586.84	19.45458
