1322_137588_000013_000010	Sir, said Balin, me forthinketh of your displeasure, for this same lady was the untruest lady living, and by enchantment and sorcery she hath been the destroyer of many good knights, and she was causer that my mother was burnt, through her falsehood and treachery. What cause soever ye had, said Arthur, ye should have forborne her in my presence; therefore, think not the contrary, ye shall repent it, for such another despite had I never in my court; therefore withdraw you out of my court in all haste ye may.	Sir, said Balin, me forthinketh of your displeasure, for this same lady was the untruest lady living, and by enchantment and sorcery she hath been the destroyer of many good knights, and she was causer that my mother was burnt, through her falsehood and treachery. What cause soever ye had, said Arthur, ye should have forborne her in my presence; therefore, think not the contrary, ye shall repent it, for such another despite had I never in my court; therefore withdraw you out of my court in all haste ye may.	false	587.96	619.3	19.944996
1322_137588_000014_000000	Then Balin took up the head of the lady, and bare it with him to his hostelry, and there he met with his squire, that was sorry he had displeased King Arthur and so they rode forth out of the town.	Then Balin took up the head of the lady, and bare it with him to his hostelry, and there he met with his squire, that was sorry he had displeased King Arthur and so they rode forth out of the town.	true	620.96	631.48	20.461737
1322_137588_000014_000001	Now, said Balin, we must depart, take thou this head and bear it to my friends, and tell them how I have sped, and tell my friends in Northumberland that my most foe is dead.	Now, said Balin, we must depart, take thou this head and bear it to my friends, and tell them how I have sped, and tell my friends in Northumberland that my most foe is dead.	true	632.12	642.73	21.243881
1322_137588_000014_000002	Also tell them how I am out of prison, and what adventure befell me at the getting of this sword.	Also tell them how I am out of prison, and what adventure befell me at the getting of this sword.	true	643.58	648.43	16
1322_137588_000014_000003	Alas! said the squire, ye are greatly to blame for to displease King Arthur.	Alas! said the squire, ye are greatly to blame for to displease King Arthur.	true	648.77	653.41	18.199175
1322_137588_000014_000004	As for that, said Balin, I will hie me, in all the haste that I may, to meet with King Rience and destroy him, either else to die therefore; and if it may hap me to win him, then will King Arthur be my good and gracious lord.	As for that, said Balin, I will h i e me, in all the haste that I may, to meet with King Rience and destroy him, either else to die therefore; and if it may hap me to win him, then will King Arthur be my good and gracious lord.	false	654.29	668.26	20.554216
1322_137588_000014_000005	Where shall I meet with you? said the squire.	Where shall I meet with you? said the squire.	false	669.23	671.32	19.963062
1322_137588_000014_000006	In King Arthur's court, said Balin.	In King Arthur's court, said Balin.	true	671.78	673.72	24
1322_137588_000014_000007	So his squire and he departed at that time.	So his squire and he departed at that time.	true	674.81	677.47	19.384958
1322_137588_000014_000008	Then King Arthur and all the court made great dole and had shame of the death of the Lady of the Lake.	Then King Arthur and all the court made great dole and had shame of the death of the Lady of the Lake.	true	678.65	683.86	17
1322_137588_000014_000009	Then the king buried her richly.	Then the king buried her richly.	true	684.05	685.9	22
1322_137588_000015_000000	CHAPTER IV.	CHAPTER four.	true	688.07	689.04	21.76394
1322_137588_000015_000001	How Merlin told the adventure of this damosel.	How Merlin told the adventure of this damosel.	false	689.04	690.03	4
1322_137588_000016_000000	AT that time there was a knight, the which was the king's son of Ireland, and his name was Lanceor, the which was an orgulous knight, and counted himself one of the best of the court; and he had great despite at Balin for the achieving of the sword, that any should be accounted more hardy, or more of prowess; and he asked King Arthur if he would give him leave to ride after Balin and to revenge the despite that he had done.	AT that time there was a knight, the which was the king's son of Ireland, and his name was Lanceor, the which was an orgulous knight, and counted himself one of the best of the court; and he had great despite at Balin for the achieving of the sword, that any should be accounted more hardy, or more of prowess; and he asked King Arthur if he would give him leave to ride after Balin and to revenge the despite that he had done.	false	690.03	712.87	21.205667
1322_137588_000016_000001	Do your best, said Arthur, I am right wroth with Balin; I would he were quit of the despite that he hath done to me and to my court.	Do your best, said Arthur, I am right wroth with Balin; I would he were quit of the despite that he hath done to me and to my court.	false	713.6	720.94	21.265903
1322_137588_000016_000002	Then this Lanceor went to his hostelry to make him ready.	Then this Lanceor went to his hostelry to make him ready.	true	721.79	724.99	15
1322_137588_000016_000003	In the meanwhile came Merlin unto the court of King Arthur, and there was told him the adventure of the sword, and the death of the Lady of the Lake. Now shall I say you, said Merlin; this same damosel that here standeth, that brought the sword unto your court, I shall tell you the cause of her coming: she was the falsest damosel that liveth.	In the meanwhile came Merlin unto the court of King Arthur, and there was told him the adventure of the sword, and the death of the Lady of the Lake. Now shall I say you, said Merlin; this same damosel that here standeth, that brought the sword unto your court, I shall tell you the cause of her coming: she was the falsest damosel that liveth.	true	725.99	748.27	19.519285
1322_137588_000016_000004	Say not so, said they.	Say not so, said they.	true	748.94	750.55	21.48526
1322_137588_000016_000005	She hath a brother, a passing good knight of prowess and a full true man; and this damosel loved another knight that held her to paramour, and this good knight her brother met with the knight that held her to paramour, and slew him by force of his hands.	She hath a brother, a passing good knight of prowess and a full true man; and this damosel loved another knight that held her to paramour, and this good knight her brother met with the knight that held her to paramour, and slew him by force of his hands.	true	751.61	765.7	20.0889
1322_137588_000016_000006	When this false damosel understood this, she went to the Lady Lile of Avelion, and besought her of help, to be avenged on her own brother.	When this false damosel understood this, she went to the Lady Lile of Avelion, and besought her of help, to be avenged on her own brother.	false	766.28	776.98	19.686153
1322_137588_000017_000000	CHAPTER V. How Balin was pursued by Sir Lanceor, knight of Ireland, and how he jousted and slew him.	CHAPTER five How Balin was pursued by Sir Lanceor, knight of Ireland, and how he jousted and slew him.	false	777.08	780	21.521006
1322_137588_000018_000000	AND so this Lady Lile of Avelion took her this sword that she brought with her, and told there should no man pull it out of the sheath but if he be one of the best knights of this realm, and he should be hard and full of prowess, and with that sword he should slay her brother.	AND so this Lady Lile of Avelion took her this sword that she brought with her, and told there should no man pull it out of the sheath but if he be one of the best knights of this realm, and he should be hard and full of prowess, and with that sword he should slay her brother.	false	780	794.8	17.82253
1322_137588_000018_000001	This was the cause that the damosel came into this court.	This was the cause that the damosel came into this court.	true	795.71	798.76	21
1322_137588_000018_000002	I know it as well as ye.	I know it as well as ye.	false	798.8	801.3	21.972717
1322_137588_000018_000003	Would God she had not come into this court, but she came never in fellowship of worship to do good, but always great harm; and that knight that hath achieved the sword shall be destroyed by that sword, for the which will be great damage, for there liveth not a knight of more prowess than he is, and he shall do unto you, my Lord Arthur, great honour and kindness; and it is great pity he shall not endure but a while, for of his strength and hardiness I know not his match living.	Would God she had not come into this court, but she came never in fellowship of worship to do good, but always great harm; and that knight that hath achieved the sword shall be destroyed by that sword, for the which will be great damage, for there liveth not a knight of more prowess than he is, and he shall do unto you, my Lord Arthur, great honour and kindness; and it is great pity he shall not endure but a while, for of his strength and hardiness I know not his match living.	true	801.3	829.06	20.958956
1322_137588_000019_000000	So the knight of Ireland armed him at all points, and dressed his shield on his shoulder, and mounted upon horseback, and took his spear in his hand, and rode after a great pace, as much as his horse might go; and within a little space on a mountain he had a sight of Balin, and with a loud voice he cried, Abide, knight, for ye shall abide whether ye will or nill, and the shield that is to-fore you shall not help.	So the knight of Ireland armed him at all points, and dressed his shield on his shoulder, and mounted upon horseback, and took his spear in his hand, and rode after a great pace, as much as his horse might go; and within a little space on a mountain he had a sight of Balin, and with a loud voice he cried, Abide, knight, for ye shall abide whether ye will or nill, and the shield that is to fore you shall not help.	false	830.99	855.43	18.670244
1322_137588_000019_000001	When Balin heard the noise, he turned his horse fiercely, and said, Fair knight, what will ye with me, will ye joust with me?	When Balin heard the noise, he turned his horse fiercely, and said, Fair knight, what will ye with me, will ye joust with me?	true	856.19	863.5	19.469423
1322_137588_000019_000002	Yea, said the Irish knight, therefore come I after you.	Yea, said the Irish knight, therefore come I after you.	false	864.17	867.4	20.210495
1322_137588_000019_000003	Peradventure, said Balin, it had been better to have holden you at home, for many a man weeneth to put his enemy to a rebuke, and oft it falleth to himself.	Peradventure, said Balin, it had been better to have holden you at home, for many a man weeneth to put his enemy to a rebuke, and oft it falleth to himself.	true	868.37	877.93	22.52416
1322_137588_000019_000004	Of what court be ye sent from? said Balin.	Of what court be ye sent from? said Balin.	false	878.45	880.93	22
1322_137588_000019_000005	I am come from the court of King Arthur, said the knight of Ireland, that come hither for to revenge the despite ye did this day to King Arthur and to his court.	I am come from the court of King Arthur, said the knight of Ireland, that come hither for to revenge the despite ye did this day to King Arthur and to his court.	false	881.9	890.08	20
1322_137588_000019_000006	Well, said Balin, I see well I must have ado with you, that me forthinketh for to grieve King Arthur, or any of his court; and your quarrel is full simple, said Balin, unto me, for the lady that is dead, did me great damage, and else would I have been loath as any knight that liveth for to slay a lady.	Well, said Balin, I see well I must have ado with you, that me forthinketh for to grieve King Arthur, or any of his court; and your quarrel is full simple, said Balin, unto me, for the lady that is dead, did me great damage, and else would I have been loath as any knight that liveth for to slay a lady.	true	890.81	908.44	19.546396
1322_137588_000019_000007	Make you ready, said the knight Lanceor, and dress you unto me, for that one shall abide in the field.	Make you ready, said the knight Lanceor, and dress you unto me, for that one shall abide in the field.	false	909.38	914.95	18.192348
1322_137588_000019_000008	Then they took their spears, and came together as much as their horses might drive, and the Irish knight smote Balin on the shield, that all went shivers off his spear, and Balin hit him through the shield, and the hauberk perished, and so pierced through his body and the horse's croup, and anon turned his horse fiercely, and drew out his sword, and wist not that he had slain him; and then he saw him lie as a dead corpse.	Then they took their spears, and came together as much as their horses might drive, and the Irish knight smote Balin on the shield, that all went shivers off his spear, and Balin hit him through the shield, and the hauberk perished, and so pierced through his body and the horse's croup, and anon turned his horse fiercely, and drew out his sword, and wist not that he had slain him; and then he saw him lie as a dead corpse.	true	915.89	939.88	20.085554
1322_137588_000020_000000	CHAPTER VI.	CHAPTER six.	true	942.38	943.38	27.989681
1322_137588_000020_000001	How a damosel, which was love to Lanceor, slew herself for love, and how Balin met with his brother Balan.	How a damosel, which was love to Lanceor, slew herself for love, and how Balin met with his brother Balan.	false	943.38	944.685	-20
1322_137588_000021_000000	THEN he looked by him, and was ware of a damosel that came riding full fast as the horse might ride, on a fair palfrey.	THEN he looked by him, and was ware of a damosel that came riding full fast as the horse might ride, on a fair palfrey.	true	944.685	951.22	14
1322_137588_000021_000001	And when she espied that Lanceor was slain, she made sorrow out of measure, and said, O Balin, two bodies thou hast slain and one heart, and two hearts in one body, and two souls thou hast lost.	And when she espied that Lanceor was slain, she made sorrow out of measure, and said, O Balin, two bodies thou hast slain and one heart, and two hearts in one body, and two souls thou hast lost.	false	952.04	965.14	20.045954
1322_137588_000021_000002	And therewith she took the sword from her love that lay dead, and fell to the ground in a swoon.	And therewith she took the sword from her love that lay dead, and fell to the ground in a swoon.	true	965.84	970.96	21.196331
1322_137588_000021_000003	And when she arose she made great dole out of measure, the which sorrow grieved Balin passingly sore, and he went unto her for to have taken the sword out of her hand, but she held it so fast he might not take it out of her hand unless he should have hurt her, and suddenly she set the pommel to the ground, and rove herself through the body.	And when she arose she made great dole out of measure, the which sorrow grieved Balin passingly sore, and he went unto her for to have taken the sword out of her hand, but she held it so fast he might not take it out of her hand unless he should have hurt her, and suddenly she set the pommel to the ground, and rove herself through the body.	true	971.9	991.36	20.986559
1322_137588_000021_000004	When Balin espied her deeds, he was passing heavy in his heart, and ashamed that so fair a damosel had destroyed herself for the love of his death.	When Balin espied her deeds, he was passing heavy in his heart, and ashamed that so fair a damosel had destroyed herself for the love of his death.	false	992.39	1000.6	18
1322_137588_000021_000005	Alas, said Balin, me repenteth sore the death of this knight, for the love of this damosel, for there was much true love betwixt them both, and for sorrow might not longer behold him, but turned his horse and looked toward a great forest, and there he was ware, by the arms, of his brother Balan. And when they were met they put off their helms and kissed together, and wept for joy and pity.	Alas, said Balin, me repenteth sore the death of this knight, for the love of this damosel, for there was much true love betwixt them both, and for sorrow might not longer behold him, but turned his horse and looked toward a great forest, and there he was ware, by the arms, of his brother Balan. And when they were met they put off their helms and kissed together, and wept for joy and pity.	false	1001.51	1024.84	20.982048
1322_137588_000021_000006	Then Balan said, I little weened to have met with you at this sudden adventure; I am right glad of your deliverance out of your dolorous prisonment, for a man told me, in the castle of Four Stones, that ye were delivered, and that man had seen you in the court of King Arthur, and therefore I came hither into this country, for here I supposed to find you.	Then Balan said, I little weened to have met with you at this sudden adventure; I am right glad of your deliverance out of your dolorous prisonment, for a man told me, in the castle of Four Stones, that ye were delivered, and that man had seen you in the court of King Arthur, and therefore I came hither into this country, for here I supposed to find you.	true	1025.87	1045.63	20.05785
1322_137588_000021_000007	Anon the knight Balin told his brother of his adventure of the sword, and of the death of the Lady of the Lake, and how King Arthur was displeased with him.	Anon the knight Balin told his brother of his adventure of the sword, and of the death of the Lady of the Lake, and how King Arthur was displeased with him.	true	1046.78	1055.26	20.085709
1322_137588_000021_000008	Wherefore he sent this knight after me, that lieth here dead, and the death of this damosel grieveth me sore.	Wherefore he sent this knight after me, that lieth here dead, and the death of this damosel grieveth me sore.	true	1056.11	1062.28	19.972036
1322_137588_000021_000009	So doth it me, said Balan, but ye must take the adventure that God will ordain you.	So doth it me, said Balan, but ye must take the adventure that God will ordain you.	false	1063.1	1068.28	19.771938
1322_137588_000021_000010	Truly, said Balin, I am right heavy that my Lord Arthur is displeased with me, for he is the most worshipful knight that reigneth now on earth, and his love will I get or else will I put my life in adventure.	Truly, said Balin, I am right heavy that my Lord Arthur is displeased with me, for he is the most worshipful knight that reigneth now on earth, and his love will I get or else will I put my life in adventure.	false	1069.07	1081.42	20.54848
1322_137588_000021_000011	For the King Rience lieth at a siege at the Castle Terrabil, and thither will we draw in all haste, to prove our worship and prowess upon him.	For the King Rience lieth at a siege at the Castle Terrabil, and thither will we draw in all haste, to prove our worship and prowess upon him.	false	1082.18	1090.24	19.716763
1322_137588_000021_000012	I will well, said Balan, that we do, and we will help each other as brethren ought to do.	I will well, said Balan, that we do, and we will help each other as brethren ought to do.	false	1091.21	1106.64	17.889757
