8855_283242_000000_000000	Unable to find her young mistress, she packed her box, and, leaving it behind her, escaped to her father.	Unable to find her young mistress, she packed her box, and, leaving it behind her, escaped to her father.	false	0	7.95	17.154356
8855_283242_000000_000001	As soon as she had told him the story, he came straight to me.	As soon as she had told him the story, he came straight to me.	false	7.95	20.055	20.758547
8855_283242_000001_000000	CHAPTER XXXII.	CHAPTER thirty two.	true	20.055	21.46	19
8855_283242_000001_000001	THE NEXT THING.	THE NEXT THING.	true	21.62	23.565	17.383251
8855_283242_000002_000000	As I sat in my study, in the twilight of that same day, the door was hurriedly opened, and Judy entered.	As I sat in my study, in the twilight of that same day, the door was hurriedly opened, and Judy entered.	true	23.565	29.65	21.109632
8855_283242_000002_000001	She looked about the room with a quick glance to see that we were alone, then caught my hand in both of hers, and burst out crying.	She looked about the room with a quick glance to see that we were alone, then caught my hand in both of hers, and burst out crying.	true	29.66	36.04	21.741983
8855_283242_000003_000000	"Why, Judy!" I said, "what IS the matter?" But the sobs would not allow her to answer.	"Why, Judy!" I said, "what IS the matter?" But the sobs would not allow her to answer.	true	36.44	41.53	23.399857
8855_283242_000003_000001	I was too frightened to put any more questions, and so stood silent--my chest feeling like an empty tomb that waited for death to fill it.	I was too frightened to put any more questions, and so stood silent-my chest feeling like an empty tomb that waited for death to fill it.	true	41.69	49.33	21.107027
8855_283242_000003_000002	At length with a strong effort she checked the succession of her sobs, and spoke.	At length with a strong effort she checked the succession of her sobs, and spoke.	true	49.85	54.015	18.488195
8855_283242_000004_000000	"They are killing auntie.	"They are killing auntie.	true	54.015	55.395	23
8855_283242_000004_000001	She looks like a ghost already," said the child, again bursting into tears.	She looks like a ghost already," said the child, again bursting into tears.	true	55.395	59.77	22.74535
8855_283242_000005_000000	"Tell me, Judy, what CAN I do for her?"	"Tell me, Judy, what CAN I do for her?"	true	60.23	62.41	20.990465
8855_283242_000006_000000	"You must find out, Mr Walton.	"You must find out, Mr Walton.	true	62.63	64.5	20
8855_283242_000006_000001	If you loved her as much as I do, you would find out what to do."	If you loved her as much as I do, you would find out what to do."	true	64.5	67.78	22
8855_283242_000007_000000	"But she will not let me do anything for her."	"But she will not let me do anything for her."	true	68.45	70.93	20.814648
8855_283242_000008_000000	"Yes, she will.	"Yes, she will.	true	71.09	72.09	21.008797
8855_283242_000008_000001	She says you promised to help her some day."	She says you promised to help her some day."	true	72.09	74.29	22
8855_283242_000009_000000	"Did she send you, then?"	"Did she send you, then?"	true	74.69	76.03	25.984554
8855_283242_000010_000000	"No.	"no	true	76.43	76.83	91
8855_283242_000010_000001	She did not send me."	She did not send me."	true	76.83	78.13	19
8855_283242_000011_000000	"Then how--what--what can I do!"	"Then how-what-what can I do!"	true	78.62	80.68	21.743406
8855_283242_000012_000000	"Oh, you exact people!	"Oh, you exact people!	true	80.96	82.905	18.20716
8855_283242_000012_000001	You must have everything square and in print before you move.	You must have everything square and in print before you move.	true	82.905	86.19	16
8855_283242_000012_000002	If it had been me now, wouldn't I have been off like a shot!	If it had been me now, wouldn't I have been off like a shot!	true	86.19	89.2	16
8855_283242_000012_000003	Do get your hat, Mr Walton."	Do get your hat, Mr Walton."	true	89.21	91.24	21
8855_283242_000013_000000	"Come, then, Judy.	"Come, then, Judy.	true	91.58	92.43	18.97833
8855_283242_000013_000001	I will go at once.--Shall I see her?"	I will go at once.--Shall I see her?"	true	92.43	94.57	22.635288
8855_283242_000014_000000	And every vein throbbed at the thought of rescuing her from her persecutors, though I had not yet the smallest idea how it was to be effected.	And every vein throbbed at the thought of rescuing her from her persecutors, though I had not yet the smallest idea how it was to be effected.	false	94.88	102.4	17
8855_283242_000015_000000	"We will talk about that as we go," said Judy, authoritatively.	"We will talk about that as we go," said Judy, authoritatively.	true	102.77	106.15	19
8855_283242_000016_000000	In a moment more we were in the open air.	In a moment more we were in the open air.	true	106.55	108.94	18
8855_283242_000016_000001	It was a still night, with an odour of damp earth, and a hint of green buds in it.	It was a still night, with an odour of damp earth, and a hint of green buds in it.	true	109.1	114.31	20
8855_283242_000016_000002	A pale half-moon hung in the sky, now and then hidden by the clouds that swept across it, for there was wind in the heavens, though upon earth all was still.	A pale half moon hung in the sky, now and then hidden by the clouds that swept across it, for there was wind in the heavens, though upon earth all was still.	true	114.56	123.94	16
8855_283242_000016_000003	I offered Judy my arm, but she took my hand, and we walked on without a word till we had got through the village and out upon the road.	I offered Judy my arm, but she took my hand, and we walked on without a word till we had got through the village and out upon the road.	false	124.61	131.56	13
8855_283242_000017_000000	"Now, Judy," I said at last, "tell me what they are doing to your aunt?"	"Now, Judy," I said at last, "tell me what they are doing to your aunt?"	false	132.29	136.32	20.69875
8855_283242_000018_000000	"I don't know what they are doing.	"I don't know what they are doing.	true	136.32	137.67	22
8855_283242_000018_000001	But I am sure she will die."	But I am sure she will die."	true	137.67	139.18	19
8855_283242_000019_000000	"Is she ill?"	"Is she ill?"	true	139.67	140.74	35.708054
8855_283242_000020_000000	"She is as white as a sheet, and will not leave her room.	"She is as white as a sheet, and will not leave her room.	true	141.11	143.86	22.432976
8855_283242_000020_000001	Grannie must have frightened her dreadfully.	Grannie must have frightened her dreadfully.	true	143.87	146.11	22.45403
8855_283242_000020_000002	Everybody is frightened at her but me, and I begin to be frightened too.	Everybody is frightened at her but me, and I begin to be frightened too.	true	146.33	150.25	20.909115
8855_283242_000020_000003	And what will become of auntie then?"	And what will become of auntie then?"	true	150.5	152.47	19.932978
8855_283242_000021_000000	"But what can her mother do to her?"	"But what can her mother do to her?"	true	153.23	155.14	24.531511
8855_283242_000022_000000	"I don't know.	"I don't know.	true	155.42	156.51	23.743242
8855_283242_000022_000001	I think it is her determination to have her own way that makes auntie afraid she will get it somehow; and she says now she will rather die than marry Captain Everard.	I think it is her determination to have her own way that makes auntie afraid she will get it somehow; and she says now she will rather die than marry Captain Everard.	true	156.51	165.22	18
8855_283242_000022_000002	Then there is no one allowed to wait on her but Sarah, and I know the very sight of her is enough to turn auntie sick almost.	Then there is no one allowed to wait on her but Sarah, and I know the very sight of her is enough to turn auntie sick almost.	true	165.62	171.85	22.034426
8855_283242_000022_000003	What has become of Jane I don't know.	What has become of Jane I don't know.	true	172.31	174.33	25.069881
8855_283242_000022_000004	I haven't seen her all day, and the servants are whispering together more than usual.	I haven't seen her all day, and the servants are whispering together more than usual.	true	174.33	178.12	14
8855_283242_000022_000005	Auntie can't eat what Sarah brings her, I am sure; else I should almost fancy she was starving herself to death to keep clear of that Captain Everard."	Auntie can't eat what Sarah brings her, I am sure; else I should almost fancy she was starving herself to death to keep clear of that Captain Everard."	true	178.55	186.25	22.020327
8855_283242_000023_000000	"Is he still at the Hall?"	"Is he still at the Hall?"	true	186.77	188.2	25.045538
8855_283242_000024_000000	"Yes.	"Yes.	true	188.99	189.7	42.384
8855_283242_000024_000001	But I don't think it is altogether his fault.	But I don't think it is altogether his fault.	true	189.83	192.18	21.910378
8855_283242_000024_000002	Grannie won't let him go.	Grannie won't let him go.	true	192.18	193.78	27.613354
8855_283242_000024_000003	I don't believe he knows how determined auntie is not to marry him.	I don't believe he knows how determined auntie is not to marry him.	true	193.91	197.26	17
8855_283242_000024_000004	Only, to be sure, though grannie never lets her have more than five shillings in her pocket at a time, she will be worth something when she is married."	Only, to be sure, though grannie never lets her have more than five shillings in her pocket at a time, she will be worth something when she is married."	true	197.9	205.12	19
8855_283242_000025_000000	"Nothing can make her worth more than she is, Judy," I said, perhaps with some discontent in my tone.	"Nothing can make her worth more than she is, Judy," I said, perhaps with some discontent in my tone.	true	205.88	211.51	21
8855_283242_000026_000000	"That's as you and I think, Mr Walton; not as grannie and the captain think at all.	"That's as you and I think, Mr Walton; not as grannie and the captain think at all.	false	212.18	216.94	22.365324
8855_283242_000026_000001	I daresay he would not care much more than grannie whether she was willing or not, so long as she married him."	I daresay he would not care much more than grannie whether she was willing or not, so long as she married him."	true	216.98	222.31	17
8855_283242_000027_000000	"But, Judy, we must have some plan laid before we reach the Hall; else my coming will be of no use."	"But, Judy, we must have some plan laid before we reach the Hall; else my coming will be of no use."	true	222.74	228.25	20.480986
8855_283242_000028_000000	"Of course.	"Of course.	true	228.62	229.48	38.799038
8855_283242_000028_000001	I know how much I can do, and you must arrange the rest with her.	I know how much I can do, and you must arrange the rest with her.	true	229.55	233.02	22.074602
8855_283242_000028_000002	I will take you to the little room up-stairs--we call it the octagon.	I will take you to the little room up stairs-we call it the octagon.	true	233.42	237.04	21.37502
8855_283242_000028_000003	That you know is just under auntie's room.	That you know is just under auntie's room.	true	237.65	239.77	23.176138
8855_283242_000028_000004	They will be at dinner--the captain and grannie.	They will be at dinner-the captain and grannie.	false	239.99	242.5	22.88879
8855_283242_000028_000005	I will leave you there, and tell auntie that you want to see her."	I will leave you there, and tell auntie that you want to see her."	true	242.87	245.83	22.39895
8855_283242_000029_000000	"But, Judy,---"	"But, Judy,---"	true	246.2	247.18	26.535173
8855_283242_000030_000000	"Don't you want to see her, Mr Walton?"	"Don't you want to see her, Mr Walton?"	true	248.06	250	22.990232
8855_283242_000031_000000	"Yes, I do; more than you can think."	"Yes, I do; more than you can think."	true	250.46	252.43	23.283363
8855_283242_000032_000000	"Then I will tell her so."	"Then I will tell her so."	true	252.59	254.02	21.61781
8855_283242_000033_000000	"But will she come to me?"	"But will she come to me?"	true	254.54	255.88	22.441427
8855_283242_000034_000000	"I don't know.	"I don't know.	true	256.34	257.23	23.900015
8855_283242_000034_000001	We have to find that out."	We have to find that out."	true	257.42	258.91	21.623623
8855_283242_000035_000000	"Very well.	"Very well.	true	259.52	260.265	23.665625
8855_283242_000035_000001	I leave myself in your hands."	I leave myself in your hands."	true	260.265	261.72	9
8855_283242_000036_000000	I was now perfectly collected.	I was now perfectly collected.	false	261.72	264.4	21.776487
8855_283242_000036_000001	All my dubitation and distress were gone, for I had something to do, although what I could not yet tell.	All my dubitation and distress were gone, for I had something to do, although what I could not yet tell.	true	264.5	271	20.645742
8855_283242_000036_000002	That she did not love Captain Everard was plain, and that she had as yet resisted her mother was also plain, though it was not equally certain that she would, if left at her mercy, go on to resist her.	That she did not love Captain Everard was plain, and that she had as yet resisted her mother was also plain, though it was not equally certain that she would, if left at her mercy, go on to resist her.	false	271.52	282.97	20.853636
8855_283242_000036_000003	This was what I hoped to strengthen her to do.	This was what I hoped to strengthen her to do.	true	283.88	286.24	20.411118
8855_283242_000036_000004	I saw nothing more within my reach as yet.	I saw nothing more within my reach as yet.	true	286.4	288.76	19.041645
8855_283242_000036_000005	But from what I knew of Miss Oldcastle, I saw plainly enough that no greater good could be done for her than this enabling to resistance. Self-assertion was so foreign to her nature, that it needed a sense of duty to rouse her even to self-defence.	But from what I knew of Miss Oldcastle, I saw plainly enough that no greater good could be done for her than this enabling to resistance. Self assertion was so foreign to her nature, that it needed a sense of duty to rouse her even to self defence.	false	289.19	302.74	20
8855_283242_000036_000006	As I have said before, she was clad in the mail of endurance, but was utterly without weapons.	As I have said before, she was clad in the mail of endurance, but was utterly without weapons.	true	303.68	308.83	20
8855_283242_000036_000007	And there was a danger of her conduct and then of her mind giving way at last, from the gradual inroads of weakness upon the thews which she left unexercised.	And there was a danger of her conduct and then of her mind giving way at last, from the gradual inroads of weakness upon the thews which she left unexercised.	false	309.38	318.55	21.372807
8855_283242_000036_000008	In respect of this, I prayed heartily that I might help her.	In respect of this, I prayed heartily that I might help her.	true	319.13	322.33	20.891752
8855_283242_000037_000000	Judy and I scarcely spoke to each other from the moment we entered the gate till I found myself at a side door which I had never observed till now.	Judy and I scarcely spoke to each other from the moment we entered the gate till I found myself at a side door which I had never observed till now.	false	322.94	330.16	16
8855_283242_000037_000001	It was fastened, and Judy told me to wait till she went in and opened it.	It was fastened, and Judy told me to wait till she went in and opened it.	true	330.44	334.03	13
8855_283242_000037_000002	The moon was now quite obscured, and I was under no apprehension of discovery.	The moon was now quite obscured, and I was under no apprehension of discovery.	true	334.61	338.91	21
8855_283242_000037_000003	While I stood there I could not help thinking of Dr Duncan's story, and reflecting that the daughter was now returning the kindness shown to the mother.	While I stood there I could not help thinking of Dr Duncan's story, and reflecting that the daughter was now returning the kindness shown to the mother.	false	338.91	348.34	21.839968
8855_283242_000038_000000	I had not to wait long before the door opened behind me noiselessly, and I stepped into the dark house.	I had not to wait long before the door opened behind me noiselessly, and I stepped into the dark house.	true	348.47	354.19	20
8855_283242_000038_000001	Judy took me by the hand, and led me along a passage, and then up a stair into the little drawing-room.	Judy took me by the hand, and led me along a passage, and then up a stair into the little drawing room.	true	354.65	359.98	20
8855_283242_000038_000002	There was no light.	There was no light.	true	360.32	361.42	25.352074
8855_283242_000038_000003	She led me to a seat at the farther end, and opening a door close beside me, left me in the dark.	She led me to a seat at the farther end, and opening a door close beside me, left me in the dark.	true	361.73	367.42	21.46137
8855_283242_000039_000000	There I sat so long that I fell into a fit of musing, broken ever by startled expectation.	There I sat so long that I fell into a fit of musing, broken ever by startled expectation.	true	368.12	373.15	15
8855_283242_000039_000001	Castle after castle I built up; castle after castle fell to pieces in my hands.	Castle after castle I built up; castle after castle fell to pieces in my hands.	true	373.49	379.15	21.166916
8855_283242_000039_000002	Still she did not come.	Still she did not come.	true	379.67	381.34	19.548565
8855_283242_000039_000003	At length I got so restless and excited that only the darkness kept me from starting up and pacing the room.	At length I got so restless and excited that only the darkness kept me from starting up and pacing the room.	true	381.65	386.71	10
8855_283242_000039_000004	Still she did not come, and partly from weakness, partly from hope deferred, I found myself beginning to tremble all over.	Still she did not come, and partly from weakness, partly from hope deferred, I found myself beginning to tremble all over.	true	387.41	394.36	23.352077
8855_283242_000039_000005	Nor could I control myself.	Nor could I control myself.	true	394.43	396.22	24.32674
8855_283242_000039_000006	As the trembling increased, I grew alarmed lest I should become unable to carry out all that might be necessary.	As the trembling increased, I grew alarmed lest I should become unable to carry out all that might be necessary.	true	396.44	401.83	12
8855_283242_000040_000000	Suddenly from out of the dark a hand settled on my arm.	Suddenly from out of the dark a hand settled on my arm.	true	402.47	406.18	15
8855_283242_000040_000001	I looked up and could just see the whiteness of a face.	I looked up and could just see the whiteness of a face.	true	406.46	409.39	17
8855_283242_000040_000002	Before I could speak, a voice said brokenly, in a half-whisper:--	Before I could speak, a voice said brokenly, in a half whisper:--	true	409.73	413.67	21.748484
8855_283242_000041_000000	"WILL you save me, Mr Walton?	"WILL you save me, Mr Walton?	false	413.67	415.89	16.654947
8855_283242_000041_000001	But you're trembling; you are ill; you ought not to have come to me.	But you're trembling; you are ill; you ought not to have come to me.	false	415.89	420.19	20.312628
8855_283242_000041_000002	I will get you something."	I will get you something."	true	420.35	421.72	17.93299
8855_283242_000042_000000	And she moved to go, but I held her.	And she moved to go, but I held her.	true	421.88	424.44	20.937765
8855_283242_000042_000001	All my trembling was gone in a moment.	All my trembling was gone in a moment.	false	424.44	426.79	23.241573
8855_283242_000042_000002	Her words, so careful of me even in her deep misery, went to my heart and gave me strength.	Her words, so careful of me even in her deep misery, went to my heart and gave me strength.	true	427.04	433.54	18
8855_283242_000042_000003	The suppressed feelings of many months rushed to my lips.	The suppressed feelings of many months rushed to my lips.	true	433.67	436.69	16
8855_283242_000042_000004	What I said I do not know, but I know that I told her I loved her.	What I said I do not know, but I know that I told her I loved her.	true	436.85	440.88	19.463675
8855_283242_000042_000005	And I know that she did not draw her hand from mine when I said so.	And I know that she did not draw her hand from mine when I said so.	true	440.88	444.43	18
8855_283242_000043_000000	But ere I ceased came a revulsion of feeling.	But ere I ceased came a revulsion of feeling.	true	445.01	447.67	20.070112
8855_283242_000044_000000	"Forgive me," I said, "I am selfishness itself to speak to you thus now, to take advantage of your misery to make you listen to mine.	"Forgive me," I said, "I am selfishness itself to speak to you thus now, to take advantage of your misery to make you listen to mine.	true	448.49	456.79	21.424376
8855_283242_000044_000001	But, at least, it will make you sure that if all I am, all I have will save you--"	But, at least, it will make you sure that if all I am, all I have will save you-"	true	457.22	461.92	21.425383
8855_283242_000045_000000	"But I am saved already," she interposed, "if you love me--for I love you."	"But I am saved already," she interposed, "if you love me-for I love you."	true	462.62	467.95	21.557188
8855_283242_000046_000000	And for some moments there were no words to speak.	And for some moments there were no words to speak.	true	468.68	471.19	20.525064
8855_283242_000046_000001	I stood holding her hand, conscious only of God and her.	I stood holding her hand, conscious only of God and her.	true	471.41	475.3	24.492943
8855_283242_000046_000002	At last I said:	At last I said:	true	475.58	476.89	22.890743
8855_283242_000047_000000	"There is no time now but for action.	"There is no time now but for action.	false	477.26	479.58	21.561735
8855_283242_000047_000001	Nor do I see anything but to go with me at once.	Nor do I see anything but to go with me at once.	false	479.58	482.5	19.958506
8855_283242_000047_000002	Will you come home to my sister?	Will you come home to my sister?	true	482.81	484.54	22.52148
8855_283242_000047_000003	Or I will take you wherever you please."	Or I will take you wherever you please."	true	484.82	486.91	20
8855_283242_000048_000000	"I will go with you anywhere you think best.	"I will go with you anywhere you think best.	true	488.06	490.305	20
8855_283242_000048_000001	Only take me away."	Only take me away."	true	490.305	491.62	19.830181
8855_283242_000049_000000	"Put on your bonnet, then, and a warm cloak, and we will settle all about it as we go."	"Put on your bonnet, then, and a warm cloak, and we will settle all about it as we go."	true	492.41	497.02	22.153774
8855_283242_000050_000000	She had scarcely left the room when Mrs Oldcastle came to the door.	She had scarcely left the room when Mrs Oldcastle came to the door.	false	498.05	501.4	16
8855_283242_000051_000000	"No lights here!" she said.	"No lights here!" she said.	true	502.4	504.37	24.56332
8855_283242_000051_000001	"Sarah, bring candles, and tell Captain Everard, when he will join us, to come to the octagon room.	"Sarah, bring candles, and tell Captain Everard, when he will join us, to come to the octagon room.	true	504.44	509.74	21.730186
8855_283242_000051_000002	Where can that little Judy be?	Where can that little Judy be?	true	509.93	511.72	21.103958
8855_283242_000051_000003	The child gets more and more troublesome, I do think.	The child gets more and more troublesome, I do think.	true	511.82	514.36	21
8855_283242_000051_000004	I must take her in hand."	I must take her in hand."	false	514.43	516.9	21.740244
8855_283242_000052_000000	I had been in great perplexity how to let her know that I was there; for to announce yourself to a lady by a voice out of the darkness of her boudoir, or to wait for candles to discover you where she thought she was quite alone--neither is a pleasant way of presenting yourself to her consciousness.	I had been in great perplexity how to let her know that I was there; for to announce yourself to a lady by a voice out of the darkness of her boudoir, or to wait for candles to discover you where she thought she was quite alone-neither is a pleasant way of presenting yourself to her consciousness.	true	516.9	532	20.85163
8855_283242_000052_000001	But I was helped out of the beginning into the middle of my difficulties, once more by that blessed little Judy.	But I was helped out of the beginning into the middle of my difficulties, once more by that blessed little Judy.	true	532.79	538.27	20
8855_283242_000052_000002	I did not know she was in the room till I heard her voice.	I did not know she was in the room till I heard her voice.	true	538.61	541.36	14
8855_283242_000052_000003	Nor do I yet know how much she had heard of the conversation between her aunt and myself; for although I sometimes see her look roguish even now that she is a middle-aged woman with many children, when anything is said which might be supposed to have a possible reference to that night, I have never cared to ask her.	Nor do I yet know how much she had heard of the conversation between her aunt and myself; for although I sometimes see her look roguish even now that she is a middle aged woman with many children, when anything is said which might be supposed to have a possible reference to that night, I have never cared to ask her.	false	542.09	559	19.634043
8855_283242_000053_000000	"Here I am, grannie," said her voice.	"Here I am, grannie," said her voice.	true	559.28	561.7	27.268185
8855_283242_000053_000001	"But I won't be taken in hand by you or any one else.	"But I won't be taken in hand by you or any one else.	true	562.01	565.56	21.952435
8855_283242_000053_000002	I tell you that.	I tell you that.	true	565.56	566.68	23.395313
8855_283242_000053_000003	So mind.	So mind.	true	566.87	567.91	21.81332
8855_283242_000053_000004	And Mr Walton is here, too, and Aunt Ethelwyn is going out with him for a long walk."	And Mr Walton is here, too, and Aunt Ethelwyn is going out with him for a long walk."	true	567.92	573.01	18
