5513_39476_000024_000005	First she stared at them, then bouncing up to her husband's knee sought to kindle an equal excitement in his mind.	First she stared at them, then bouncing up to her husband's knee sought to kindle an equal excitement in his mind.	true	607.64	613.99	17
5513_39476_000024_000006	Whilst she rested her paws on his knee she turned her head again and again towards the ducks as though she could not take her eyes off them, and then ran down before him to the water's edge.	Whilst she rested her paws on his knee she turned her head again and again towards the ducks as though she could not take her eyes off them, and then ran down before him to the water's edge.	true	614.57	623.98	15
5513_39476_000025_000000	But her appearance threw the ducks into the utmost degree of consternation.	But her appearance threw the ducks into the utmost degree of consternation.	true	624.2	628.3	21
5513_39476_000025_000001	Those on shore or near the bank swam or flew to the centre of the pond, and there huddled in a bunch; and then, swimming round and round, they began such a quacking that Mr. Tebrick was nearly deafened.	Those on shore or near the bank swam or flew to the centre of the pond, and there huddled in a bunch; and then, swimming round and round, they began such a quacking that mr Tebrick was nearly deafened.	false	628.46	639.76	17
5513_39476_000025_000002	As I have before said, nothing in the ludicrous way that arose out of the metamorphosis of his wife (and such incidents were plentiful) ever stood a chance of being smiled at by him.	As I have before said, nothing in the ludicrous way that arose out of the metamorphosis of his wife (and such incidents were plentiful) ever stood a chance of being smiled at by him.	false	641.24	652.42	20.675407
5513_39476_000025_000003	So in this case, too, for realising that the silly ducks thought his wife a fox indeed and were alarmed on that account he found painful that spectacle which to others might have been amusing.	So in this case, too, for realising that the silly ducks thought his wife a fox indeed and were alarmed on that account he found painful that spectacle which to others might have been amusing.	true	652.79	663.97	22
5513_39476_000026_000000	Not so his vixen, who appeared if anything more pleased than ever when she saw in what a commotion she had set them, and began cutting a thousand pretty capers.	Not so his vixen, who appeared if anything more pleased than ever when she saw in what a commotion she had set them, and began cutting a thousand pretty capers.	true	664.55	673.72	16
5513_39476_000026_000001	Though at first he called to her to come back and walk another way, Mr. Tebrick was overborne by her pleasure and sat down, while she frisked around him happier far than he had seen her ever since the change.	Though at first he called to her to come back and walk another way, mr Tebrick was overborne by her pleasure and sat down, while she frisked around him happier far than he had seen her ever since the change.	false	674.51	686.41	20
5513_39476_000026_000002	First she ran up to him in a laughing way, all smiles, and then ran down again to the water's edge and began frisking and frolicking, chasing her own brush, dancing on her hind legs even, and rolling on the ground, then fell to running in circles, but all this without paying any heed to the ducks.	First she ran up to him in a laughing way, all smiles, and then ran down again to the water's edge and began frisking and frolicking, chasing her own brush, dancing on her hind legs even, and rolling on the ground, then fell to running in circles, but all this without paying any heed to the ducks.	false	686.96	703.24	15
5513_39476_000027_000000	But they, with their necks craned out all pointing one way, swam to and fro in the middle of the pond, never stopping their quack, quack quack, and keeping time too, for they all quacked in chorus.	But they, with their necks craned out all pointing one way, swam to and fro in the middle of the pond, never stopping their quack, quack quack, and keeping time too, for they all quacked in chorus.	false	703.7	715.96	23.875652
5513_39476_000027_000001	Presently she came further away from the pond, and he, thinking they had had enough of this sort of entertainment, laid hold of her and said to her:	Presently she came further away from the pond, and he, thinking they had had enough of this sort of entertainment, laid hold of her and said to her:	true	716.66	724.24	15
5513_39476_000028_000000	"Come, Silvia, my dear, it is growing cold, and it is time we went indoors.	"Come, Silvia, my dear, it is growing cold, and it is time we went indoors.	true	724.61	728.56	14
5513_39476_000028_000001	I am sure taking the air has done you a world of good, but we must not linger any more."	I am sure taking the air has done you a world of good, but we must not linger any more."	true	728.87	733.93	15
5513_39476_000029_000000	She appeared then to agree with him, though she threw half a glance over her shoulder at the ducks, and they both walked soberly enough towards the house.	She appeared then to agree with him, though she threw half a glance over her shoulder at the ducks, and they both walked soberly enough towards the house.	true	734.21	741.67	18
5513_39476_000030_000000	When they had gone about halfway she suddenly slipped round and was off. He turned quickly and saw the ducks had been following them.	When they had gone about halfway she suddenly slipped round and was off. He turned quickly and saw the ducks had been following them.	true	742.64	749.47	19
5513_39476_000031_000000	So she drove them before her back into the pond, the ducks running in terror from her with their wings spread, and she not pressing them, for he saw that had she been so minded she could have caught two or three of the nearest.	So she drove them before her back into the pond, the ducks running in terror from her with their wings spread, and she not pressing them, for he saw that had she been so minded she could have caught two or three of the nearest.	true	749.48	761.47	21.15373
5513_39476_000031_000001	Then, with her brush waving above her, she came gambolling back to him so playfully that he stroked her indulgently, though he was first vexed, and then rather puzzled that his wife should amuse herself with such pranks.	Then, with her brush waving above her, she came gambolling back to him so playfully that he stroked her indulgently, though he was first vexed, and then rather puzzled that his wife should amuse herself with such pranks.	true	762.29	774.31	17
5513_39476_000032_000000	But when they got within doors he picked her up in his arms, kissed her and spoke to her.	But when they got within doors he picked her up in his arms, kissed her and spoke to her.	true	774.86	779.59	22
5513_39476_000033_000000	"Silvia, what a light-hearted childish creature you are.	"Silvia, what a light-hearted childish creature you are.	true	780.08	784.18	20.72604
5513_39476_000033_000001	Your courage under misfortune shall be a lesson to me, but I cannot, I cannot bear to see it."	Your courage under misfortune shall be a lesson to me, but I cannot, I cannot bear to see it."	false	784.25	790.87	21.428871
5513_39476_000034_000000	Here the tears stood suddenly in his eyes, and he lay down upon the ottoman and wept, paying no heed to her until presently he was aroused by her licking his cheek and his ear.	Here the tears stood suddenly in his eyes, and he lay down upon the ottoman and wept, paying no heed to her until presently he was aroused by her licking his cheek and his ear.	false	792.11	802.24	19
5513_39476_000035_000000	After tea she led him to the drawing room and scratched at the door till he opened it, for this was part of the house which he had shut up, thinking three or four rooms enough for them now, and to save the dusting of it.	After tea she led him to the drawing room and scratched at the door till he opened it, for this was part of the house which he had shut up, thinking three or four rooms enough for them now, and to save the dusting of it.	true	802.82	813.79	19.295397
5513_39476_000035_000001	Then it seemed she would have him play to her on the pianoforte: she led him to it, nay, what is more, she would herself pick out the music he was to play.	Then it seemed she would have him play to her on the pianoforte: she led him to it, nay, what is more, she would herself pick out the music he was to play.	true	814.19	823.54	22
5513_39476_000035_000002	First it was a fugue of Handel's, then one of Mendelssohn's Songs Without Words, and then "The Diver," and then music from Gilbert and Sullivan; but each piece of music she picked out was gayer than the last one.	First it was a fugue of Handel's, then one of Mendelssohn's Songs Without Words, and then "The Diver," and then music from Gilbert and Sullivan; but each piece of music she picked out was gayer than the last one.	true	824.18	837.4	19.095825
5513_39476_000035_000003	Thus they sat happily engrossed for perhaps an hour in the candle light until the extreme cold in that unwarmed room stopped his playing and drove them downstairs to the fire.	Thus they sat happily engrossed for perhaps an hour in the candle light until the extreme cold in that unwarmed room stopped his playing and drove them downstairs to the fire.	false	838.04	847.69	14
5513_39476_000035_000004	Thus did she admirably comfort her husband when he was dispirited.	Thus did she admirably comfort her husband when he was dispirited.	false	848.21	856.95	22.079157
