5513_39476_000000_000000	Old Nanny, though she was not expecting to find her mistress there, having been told that she was gone that afternoon to London, knew her instantly, and cried out:	Old Nanny, though she was not expecting to find her mistress there, having been told that she was gone that afternoon to London, knew her instantly, and cried out:	false	0	2.67	18.793224
5513_39476_000001_000000	"Oh, my poor precious!	"Oh, my poor precious!	false	2.67	2.97	-20
5513_39476_000001_000001	Oh, poor Miss Silvia!	Oh, poor Miss Silvia!	false	2.97	3.24	60
5513_39476_000001_000002	What dreadful change is this?"	What dreadful change is this?"	false	3.24	3.69	10
5513_39476_000001_000003	Then, seeing her mistress start and look at her, she cried out: "But never fear, my darling, it will all come right, your old Nanny knows you, it will all come right in the end."	Then, seeing her mistress start and look at her, she cried out: "But never fear, my darling, it will all come right, your old Nanny knows you, it will all come right in the end."	false	3.69	6.87	21.584383
5513_39476_000002_000000	But though she said this she did not care to look again, and kept her eyes turned away so as not to meet the foxy slit ones of her mistress, for that was too much for her.	But though she said this she did not care to look again, and kept her eyes turned away so as not to meet the foxy slit ones of her mistress, for that was too much for her.	false	6.87	8.64	22.00307
5513_39476_000002_000001	So she hurried out soon, fearing to be found there by Mr. Tebrick, and who knows, perhaps shot, like the dogs, for knowing the secret.	So she hurried out soon, fearing to be found there by mr Tebrick, and who knows, perhaps shot, like the dogs, for knowing the secret.	false	8.64	12.09	18
5513_39476_000003_000000	Mr. Tebrick had all this time gone about paying off his servants and shooting his dogs as if he were in a dream.	mr Tebrick had all this time gone about paying off his servants and shooting his dogs as if he were in a dream.	false	12.09	15.18	18.614397
5513_39476_000003_000001	Now he fortified himself with two or three glasses of strong whisky and went to bed, taking his vixen into his arms, where he slept soundly.	Now he fortified himself with two or three glasses of strong whisky and went to bed, taking his vixen into his arms, where he slept soundly.	false	15.18	16.62	11
5513_39476_000003_000002	Whether she did or not is more than I or anybody else can say.	Whether she did or not is more than I or anybody else can say.	false	16.62	19.365	15.748901
5513_39476_000004_000000	In the morning when he woke up they had the place to themselves, for on his instructions the servants had all left first thing: Janet and the cook to Oxford, where they would try and find new places, and Nanny going back to the cottage near Tangley, where her son lived, who was the pigman there.	In the morning when he woke up they had the place to themselves, for on his instructions the servants had all left first thing: Janet and the cook to Oxford, where they would try and find new places, and Nanny going back to the cottage near Tangley, where her son lived, who was the pigman there.	true	19.365	33.67	20
5513_39476_000005_000000	So with that morning there began what was now to be their ordinary life together.	So with that morning there began what was now to be their ordinary life together.	true	34.22	38.44	14
5513_39476_000005_000001	He would get up when it was broad day, and first thing light the fire downstairs and cook the breakfast, then brush his wife, sponge her with a damp sponge, then brush her again, in all this using scent very freely to hide somewhat her rank odour.	He would get up when it was broad day, and first thing light the fire downstairs and cook the breakfast, then brush his wife, sponge her with a damp sponge, then brush her again, in all this using scent very freely to hide somewhat her rank odour.	true	38.78	52.6	19
5513_39476_000005_000002	When she was dressed he carried her downstairs and they had their breakfast together, she sitting up to table with him, drinking her saucer of tea, and taking her food from his fingers, or at any rate being fed by him.	When she was dressed he carried her downstairs and they had their breakfast together, she sitting up to table with him, drinking her saucer of tea, and taking her food from his fingers, or at any rate being fed by him.	false	52.94	64.51	19
5513_39476_000005_000003	She was still fond of the same food that she had been used to before her transformation, a lightly boiled egg or slice of ham, a piece of buttered toast or two, with a little quince and apple jam.	She was still fond of the same food that she had been used to before her transformation, a lightly boiled egg or slice of ham, a piece of buttered toast or two, with a little quince and apple jam.	true	65.54	75.76	20
5513_39476_000005_000004	While I am on the subject of her food, I should say that reading in the encyclopedia he found that foxes on the Continent are inordinately fond of grapes, and that during the autumn season they abandon their ordinary diet for them, and then grow exceedingly fat and lose their offensive odour.	While I am on the subject of her food, I should say that reading in the encyclopedia he found that foxes on the Continent are inordinately fond of grapes, and that during the autumn season they abandon their ordinary diet for them, and then grow exceedingly fat and lose their offensive odour.	true	76.55	91.69	17
5513_39476_000006_000000	This appetite for grapes is so well confirmed by Aesop, and by passages in the Scriptures, that it is strange Mr. Tebrick should not have known it.	This appetite for grapes is so well confirmed by Aesop, and by passages in the Scriptures, that it is strange mr Tebrick should not have known it.	true	92.24	99.61	19
5513_39476_000006_000001	After reading this account he wrote to London for a basket of grapes to be posted to him twice a week and was rejoiced to find that the account in the encyclopedia was true in the most important of these particulars.	After reading this account he wrote to London for a basket of grapes to be posted to him twice a week and was rejoiced to find that the account in the encyclopedia was true in the most important of these particulars.	true	100.01	110.44	15
5513_39476_000006_000002	His vixen relished them exceedingly and seemed never to tire of them, so that he increased his order first from one pound to three pounds and afterwards to five.	His vixen relished them exceedingly and seemed never to tire of them, so that he increased his order first from one pound to three pounds and afterwards to five.	true	111.08	121.33	21.223955
5513_39476_000006_000003	Her odour abated so much by this means that he came not to notice it at all except sometimes in the mornings before her toilet.	Her odour abated so much by this means that he came not to notice it at all except sometimes in the mornings before her toilet.	false	121.58	129.18	19.335894
5513_39476_000006_000004	What helped most to make living with her bearable for him was that she understood him perfectly--yes, every word he said, and though she was dumb she expressed herself very fluently by looks and signs though never by the voice.	What helped most to make living with her bearable for him was that she understood him perfectly-yes, every word he said, and though she was dumb she expressed herself very fluently by looks and signs though never by the voice.	true	129.18	142.09	18
5513_39476_000007_000000	Thus he frequently conversed with her, telling her all his thoughts and hiding nothing from her, and this the more readily because he was very quick to catch her meaning and her answers.	Thus he frequently conversed with her, telling her all his thoughts and hiding nothing from her, and this the more readily because he was very quick to catch her meaning and her answers.	true	142.67	151.69	17
5513_39476_000008_000000	"Puss, Puss," he would say to her, for calling her that had been a habit with him always.	"Puss, Puss," he would say to her, for calling her that had been a habit with him always.	false	152.63	157.12	21.356709
5513_39476_000008_000001	"Sweet Puss, some men would pity me living alone here with you after what has happened, but I would not change places while you were living with any man for the whole world.	"Sweet Puss, some men would pity me living alone here with you after what has happened, but I would not change places while you were living with any man for the whole world.	true	157.25	166.99	19.396465
5513_39476_000008_000002	Though you are a fox I would rather live with you than any woman.	Though you are a fox I would rather live with you than any woman.	true	167.72	170.92	20
5513_39476_000008_000003	I swear I would, and that too if you were changed to anything." But then, catching her grave look, he would say: "Do you think I jest on these things, my dear?	I swear I would, and that too if you were changed to anything." But then, catching her grave look, he would say: "Do you think I jest on these things, my dear?	true	170.96	181.89	21.779217
5513_39476_000008_000004	I do not.	I do not.	true	181.89	182.89	24.112358
5513_39476_000008_000005	I swear to you, my darling, that all my life I will be true to you, will be faithful, will respect and reverence you who are my wife.	I swear to you, my darling, that all my life I will be true to you, will be faithful, will respect and reverence you who are my wife.	true	183.02	191.08	21.216917
5513_39476_000008_000006	And I will do that not because of any hope that God in His mercy will see fit to restore your shape, but solely because I love you.	And I will do that not because of any hope that God in His mercy will see fit to restore your shape, but solely because I love you.	true	191.12	198.55	17
5513_39476_000008_000007	However you may be changed, my love is not."	However you may be changed, my love is not."	true	198.86	201.85	19
5513_39476_000009_000000	Then anyone seeing them would have sworn that they were lovers, so passionately did each look on the other.	Then anyone seeing them would have sworn that they were lovers, so passionately did each look on the other.	false	203	208.42	18
5513_39476_000010_000000	Often he would swear to her that the devil might have power to work some miracles, but that he would find it beyond him to change his love for her.	Often he would swear to her that the devil might have power to work some miracles, but that he would find it beyond him to change his love for her.	true	209.51	217.6	21.306051
5513_39476_000011_000000	These passionate speeches, however they might have struck his wife in an ordinary way, now seemed to be her chief comfort.	These passionate speeches, however they might have struck his wife in an ordinary way, now seemed to be her chief comfort.	true	218.72	225.07	17
5513_39476_000011_000001	She would come to him, put her paw in his hand and look at him with sparkling eyes shining with joy and gratitude, would pant with eagerness, jump at him and lick his face.	She would come to him, put her paw in his hand and look at him with sparkling eyes shining with joy and gratitude, would pant with eagerness, jump at him and lick his face.	true	225.2	235.18	22
5513_39476_000012_000000	Now he had many little things which busied him in the house--getting his meals, setting the room straight, making the bed and so forth.	Now he had many little things which busied him in the house-getting his meals, setting the room straight, making the bed and so forth.	false	236.12	243.43	21.205448
5513_39476_000012_000001	When he was doing this housework it was comical to watch his vixen.	When he was doing this housework it was comical to watch his vixen.	true	243.71	247	19
5513_39476_000012_000002	Often she was as it were beside herself with vexation and distress to see him in his clumsy way doing what she could have done so much better had she been able.	Often she was as it were beside herself with vexation and distress to see him in his clumsy way doing what she could have done so much better had she been able.	false	247.43	256.57	16
5513_39476_000012_000003	Then, forgetful of the decency and the decorum which she had at first imposed upon herself never to run upon all fours, she followed him everywhere, and if he did one thing wrong she stopped him and showed him the way of it.	Then, forgetful of the decency and the decorum which she had at first imposed upon herself never to run upon all fours, she followed him everywhere, and if he did one thing wrong she stopped him and showed him the way of it.	false	257.06	269.05	18
5513_39476_000012_000004	When he had forgot the hour for his meal she would come and tug his sleeve and tell him as if she spoke: "Husband, are we to have no luncheon to-day?"	When he had forgot the hour for his meal she would come and tug his sleeve and tell him as if she spoke: "Husband, are we to have no luncheon to day?"	true	269.3	277.03	16
5513_39476_000013_000000	This womanliness in her never failed to delight him, for it showed she was still his wife, buried as it were in the carcase of a beast but with a woman's soul.	This womanliness in her never failed to delight him, for it showed she was still his wife, buried as it were in the carcase of a beast but with a woman's soul.	true	278.33	287.44	17
5513_39476_000013_000001	This encouraged him so much that he debated with himself whether he should not read aloud to her, as he often had done formerly. At last, since he could find no reason against it, he went to the shelf and fetched down a volume of the "History of Clarissa Harlowe," which he had begun to read aloud to her a few weeks before.	This encouraged him so much that he debated with himself whether he should not read aloud to her, as he often had done formerly. At last, since he could find no reason against it, he went to the shelf and fetched down a volume of the "History of Clarissa Harlowe," which he had begun to read aloud to her a few weeks before.	false	287.75	304.78	18.463444
5513_39476_000013_000002	He opened the volume where he had left off, with Lovelace's letter after he had spent the night waiting fruitlessly in the copse.	He opened the volume where he had left off, with Lovelace's letter after he had spent the night waiting fruitlessly in the copse.	false	305.69	311.95	15
5513_39476_000014_000000	"Good God!	"Good God!	true	312.32	313.44	24.672773
5513_39476_000015_000000	"What is now to become of me?	"What is now to become of me?	true	313.44	315.16	17.147379
5513_39476_000016_000000	"My feet benumbed by midnight wanderings through the heaviest dews that ever fell; my wig and my linen dripping with the hoarfrost dissolving on them!	"My feet benumbed by midnight wanderings through the heaviest dews that ever fell; my wig and my linen dripping with the hoarfrost dissolving on them!	true	315.35	324.07	16
5513_39476_000017_000000	"Day but just breaking...." etc.	"Day but just breaking...." etc	true	324.32	327.25	24.501156
5513_39476_000018_000000	While he read he was conscious of holding her attention, then after a few pages the story claimed all his, so that he read on for about half-an-hour without looking at her.	While he read he was conscious of holding her attention, then after a few pages the story claimed all his, so that he read on for about half an hour without looking at her.	true	328.58	337.78	17
5513_39476_000018_000001	When he did so he saw that she was not listening to him, but was watching something with strange eagerness. Such a fixed intent look was on her face that he was alarmed and sought the cause of it.	When he did so he saw that she was not listening to him, but was watching something with strange eagerness. Such a fixed intent look was on her face that he was alarmed and sought the cause of it.	true	338.42	348.73	18
5513_39476_000018_000002	Presently he found that her gaze was fixed on the movements of her pet dove which was in its cage hanging in the window. He spoke to her, but she seemed displeased, so he laid "Clarissa Harlowe" aside.	Presently he found that her gaze was fixed on the movements of her pet dove which was in its cage hanging in the window. He spoke to her, but she seemed displeased, so he laid "Clarissa Harlowe" aside.	true	349.19	360.64	19.573576
5513_39476_000018_000003	Nor did he ever repeat the experiment of reading to her.	Nor did he ever repeat the experiment of reading to her.	true	361.16	364.45	21
5513_39476_000019_000000	Yet that same evening, as he happened to be looking through his writing table drawer with Puss beside him looking over his elbow, she spied a pack of cards, and then he was forced to pick them out to please her, then draw them from their case.	Yet that same evening, as he happened to be looking through his writing table drawer with Puss beside him looking over his elbow, she spied a pack of cards, and then he was forced to pick them out to please her, then draw them from their case.	true	365.36	378.55	17
5513_39476_000019_000001	At last, trying first one thing, then another, he found that what she was after was to play piquet with him. They had some difficulty at first in contriving for her to hold her cards and then to play them, but this was at last overcome by his stacking them for her on a sloping board, after which she could flip them out very neatly with her claws as she wanted to play them.	At last, trying first one thing, then another, he found that what she was after was to play piquet with him. They had some difficulty at first in contriving for her to hold her cards and then to play them, but this was at last overcome by his stacking them for her on a sloping board, after which she could flip them out very neatly with her claws as she wanted to play them.	false	378.86	399.13	20
5513_39476_000019_000002	When they had overcome this trouble they played three games, and most heartily she seemed to enjoy them.	When they had overcome this trouble they played three games, and most heartily she seemed to enjoy them.	true	399.71	405.07	16
5513_39476_000019_000003	Moreover she won all three of them. After this they often played a quiet game of piquet together, and cribbage too.	Moreover she won all three of them. After this they often played a quiet game of piquet together, and cribbage too.	true	405.62	413.02	20.458242
5513_39476_000019_000004	I should say that in marking the points at cribbage on the board he always moved her pegs for her as well as his own, for she could not handle them or set them in the holes.	I should say that in marking the points at cribbage on the board he always moved her pegs for her as well as his own, for she could not handle them or set them in the holes.	true	413.36	422.26	12
5513_39476_000020_000000	The weather, which had been damp and misty, with frequent downpours of rain, improved very much in the following week, and, as often happens in January, there were several days with the sun shining, no wind and light frosts at night, these frosts becoming more intense as the days went on till bye and bye they began to think of snow.	The weather, which had been damp and misty, with frequent downpours of rain, improved very much in the following week, and, as often happens in January, there were several days with the sun shining, no wind and light frosts at night, these frosts becoming more intense as the days went on till bye and bye they began to think of snow.	true	423.38	443.95	18.71583
5513_39476_000021_000000	With this spell of fine weather it was but natural that Mr. Tebrick should think of taking his vixen out of doors.	With this spell of fine weather it was but natural that mr Tebrick should think of taking his vixen out of doors.	true	445.07	451.3	15
5513_39476_000021_000001	This was something he had not yet done, both because of the damp rainy weather up till then and because the mere notion of taking her out filled him with alarm.	This was something he had not yet done, both because of the damp rainy weather up till then and because the mere notion of taking her out filled him with alarm.	true	451.82	460.33	17
5513_39476_000021_000002	Indeed he had so many apprehensions beforehand that at one time he resolved totally against it.	Indeed he had so many apprehensions beforehand that at one time he resolved totally against it.	true	460.64	466.24	13
5513_39476_000021_000003	For his mind was filled not only with the fear that she might escape from him and run away, which he knew was groundless, but with more rational visions, such as wandering curs, traps, gins, spring guns, besides a dread of being seen with her by the neighbourhood.	For his mind was filled not only with the fear that she might escape from him and run away, which he knew was groundless, but with more rational visions, such as wandering curs, traps, gins, spring guns, besides a dread of being seen with her by the neighbourhood.	true	466.46	481.72	20
5513_39476_000021_000004	At last however he resolved on it, and all the more as his vixen kept asking him in the gentlest way: "Might she not go out into the garden?" Yet she always listened very submissively when he told her that he was afraid if they were seen together it would excite the curiosity of their neighbours; besides this, he often told her of his fears for her on account of dogs.	At last however he resolved on it, and all the more as his vixen kept asking him in the gentlest way: "Might she not go out into the garden?" Yet she always listened very submissively when he told her that he was afraid if they were seen together it would excite the curiosity of their neighbours; besides this, he often told her of his fears for her on account of dogs.	false	482.03	502.99	18.94684
5513_39476_000021_000005	But one day she answered this by leading him into the hall and pointing boldly to his gun.	But one day she answered this by leading him into the hall and pointing boldly to his gun.	false	503.36	508.12	13
5513_39476_000021_000006	After this he resolved to take her, though with full precautions.	After this he resolved to take her, though with full precautions.	true	508.46	512.05	21
5513_39476_000021_000007	That is he left the house door open so that in case of need she could beat a swift retreat, then he took his gun under his arm, and lastly he had her well wrapped up in a little fur jacket lest she should take cold.	That is he left the house door open so that in case of need she could beat a swift retreat, then he took his gun under his arm, and lastly he had her well wrapped up in a little fur jacket lest she should take cold.	false	512.51	524.77	18
5513_39476_000022_000000	He would have carried her too, but that she delicately disengaged herself from his arms and looked at him very expressively to say that she would go by herself.	He would have carried her too, but that she delicately disengaged herself from his arms and looked at him very expressively to say that she would go by herself.	true	525.35	533.68	16
5513_39476_000022_000001	For already her first horror of being seen to go upon all fours was worn off; reasoning no doubt upon it, that either she must resign herself to go that way or else stay bed-ridden all the rest of her life.	For already her first horror of being seen to go upon all fours was worn off; reasoning no doubt upon it, that either she must resign herself to go that way or else stay bed ridden all the rest of her life.	true	534.2	546.37	17
5513_39476_000023_000000	Her joy at going into the garden was inexpressible.	Her joy at going into the garden was inexpressible.	true	547.01	550.06	18.596594
5513_39476_000023_000001	First she ran this way, then that, though keeping always close to him, looking very sharply with ears cocked forward first at one thing, then another and then up to catch his eye.	First she ran this way, then that, though keeping always close to him, looking very sharply with ears cocked forward first at one thing, then another and then up to catch his eye.	true	550.13	560.77	22.34721
5513_39476_000024_000000	For some time indeed she was almost dancing with delight, running round him, then forward a yard or two, then back to him and gambolling beside him as they went round the garden.	For some time indeed she was almost dancing with delight, running round him, then forward a yard or two, then back to him and gambolling beside him as they went round the garden.	false	561.65	570.91	11
5513_39476_000024_000001	But in spite of her joy she was full of fear.	But in spite of her joy she was full of fear.	true	571.76	574.18	18.174646
5513_39476_000024_000002	At every noise, a cow lowing, a cock crowing, or a ploughman in the distance hulloaing to scare the rooks, she started, her ears pricked to catch the sound, her muzzle wrinkled up and her nose twitched, and she would then press herself against his legs.	At every noise, a cow lowing, a cock crowing, or a ploughman in the distance hulloaing to scare the rooks, she started, her ears pricked to catch the sound, her muzzle wrinkled up and her nose twitched, and she would then press herself against his legs.	false	574.34	589.18	22
5513_39476_000024_000003	They walked round the garden and down to the pond where there were ornamental waterfowl, teal, widgeon and mandarin ducks, and seeing these again gave her great pleasure.	They walked round the garden and down to the pond where there were ornamental waterfowl, teal, widgeon and mandarin ducks, and seeing these again gave her great pleasure.	true	590.09	599.77	18
5513_39476_000024_000004	They had always been her favourites, and now she was so overjoyed to see them that she behaved with very little of her usual self-restraint.	They had always been her favourites, and now she was so overjoyed to see them that she behaved with very little of her usual self restraint.	true	600.53	607.3	16
