2673_156474_000013_000000	Thus far in the war, Farragut had been assigned to no prominent service, but the patience with which he had awaited his opportunity was now more than compensated by the energy and thoroughness with which he superintended the organization of his fleet.	Thus far in the war, Farragut had been assigned to no prominent service, but the patience with which he had awaited his opportunity was now more than compensated by the energy and thoroughness with which he superintended the organization of his fleet.	false	824.93	840.25	22.814568
2673_156474_000013_000001	By the middle of April he was in the lower Mississippi with seventeen men-of-war and one hundred and seventy-seven guns.	By the middle of April he was in the lower Mississippi with seventeen men of war and one hundred and seventy seven guns.	true	840.77	847.96	19.16502
2673_156474_000013_000002	With him were Commander David D. Porter, in charge of a mortar flotilla of nineteen schooners and six armed steamships, and General Benjamin F. Butler, at the head of an army contingent of six thousand men, soon to be followed by considerable reinforcements.	With him were Commander David d Porter, in charge of a mortar flotilla of nineteen schooners and six armed steamships, and General Benjamin f Butler, at the head of an army contingent of six thousand men, soon to be followed by considerable reinforcements.	true	848.54	865.54	22.073643
2673_156474_000014_000000	The first obstacle to be overcome was the fire from the twin forts Jackson and St. Philip, situated nearly opposite each other at a bend of the Mississippi twenty-five miles above the mouth of the river, while the city of New Orleans itself lies seventy-five miles farther up the stream.	The first obstacle to be overcome was the fire from the twin forts Jackson and saint Philip, situated nearly opposite each other at a bend of the Mississippi twenty five miles above the mouth of the river, while the city of New Orleans itself lies seventy five miles farther up the stream.	true	866.39	884.23	21.477337
2673_156474_000014_000001	These were formidable forts of masonry, with an armament together of over a hundred guns, and garrisons of about six hundred men each.	These were formidable forts of masonry, with an armament together of over a hundred guns, and garrisons of about six hundred men each.	true	884.63	894.045	21.885777
2673_156474_000014_000002	They also had auxiliary defenses: first, of a strong river barrier of log rafts and other obstructions connected by powerful chains, half a mile below the forts; second, of an improvised fleet of sixteen rebel gunboats and a formidable floating battery.	They also had auxiliary defenses: first, of a strong river barrier of log rafts and other obstructions connected by powerful chains, half a mile below the forts; second, of an improvised fleet of sixteen rebel gunboats and a formidable floating battery.	true	894.045	912.22	22.97589
2673_156474_000014_000003	None of Farragut's ships were ironclad.	None of Farragut's ships were ironclad.	true	912.71	915.37	24.816362
2673_156474_000014_000004	He had, from the beginning of the undertaking, maintained the theory that a wooden fleet, properly handled, could successfully pass the batteries of the forts.	He had, from the beginning of the undertaking, maintained the theory that a wooden fleet, properly handled, could successfully pass the batteries of the forts.	true	915.89	925.63	23.68482
2673_156474_000014_000005	"I would as soon have a paper ship as an ironclad; only give me _men_ to fight her!" he said.	"I would as soon have a paper ship as an ironclad; only give me underscore men underscore to fight her!" he said.	false	926.6	933.88	19.758684
2673_156474_000014_000006	He might not come back; but New Orleans would be won.	He might not come back; but New Orleans would be won.	true	934.19	938.32	23.912962
2673_156474_000014_000007	In his hazardous undertaking his faith was based largely on the skill and courage of his subordinate commanders of ships, and this faith was fully sustained by their gallantry and devotion.	In his hazardous undertaking his faith was based largely on the skill and courage of his subordinate commanders of ships, and this faith was fully sustained by their gallantry and devotion.	true	938.93	951.85	22.733377
2673_156474_000015_000000	Porter's flotilla of nineteen schooners carrying two mortars each, anchored below the forts, maintained a heavy bombardment for five days, and then Farragut decided to try his ships.	Porter's flotilla of nineteen schooners carrying two mortars each, anchored below the forts, maintained a heavy bombardment for five days, and then Farragut decided to try his ships.	true	952.31	965.08	23.625343
2673_156474_000015_000001	On the night of the twentieth the daring work of two gunboats cut an opening through the river barrier through which the vessels might pass; and at two o'clock on the morning of April 24, Farragut gave the signal to advance.	On the night of the twentieth the daring work of two gunboats cut an opening through the river barrier through which the vessels might pass; and at two o'clock on the morning of april twenty fourth, Farragut gave the signal to advance.	false	965.48	979.75	22.883057
2673_156474_000015_000002	The first division of his fleet, eight vessels, led by Captain Bailey, successfully passed the barrier.	The first division of his fleet, eight vessels, led by Captain Bailey, successfully passed the barrier.	true	980.51	987.7	25.07731
2673_156474_000015_000003	The second division of nine ships was not quite so fortunate.	The second division of nine ships was not quite so fortunate.	true	988.19	992.08	24.19599
2673_156474_000015_000004	Three of them failed to pass the barrier, but the others, led by Farragut himself in his flag-ship, the _Hartford_, followed the advance.	Three of them failed to pass the barrier, but the others, led by Farragut himself in his flag ship, the underscore Hartford underscore, followed the advance.	false	992.48	1001.08	23.740335
2673_156474_000016_000000	The starlit night was quickly obscured by the smoke of the general cannonade from both ships and forts; but the heavy batteries of the latter had little effect on the passing fleet.	The starlit night was quickly obscured by the smoke of the general cannonade from both ships and forts; but the heavy batteries of the latter had little effect on the passing fleet.	true	1001.84	1012.84	22.94625
2673_156474_000016_000001	Farragut's flag-ship was for a short while in great danger.	Farragut's flag ship was for a short while in great danger.	true	1013.27	1017.07	25.218138
2673_156474_000016_000002	At a moment when she slightly grounded a huge fire-raft, fully ablaze, was pushed against her by a rebel tug, and the flames caught in the paint on her side, and mounted into her rigging.	At a moment when she slightly grounded a huge fire raft, fully ablaze, was pushed against her by a rebel tug, and the flames caught in the paint on her side, and mounted into her rigging.	false	1017.56	1030.03	24.278326
2673_156474_000016_000003	But this danger had also been provided against, and by heroic efforts the _Hartford_ freed herself from her peril.	But this danger had also been provided against, and by heroic efforts the underscore Hartford underscore freed herself from her peril.	false	1030.67	1037.41	23.247683
2673_156474_000016_000004	Immediately above the forts, the fleet of rebel gunboats joined in the battle, which now resolved itself into a series of conflicts between single vessels or small groups.	Immediately above the forts, the fleet of rebel gunboats joined in the battle, which now resolved itself into a series of conflicts between single vessels or small groups.	true	1038.29	1048.93	21.36628
2673_156474_000016_000005	But the stronger and better-armed Union ships quickly destroyed the Confederate flotilla, with the single exception that two of the enemy's gunboats rammed the _Varuna_ from opposite sides and sank her.	But the stronger and better armed Union ships quickly destroyed the Confederate flotilla, with the single exception that two of the enemy's gunboats rammed the underscore Varuna underscore from opposite sides and sank her.	false	1049.51	1061.62	22.252052
2673_156474_000016_000006	Aside from this, the Union fleet sustained much miscellaneous damage, but no serious injury in the furious battle of an hour and a half.	Aside from this, the Union fleet sustained much miscellaneous damage, but no serious injury in the furious battle of an hour and a half.	true	1061.62	1070.77	22.848442
2673_156474_000017_000000	With but a short halt at Quarantine, six miles above the forts, Farragut and his thirteen ships of war pushed on rapidly over the seventy-five miles, and on the forenoon of April 25 New Orleans lay helpless under the guns of the Union fleet.	With but a short halt at Quarantine, six miles above the forts, Farragut and his thirteen ships of war pushed on rapidly over the seventy five miles, and on the forenoon of april twenty fifth New Orleans lay helpless under the guns of the Union fleet.	false	1072.07	1089.34	22.648687
2673_156474_000017_000001	The city was promptly evacuated by the Confederate General Lovell.	The city was promptly evacuated by the Confederate General Lovell.	true	1090.01	1094.2	24.940374
2673_156474_000017_000002	Meanwhile, General Butler was busy moving his transports and troops around outside by sea to Quarantine; and, having occupied that point in force, Forts Jackson and St. Philip capitulated on April 28.	Meanwhile, General Butler was busy moving his transports and troops around outside by sea to Quarantine; and, having occupied that point in force, Forts Jackson and saint Philip capitulated on april twenty eighth.	true	1094.84	1111	24.142094
2673_156474_000017_000003	This last obstruction removed, Butler, after having garrisoned the forts, brought the bulk of his army up to New Orleans, and on May 1 Farragut turned over to him the formal possession of the city, where Butler continued in command of the Department of the Gulf until the following December.	This last obstruction removed, Butler, after having garrisoned the forts, brought the bulk of his army up to New Orleans, and on may first Farragut turned over to him the formal possession of the city, where Butler continued in command of the Department of the Gulf until the following December.	false	1111.55	1129.9	24.55752
2673_156474_000018_000000	Farragut immediately despatched an advance section of his fleet up the Mississippi.	Farragut immediately despatched an advance section of his fleet up the Mississippi.	true	1130.33	1135.15	25.16224
2673_156474_000018_000001	None of the important cities on its banks below Vicksburg had yet been fortified, and, without serious opposition, they surrendered as the Union ships successively reached them.	None of the important cities on its banks below Vicksburg had yet been fortified, and, without serious opposition, they surrendered as the Union ships successively reached them.	true	1135.67	1145.83	23.457785
2673_156474_000018_000002	Farragut himself, following with the remainder of his fleet, arrived at Vicksburg on May 20.	Farragut himself, following with the remainder of his fleet, arrived at Vicksburg on may twentieth.	false	1146.74	1154.46	22.669195
2673_156474_000018_000003	This city, by reason of the high bluffs on which it stands, was the most defensible point on the whole length of the great river within the Southern States; but so confidently had the Confederates trusted to the strength of their works at Columbus, Island No. 10, Fort Pillow, and other points, that the fortifications of Vicksburg had thus far received comparatively little attention.	This city, by reason of the high bluffs on which it stands, was the most defensible point on the whole length of the great river within the Southern States; but so confidently had the Confederates trusted to the strength of their works at Columbus, Island no ten, Fort Pillow, and other points, that the fortifications of Vicksburg had thus far received comparatively little attention.	false	1154.46	1179.64	23.762108
2673_156474_000018_000004	The recent Union victories, however, both to the north and south, had awakened them to their danger; and when Lovell evacuated New Orleans, he shipped heavy guns and sent five Confederate regiments to Vicksburg; and during the eight days between their arrival on May 12 and the twentieth, on which day Farragut reached the city, six rebel batteries were put in readiness to fire on his ships.	The recent Union victories, however, both to the north and south, had awakened them to their danger; and when Lovell evacuated New Orleans, he shipped heavy guns and sent five Confederate regiments to Vicksburg; and during the eight days between their arrival on may twelfth and the twentieth, on which day Farragut reached the city, six rebel batteries were put in readiness to fire on his ships.	false	1180.22	1206.01	23.20322
2673_156474_000019_000000	General Halleck, while pushing his siege works toward Corinth, was notified as early as April 27 that Farragut was coming, and the logic of the situation ought to have induced him to send a cooeperating force to Farragut's assistance, or, at the very least, to have matured plans for such cooeperation.	General Halleck, while pushing his siege works toward Corinth, was notified as early as april twenty seventh that Farragut was coming, and the logic of the situation ought to have induced him to send a cooeperating force to Farragut's assistance, or, at the very least, to have matured plans for such cooeperation.	false	1206.71	1227.78	22.776318
2673_156474_000019_000001	All the events would have favored an expedition of this kind.	All the events would have favored an expedition of this kind.	true	1227.78	1231.12	22.632488
2673_156474_000019_000002	When Corinth, at the end of May, fell into Halleck's hands, Forts Pillow and Randolph on the Mississippi River were hastily evacuated by the enemy, and on June 6 the Union flotilla of river gunboats which had rendered such signal service at Henry, Donelson, and Island No. 10, reinforced by a hastily constructed flotilla of heavy river tugs converted into rams, gained another brilliant victory in a most dramatic naval battle at Memphis, during which an opposing Confederate flotilla of similar rams and gunboats was almost completely destroyed, and the immediate evacuation of Memphis by the Confederates thereby forced.	When Corinth, at the end of May, fell into Halleck's hands, Forts Pillow and Randolph on the Mississippi River were hastily evacuated by the enemy, and on june sixth the Union flotilla of river gunboats which had rendered such signal service at Henry, Donelson, and Island no ten, reinforced by a hastily constructed flotilla of heavy river tugs converted into rams, gained another brilliant victory in a most dramatic naval battle at Memphis, during which an opposing Confederate flotilla of similar rams and gunboats was almost completely destroyed, and the immediate evacuation of Memphis by the Confederates thereby forced.	false	1231.55	1273.78	23.161514
2673_156474_000020_000000	This left Vicksburg as the single barrier to the complete opening of the Mississippi, and that barrier was defended by only six batteries and a garrison of six Confederate regiments at the date of Farragut's arrival before it.	This left Vicksburg as the single barrier to the complete opening of the Mississippi, and that barrier was defended by only six batteries and a garrison of six Confederate regiments at the date of Farragut's arrival before it.	true	1274.27	1287.94	23.341047
2673_156474_000020_000001	But Farragut had with his expedition only two regiments of troops, and the rebel batteries were situated at such an elevation that the guns of the Union fleet could not be raised sufficiently to silence them.	But Farragut had with his expedition only two regiments of troops, and the rebel batteries were situated at such an elevation that the guns of the Union fleet could not be raised sufficiently to silence them.	true	1288.4	1301.44	21.756718
2673_156474_000020_000002	Neither help nor promise of help came from Halleck's army, and Farragut could therefore do nothing but turn his vessels down stream and return to New Orleans.	Neither help nor promise of help came from Halleck's army, and Farragut could therefore do nothing but turn his vessels down stream and return to New Orleans.	true	1301.96	1311.55	23.542768
2673_156474_000020_000003	There, about June 1, he received news from the Navy Department that the administration was exceedingly anxious to have the Mississippi opened; and this time, taking with him Porter's mortar flotilla and three thousand troops, he again proceeded up the river, and a second time reached Vicksburg on June 25.	There, about june first, he received news from the Navy Department that the administration was exceedingly anxious to have the Mississippi opened; and this time, taking with him Porter's mortar flotilla and three thousand troops, he again proceeded up the river, and a second time reached Vicksburg on june twenty fifth.	false	1312.07	1334.55	23.161154
2673_156474_000021_000000	The delay, however, had enabled the Confederates greatly to strengthen the fortifications and the garrison of the city.	The delay, however, had enabled the Confederates greatly to strengthen the fortifications and the garrison of the city.	true	1334.55	1341.19	18
2673_156474_000021_000001	Neither a bombardment from Porter's mortar sloops, nor the running of Farragut's ships past the batteries, where they were joined by the Union gunboat flotilla from above, sufficed to bring the Confederates to a surrender.	Neither a bombardment from Porter's mortar sloops, nor the running of Farragut's ships past the batteries, where they were joined by the Union gunboat flotilla from above, sufficed to bring the Confederates to a surrender.	true	1342.04	1355.53	22.776358
2673_156474_000021_000002	Farragut estimated that a cooeperating land force of twelve to fifteen thousand would have enabled him to take the works; and Halleck, on June 28 and July 3, partially promised early assistance.	Farragut estimated that a cooeperating land force of twelve to fifteen thousand would have enabled him to take the works; and Halleck, on june twenty eighth and july third, partially promised early assistance.	false	1356.35	1370.05	23.909918
2673_156474_000021_000003	But on July 14 he reported definitely that it would be impossible for him to render the expected aid.	But on july fourteenth he reported definitely that it would be impossible for him to render the expected aid.	true	1370.54	1377.22	24.521454
2673_156474_000021_000004	Under these circumstances, the Navy Department ordered Farragut back to New Orleans, lest his ships of deep draft should be detained in the river by the rapidly falling water.	Under these circumstances, the Navy Department ordered Farragut back to New Orleans, lest his ships of deep draft should be detained in the river by the rapidly falling water.	false	1377.83	1389.85	23.035698
2673_156474_000021_000005	The capture of Vicksburg was postponed for a whole year, and the early transfer of Halleck to Washington changed the current of Western campaigns.	The capture of Vicksburg was postponed for a whole year, and the early transfer of Halleck to Washington changed the current of Western campaigns.	false	1390.04	1411.05	22.1842
