1603_139325_000059_000002	It may save--London!"	It may save-London!"	true	534.5	535.96	22.250355
1603_139325_000060_000000	He stopped, he could speak no more, he swept the alternative aside by a gesture, and they stood looking at one another.	He stopped, he could speak no more, he swept the alternative aside by a gesture, and they stood looking at one another.	true	536.78	543.13	22.218966
1603_139325_000061_000000	They were both clear that he must go.	They were both clear that he must go.	true	543.74	545.53	20.399988
1603_139325_000061_000001	There was no step back from these towering heroisms.	There was no step back from these towering heroisms.	true	545.96	548.65	21.792006
1603_139325_000062_000000	Her eyes brimmed with tears.	Her eyes brimmed with tears.	true	549.26	550.81	20.007334
1603_139325_000062_000001	She came towards him with a curious movement of her hands, as though she felt her way and could not see; she seized his hand and kissed it.	She came towards him with a curious movement of her hands, as though she felt her way and could not see; she seized his hand and kissed it.	true	551.42	558.49	19.826227
1603_139325_000063_000000	"To wake," she cried, "for this!"	"To wake," she cried, "for this!"	true	558.98	561.34	21.34249
1603_139325_000064_000000	He held her clumsily for a moment, and kissed the hair of her bowed head, and then thrust her away, and turned towards the man in yellow.	He held her clumsily for a moment, and kissed the hair of her bowed head, and then thrust her away, and turned towards the man in yellow.	false	562.37	581.16	18.245026
