698_122863_000042_000005	I believe now he really does mean them, only he has got into the habit of saying them as if he didn't.	I believe now he really does mean them, only he has got into the habit of saying them as if he didn't.	true	558.08	563.11	18.441872
698_122863_000042_000006	He could get over that if he'd take a little trouble.	He could get over that if he'd take a little trouble.	true	563.36	565.48	21.781527
698_122863_000042_000007	I gave him a good broad hint.	I gave him a good broad hint.	true	565.49	567.195	22.103613
698_122863_000042_000008	I told him how hard I tried to make my own little private prayers interesting.	I told him how hard I tried to make my own little private prayers interesting.	true	567.195	570.85	19.874123
698_122863_000042_000009	He told me all about the time he broke his ankle when he was a boy.	He told me all about the time he broke his ankle when he was a boy.	true	571.19	574.27	21
698_122863_000042_000010	It does seem so strange to think of Superintendent Bell ever being a boy.	It does seem so strange to think of Superintendent Bell ever being a boy.	true	574.31	578.29	18.110907
698_122863_000042_000011	Even my imagination has its limits, for I can't imagine THAT.	Even my imagination has its limits, for I can't imagine THAT.	true	578.3	582.16	17.262405
698_122863_000042_000012	When I try to imagine him as a boy I see him with gray whiskers and spectacles, just as he looks in Sunday school, only small.	When I try to imagine him as a boy I see him with gray whiskers and spectacles, just as he looks in Sunday school, only small.	true	582.26	589.03	22.231985
698_122863_000042_000013	Now, it's so easy to imagine Mrs. Allan as a little girl.	Now, it's so easy to imagine mrs Allan as a little girl.	true	589.34	592.72	18
698_122863_000042_000014	Mrs. Allan has been to see me fourteen times.	mrs Allan has been to see me fourteen times.	true	592.76	595.5	16.69151
698_122863_000042_000015	Isn't that something to be proud of, Marilla?	Isn't that something to be proud of, Marilla?	true	595.5	597.49	22
698_122863_000042_000016	When a minister's wife has so many claims on her time!	When a minister's wife has so many claims on her time!	true	597.53	600.46	21
698_122863_000042_000017	She is such a cheerful person to have visit you, too.	She is such a cheerful person to have visit you, too.	true	600.68	603.25	19
698_122863_000042_000018	She never tells you it's your own fault and she hopes you'll be a better girl on account of it.	She never tells you it's your own fault and she hopes you'll be a better girl on account of it.	true	603.32	607.78	22.239952
698_122863_000042_000019	Mrs. Lynde always told me that when she came to see me; and she said it in a kind of way that made me feel she might hope I'd be a better girl but didn't really believe I would.	mrs Lynde always told me that when she came to see me; and she said it in a kind of way that made me feel she might hope I'd be a better girl but didn't really believe I would.	true	607.85	616.3	18.590008
698_122863_000042_000020	Even Josie Pye came to see me.	Even Josie Pye came to see me.	true	616.82	618.85	22.304747
698_122863_000042_000021	I received her as politely as I could, because I think she was sorry she dared me to walk a ridgepole.	I received her as politely as I could, because I think she was sorry she dared me to walk a ridgepole.	true	618.89	623.77	22.014435
698_122863_000042_000022	If I had been killed she would had to carry a dark burden of remorse all her life.	If I had been killed she would had to carry a dark burden of remorse all her life.	false	623.87	628.69	22.604574
698_122863_000042_000023	Diana has been a faithful friend.	Diana has been a faithful friend.	true	628.82	630.63	20.798874
698_122863_000042_000024	She's been over every day to cheer my lonely pillow.	She's been over every day to cheer my lonely pillow.	true	630.63	633.28	20.77416
698_122863_000042_000025	But oh, I shall be so glad when I can go to school for I've heard such exciting things about the new teacher.	But oh, I shall be so glad when I can go to school for I've heard such exciting things about the new teacher.	true	633.38	638.68	19.675955
698_122863_000042_000026	The girls all think she is perfectly sweet.	The girls all think she is perfectly sweet.	true	638.72	641.05	20.123531
698_122863_000042_000027	Diana says she has the loveliest fair curly hair and such fascinating eyes.	Diana says she has the loveliest fair curly hair and such fascinating eyes.	true	641.09	645.36	17.373123
698_122863_000042_000028	She dresses beautifully, and her sleeve puffs are bigger than anybody else's in Avonlea.	She dresses beautifully, and her sleeve puffs are bigger than anybody else's in Avonlea.	true	645.36	650.05	18
698_122863_000042_000029	Every other Friday afternoon she has recitations and everybody has to say a piece or take part in a dialogue.	Every other Friday afternoon she has recitations and everybody has to say a piece or take part in a dialogue.	false	650.39	656.145	20.509806
698_122863_000042_000030	Oh, it's just glorious to think of it.	Oh, it's just glorious to think of it.	true	656.145	658.15	22.82442
698_122863_000042_000031	Josie Pye says she hates it but that is just because Josie has so little imagination.	Josie Pye says she hates it but that is just because Josie has so little imagination.	true	658.16	662.8	19.655014
698_122863_000042_000032	Diana and Ruby Gillis and Jane Andrews are preparing a dialogue, called 'A Morning Visit,' for next Friday.	Diana and Ruby Gillis and Jane Andrews are preparing a dialogue, called 'A Morning Visit,' for next Friday.	true	663.38	669.34	18.860176
698_122863_000042_000033	And the Friday afternoons they don't have recitations Miss Stacy takes them all to the woods for a 'field' day and they study ferns and flowers and birds.	And the Friday afternoons they don't have recitations Miss Stacy takes them all to the woods for a 'field' day and they study ferns and flowers and birds.	true	669.44	677.04	21
698_122863_000042_000034	And they have physical culture exercises every morning and evening.	And they have physical culture exercises every morning and evening.	true	677.04	680.17	17
698_122863_000042_000035	Mrs. Lynde says she never heard of such goings on and it all comes of having a lady teacher.	mrs Lynde says she never heard of such goings on and it all comes of having a lady teacher.	true	680.27	684.88	16.615742
698_122863_000042_000036	But I think it must be splendid and I believe I shall find that Miss Stacy is a kindred spirit."	But I think it must be splendid and I believe I shall find that Miss Stacy is a kindred spirit."	true	685.16	690.22	19.134882
698_122863_000043_000000	"There's one thing plain to be seen, Anne," said Marilla, "and that is that your fall off the Barry roof hasn't injured your tongue at all."	"There's one thing plain to be seen, Anne," said Marilla, "and that is that your fall off the Barry roof hasn't injured your tongue at all."	true	691.34	698.94	19.902195
698_122863_000044_000000	CHAPTER XXIV.	CHAPTER twenty four.	false	698.94	700.77	8
698_122863_000044_000001	Miss Stacy and Her Pupils Get Up a Concert	Miss Stacy and Her Pupils Get Up a Concert	false	700.77	702.24	100
698_122863_000045_000000	It was October again when Anne was ready to go back to school--a glorious October, all red and gold, with mellow mornings when the valleys were filled with delicate mists as if the spirit of autumn had poured them in for the sun to drain--amethyst, pearl, silver, rose, and smoke-blue.	It was October again when Anne was ready to go back to school-a glorious October, all red and gold, with mellow mornings when the valleys were filled with delicate mists as if the spirit of autumn had poured them in for the sun to drain-amethyst, pearl, silver, rose, and smoke blue.	false	702.24	704.49	19.535355
698_122863_000045_000001	The dews were so heavy that the fields glistened like cloth of silver and there were such heaps of rustling leaves in the hollows of many-stemmed woods to run crisply through.	The dews were so heavy that the fields glistened like cloth of silver and there were such heaps of rustling leaves in the hollows of many stemmed woods to run crisply through.	false	704.49	704.94	11
698_122863_000045_000002	The Birch Path was a canopy of yellow and the ferns were sear and brown all along it.	The Birch Path was a canopy of yellow and the ferns were sear and brown all along it.	false	704.94	705.3	10
698_122863_000045_000003	There was a tang in the very air that inspired the hearts of small maidens tripping, unlike snails, swiftly and willingly to school; and it WAS jolly to be back again at the little brown desk beside Diana, with Ruby Gillis nodding across the aisle and Carrie Sloane sending up notes and Julia Bell passing a "chew" of gum down from the back seat.	There was a tang in the very air that inspired the hearts of small maidens tripping, unlike snails, swiftly and willingly to school; and it WAS jolly to be back again at the little brown desk beside Diana, with Ruby Gillis nodding across the aisle and Carrie Sloane sending up notes and Julia Bell passing a "chew" of gum down from the back seat.	false	705.3	708.99	17.620035
698_122863_000045_000004	Anne drew a long breath of happiness as she sharpened her pencil and arranged her picture cards in her desk.	Anne drew a long breath of happiness as she sharpened her pencil and arranged her picture cards in her desk.	false	708.99	711.6	11.99566
698_122863_000045_000005	Life was certainly very interesting.	Life was certainly very interesting.	false	711.6	712.23	10
