2004_147173_000046_000000	"Let me stay up a little," pleaded Mary, as her hostess seemed so resolute about seeing her to bed.	"Let me stay up a little," pleaded Mary, as her hostess seemed so resolute about seeing her to bed.	true	692.63	698.68	18.032919
2004_147173_000046_000001	Her looks won her suit.	Her looks won her suit.	true	699.29	700.99	23.22224
2004_147173_000047_000000	"Well, I suppose I mun.	"Well, I suppose I mun.	true	701.72	703.36	22.577084
2004_147173_000047_000001	I shall catch it down stairs, I know.	I shall catch it down stairs, I know.	true	703.37	705.4	23.129063
2004_147173_000047_000002	He'll be in a fidget till you're getten to bed, I know; so you mun be quiet if you are so bent upon staying up."	He'll be in a fidget till you're getten to bed, I know; so you mun be quiet if you are so bent upon staying up."	true	705.53	711.16	18
2004_147173_000048_000000	And quietly, noiselessly, Mary watched the unchanging weather-cock through the night.	And quietly, noiselessly, Mary watched the unchanging weather cock through the night.	true	712.1	717.67	21.501097
2004_147173_000048_000001	She sat on the little window-seat, her hand holding back the curtain which shaded the room from the bright moonlight without; her head resting its weariness against the corner of the window-frame; her eyes burning and stiff with the intensity of her gaze.	She sat on the little window seat, her hand holding back the curtain which shaded the room from the bright moonlight without; her head resting its weariness against the corner of the window frame; her eyes burning and stiff with the intensity of her gaze.	true	718.22	732.64	20.394339
2004_147173_000049_000000	The ruddy morning stole up the horizon, casting a crimson glow into the watcher's room.	The ruddy morning stole up the horizon, casting a crimson glow into the watcher's room.	true	733.91	739.54	17.926563
2004_147173_000050_000000	It was the morning of the day of trial!	It was the morning of the day of trial!	false	740.3	750.63	19.089228
