2654_158744_000019_000011	Lord Fawn, the eldest son, a young man of about thirty-five, a Peer of Parliament and an Under-Secretary of State,--very prudent and very diligent,--of whom his mother and sisters stood in great awe, consulted her frequently and made no secret of his friendship.	Lord Fawn, the eldest son, a young man of about thirty five, a Peer of Parliament and an under-secretary of State,--very prudent and very diligent,--of whom his mother and sisters stood in great awe, consulted her frequently and made no secret of his friendship.	false	734.66	750.46	21.35485
2654_158744_000019_000012	The mother knew her awful son well, and was afraid of nothing wrong in that direction.	The mother knew her awful son well, and was afraid of nothing wrong in that direction.	true	750.95	755.74	18.628046
2654_158744_000019_000013	Lord Fawn had suffered a disappointment in love, but he had consoled himself with blue-books, and mastered his passion by incessant attendance at the India Board. The lady he had loved had been rich, and Lord Fawn was poor; but nevertheless he had mastered his passion.	Lord Fawn had suffered a disappointment in love, but he had consoled himself with blue books, and mastered his passion by incessant attendance at the India Board. The lady he had loved had been rich, and Lord Fawn was poor; but nevertheless he had mastered his passion.	true	756.23	773.47	21.425356
2654_158744_000019_000014	There was no fear that his feelings towards the governess would become too warm;--nor was it likely that Miss Morris should encounter danger in regard to him.	There was no fear that his feelings towards the governess would become too warm;--nor was it likely that Miss Morris should encounter danger in regard to him.	true	773.72	783.13	22.516645
2654_158744_000019_000015	It was quite an understood thing in the family that Lord Fawn must marry money.	It was quite an understood thing in the family that Lord Fawn must marry money.	true	783.26	788.74	26.055075
2654_158744_000020_000000	Lucy Morris was indeed a treasure.	Lucy Morris was indeed a treasure.	true	789.77	792.73	18.208311
2654_158744_000020_000001	No brighter face ever looked into another to seek sympathy there, either in mirth or woe.	No brighter face ever looked into another to seek sympathy there, either in mirth or woe.	true	792.8	798.37	18
2654_158744_000020_000002	There was a gleam in her eyes that was almost magnetic, so sure was she to obtain by it that community of interest which she desired,--though it were but for a moment.	There was a gleam in her eyes that was almost magnetic, so sure was she to obtain by it that community of interest which she desired,--though it were but for a moment.	false	798.83	809.11	22.094969
2654_158744_000020_000003	Lord Fawn was pompous, slow, dull, and careful; but even he had given way to it at once.	Lord Fawn was pompous, slow, dull, and careful; but even he had given way to it at once.	true	809.57	816.22	21
2654_158744_000020_000004	Lady Fawn, too, was very careful, but she had owned to herself long since that she could not bear to look forward to any permanent severance.	Lady Fawn, too, was very careful, but she had owned to herself long since that she could not bear to look forward to any permanent severance.	true	816.74	824.47	20
2654_158744_000020_000005	Of course Lucy would be made over to the Hittaways, whose mother lived in Warwick Square, and whose father was Chairman of the Board of Civil Appeals.	Of course Lucy would be made over to the Hittaways, whose mother lived in Warwick Square, and whose father was Chairman of the Board of Civil Appeals.	true	824.93	832.84	21.94206
2654_158744_000020_000006	The Hittaways were the only grandchildren with whom Lady Fawn had as yet been blessed, and of course Lucy must go to the Hittaways.	The Hittaways were the only grandchildren with whom Lady Fawn had as yet been blessed, and of course Lucy must go to the Hittaways.	false	833.24	841.72	22
2654_158744_000021_000000	She was but a little thing;--and it cannot be said of her, as of Lady Eustace, that she was a beauty.	She was but a little thing;--and it cannot be said of her, as of Lady Eustace, that she was a beauty.	true	842.48	849.07	23.309765
2654_158744_000021_000001	The charm of her face consisted in the peculiar, watery brightness of her eyes,--in the corners of which it would always seem that a diamond of a tear was lurking whenever any matter of excitement was afoot.	The charm of her face consisted in the peculiar, watery brightness of her eyes,--in the corners of which it would always seem that a diamond of a tear was lurking whenever any matter of excitement was afoot.	true	849.38	860.17	18.965166
2654_158744_000021_000002	Her light-brown hair was soft and smooth and pretty.	Her light brown hair was soft and smooth and pretty.	true	860.57	863.83	21.392332
2654_158744_000021_000003	As hair it was very well, but it had no speciality.	As hair it was very well, but it had no speciality.	true	864.32	867.85	21.999874
2654_158744_000021_000004	Her mouth was somewhat large, but full of ever-varying expression.	Her mouth was somewhat large, but full of ever varying expression.	true	868.43	872.41	22.020819
2654_158744_000021_000005	Her forehead was low and broad, with prominent temples, on which it was her habit to clasp tightly her little outstretched fingers as she sat listening to you.	Her forehead was low and broad, with prominent temples, on which it was her habit to clasp tightly her little outstretched fingers as she sat listening to you.	true	872.69	882.19	19
2654_158744_000021_000006	Of listeners she was the very best, for she would always be saying a word or two, just to help you,--the best word that could be spoken, and then again she would be hanging on your lips.	Of listeners she was the very best, for she would always be saying a word or two, just to help you,--the best word that could be spoken, and then again she would be hanging on your lips.	true	882.83	892.78	19.953371
2654_158744_000021_000007	There are listeners who show by their mode of listening that they listen as a duty,--not because they are interested.	There are listeners who show by their mode of listening that they listen as a duty,--not because they are interested.	true	893.18	899.38	19.901566
2654_158744_000021_000008	Lucy Morris was not such a one.	Lucy Morris was not such a one.	true	899.72	902.2	19.624746
2654_158744_000021_000009	She would take up your subject, whatever it was, and make it her own.	She would take up your subject, whatever it was, and make it her own.	true	902.33	906.25	23
2654_158744_000021_000010	There was forward just then a question as to whether the Sawab of Mygawb should have twenty millions of rupees paid to him and be placed upon a throne, or whether he should be kept in prison all his life.	There was forward just then a question as to whether the Sawab of Mygawb should have twenty millions of rupees paid to him and be placed upon a throne, or whether he should be kept in prison all his life.	true	906.74	918.85	20.183283
2654_158744_000021_000011	The British world generally could not be made to interest itself about the Sawab, but Lucy positively mastered the subject, and almost got Lord Fawn into a difficulty by persuading him to stand up against his chief on behalf of the injured prince.	The British world generally could not be made to interest itself about the Sawab, but Lucy positively mastered the subject, and almost got Lord Fawn into a difficulty by persuading him to stand up against his chief on behalf of the injured prince.	false	919.4	933.79	23.006508
2654_158744_000022_000000	What else can be said of her face or personal appearance that will interest a reader?	What else can be said of her face or personal appearance that will interest a reader?	true	935.09	940.03	23
2654_158744_000022_000001	When she smiled, there was the daintiest little dimple on her cheek.	When she smiled, there was the daintiest little dimple on her cheek.	false	940.58	944.71	22.67411
2654_158744_000022_000002	And when she laughed, that little nose, which was not as well-shaped a nose as it might have been, would almost change its shape and cock itself up in its mirth.	And when she laughed, that little nose, which was not as well shaped a nose as it might have been, would almost change its shape and cock itself up in its mirth.	true	945.08	954.55	19.15795
2654_158744_000022_000003	Her hands were very thin and long, and so were her feet,--by no means models as were those of her friend Lady Eustace.	Her hands were very thin and long, and so were her feet,--by no means models as were those of her friend Lady Eustace.	true	954.95	961.96	19
2654_158744_000022_000004	She was a little, thin, quick, graceful creature, whom it was impossible that you should see without wishing to have near you.	She was a little, thin, quick, graceful creature, whom it was impossible that you should see without wishing to have near you.	true	962.3	968.95	20.247725
2654_158744_000022_000005	A most unselfish little creature she was, but one who had a well-formed idea of her own identity.	A most unselfish little creature she was, but one who had a well formed idea of her own identity.	true	969.71	977.2	20.354343
2654_158744_000022_000006	She was quite resolved to be somebody among her fellow-creatures,--not somebody in the way of marrying a lord or a rich man, or somebody in the way of being a beauty, or somebody as a wit; but somebody as having a purpose and a use in life.	She was quite resolved to be somebody among her fellow creatures,--not somebody in the way of marrying a lord or a rich man, or somebody in the way of being a beauty, or somebody as a wit; but somebody as having a purpose and a use in life.	true	977.48	992.98	19.129469
2654_158744_000022_000007	She was the humblest little thing in the world in regard to any possible putting of herself forward or needful putting of herself back; and yet, to herself, nobody was her superior.	She was the humblest little thing in the world in regard to any possible putting of herself forward or needful putting of herself back; and yet, to herself, nobody was her superior.	true	993.26	1004.91	21.57438
2654_158744_000022_000008	What she had was her own, whether it was the old grey silk dress which she had bought with the money she had earned, or the wit which nature had given her.	What she had was her own, whether it was the old grey silk dress which she had bought with the money she had earned, or the wit which nature had given her.	false	1004.91	1013.98	21.206114
2654_158744_000022_000009	And Lord Fawn's title was his own, and Lady Fawn's rank her own.	And Lord Fawn's title was his own, and Lady Fawn's rank her own.	false	1014.53	1019.2	16.292772
2654_158744_000022_000010	She coveted no man's possessions,--and no woman's; but she was minded to hold by her own.	She coveted no man's possessions,--and no woman's; but she was minded to hold by her own.	true	1020.14	1026.43	21.54649
2654_158744_000022_000011	Of present advantages or disadvantages,--whether she had the one or suffered from the other,--she thought not at all.	Of present advantages or disadvantages,--whether she had the one or suffered from the other,--she thought not at all.	true	1026.65	1033.15	20.903532
2654_158744_000022_000012	It was her fault that she had nothing of feminine vanity.	It was her fault that she had nothing of feminine vanity.	true	1033.4	1036.24	19
2654_158744_000022_000013	But no man or woman was ever more anxious to be effective, to persuade, to obtain belief, sympathy, and co-operation;--not for any result personal to herself, but because, by obtaining these things, she could be effective in the object then before her, be it what it might.	But no man or woman was ever more anxious to be effective, to persuade, to obtain belief, sympathy, and co-operation;--not for any result personal to herself, but because, by obtaining these things, she could be effective in the object then before her, be it what it might.	false	1036.24	1054.24	22.08132
2654_158744_000023_000000	One other thing may be told of her.	One other thing may be told of her.	true	1054.94	1057.57	19.988855
2654_158744_000023_000001	She had given her heart,--for good and all, as she owned to herself,--to Frank Greystock.	She had given her heart,--for good and all, as she owned to herself,--to Frank Greystock.	true	1057.67	1063.69	23.856546
2654_158744_000023_000002	She had owned to herself that it was so, and had owned to herself that nothing could come of it.	She had owned to herself that it was so, and had owned to herself that nothing could come of it.	true	1063.94	1068.85	18.3636
2654_158744_000023_000003	Frank was becoming a man of mark,--but was becoming a man of mark without much money.	Frank was becoming a man of mark,--but was becoming a man of mark without much money.	true	1069.34	1075.12	23.73826
2654_158744_000023_000004	Of all men he was the last who could afford to marry a governess.	Of all men he was the last who could afford to marry a governess.	true	1075.64	1079.32	20
2654_158744_000023_000005	And then, moreover, he had never said a word to make her think that he loved her.	And then, moreover, he had never said a word to make her think that he loved her.	true	1079.69	1083.94	23.655804
2654_158744_000023_000006	He had called on her once or twice at Fawn Court,--as why should he not?	He had called on her once or twice at Fawn Court,--as why should he not?	false	1084.31	1088.92	23.131866
2654_158744_000023_000007	Seeing that there had been friendship between the families for so many years, who could complain of that?	Seeing that there had been friendship between the families for so many years, who could complain of that?	true	1089.05	1093.99	22.175323
2654_158744_000023_000008	Lady Fawn, however, had--not complained, but just said a word.	Lady Fawn, however, had-not complained, but just said a word.	true	1094.48	1099.68	21.273283
2654_158744_000023_000009	A word in season, how good is it?	A word in season, how good is it?	true	1099.68	1101.49	21.618685
2654_158744_000023_000010	Lucy did not much regard the word spoken to herself; but when she reflected that a word must also have been spoken to Mr. Greystock,--otherwise how should it have been that he never came again?--that she did not like.	Lucy did not much regard the word spoken to herself; but when she reflected that a word must also have been spoken to mr Greystock,--otherwise how should it have been that he never came again?--that she did not like.	true	1101.77	1116.04	21.948338
2654_158744_000024_000000	In herself she regarded this passion of hers as a healthy man regards the loss of a leg or an arm.	In herself she regarded this passion of hers as a healthy man regards the loss of a leg or an arm.	false	1116.59	1123.36	20.297365
2654_158744_000024_000001	It is a great nuisance, a loss that maims the whole life,--a misfortune to be much regretted.	It is a great nuisance, a loss that maims the whole life,--a misfortune to be much regretted.	true	1123.52	1128.73	21.177868
2654_158744_000024_000002	But because a leg is gone, everything is not gone.	But because a leg is gone, everything is not gone.	false	1129.22	1132.72	22.591175
2654_158744_000024_000003	A man with a wooden leg may stump about through much action, and may enjoy the keenest pleasures of humanity.	A man with a wooden leg may stump about through much action, and may enjoy the keenest pleasures of humanity.	true	1133.09	1139.02	21
2654_158744_000024_000004	He has his eyes left to him, and his ears, and his intellect.	He has his eyes left to him, and his ears, and his intellect.	true	1139.24	1143.34	23.324331
2654_158744_000024_000005	He will not break his heart for the loss of that leg.	He will not break his heart for the loss of that leg.	true	1143.77	1146.73	21.760462
2654_158744_000024_000006	And so it was with Lucy Morris.	And so it was with Lucy Morris.	true	1146.95	1149.4	21.841051
2654_158744_000024_000007	She would still stump about and be very active.	She would still stump about and be very active.	true	1149.59	1152.55	26.910683
2654_158744_000024_000008	Eyes, ears, and intellect were left to her.	Eyes, ears, and intellect were left to her.	true	1152.71	1155.58	20
2654_158744_000024_000009	Looking at her position, she told herself that a happy love could hardly have been her lot in life.	Looking at her position, she told herself that a happy love could hardly have been her lot in life.	true	1155.98	1161.52	18.805754
2654_158744_000024_000010	Lady Fawn, she thought, was right.	Lady Fawn, she thought, was right.	true	1161.83	1164.46	21.437336
2654_158744_000024_000011	A governess should make up her mind to do without a lover.	A governess should make up her mind to do without a lover.	true	1164.77	1168.51	22.775015
2654_158744_000024_000012	She had given away her heart, and yet she would do without a lover.	She had given away her heart, and yet she would do without a lover.	true	1168.76	1172.32	22.655571
2654_158744_000024_000013	When, on one dull, dark afternoon, as she was thinking of all this, Lord Fawn suddenly put into her hands a cruelly long printed document respecting the Sawab, she went to work upon it immediately.	When, on one dull, dark afternoon, as she was thinking of all this, Lord Fawn suddenly put into her hands a cruelly long printed document respecting the Sawab, she went to work upon it immediately.	false	1172.81	1186.15	20.730917
2654_158744_000024_000014	As she read it, she could not refrain from thinking how wonderfully Frank Greystock would plead the cause of the Indian prince, if the privilege of pleading it could be given to him.	As she read it, she could not refrain from thinking how wonderfully Frank Greystock would plead the cause of the Indian prince, if the privilege of pleading it could be given to him.	false	1186.7	1197.37	21.544939
2654_158744_000025_000000	The spring had come round, with May and the London butterflies, at the time at which our story begins, and during six months Frank Greystock had not been at Fawn Court.	The spring had come round, with May and the London butterflies, at the time at which our story begins, and during six months Frank Greystock had not been at Fawn Court.	false	1197.92	1208.62	21.329857
2654_158744_000025_000001	Then one day Lady Eustace came down with her ponies, and her footman, and a new dear friend of hers, Miss Macnulty.	Then one day Lady Eustace came down with her ponies, and her footman, and a new dear friend of hers, Miss Macnulty.	false	1209.14	1216.48	23.971323
2654_158744_000025_000002	While Miss Macnulty was being honoured by Lady Fawn, Lizzie had retreated to a corner with her old dear friend Lucy Morris.	While Miss Macnulty was being honoured by Lady Fawn, Lizzie had retreated to a corner with her old dear friend Lucy Morris.	false	1216.91	1223.95	20.609436
2654_158744_000025_000003	It was pretty to see how so wealthy and fashionable a woman as Lady Eustace could show so much friendship to a governess.	It was pretty to see how so wealthy and fashionable a woman as Lady Eustace could show so much friendship to a governess.	true	1224.32	1231.09	18.952509
2654_158744_000025_000004	"Have you seen Frank, lately?" said Lady Eustace, referring to her cousin the barrister.	"Have you seen Frank, lately?" said Lady Eustace, referring to her cousin the barrister.	true	1232.18	1237.18	19.700928
2654_158744_000026_000000	"Not for ever so long," said Lucy, with her cheeriest smile.	"Not for ever so long," said Lucy, with her cheeriest smile.	true	1238.03	1242.28	19.713678
2654_158744_000027_000000	"He is not going to prove a false knight?" asked Lady Eustace, in her lowest whisper.	"He is not going to prove a false knight?" asked Lady Eustace, in her lowest whisper.	true	1242.65	1247.56	21.396255
2654_158744_000028_000000	"I don't know that Mr. Greystock is much given to knighthood at all," said Lucy,--"unless it is to being made Sir Francis by his party."	"I don't know that mr Greystock is much given to knighthood at all," said Lucy,--"unless it is to being made Sir Francis by his party."	true	1248.17	1257.25	19.085817
2654_158744_000029_000000	"Nonsense, my dear; as if I didn't know.	"Nonsense, my dear; as if I didn't know.	true	1258.16	1260.91	24.820728
2654_158744_000029_000001	I suppose Lady Fawn has been interfering--like an old cat as she is."	I suppose Lady Fawn has been interfering-like an old cat as she is."	false	1261.1	1264.99	18.30736
2654_158744_000030_000000	"She is not an old cat, Lizzie! and I won't hear her called so.	"She is not an old cat, Lizzie! and I won't hear her called so.	true	1265.6	1269.61	18
2654_158744_000030_000001	If you think so, you shouldn't come here.	If you think so, you shouldn't come here.	false	1269.92	1272.75	19.133064
2654_158744_000030_000002	And she hasn't interfered. That is, she has done nothing that she ought not to have done."	And she hasn't interfered. That is, she has done nothing that she ought not to have done."	false	1272.75	1276.92	16
2654_158744_000031_000000	"Then she has interfered," said Lady Eustace, as she got up and walked across the room, with a sweet smile to the old cat.	"Then she has interfered," said Lady Eustace, as she got up and walked across the room, with a sweet smile to the old cat.	false	1276.92	1286.73	21.38342
2654_158744_000032_000000	CHAPTER IV	CHAPTER four	false	1286.73	1287.06	-20
2654_158744_000033_000000	Frank Greystock	Frank Greystock	false	1287.06	1287.42	-2
2654_158744_000034_000000	Frank Greystock the barrister was the only son of the Dean of Bobsborough.	Frank Greystock the barrister was the only son of the Dean of Bobsborough.	false	1287.42	1289.04	19.111965
2654_158744_000034_000001	Now the dean had a family of daughters,--not quite so numerous indeed as that of Lady Fawn, for there were only three of them,--and was by no means a rich man.	Now the dean had a family of daughters,--not quite so numerous indeed as that of Lady Fawn, for there were only three of them,--and was by no means a rich man.	false	1289.04	1294.05	19.495626
2654_158744_000034_000002	Unless a dean have a private fortune, or has chanced to draw the happy lot of Durham in the lottery of deans, he can hardly be wealthy.	Unless a dean have a private fortune, or has chanced to draw the happy lot of Durham in the lottery of deans, he can hardly be wealthy.	false	1294.05	1297.29	22.030642
2654_158744_000034_000003	At Bobsborough the dean was endowed with a large, rambling, picturesque, uncomfortable house, and with L1,500 a year.	At Bobsborough the dean was endowed with a large, rambling, picturesque, uncomfortable house, and with L one thousand five hundred a year.	false	1297.29	1297.59	19.19535
2654_158744_000034_000004	In regard to personal property it may be asserted of all the Greystocks that they never had any.	In regard to personal property it may be asserted of all the Greystocks that they never had any.	false	1297.59	1297.83	10
2654_158744_000034_000005	They were a family of which the males would surely come to be deans and admirals, and the females would certainly find husbands.	They were a family of which the males would surely come to be deans and admirals, and the females would certainly find husbands.	false	1297.83	1299.15	17.590002
2654_158744_000034_000006	And they lived on the good things of the world, and mixed with wealthy people.	And they lived on the good things of the world, and mixed with wealthy people.	false	1299.15	1299.15	
2654_158744_000034_000007	But they never had any money.	But they never had any money.	false	1299.15	1299.15	
2654_158744_000034_000008	The Eustaces always had money, and the Bishop of Bobsborough was wealthy.	The Eustaces always had money, and the Bishop of Bobsborough was wealthy.	false	1299.15	1299.15	
2654_158744_000034_000009	The dean was a man very different from his brother the admiral, who had never paid anybody anything.	The dean was a man very different from his brother the admiral, who had never paid anybody anything.	false	1299.15	1299.15	
2654_158744_000034_000010	The dean did pay; but he was a little slow in his payments, and money with him was never very plentiful.	The dean did pay; but he was a little slow in his payments, and money with him was never very plentiful.	false	1299.15	1299.15	
2654_158744_000034_000011	In these circumstances it became very expedient that Frank Greystock should earn his bread early in life.	In these circumstances it became very expedient that Frank Greystock should earn his bread early in life.	false	1299.15	1299.15	
