2654_158744_000000_000000	CHAPTER III	CHAPTER three	false	8.94	32.05	22.764263
2654_158744_000001_000000	Lucy Morris	Lucy Morris	true	32.24	33.76	20.99432
2654_158744_000002_000000	Although the first two chapters of this new history have been devoted to the fortunes and personal attributes of Lady Eustace, the historian begs his readers not to believe that that opulent and aristocratic Becky Sharp is to assume the dignity of heroine in the forthcoming pages.	Although the first two chapters of this new history have been devoted to the fortunes and personal attributes of Lady Eustace, the historian begs his readers not to believe that that opulent and aristocratic Becky Sharp is to assume the dignity of heroine in the forthcoming pages.	false	34.82	53.98	22.532068
2654_158744_000002_000001	That there shall be any heroine the historian will not take upon himself to assert; but if there be a heroine, that heroine shall not be Lady Eustace.	That there shall be any heroine the historian will not take upon himself to assert; but if there be a heroine, that heroine shall not be Lady Eustace.	false	54.62	65.23	20.466738
2654_158744_000002_000002	Poor Lizzie Greystock!--as men double her own age, and who had known her as a forward, capricious, spoilt child in her father's lifetime, would still call her.	Poor Lizzie Greystock!--as men double her own age, and who had known her as a forward, capricious, spoilt child in her father's lifetime, would still call her.	true	65.9	75.37	21.705769
2654_158744_000002_000003	She did so many things, made so many efforts, caused so much suffering to others, and suffered so much herself throughout the scenes with which we are about to deal, that the story can hardly be told without giving her that prominence of place which has been assigned to her in the last two chapters.	She did so many things, made so many efforts, caused so much suffering to others, and suffered so much herself throughout the scenes with which we are about to deal, that the story can hardly be told without giving her that prominence of place which has been assigned to her in the last two chapters.	false	75.92	96.16	21.39466
2654_158744_000003_000000	Nor does the chronicler dare to put forward Lucy Morris as a heroine. The real heroine, if it be found possible to arrange her drapery for her becomingly, and to put that part which she enacted into properly heroic words, shall stalk in among us at some considerably later period of the narrative, when the writer shall have accustomed himself to the flow of words, and have worked himself up to a state of mind fit for the reception of noble acting and noble speaking.	Nor does the chronicler dare to put forward Lucy Morris as a heroine. The real heroine, if it be found possible to arrange her drapery for her becomingly, and to put that part which she enacted into properly heroic words, shall stalk in among us at some considerably later period of the narrative, when the writer shall have accustomed himself to the flow of words, and have worked himself up to a state of mind fit for the reception of noble acting and noble speaking.	false	97.46	127.39	21.99286
2654_158744_000003_000001	In the meantime, let it be understood that poor little Lucy Morris was a governess in the house of old Lady Fawn, when our beautiful young widow established herself in Mount Street.	In the meantime, let it be understood that poor little Lucy Morris was a governess in the house of old Lady Fawn, when our beautiful young widow established herself in Mount Street.	true	127.88	139.96	22.432663
2654_158744_000004_000000	Lady Eustace and Lucy Morris had known each other for many years,--had indeed been children together,--there having been some old family friendship between the Greystocks and the Morrises.	Lady Eustace and Lucy Morris had known each other for many years,--had indeed been children together,--there having been some old family friendship between the Greystocks and the Morrises.	true	140.78	152.41	21.538176
2654_158744_000004_000001	When the admiral's wife was living, Lucy had, as a little girl of eight or nine, been her guest.	When the admiral's wife was living, Lucy had, as a little girl of eight or nine, been her guest.	true	152.78	158.77	19.71003
2654_158744_000004_000002	She had often been a guest at the deanery.	She had often been a guest at the deanery.	true	158.84	161.44	21.147217
2654_158744_000004_000003	When Lady Eustace had gone down to the bishop's palace at Bobsborough, in order that an heir to the Eustaces might be born under an auspicious roof, Lucy Morris was with the Greystocks.	When Lady Eustace had gone down to the bishop's palace at Bobsborough, in order that an heir to the Eustaces might be born under an auspicious roof, Lucy Morris was with the Greystocks.	false	161.72	172.15	20.89042
2654_158744_000004_000004	Lucy, who was a year younger than Lizzie, had at that time been an orphan for the last four years.	Lucy, who was a year younger than Lizzie, had at that time been an orphan for the last four years.	true	172.4	178.24	21.484735
2654_158744_000004_000005	She too had been left penniless, but no such brilliant future awaited her as that which Lizzie had earned for herself.	She too had been left penniless, but no such brilliant future awaited her as that which Lizzie had earned for herself.	false	178.52	186.28	22.896006
2654_158744_000004_000006	There was no countess-aunt to take her into her London house.	There was no countess aunt to take her into her London house.	false	186.53	189.91	19
2654_158744_000004_000007	The dean and the dean's wife and the dean's daughters had been her best friends, but they were not friends on whom she could be dependent.	The dean and the dean's wife and the dean's daughters had been her best friends, but they were not friends on whom she could be dependent.	true	190.07	197.59	21.674612
2654_158744_000004_000008	They were in no way connected with her by blood.	They were in no way connected with her by blood.	true	198.35	202	21
2654_158744_000004_000009	Therefore, at the age of eighteen, she had gone out to be a child's governess.	Therefore, at the age of eighteen, she had gone out to be a child's governess.	true	202.16	206.86	19
2654_158744_000004_000010	Then old Lady Fawn had heard of her virtues,--Lady Fawn, who had seven unmarried daughters running down from seven-and-twenty to thirteen, and Lucy Morris had been hired to teach English, French, German, and something of music to the two youngest Miss Fawns.	Then old Lady Fawn had heard of her virtues,--Lady Fawn, who had seven unmarried daughters running down from seven and twenty to thirteen, and Lucy Morris had been hired to teach English, French, German, and something of music to the two youngest Miss Fawns.	false	207.17	226.35	20.141012
2654_158744_000005_000000	During that visit at the deanery, when the heir of the Eustaces was being born, Lucy was undergoing a sort of probation for the Fawn establishment.	During that visit at the deanery, when the heir of the Eustaces was being born, Lucy was undergoing a sort of probation for the Fawn establishment.	false	226.35	236.5	19.171257
2654_158744_000005_000001	The proposed engagement with Lady Fawn was thought to be a great thing for her.	The proposed engagement with Lady Fawn was thought to be a great thing for her.	true	236.66	241.06	20.508226
2654_158744_000005_000002	Lady Fawn was known as a miracle of Virtue, Benevolence, and Persistency.	Lady Fawn was known as a miracle of Virtue, Benevolence, and Persistency.	true	241.28	246.07	22.829586
2654_158744_000005_000003	Every good quality that she possessed was so marked as to be worthy of being expressed with a capital. But her virtues were of that extraordinarily high character that there was no weakness in them,--no getting over them, no perverting them with follies or even exaggerations.	Every good quality that she possessed was so marked as to be worthy of being expressed with a capital. But her virtues were of that extraordinarily high character that there was no weakness in them,--no getting over them, no perverting them with follies or even exaggerations.	false	246.32	263.77	22.740023
2654_158744_000005_000004	When she heard of the excellencies of Miss Morris from the dean's wife, and then, after minutest investigation, learned the exact qualities of the young lady, she expressed herself willing to take Lucy into her house on special conditions.	When she heard of the excellencies of Miss Morris from the dean's wife, and then, after minutest investigation, learned the exact qualities of the young lady, she expressed herself willing to take Lucy into her house on special conditions.	false	264.08	279.76	20.79611
2654_158744_000005_000005	She must be able to teach music up to a certain point.	She must be able to teach music up to a certain point.	true	280.28	283.69	24.26506
2654_158744_000005_000006	"Then it's all over," said Lucy to the dean with her pretty smile,--that smile which caused all the old and middle-aged men to fall in love with her.	"Then it's all over," said Lucy to the dean with her pretty smile,--that smile which caused all the old and middle aged men to fall in love with her.	true	284.33	292.75	21.538397
2654_158744_000005_000007	"It's not over at all," said the dean.	"It's not over at all," said the dean.	true	293.24	296.05	22.460527
2654_158744_000005_000008	"You've got four months.	"You've got four months.	true	296.51	298.12	23.861193
2654_158744_000005_000009	Our organist is about as good a teacher as there is in England.	Our organist is about as good a teacher as there is in England.	true	298.43	302.085	22.299881
2654_158744_000005_000010	You are clever and quick, and he shall teach you." So Lucy went to Bobsborough, and was afterwards accepted by Lady Fawn.	You are clever and quick, and he shall teach you." So Lucy went to Bobsborough, and was afterwards accepted by Lady Fawn.	true	302.085	311.38	20.359205
2654_158744_000006_000000	While she was at the deanery there sprung up a renewed friendship between her and Lizzie.	While she was at the deanery there sprung up a renewed friendship between her and Lizzie.	true	312.02	318.25	20.774311
2654_158744_000006_000001	It was, indeed, chiefly a one-sided friendship; for Lucy, who was quick and unconsciously capable of reading that book to which we alluded in a previous chapter, was somewhat afraid of the rich widow.	It was, indeed, chiefly a one sided friendship; for Lucy, who was quick and unconsciously capable of reading that book to which we alluded in a previous chapter, was somewhat afraid of the rich widow.	true	318.62	331	19.100857
2654_158744_000006_000002	And when Lizzie talked to her of their old childish days, and quoted poetry, and spoke of things romantic,--as she was much given to do,--Lucy felt that the metal did not ring true.	And when Lizzie talked to her of their old childish days, and quoted poetry, and spoke of things romantic,--as she was much given to do,--Lucy felt that the metal did not ring true.	true	331.31	343.15	19.884874
2654_158744_000006_000003	And then Lizzie had an ugly habit of abusing all her other friends behind their backs.	And then Lizzie had an ugly habit of abusing all her other friends behind their backs.	true	343.73	349.39	18
2654_158744_000006_000004	Now Lucy did not like to hear the Greystocks abused, and would say so.	Now Lucy did not like to hear the Greystocks abused, and would say so.	true	350.21	354.82	21.763647
2654_158744_000006_000005	"That's all very well, you little minx," Lizzie would say playfully, "but you know that they are all asses!" Lucy by no means thought that the Greystocks were asses, and was very strongly of opinion that one of them was as far removed from being an ass as any human being she had ever known.	"That's all very well, you little minx," Lizzie would say playfully, "but you know that they are all asses!" Lucy by no means thought that the Greystocks were asses, and was very strongly of opinion that one of them was as far removed from being an ass as any human being she had ever known.	false	355.55	373.45	20.005215
2654_158744_000006_000006	This one was Frank Greystock, the barrister.	This one was Frank Greystock, the barrister.	true	373.97	377.19	21.65848
2654_158744_000006_000007	Of Frank Greystock some special--but, let it be hoped, very short--description must be given by-and-by.	Of Frank Greystock some special-but, let it be hoped, very short-description must be given by and by.	false	377.19	384.73	20.565983
2654_158744_000006_000008	For the present it will be sufficient to declare that, during that short Easter holiday which he spent at his father's house in Bobsborough, he found Lucy Morris to be a most agreeable companion.	For the present it will be sufficient to declare that, during that short Easter holiday which he spent at his father's house in Bobsborough, he found Lucy Morris to be a most agreeable companion.	false	385.07	398.94	20.58797
2654_158744_000007_000000	"Remember her position," said Mrs. Dean to her son.	"Remember her position," said mrs Dean to her son.	true	398.94	402.7	20.62283
2654_158744_000008_000000	"Her position!	"Her position!	true	403.49	404.8	23.999987
2654_158744_000008_000001	Well;--and what is her position mother?"	Well;--and what is her position mother?"	true	405.05	408.19	24.640228
2654_158744_000009_000000	"You know what I mean, Frank.	"You know what I mean, Frank.	true	408.65	410.26	18.700415
2654_158744_000009_000001	She is as sweet a girl as ever lived, and a perfect lady.	She is as sweet a girl as ever lived, and a perfect lady.	false	410.3	414.4	20.986689
2654_158744_000009_000002	But with a governess, unless you mean to marry her, you should be more careful than with another girl, because you may do her such a world of mischief."	But with a governess, unless you mean to marry her, you should be more careful than with another girl, because you may do her such a world of mischief."	true	414.65	423.46	22.575615
2654_158744_000010_000000	"I don't see that at all."	"I don't see that at all."	true	424.01	425.44	22.39821
2654_158744_000011_000000	"If Lady Fawn knew that she had an admirer, Lady Fawn would not let her come into her house."	"If Lady Fawn knew that she had an admirer, Lady Fawn would not let her come into her house."	true	426.23	432.49	18.632183
2654_158744_000012_000000	"Then Lady Fawn is an idiot.	"Then Lady Fawn is an idiot.	true	433.28	434.98	16.710527
2654_158744_000012_000001	If a girl be admirable, of course she will be admired.	If a girl be admirable, of course she will be admired.	false	435.08	438.735	21.914612
2654_158744_000012_000002	Who can hinder it?"	Who can hinder it?"	true	438.735	439.81	25.147587
2654_158744_000013_000000	"You know what I mean, Frank."	"You know what I mean, Frank."	true	440.54	442.21	19.170435
2654_158744_000014_000000	"Yes--I do; well.	"Yes-I do; well.	true	442.49	444.58	22.132936
2654_158744_000014_000001	I don't suppose I can afford to marry Lucy Morris. At any rate, mother, I will never say a word to raise a hope in her,--if it would be a hope--"	I don't suppose I can afford to marry Lucy Morris. At any rate, mother, I will never say a word to raise a hope in her,--if it would be a hope-"	true	444.8	454	20.78566
2654_158744_000015_000000	"Of course it would be a hope."	"Of course it would be a hope."	true	454.01	456.25	23.803288
2654_158744_000016_000000	"I don't know that at all.	"I don't know that at all.	true	456.5	457.84	15
2654_158744_000016_000001	But I will never say any such word to her,--unless I make up my mind that I can afford to marry her."	But I will never say any such word to her,--unless I make up my mind that I can afford to marry her."	false	458.36	464.98	23.65067
2654_158744_000017_000000	"Oh, Frank, it would be impossible!" said Mrs. Dean.	"Oh, Frank, it would be impossible!" said mrs Dean.	true	465.68	470.23	24.547867
2654_158744_000018_000000	Mrs. Dean was a very good woman, but she had aspirations in the direction of filthy lucre on behalf of her children, or at least on behalf of this special child, and she did think it would be very nice if Frank would marry an heiress.	mrs Dean was a very good woman, but she had aspirations in the direction of filthy lucre on behalf of her children, or at least on behalf of this special child, and she did think it would be very nice if Frank would marry an heiress.	true	471.38	486.61	23.11969
2654_158744_000018_000001	This, however, was a long time ago, nearly two years ago; and many grave things had got themselves transacted since Lucy's visit to the deanery.	This, however, was a long time ago, nearly two years ago; and many grave things had got themselves transacted since Lucy's visit to the deanery.	false	487.04	495.94	20.874943
2654_158744_000018_000002	She had become quite an old and an accustomed member of Lady Fawn's family.	She had become quite an old and an accustomed member of Lady Fawn's family.	true	496.43	500.56	19
2654_158744_000018_000003	The youngest Fawn girl was not yet fifteen, and it was understood that Lucy was to remain with the Fawns for some quite indefinite time to come.	The youngest Fawn girl was not yet fifteen, and it was understood that Lucy was to remain with the Fawns for some quite indefinite time to come.	false	501.02	510.01	19.64157
2654_158744_000018_000004	Lady Fawn's eldest daughter, Mrs. Hittaway, had a family of her own, having been married ten or twelve years, and it was quite probable that Lucy might be transferred.	Lady Fawn's eldest daughter, mrs Hittaway, had a family of her own, having been married ten or twelve years, and it was quite probable that Lucy might be transferred.	true	510.5	520.84	19.86629
2654_158744_000018_000005	Lady Fawn fully appreciated her treasure, and was, and ever had been, conscientiously anxious to make Lucy's life happy.	Lady Fawn fully appreciated her treasure, and was, and ever had been, conscientiously anxious to make Lucy's life happy.	false	521.27	529.74	18.471977
2654_158744_000018_000006	But she thought that a governess should not be desirous of marrying, at any rate till a somewhat advanced period of life.	But she thought that a governess should not be desirous of marrying, at any rate till a somewhat advanced period of life.	false	529.74	536.8	22.171658
2654_158744_000018_000007	A governess, if she were given to falling in love, could hardly perform her duties in life.	A governess, if she were given to falling in love, could hardly perform her duties in life.	true	537.26	542.89	24.58697
2654_158744_000018_000008	No doubt, not to be a governess, but a young lady free from the embarrassing necessity of earning bread, free to have a lover and a husband, would be upon the whole nicer. So it is nicer to be born to L10,000 a year than to have to wish for L500.	No doubt, not to be a governess, but a young lady free from the embarrassing necessity of earning bread, free to have a lover and a husband, would be upon the whole nicer. So it is nicer to be born to L ten thousand a year than to have to wish for l five hundred.	false	543.32	559.45	20.233103
2654_158744_000018_000009	Lady Fawn could talk excellent sense on this subject by the hour, and always admitted that much was due to a governess who knew her place and did her duty.	Lady Fawn could talk excellent sense on this subject by the hour, and always admitted that much was due to a governess who knew her place and did her duty.	false	559.91	569.65	21.773542
2654_158744_000018_000010	She was very fond of Lucy Morris, and treated her dependent with affectionate consideration;--but she did not approve of visits from Mr. Frank Greystock.	She was very fond of Lucy Morris, and treated her dependent with affectionate consideration;--but she did not approve of visits from mr Frank Greystock.	true	570.14	579.88	21.632101
2654_158744_000018_000011	Lucy, blushing up to the eyes, had once declared that she desired to have no personal visitors at Lady Fawn's house; but that, as regarded her own friendships, the matter was one for her own bosom.	Lucy, blushing up to the eyes, had once declared that she desired to have no personal visitors at Lady Fawn's house; but that, as regarded her own friendships, the matter was one for her own bosom.	true	580.25	592.78	22.03689
2654_158744_000018_000012	"Dear Miss Morris," Lady Fawn had said, "we understand each other so perfectly, and you are so good, that I am quite sure everything will be as it ought to be." Lady Fawn lived down at Richmond all the year through, in a large old-fashioned house with a large old-fashioned garden, called Fawn Court.	"Dear Miss Morris," Lady Fawn had said, "we understand each other so perfectly, and you are so good, that I am quite sure everything will be as it ought to be." Lady Fawn lived down at Richmond all the year through, in a large old-fashioned house with a large old-fashioned garden, called Fawn Court.	false	593.81	615.28	22.227869
2654_158744_000018_000013	After that speech of hers to Lucy, Frank Greystock did not call again at Fawn Court for many months, and it is possible that her ladyship had said a word also to him.	After that speech of hers to Lucy, Frank Greystock did not call again at Fawn Court for many months, and it is possible that her ladyship had said a word also to him.	false	615.71	626.23	21.977322
2654_158744_000018_000014	But Lady Eustace, with her pretty little pair of grey ponies, would sometimes drive down to Richmond to see her "dear little old friend" Lucy, and her visits were allowed.	But Lady Eustace, with her pretty little pair of grey ponies, would sometimes drive down to Richmond to see her "dear little old friend" Lucy, and her visits were allowed.	true	627.05	637.75	19.732037
2654_158744_000018_000015	Lady Fawn had expressed an opinion among her daughters that she did not see any harm in Lady Eustace.	Lady Fawn had expressed an opinion among her daughters that she did not see any harm in Lady Eustace.	true	638.12	643.9	17.413134
2654_158744_000018_000016	She thought that she rather liked Lady Eustace.	She thought that she rather liked Lady Eustace.	false	644.12	646.75	19.652126
2654_158744_000018_000017	But then Lady Fawn hated Lady Linlithgow as only two old women can hate each other;--and she had not heard the story of the diamond necklace.	But then Lady Fawn hated Lady Linlithgow as only two old women can hate each other;--and she had not heard the story of the diamond necklace.	true	647	656.38	20
2654_158744_000019_000000	Lucy Morris certainly was a treasure,--a treasure though no heroine. She was a sweetly social, genial little human being whose presence in the house was ever felt to be like sunshine.	Lucy Morris certainly was a treasure,--a treasure though no heroine. She was a sweetly social, genial little human being whose presence in the house was ever felt to be like sunshine.	true	656.99	669.64	19.969086
2654_158744_000019_000001	She was never forward, but never bashful.	She was never forward, but never bashful.	true	669.89	672.67	22.78248
2654_158744_000019_000002	She was always open to familiar intercourse without ever putting herself forward.	She was always open to familiar intercourse without ever putting herself forward.	true	672.95	678.01	19.38757
2654_158744_000019_000003	There was no man or woman with whom she would not so talk as to make the man or woman feel that the conversation was remarkably pleasant,--and she could do the same with any child.	There was no man or woman with whom she would not so talk as to make the man or woman feel that the conversation was remarkably pleasant,--and she could do the same with any child.	false	678.17	688.39	18.916931
2654_158744_000019_000004	She was an active, mindful, bright, energetic little thing to whom no work ever came amiss.	She was an active, mindful, bright, energetic little thing to whom no work ever came amiss.	false	688.7	695.25	21.925812
2654_158744_000019_000005	She had catalogued the library,--which had been collected by the late Lord Fawn with peculiar reference to the Christian theology of the third and fourth centuries.	She had catalogued the library,--which had been collected by the late Lord Fawn with peculiar reference to the Christian theology of the third and fourth centuries.	false	695.25	703.66	18
2654_158744_000019_000006	She had planned the new flower-garden,--though Lady Fawn thought that she had done that herself.	She had planned the new flower garden,--though Lady Fawn thought that she had done that herself.	false	704.21	709.63	22.694494
2654_158744_000019_000007	She had been invaluable during Clara Fawn's long illness.	She had been invaluable during Clara Fawn's long illness.	true	709.94	713.56	16
2654_158744_000019_000008	She knew every rule at croquet, and could play piquet.	She knew every rule at croquet, and could play piquet.	false	713.81	717.79	19
2654_158744_000019_000009	When the girls got up charades they had to acknowledge that everything depended on Miss Morris.	When the girls got up charades they had to acknowledge that everything depended on Miss Morris.	true	718.28	723.43	19
2654_158744_000019_000010	They were good-natured, plain, unattractive girls, who spoke of her to her face as one who could easily do anything to which she might put her hand. Lady Fawn did really love her.	They were good-natured, plain, unattractive girls, who spoke of her to her face as one who could easily do anything to which she might put her hand. Lady Fawn did really love her.	true	724.01	734.65	22.323166
