2240_148522_000013_000005	Men attend to the interests of the public, first by necessity, afterwards by choice: what was intentional becomes an instinct; and by dint of working for the good of one's fellow citizens, the habit and the taste for serving them is at length acquired.	Men attend to the interests of the public, first by necessity, afterwards by choice: what was intentional becomes an instinct; and by dint of working for the good of one's fellow citizens, the habit and the taste for serving them is at length acquired.	false	967.37	985.84	24.046314
2240_148522_000014_000000	Many people in France consider equality of conditions as one evil, and political freedom as a second.	Many people in France consider equality of conditions as one evil, and political freedom as a second.	true	987.53	995.02	24.772747
2240_148522_000014_000001	When they are obliged to yield to the former, they strive at least to escape from the latter.	When they are obliged to yield to the former, they strive at least to escape from the latter.	true	995.75	1001.89	24.495014
2240_148522_000014_000002	But I contend that in order to combat the evils which equality may produce, there is only one effectual remedy--namely, political freedom.	But I contend that in order to combat the evils which equality may produce, there is only one effectual remedy-namely, political freedom.	true	1002.47	1014.06	25.31454
2240_148522_000015_000000	Chapter V: Of The Use Which The Americans Make Of Public Associations In Civil Life	Chapter five: Of The Use Which The Americans Make Of Public Associations In Civil Life	false	1014.06	1024.62	23.874662
2240_148522_000016_000000	I do not propose to speak of those political associations--by the aid of which men endeavor to defend themselves against the despotic influence of a majority--or against the aggressions of regal power.	I do not propose to speak of those political associations-by the aid of which men endeavor to defend themselves against the despotic influence of a majority-or against the aggressions of regal power.	false	1024.62	1027.89	31.177711
2240_148522_000016_000001	That subject I have already treated.	That subject I have already treated.	false	1027.89	1029.09	24.495829
2240_148522_000016_000002	If each citizen did not learn, in proportion as he individually becomes more feeble, and consequently more incapable of preserving his freedom single-handed, to combine with his fellow-citizens for the purpose of defending it, it is clear that tyranny would unavoidably increase together with equality.	If each citizen did not learn, in proportion as he individually becomes more feeble, and consequently more incapable of preserving his freedom single handed, to combine with his fellow citizens for the purpose of defending it, it is clear that tyranny would unavoidably increase together with equality.	false	1029.09	1038.48	14.795581
