1603_140931_000037_000003	His great size, which became more apparent as he advanced, his flashing eyes, compressed lips, and the wild flowing of his uncut hair and beard, gave him altogether an aspect so terrible that his foes trembled, while his friends rejoiced, and when at last he uttered a roar like a mad bull, and launched himself into the thickest of the fight the Raturans could not stand it, but turned and fled in a body under the impression that he was more than human.	His great size, which became more apparent as he advanced, his flashing eyes, compressed lips, and the wild flowing of his uncut hair and beard, gave him altogether an aspect so terrible that his foes trembled, while his friends rejoiced, and when at last he uttered a roar like a mad bull, and launched himself into the thickest of the fight the Raturans could not stand it, but turned and fled in a body under the impression that he was more than human.	false	604.04	627.25	20.622606
1603_140931_000037_000004	He was too fleet for them, however.	He was too fleet for them, however.	true	627.83	629.62	16
1603_140931_000037_000005	Overtaking a flying knot, he brought the the corner-post down on the mass, and three warriors were levelled with the ground.	Overtaking a flying knot, he brought the the corner post down on the mass, and three warriors were levelled with the ground.	false	629.78	635.77	20.250326
1603_140931_000037_000006	Then, hurling the mighty club away as if it were a mere hindrance to him, he ran straight at the leader of the Raturans, who, being head and shoulders above his fellows, seemed a suitable foe to single out.	Then, hurling the mighty club away as if it were a mere hindrance to him, he ran straight at the leader of the Raturans, who, being head and shoulders above his fellows, seemed a suitable foe to single out.	false	636.11	646.21	19.610844
1603_140931_000038_000000	Before reaching him, however, his attention was arrested by a cry from some one in the midst of the enemy in front.	Before reaching him, however, his attention was arrested by a cry from some one in the midst of the enemy in front.	true	646.85	652.39	21
1603_140931_000038_000001	It was the voice of Wapoota, who was trying to break his way through the flying foe to his own people.	It was the voice of Wapoota, who was trying to break his way through the flying foe to his own people.	true	652.7	657.61	19.257145
1603_140931_000039_000000	Fortunately Zeppa recognised the voice, and darted towards his friend, who was hard pressed at the time by a crowd of opponents.	Fortunately Zeppa recognised the voice, and darted towards his friend, who was hard pressed at the time by a crowd of opponents.	false	658.16	663.94	20.549273
1603_140931_000040_000000	One roar from the maniac sent these flying like chaff before the wind. It must be added, however, for the credit of the men of Ratura, that Ongoloo and his warriors had backed up their new leader gallantly.	One roar from the maniac sent these flying like chaff before the wind. It must be added, however, for the credit of the men of Ratura, that Ongoloo and his warriors had backed up their new leader gallantly.	true	664.61	675.34	19.59778
1603_140931_000041_000000	When Wapoota saw his deliverer, he ran to him, panting, and said--	When Wapoota saw his deliverer, he ran to him, panting, and said-	true	676.13	680.1	23.089043
1603_140931_000042_000000	"Come with me--this way--Lippy is here!"	"Come with me-this way-Lippy is here!"	true	680.1	682.36	21.448973
1603_140931_000043_000000	That was sufficient.	That was sufficient.	true	682.97	684.07	21.177816
1603_140931_000043_000001	Zeppa became submissive like a child, while the jester, taking him by the hand, ran with him at racing speed in the direction of the Raturan villages, towards which the child and her mother were being led by the party which had captured them.	Zeppa became submissive like a child, while the jester, taking him by the hand, ran with him at racing speed in the direction of the Raturan villages, towards which the child and her mother were being led by the party which had captured them.	false	684.26	695.5	20.14357
1603_140931_000044_000000	This was briefly explained to Zeppa by Wapoota, who had chanced to encounter the party when returning from his yelling mission, if we may so express it.	This was briefly explained to Zeppa by Wapoota, who had chanced to encounter the party when returning from his yelling mission, if we may so express it.	true	696.02	703.18	20.072506
1603_140931_000045_000000	The race was a long one, but neither the madman nor his friend flagged until they overtook the party.	The race was a long one, but neither the madman nor his friend flagged until they overtook the party.	true	703.97	708.82	20.854898
1603_140931_000045_000001	It consisted of about thirty warriors, but if it had been thirty hundred it would have made no difference in the effect of Zeppa's roar and aspect as he rushed upon them with obviously awful intentions, though without arms.	It consisted of about thirty warriors, but if it had been thirty hundred it would have made no difference in the effect of Zeppa's roar and aspect as he rushed upon them with obviously awful intentions, though without arms.	true	709.22	720.58	19.492327
1603_140931_000045_000002	In fact the latter circumstance tended rather to increase the fears of the superstitious natives.	In fact the latter circumstance tended rather to increase the fears of the superstitious natives.	true	720.86	725.89	19.457493
1603_140931_000045_000003	They fled as one man at the first sight of the maniac and Lippy was recovered!	They fled as one man at the first sight of the maniac and Lippy was recovered!	true	726.14	730.33	19.9813
1603_140931_000046_000000	Instantly Zeppa's ferocity vanished, and the tenderest of smiles rippled over his face as he took the child in his arms and kissed her.	Instantly Zeppa's ferocity vanished, and the tenderest of smiles rippled over his face as he took the child in his arms and kissed her.	true	730.85	737.71	19.04558
1603_140931_000047_000000	But Wapoota did not feel quite so easy, for in their mad race they had outstripped the flying enemy, bands of whom were constantly passing them in their flight before the Mountain-men.	But Wapoota did not feel quite so easy, for in their mad race they had outstripped the flying enemy, bands of whom were constantly passing them in their flight before the Mountain men.	false	738.26	747.51	20.22058
1603_140931_000047_000001	His anxieties, however, were groundless, for no sooner did any of the Raturans set eyes on Zeppa, than, with howls of consternation, they diverged at a tangent like hunted hares, and coursed away homeward on the wings of terror.	His anxieties, however, were groundless, for no sooner did any of the Raturans set eyes on Zeppa, than, with howls of consternation, they diverged at a tangent like hunted hares, and coursed away homeward on the wings of terror.	false	747.51	759.55	20.441874
1603_140931_000048_000000	As on former occasions of conquest, the Mountain-men pursued the flying host into their swamps, but they did not, as in former times, return to slay the aged and carry the women and children into captivity.	As on former occasions of conquest, the Mountain men pursued the flying host into their swamps, but they did not, as in former times, return to slay the aged and carry the women and children into captivity.	true	760.19	770.86	20.956211
1603_140931_000049_000000	To the surprise of all his followers, and the anger of not a few, Ongoloo commanded his men to return to their village and leave the Raturans alone.	To the surprise of all his followers, and the anger of not a few, Ongoloo commanded his men to return to their village and leave the Raturans alone.	false	771.65	778.66	19.718163
1603_140931_000049_000001	One of his chiefs, who showed a disposition to resist his authority, he promptly knocked down, whereupon the rest became obedient and went quietly home.	One of his chiefs, who showed a disposition to resist his authority, he promptly knocked down, whereupon the rest became obedient and went quietly home.	true	779.39	786.94	19.772053
1603_140931_000050_000000	On reaching the village, Zeppa went straight to his hut with Lippy on his shoulder.	On reaching the village, Zeppa went straight to his hut with Lippy on his shoulder.	false	787.46	791.08	19.684889
1603_140931_000050_000001	Apparently he had forgotten all about the recent fight for, without even waiting to take food or rest he sat down, and began to give his little friend a singing lesson!	Apparently he had forgotten all about the recent fight for, without even waiting to take food or rest he sat down, and began to give his little friend a singing lesson!	true	791.18	799.66	19.29009
1603_140931_000051_000000	With the air of a little princess, who felt that she was only receiving her due, the child accepted the attention.	With the air of a little princess, who felt that she was only receiving her due, the child accepted the attention.	false	800.27	805.93	19.735716
1603_140931_000051_000001	Her young companions, attracted by the sweet sounds, soon flocked to the old place of rendezvous, and when the last of the straggling warriors returned from the field of battle they found the singing class going full swing as if nothing had happened.	Her young companions, attracted by the sweet sounds, soon flocked to the old place of rendezvous, and when the last of the straggling warriors returned from the field of battle they found the singing class going full swing as if nothing had happened.	false	806.27	817.36	20.289875
1603_140931_000052_000000	But when the wounded and the dead were brought in, other sounds began to arise--sounds of wailing and woe, which soon drowned the hymns of praise.	But when the wounded and the dead were brought in, other sounds began to arise-sounds of wailing and woe, which soon drowned the hymns of praise.	false	817.94	826.12	17.856527
1603_140931_000052_000001	As soon as Zeppa became fully alive to this fact he ceased singing and went about trying to comfort those who wept but, from his perplexed air, and the frequency with which he paused in his wanderings to and fro and passed his hand across his brow, as if to clear away some misty clouds that rested there, it was evident that his shattered intellect had taken in a very imperfect impression of what had occurred.	As soon as Zeppa became fully alive to this fact he ceased singing and went about trying to comfort those who wept but, from his perplexed air, and the frequency with which he paused in his wanderings to and fro and passed his hand across his brow, as if to clear away some misty clouds that rested there, it was evident that his shattered intellect had taken in a very imperfect impression of what had occurred.	false	826.58	846.97	21.139833
1603_140931_000053_000000	As if to get rid of this beclouded state, he started off that evening at a quick walk towards his favourite haunts among the hills.	As if to get rid of this beclouded state, he started off that evening at a quick walk towards his favourite haunts among the hills.	false	847.7	853.87	22.490337
1603_140931_000053_000001	No one ever followed him on these occasions.	No one ever followed him on these occasions.	true	854.54	856.69	19.138765
1603_140931_000053_000002	The natives regarded his person as in some measure sacred, and would have deemed it not only dangerous but insolent to go up among the rocky heights when the madman was known to be there.	The natives regarded his person as in some measure sacred, and would have deemed it not only dangerous but insolent to go up among the rocky heights when the madman was known to be there.	true	856.97	866.41	20.05529
1603_140931_000054_000000	Once, indeed, Wapoota, with that presumptuous temerity which is a characteristic of fools in general, ventured, on the strength of old acquaintance, to follow him, and even went towards the well known cave where he had found refuge and protection in the day of his distress; but Zeppa had either forgotten his former intercourse with the jester or intended to repudiate the connection, for he did not receive him kindly.	Once, indeed, Wapoota, with that presumptuous temerity which is a characteristic of fools in general, ventured, on the strength of old acquaintance, to follow him, and even went towards the well known cave where he had found refuge and protection in the day of his distress; but Zeppa had either forgotten his former intercourse with the jester or intended to repudiate the connection, for he did not receive him kindly.	false	867.14	889.27	20.94004
1603_140931_000055_000000	On the way up, Wapoota, who felt somewhat timorous about the visit, had made up his mind as to the best mode of address with which to approach his friend.	On the way up, Wapoota, who felt somewhat timorous about the visit, had made up his mind as to the best mode of address with which to approach his friend.	true	890.03	897.82	20.963707
1603_140931_000055_000001	He had decided that, although he was not particularly youthful, the language and manner of a respectful son to a revered father would best befit the occasion.	He had decided that, although he was not particularly youthful, the language and manner of a respectful son to a revered father would best befit the occasion.	true	898.25	906.88	20.136639
1603_140931_000055_000002	Accordingly when he reached the cave and saw Zeppa busy beside his fire with a cocoa-nut, he assumed a stooping attitude of profound respect, and drew near.	Accordingly when he reached the cave and saw Zeppa busy beside his fire with a cocoa nut, he assumed a stooping attitude of profound respect, and drew near.	false	907.34	915.58	21
1603_140931_000056_000000	Zeppa looked up with a frown, as if annoyed at the intrusion.	Zeppa looked up with a frown, as if annoyed at the intrusion.	true	916.22	919.45	22.687054
1603_140931_000057_000000	"Your unworthy son," began Wapoota, "comes to--"	"Your unworthy son," began Wapoota, "comes to-"	true	919.91	922.9	16.565697
1603_140931_000058_000000	But he got no further.	But he got no further.	true	923.06	924.34	22.257057
1603_140931_000058_000001	He could not well have hit upon a more unfortunate phrase.	He could not well have hit upon a more unfortunate phrase.	true	924.38	927.7	21.702616
1603_140931_000059_000000	"My unworthy _son_!" shouted Zeppa, leaping up, while unearthly fires seemed to shoot from his distended eyes.	"My unworthy underscore son underscore!" shouted Zeppa, leaping up, while unearthly fires seemed to shoot from his distended eyes.	false	928.19	934.87	19.277895
1603_140931_000059_000001	"My son!	"My son!	true	934.97	935.82	20.830996
1603_140931_000059_000002	_son_!	underscore son underscore!	false	935.82	937.32	19.594534
1603_140931_000059_000003	Ha! ha-a-a-a!"	Ha! ha a a a!"	false	937.32	940.365	30.823673
1603_140931_000060_000000	The horrified intruder heard the terminal yell, and saw the maniac bound over the fire towards him, but he saw and heard no more, for his limbs became suddenly endued with something like electric vitality.	The horrified intruder heard the terminal yell, and saw the maniac bound over the fire towards him, but he saw and heard no more, for his limbs became suddenly endued with something like electric vitality.	true	940.365	951.22	20.367863
1603_140931_000060_000001	He turned and shot over a small precipice, as if flung from an ancient catapult. What he alighted on he did not know, still less did he care.	He turned and shot over a small precipice, as if flung from an ancient catapult. What he alighted on he did not know, still less did he care.	true	951.47	959.44	19.63043
1603_140931_000060_000002	It was sufficiently soft to prevent death.	It was sufficiently soft to prevent death.	true	959.6	961.78	20
1603_140931_000061_000000	Another awful cry echoed and re-echoed from the heights above, and intensified the electric battery within him.	Another awful cry echoed and re echoed from the heights above, and intensified the electric battery within him.	false	962.48	968.59	22.837488
1603_140931_000061_000001	He went down the slopes regardless of gradient at a pace that might have left even Zeppa behind if he had followed; but Zeppa did not follow.	He went down the slopes regardless of gradient at a pace that might have left even Zeppa behind if he had followed; but Zeppa did not follow.	true	968.9	975.91	19.98339
1603_140931_000062_000000	When Wapoota went over the precipice and disappeared, Zeppa halted and stood erect, gazing with a questioning aspect at the sky, and drawing his hand slowly across his brows with that wearied and puzzled aspect which had become characteristic.	When Wapoota went over the precipice and disappeared, Zeppa halted and stood erect, gazing with a questioning aspect at the sky, and drawing his hand slowly across his brows with that wearied and puzzled aspect which had become characteristic.	true	976.58	989.26	20.17336
1603_140931_000063_000000	Returning after a few minutes to his cave, he reseated himself quietly beside his fire, and, with his usual placid expression, devoted himself earnestly to his cocoa-nut.	Returning after a few minutes to his cave, he reseated himself quietly beside his fire, and, with his usual placid expression, devoted himself earnestly to his cocoa nut.	false	989.81	1014.36	18.863197
