3483_115968_000002_000000	Incredible Treason	Incredible Treason
3483_115968_000004_000000	A careful survey of the territory showed that it was only the northern sections and slopes that had been "beamed" by the first Han ship.	A careful survey of the territory showed that it was only the northern sections and slopes that had been "beamed" by the first Han ship.
3483_115968_000005_000001	The forest screen above it, however, had been annihilated, and it was determined to abandon it, after removing all usable machinery and evidences of the processes that might be of interest to the Han scientists, should they return to the valley in the future.	The forest screen above it, however, had been annihilated, and it was determined to abandon it, after removing all usable machinery and evidences of the processes that might be of interest to the Han scientists, should they return to the valley in the future.
3483_115968_000006_000000	The ammunition plant, and the rocket-ship plant, which had just been about to start operation at the time of the raid, were intact, as were the other important plants.	The ammunition plant, and the rocket ship plant, which had just been about to start operation at the time of the raid, were intact, as were the other important plants.
3483_115968_000007_000000	Hart brought the Camboss up from the Susquanna Works, and laid out new camp locations, scattering them farther to the south, and avoiding ground which had been seared by the Han beams and the immediate locations of the Han wrecks.	Hart brought the Camboss up from the Susquanna Works, and laid out new camp locations, scattering them farther to the south, and avoiding ground which had been seared by the Han beams and the immediate locations of the Han wrecks.
3483_115968_000009_000001	On our return, we had a camp of our own, of course.	On our return, we had a camp of our own, of course.
3483_115968_000009_000003	And as might be expected, we had a great deal of banter over which one of us was Camp Boss.	And as might be expected, we had a great deal of banter over which one of us was Camp Boss.
3483_115968_000010_000001	The Wyomings had a high morale, and had prospered under the rule of Big Boss Hart for many years.	The Wyomings had a high morale, and had prospered under the rule of Big Boss Hart for many years.
3483_115968_000010_000002	But many of the gangs, I found, were badly organized, lacked strong hands in authority, and were rife with intrigue.	But many of the gangs, I found, were badly organized, lacked strong hands in authority, and were rife with intrigue.
3483_115968_000010_000003	On the whole, I thought I would be wise to stay with a group which had already proved its friendliness, and in which I seemed to have prospects of advancement.	On the whole, I thought I would be wise to stay with a group which had already proved its friendliness, and in which I seemed to have prospects of advancement.
3483_115968_000010_000004	Under these modern social and economic conditions, the kind of individual freedom to which I had been accustomed in the 20th Century was impossible.	Under these modern social and economic conditions, the kind of individual freedom to which I had been accustomed in the twentieth Century was impossible.
3483_115968_000010_000005	I would have been as much of a nonentity in every phase of human relationship by attempting to avoid alliances, as any man of the 20th Century would have been politically, who aligned himself with no political party.	I would have been as much of a nonentity in every phase of human relationship by attempting to avoid alliances, as any man of the twentieth Century would have been politically, who aligned himself with no political party.
3483_115968_000011_000000	This entire modern life, it appeared to me, judging from my ancient viewpoint, was organized along what I called "political" lines.	This entire modern life, it appeared to me, judging from my ancient viewpoint, was organized along what I called "political" lines.
3483_115968_000011_000002	He was just as much of an autocrat, and just as much dependent upon the general popularity of his actions for the ability to maintain his autocracy.	He was just as much of an autocrat, and just as much dependent upon the general popularity of his actions for the ability to maintain his autocracy.
3483_115968_000012_000000	The sub-boss who could not command the loyalty of his followers was as quickly deposed, either by them or by his superiors, as the ancient ward leader of the 20th Century who lost control of his votes.	The sub boss who could not command the loyalty of his followers was as quickly deposed, either by them or by his superiors, as the ancient ward leader of the twentieth Century who lost control of his votes.
3483_115968_000013_000001	I tremble to think what would have happened, had the attempt been made to handle the A. E. F. this way during the First World War, instead of by that rigid military discipline and complete assumption of the individual as a mere standardized cog in the machine.	I tremble to think what would have happened, had the attempt been made to handle the a e f this way during the First World War, instead of by that rigid military discipline and complete assumption of the individual as a mere standardized cog in the machine.
3483_115968_000014_000000	But owing to the centuries of desperate suffering the people had endured at the hands of the Hans, there developed a spirit of self-sacrifice and consideration for the common good that made the scheme applicable and efficient in all forms of human co-operation.	But owing to the centuries of desperate suffering the people had endured at the hands of the Hans, there developed a spirit of self sacrifice and consideration for the common good that made the scheme applicable and efficient in all forms of human co-operation.
3483_115968_000015_000000	I have a little heresy about all this, however.	I have a little heresy about all this, however.
3483_115968_000015_000001	My associates regard the thought with as much horror as many worthy people of the 20th Century felt in regard to any heretical suggestion that the original outline of government as laid down in the First Constitution did not apply as well to 20th Century conditions as to those of the early 19th.	My associates regard the thought with as much horror as many worthy people of the twentieth Century felt in regard to any heretical suggestion that the original outline of government as laid down in the First Constitution did not apply as well to twentieth Century conditions as to those of the early nineteenth.
3483_115968_000016_000001	I have seen signs of the reawakening of greed, of selfishness.	I have seen signs of the reawakening of greed, of selfishness.
3483_115968_000016_000002	The eternal cycle seems to be at work.	The eternal cycle seems to be at work.
3483_115968_000017_000000	All this, however, is wandering afar from my story, which concerns our early battles against the Hans, and not our more modern problems of self-control.	All this, however, is wandering afar from my story, which concerns our early battles against the Hans, and not our more modern problems of self control.
3483_115968_000018_000000	Our victory over the seven Han ships had set the country ablaze.	Our victory over the seven Han ships had set the country ablaze.
3483_115968_000018_000002	There was feverish activity in the ammunition plants, and the hunting of stray Han ships became an enthusiastic sport.	There was feverish activity in the ammunition plants, and the hunting of stray Han ships became an enthusiastic sport.
3483_115968_000018_000003	The results were disastrous to our hereditary enemies.	The results were disastrous to our hereditary enemies.
3483_115968_000019_000001	A dozen Sacramentos had caught the hazy outlines of its rep rays approaching them, head-on, in the twilight, like ghostly pillars reaching into the sky.	A dozen Sacramentos had caught the hazy outlines of its rep rays approaching them, head on, in the twilight, like ghostly pillars reaching into the sky.
3483_115968_000019_000003	They got one rep ray. The other was not strong enough to hold it up.	They got one rep ray. The other was not strong enough to hold it up.
3483_115968_000019_000004	It floated to earth, nose down, and since it was unarmed and unarmored, they had no difficulty in shooting it to pieces and massacring its crew and passengers.	It floated to earth, nose down, and since it was unarmed and unarmored, they had no difficulty in shooting it to pieces and massacring its crew and passengers.
3483_115968_000019_000006	But then I did not have centuries of bitter persecution in my blood.	But then I did not have centuries of bitter persecution in my blood.
3483_115968_000020_000001	The Sand-snipers, practically invisible in their sand-colored clothing, and half buried along the beaches, lay in wait for days, risking the play of dis beams along the route, and finally registering four hits within a week.	The Sand snipers, practically invisible in their sand colored clothing, and half buried along the beaches, lay in wait for days, risking the play of dis beams along the route, and finally registering four hits within a week.
3483_115968_000020_000002	The Hans discontinued their service along this route, and as evidence that they were badly shaken by our success, sent no raiders down the Beaches.	The Hans discontinued their service along this route, and as evidence that they were badly shaken by our success, sent no raiders down the Beaches.
3483_115968_000022_000000	"Tony," he said, "There are two things I want to talk to you about.	"Tony," he said, "There are two things I want to talk to you about.
3483_115968_000022_000001	One of them will become public property in a few days, I think.	One of them will become public property in a few days, I think.
3483_115968_000022_000002	We aren't going to get any more Han ships by shooting up their repellor rays unless we use much larger rockets.	We aren't going to get any more Han ships by shooting up their repellor rays unless we use much larger rockets.
3483_115968_000022_000003	They are wise to us now.	They are wise to us now.
3483_115968_000022_000004	They're putting armor of great thickness in the hulls of their ships below the rep-ray machines.	They're putting armor of great thickness in the hulls of their ships below the rep ray machines.
3483_115968_000022_000005	Near Bah-flo this morning a party of Eries shot one without success.	Near Bah flo this morning a party of Eries shot one without success.
3483_115968_000022_000006	The explosions staggered her, but did not penetrate.	The explosions staggered her, but did not penetrate.
3483_115968_000022_000008	Our reports indicate that the Eries' rockets bounced off harmlessly.	Our reports indicate that the Eries' rockets bounced off harmlessly.
3483_115968_000022_000009	Most of the party was wiped out as the dis rays went into action on them.	Most of the party was wiped out as the dis rays went into action on them.
3483_115968_000023_000002	The first move is to develop sectional organization by Zones.	The first move is to develop sectional organization by Zones.
3483_115968_000024_000000	"We're in for it now.	"We're in for it now.
3483_115968_000024_000001	The Hans are sure to launch reprisal expeditions. If we're to save the race we must keep them away from our camps and plants.	The Hans are sure to launch reprisal expeditions. If we're to save the race we must keep them away from our camps and plants.
3483_115968_000024_000002	I'm thinking of developing a permanent field force, along the lines of the regular armies of the 20th Century you told me about.	I'm thinking of developing a permanent field force, along the lines of the regular armies of the twentieth Century you told me about.
3483_115968_000024_000004	I'm going to need your help in this.	I'm going to need your help in this.
3483_115968_000025_000002	You know, a hundred and fifteen or twenty years ago there were certain of these people's ancestors who actually degraded themselves by mating with the Hans, sometimes even serving them as slaves, in the days before they brought all their service machinery to perfection.	You know, a hundred and fifteen or twenty years ago there were certain of these people's ancestors who actually degraded themselves by mating with the Hans, sometimes even serving them as slaves, in the days before they brought all their service machinery to perfection.
3483_115968_000026_000001	But I hardly suspect the Pineys. There is little intelligence among them.	But I hardly suspect the Pineys. There is little intelligence among them.
3483_115968_000027_000000	"Just what evidence is there that anybody has been clearing information to the Hans?" I asked.	"Just what evidence is there that anybody has been clearing information to the Hans?" I asked.
3483_115968_000028_000000	"Well," he replied, "first of all there was that raid upon us.	"Well," he replied, "first of all there was that raid upon us.
3483_115968_000028_000001	That first Han ship knew the location of our plants exactly.	That first Han ship knew the location of our plants exactly.
3483_115968_000028_000003	Then, the Hans quite obviously have learned that we are picking up their electrophone waves, for they've gone back to their old, but extremely accurate, system of directional control.	Then, the Hans quite obviously have learned that we are picking up their electrophone waves, for they've gone back to their old, but extremely accurate, system of directional control.
3483_115968_000028_000004	But we've been getting them for the past week by installing automatic re-broadcast units along the scar paths.	But we've been getting them for the past week by installing automatic re broadcast units along the scar paths.
3483_115968_000028_000005	This is what the Americans called those strips of country directly under the regular ship routes of the Hans, who as a matter of precaution frequently blasted them with their dis beams to prevent the growth of foliage which might give shelter to the Americans.	This is what the Americans called those strips of country directly under the regular ship routes of the Hans, who as a matter of precaution frequently blasted them with their dis beams to prevent the growth of foliage which might give shelter to the Americans.
3483_115968_000028_000006	But they've been beaming those paths so hard, it looks as though they even had information of this strategy.	But they've been beaming those paths so hard, it looks as though they even had information of this strategy.
3483_115968_000028_000007	And in addition, they've been using code.	And in addition, they've been using code.
3483_115968_000028_000008	Finally, we've picked up three of their messages in which they discuss, with some nervousness, the existence of our 'mysterious' ultrophone."	Finally, we've picked up three of their messages in which they discuss, with some nervousness, the existence of our 'mysterious' ultrophone."
3483_115968_000029_000000	"But they still have no knowledge of the nature and control of ultronic activity?" I asked.	"But they still have no knowledge of the nature and control of ultronic activity?" I asked.
3483_115968_000031_000000	"Then it's quite clear," I ventured, "that whoever is 'clearing' us to them is doing it piecemeal.	"Then it's quite clear," I ventured, "that whoever is 'clearing' us to them is doing it piecemeal.
3483_115968_000031_000001	It sounds like a bit of occasional barter, rather than an out-and-out alliance.	It sounds like a bit of occasional barter, rather than an out and out alliance.
3483_115968_000031_000002	They're holding back as much information as possible for future bartering, perhaps."	They're holding back as much information as possible for future bartering, perhaps."
