543_133217_000005_000000	"It is a great question," said Candide.	"It is a great question," said Candide.
543_133217_000006_000001	Candide did not quite agree to that, but he affirmed nothing.	Candide did not quite agree to that, but he affirmed nothing.
543_133217_000007_000002	Paquette continued her trade wherever she went, but made nothing of it.	Paquette continued her trade wherever she went, but made nothing of it.
543_133217_000009_000000	"Ha!" said Pangloss to Paquette, "Providence has then brought you amongst us again, my poor child!	"Ha!" said Pangloss to Paquette, "Providence has then brought you amongst us again, my poor child!
543_133217_000017_000000	"Hold your tongue," answered the Dervish.	"Hold your tongue," answered the Dervish.
543_133217_000031_000001	Their little plot of land produced plentiful crops.	Their little plot of land produced plentiful crops.
543_133217_000034_000000	"All that is very well," answered Candide, "but let us cultivate our garden."	"All that is very well," answered Candide, "but let us cultivate our garden."
