1160_139717_000003_000000	Keimer and I liv'd on a pretty good familiar footing, and agreed tolerably well, for he suspected nothing of my setting up.	Keimer and I liv'd on a pretty good familiar footing, and agreed tolerably well, for he suspected nothing of my setting up.
1160_139717_000003_000002	We therefore had many disputations.	We therefore had many disputations.
1160_139717_000004_000004	He agreed to try the practice, if I would keep him company.	He agreed to try the practice, if I would keep him company.
1160_139717_000004_000005	I did so, and we held it for three months.	I did so, and we held it for three months.
1160_139717_000004_000009	He invited me and two women friends to dine with him; but, it being brought too soon upon table, he could not resist the temptation, and ate the whole before we came.	He invited me and two women friends to dine with him; but, it being brought too soon upon table, he could not resist the temptation, and ate the whole before we came.
1160_139717_000006_000003	Ralph was ingenious, genteel in his manners, and extremely eloquent; I think I never knew a prettier talker.	Ralph was ingenious, genteel in his manners, and extremely eloquent; I think I never knew a prettier talker.
1160_139717_000009_000002	When the time of our meeting drew nigh, Ralph called on me first, and let me know his piece was ready.	When the time of our meeting drew nigh, Ralph called on me first, and let me know his piece was ready.
1160_139717_000009_000004	He then show'd me his piece for my opinion, and I much approv'd it, as it appear'd to me to have great merit.	He then show'd me his piece for my opinion, and I much approv'd it, as it appear'd to me to have great merit.
