7339_86765_000040_000002	The old servant left the room, and presently returned, bringing with him a small casket.	The old servant left the room, and presently returned, bringing with him a small casket.	true	717.11	722.35	12
7339_86765_000040_000003	"Do you permit us to open this casket?" asked the notary.	"Do you permit us to open this casket?" asked the notary.	true	722.84	726.19	14
7339_86765_000040_000004	Noirtier gave his assent.	Noirtier gave his assent.	false	726.23	728.14	13
7339_86765_000040_000005	They opened it, and found 900,000. francs in bank scrip.	They opened it, and found nine hundred thousand. francs in bank scrip.	false	728.63	733.44	13
7339_86765_000040_000006	The first notary handed over each note, as he examined it, to his colleague.	The first notary handed over each note, as he examined it, to his colleague.	true	733.44	738.04	11
7339_86765_000041_000000	The total amount was found to be as M. Noirtier had stated.	The total amount was found to be as m Noirtier had stated.	false	738.53	742.57	12
7339_86765_000041_000001	"It is all as he has said; it is very evident that the mind still retains its full force and vigor." Then, turning towards the paralytic, he said, "You possess, then, 900,000. francs of capital, which, according to the manner in which you have invested it, ought to bring in an income of about 40,000 livres?"	"It is all as he has said; it is very evident that the mind still retains its full force and vigor." Then, turning towards the paralytic, he said, "You possess, then, nine hundred thousand. francs of capital, which, according to the manner in which you have invested it, ought to bring in an income of about forty thousand livres?"	false	743.48	763.81	12
7339_86765_000042_000000	"Yes."	"Yes."	true	764.66	765.52	20.392214
7339_86765_000043_000000	"To whom do you desire to leave this fortune?"	"To whom do you desire to leave this fortune?"	true	766.43	768.94	14
7339_86765_000044_000000	"Oh," said Madame de Villefort, "there is not much doubt on that subject.	"Oh," said Madame de Villefort, "there is not much doubt on that subject.	false	769.7	774.37	14
7339_86765_000044_000001	M. Noirtier tenderly loves his granddaughter, Mademoiselle de Villefort; it is she who has nursed and tended him for six years, and has, by her devoted attention, fully secured the affection, I had almost said the gratitude, of her grandfather, and it is but just that she should reap the fruit of her devotion." The eye of Noirtier clearly showed by its expression that he was not deceived by the false assent given by Madame de Villefort's words and manner to the motives which she supposed him to entertain.	M. Noirtier tenderly loves his granddaughter, Mademoiselle de Villefort; it is she who has nursed and tended him for six years, and has, by her devoted attention, fully secured the affection, I had almost said the gratitude, of her grandfather, and it is but just that she should reap the fruit of her devotion." The eye of Noirtier clearly showed by its expression that he was not deceived by the false assent given by Madame de Villefort's words and manner to the motives which she supposed him to entertain.	false	774.62	807.67	12
7339_86765_000044_000002	"Is it, then, to Mademoiselle Valentine de Villefort that you leave these 900,000 francs?" demanded the notary, thinking he had only to insert this clause, but waiting first for the assent of Noirtier, which it was necessary should be given before all the witnesses of this singular scene.	"Is it, then, to Mademoiselle Valentine de Villefort that you leave these nine hundred thousand francs?" demanded the notary, thinking he had only to insert this clause, but waiting first for the assent of Noirtier, which it was necessary should be given before all the witnesses of this singular scene.	false	808.61	828.25	11
7339_86765_000044_000003	Valentine, when her name was made the subject of discussion, had stepped back, to escape unpleasant observation; her eyes were cast down, and she was crying.	Valentine, when her name was made the subject of discussion, had stepped back, to escape unpleasant observation; her eyes were cast down, and she was crying.	false	829.07	839.5	15
7339_86765_000044_000004	The old man looked at her for an instant with an expression of the deepest tenderness, then, turning towards the notary, he significantly winked his eye in token of dissent.	The old man looked at her for an instant with an expression of the deepest tenderness, then, turning towards the notary, he significantly winked his eye in token of dissent.	true	840.14	851.17	12
7339_86765_000045_000000	"What," said the notary, "do you not intend making Mademoiselle Valentine de Villefort your residuary legatee?"	"What," said the notary, "do you not intend making Mademoiselle Valentine de Villefort your residuary legatee?"	true	852.29	860.74	7
7339_86765_000046_000000	"No."	"no"	true	861.65	862.51	10.701021
7339_86765_000047_000000	"You are not making any mistake, are you?" said the notary; "you really mean to declare that such is not your intention?"	"You are not making any mistake, are you?" said the notary; "you really mean to declare that such is not your intention?"	false	863.3	870.88	12
7339_86765_000048_000000	"No," repeated Noirtier; "No." Valentine raised her head, struck dumb with astonishment.	"No," repeated Noirtier; "no" Valentine raised her head, struck dumb with astonishment.	false	871.97	879.88	17.049158
7339_86765_000048_000001	It was not so much the conviction that she was disinherited that caused her grief, but her total inability to account for the feelings which had provoked her grandfather to such an act.	It was not so much the conviction that she was disinherited that caused her grief, but her total inability to account for the feelings which had provoked her grandfather to such an act.	true	880.31	890.95	11
7339_86765_000048_000002	But Noirtier looked at her with so much affectionate tenderness that she exclaimed, "Oh, grandpapa, I see now that it is only your fortune of which you deprive me; you still leave me the love which I have always enjoyed."	But Noirtier looked at her with so much affectionate tenderness that she exclaimed, "Oh, grandpapa, I see now that it is only your fortune of which you deprive me; you still leave me the love which I have always enjoyed."	false	891.5	907.45	11
7339_86765_000049_000000	"Ah, yes, most assuredly," said the eyes of the paralytic, for he closed them with an expression which Valentine could not mistake.	"Ah, yes, most assuredly," said the eyes of the paralytic, for he closed them with an expression which Valentine could not mistake.	true	908.54	917.23	11
7339_86765_000049_000001	"Thank you, thank you," murmured she.	"Thank you, thank you," murmured she.	true	918.14	920.71	11
7339_86765_000049_000002	The old man's declaration that Valentine was not the destined inheritor of his fortune had excited the hopes of Madame de Villefort; she gradually approached the invalid, and said: "Then, doubtless, dear M. Noirtier, you intend leaving your fortune to your grandson, Edward de Villefort?" The winking of the eyes which answered this speech was most decided and terrible, and expressed a feeling almost amounting to hatred.	The old man's declaration that Valentine was not the destined inheritor of his fortune had excited the hopes of Madame de Villefort; she gradually approached the invalid, and said: "Then, doubtless, dear m Noirtier, you intend leaving your fortune to your grandson, Edward de Villefort?" The winking of the eyes which answered this speech was most decided and terrible, and expressed a feeling almost amounting to hatred.	false	920.96	948.22	13
7339_86765_000050_000000	"No?" said the notary; "then, perhaps, it is to your son, M. de Villefort?"	"No?" said the notary; "then, perhaps, it is to your son, m de Villefort?"	true	949.7	955.39	15
7339_86765_000051_000000	"No." The two notaries looked at each other in mute astonishment and inquiry as to what were the real intentions of the testator.	"no" The two notaries looked at each other in mute astonishment and inquiry as to what were the real intentions of the testator.	false	956	965.73	12
7339_86765_000051_000001	Villefort and his wife both grew red, one from shame, the other from anger.	Villefort and his wife both grew red, one from shame, the other from anger.	true	965.73	971.26	9
7339_86765_000052_000000	"What have we all done, then, dear grandpapa?" said Valentine; "you no longer seem to love any of us?" The old man's eyes passed rapidly from Villefort and his wife, and rested on Valentine with a look of unutterable fondness.	"What have we all done, then, dear grandpapa?" said Valentine; "you no longer seem to love any of us?" The old man's eyes passed rapidly from Villefort and his wife, and rested on Valentine with a look of unutterable fondness.	false	972.44	988.27	12
7339_86765_000052_000001	"Well," said she; "if you love me, grandpapa, try and bring that love to bear upon your actions at this present moment. You know me well enough to be quite sure that I have never thought of your fortune; besides, they say I am already rich in right of my mother--too rich, even.	"Well," said she; "if you love me, grandpapa, try and bring that love to bear upon your actions at this present moment. You know me well enough to be quite sure that I have never thought of your fortune; besides, they say I am already rich in right of my mother-too rich, even.	false	989.15	1008.97	12
7339_86765_000052_000002	Explain yourself, then." Noirtier fixed his intelligent eyes on Valentine's hand.	Explain yourself, then." Noirtier fixed his intelligent eyes on Valentine's hand.	true	1009.88	1015.6	11
7339_86765_000052_000003	"My hand?" said she.	"My hand?" said she.	true	1016.45	1018.27	15
7339_86765_000053_000000	"Yes."	"Yes."	true	1018.73	1019.59	17
7339_86765_000054_000000	"Her hand!" exclaimed every one.	"Her hand!" exclaimed every one.	true	1020.32	1022.32	16
7339_86765_000055_000000	"Oh, gentlemen, you see it is all useless, and that my father's mind is really impaired," said Villefort.	"Oh, gentlemen, you see it is all useless, and that my father's mind is really impaired," said Villefort.	true	1023.35	1029.22	10
7339_86765_000056_000000	"Ah," cried Valentine suddenly, "I understand.	"Ah," cried Valentine suddenly, "I understand.	true	1029.89	1033.12	14
7339_86765_000056_000001	It is my marriage you mean, is it not, dear grandpapa?"	It is my marriage you mean, is it not, dear grandpapa?"	true	1033.43	1037.44	15.283803
7339_86765_000057_000000	"Yes, yes, yes," signed the paralytic, casting on Valentine a look of joyful gratitude for having guessed his meaning.	"Yes, yes, yes," signed the paralytic, casting on Valentine a look of joyful gratitude for having guessed his meaning.	true	1037.84	1045.35	8
7339_86765_000058_000000	"You are angry with us all on account of this marriage, are you not?"	"You are angry with us all on account of this marriage, are you not?"	false	1045.35	1051.03	13.530344
7339_86765_000059_000000	"Yes?"	"Yes?"	true	1051.61	1052.47	13
7339_86765_000060_000000	"Really, this is too absurd," said Villefort.	"Really, this is too absurd," said Villefort.	true	1053.47	1056.04	13
7339_86765_000061_000000	"Excuse me, sir," replied the notary; "on the contrary, the meaning of M. Noirtier is quite evident to me, and I can quite easily connect the train of ideas passing in his mind."	"Excuse me, sir," replied the notary; "on the contrary, the meaning of m Noirtier is quite evident to me, and I can quite easily connect the train of ideas passing in his mind."	false	1056.47	1067.38	12
7339_86765_000062_000000	"You do not wish me to marry M. Franz d'Epinay?" observed Valentine.	"You do not wish me to marry m Franz d'Epinay?" observed Valentine.	true	1068.44	1073.44	10
7339_86765_000063_000000	"I do not wish it," said the eye of her grandfather.	"I do not wish it," said the eye of her grandfather.	true	1074.35	1076.98	5
7339_86765_000063_000001	"And you disinherit your granddaughter," continued the notary, "because she has contracted an engagement contrary to your wishes?"	"And you disinherit your granddaughter," continued the notary, "because she has contracted an engagement contrary to your wishes?"	true	1077.44	1084.93	9
7339_86765_000064_000000	"Yes."	"Yes."	true	1085.69	1086.49	13
7339_86765_000065_000000	"So that, but for this marriage, she would have been your heir?"	"So that, but for this marriage, she would have been your heir?"	true	1088.09	1092.16	16
7339_86765_000066_000000	"Yes." There was a profound silence.	"Yes." There was a profound silence.	true	1093.13	1096.93	17.440556
7339_86765_000066_000001	The two notaries were holding a consultation as to the best means of proceeding with the affair. Valentine was looking at her grandfather with a smile of intense gratitude, and Villefort was biting his lips with vexation, while Madame de Villefort could not succeed in repressing an inward feeling of joy, which, in spite of herself, appeared in her whole countenance.	The two notaries were holding a consultation as to the best means of proceeding with the affair. Valentine was looking at her grandfather with a smile of intense gratitude, and Villefort was biting his lips with vexation, while Madame de Villefort could not succeed in repressing an inward feeling of joy, which, in spite of herself, appeared in her whole countenance.	false	1097.6	1120.36	11
7339_86765_000066_000002	"But," said Villefort, who was the first to break the silence, "I consider that I am the best judge of the propriety of the marriage in question.	"But," said Villefort, who was the first to break the silence, "I consider that I am the best judge of the propriety of the marriage in question.	true	1121.06	1129.84	13
7339_86765_000066_000003	I am the only person possessing the right to dispose of my daughter's hand. It is my wish that she should marry M. Franz d'Epinay--and she shall marry him." Valentine sank weeping into a chair.	I am the only person possessing the right to dispose of my daughter's hand. It is my wish that she should marry m Franz d'Epinay-and she shall marry him." Valentine sank weeping into a chair.	true	1130.21	1144.45	14
7339_86765_000067_000000	"Sir," said the notary, "how do you intend disposing of your fortune in case Mademoiselle de Villefort still determines on marrying M. Franz?" The old man gave no answer.	"Sir," said the notary, "how do you intend disposing of your fortune in case Mademoiselle de Villefort still determines on marrying m Franz?" The old man gave no answer.	false	1145.45	1157.62	15
7339_86765_000067_000001	"You will, of course, dispose of it in some way or other?"	"You will, of course, dispose of it in some way or other?"	false	1158.38	1162.59	15.512819
7339_86765_000068_000000	"Yes."	"Yes."	true	1162.59	1163.41	12
7339_86765_000069_000000	"In favor of some member of your family?"	"In favor of some member of your family?"	true	1163.96	1166.41	11
7339_86765_000070_000000	"No."	"no"	true	1167.14	1167.94	16
7339_86765_000071_000000	"Do you intend devoting it to charitable purposes, then?" pursued the notary.	"Do you intend devoting it to charitable purposes, then?" pursued the notary.	true	1168.73	1173.1	10
7339_86765_000072_000000	"Yes."	"Yes."	true	1173.71	1174.63	12
7339_86765_000073_000000	"But," said the notary, "you are aware that the law does not allow a son to be entirely deprived of his patrimony?"	"But," said the notary, "you are aware that the law does not allow a son to be entirely deprived of his patrimony?"	true	1175.15	1182.4	12
7339_86765_000074_000000	"Yes."	"Yes."	true	1183.04	1183.93	14
7339_86765_000075_000000	"You only intend, then, to dispose of that part of your fortune which the law allows you to subtract from the inheritance of your son?" Noirtier made no answer.	"You only intend, then, to dispose of that part of your fortune which the law allows you to subtract from the inheritance of your son?" Noirtier made no answer.	false	1184.69	1194.4	13
7339_86765_000075_000001	"Do you still wish to dispose of all?"	"Do you still wish to dispose of all?"	true	1195.04	1197.58	15
7339_86765_000076_000000	"Yes."	"Yes."	true	1198.58	1199.44	15.968487
7339_86765_000077_000000	"But they will contest the will after your death?"	"But they will contest the will after your death?"	true	1200.41	1202.98	10
7339_86765_000078_000000	"No."	"no"	true	1203.44	1204.27	12
7339_86765_000079_000000	"My father knows me," replied Villefort; "he is quite sure that his wishes will be held sacred by me; besides, he understands that in my position I cannot plead against the poor." The eye of Noirtier beamed with triumph.	"My father knows me," replied Villefort; "he is quite sure that his wishes will be held sacred by me; besides, he understands that in my position I cannot plead against the poor." The eye of Noirtier beamed with triumph.	false	1205.21	1221.22	16.80074
7339_86765_000079_000001	"What do you decide on, sir?" asked the notary of Villefort.	"What do you decide on, sir?" asked the notary of Villefort.	false	1222.19	1226.73	14.156761
7339_86765_000080_000000	"Nothing, sir; it is a resolution which my father has taken and I know he never alters his mind.	"Nothing, sir; it is a resolution which my father has taken and I know he never alters his mind.	true	1226.73	1233.85	14
7339_86765_000080_000001	I am quite resigned.	I am quite resigned.	true	1234.34	1235.83	18
7339_86765_000080_000002	These 900,000 francs will go out of the family in order to enrich some hospital; but it is ridiculous thus to yield to the caprices of an old man, and I shall, therefore, act according to my conscience." Having said this, Villefort quitted the room with his wife, leaving his father at liberty to do as he pleased.	These nine hundred thousand francs will go out of the family in order to enrich some hospital; but it is ridiculous thus to yield to the caprices of an old man, and I shall, therefore, act according to my conscience." Having said this, Villefort quitted the room with his wife, leaving his father at liberty to do as he pleased.	true	1236.17	1257.64	13
7339_86765_000080_000003	The same day the will was made, the witnesses were brought, it was approved by the old man, sealed in the presence of all and given in charge to M. Deschamps, the family notary.	The same day the will was made, the witnesses were brought, it was approved by the old man, sealed in the presence of all and given in charge to m Deschamps, the family notary.	false	1258.13	1277.88	14
