6188_73024_000021_000004	It couldn't be done, I suppose, till after a year; and in that case she shall be married at Clavering."	It couldn't be done, I suppose, till after a year; and in that case she shall be married at Clavering."	true	685.25	690.79	21
6188_73024_000022_000000	Here was a prospect for Julia Brabazon--to be led to the same altar, at which she had married Lord Ongar, by Archie Clavering, twelve month's after her first husband's death, and little more than two years after her first wedding!	Here was a prospect for Julia Brabazon-to be led to the same altar, at which she had married Lord Ongar, by Archie Clavering, twelve month's after her first husband's death, and little more than two years after her first wedding!	true	692.12	706.87	21.632933
6188_73024_000022_000001	The peculiarity of the position did not quite make itself apparent either to Hugh or to Archie; but there was one point which did suggest itself to the younger brother at that moment.	The peculiarity of the position did not quite make itself apparent either to Hugh or to Archie; but there was one point which did suggest itself to the younger brother at that moment.	false	707.51	718.45	23.842821
6188_73024_000023_000000	"I don't suppose there was anything really wrong, eh?"	"I don't suppose there was anything really wrong, eh?"	true	719.84	722.53	19
6188_73024_000024_000000	"Can't say, I'm sure," said Sir Hugh.	"Can't say, I'm sure," said Sir Hugh.	true	723.32	725.98	19.985304
6188_73024_000025_000000	"Because I shouldn't like--"	"Because I shouldn't like-"	true	726.23	727.84	20.181683
6188_73024_000026_000000	"If I were you I wouldn't trouble myself about that.	"If I were you I wouldn't trouble myself about that.	true	728.15	731.14	18.558878
6188_73024_000026_000001	Judge not, that you be not judged."	Judge not, that you be not judged."	true	731.27	734.02	25.953156
6188_73024_000027_000000	"Yes, that's true, to be sure," said Archie; and on that point he went forth satisfied.	"Yes, that's true, to be sure," said Archie; and on that point he went forth satisfied.	true	734.57	740.76	23.564548
6188_73024_000028_000000	Chapter XIX	Chapter nineteen	false	740.76	740.79	-20
6188_73024_000029_000000	Let Her Know That You're There	Let Her Know That You're There	false	740.79	740.91	-20
6188_73024_000030_000000	The job before him, in his attempt to win Lady Ongar, was a peculiar job, and that Archie well knew.	The job before him, in his attempt to win Lady Ongar, was a peculiar job, and that Archie well knew.	false	740.91	741.3	-20
6188_73024_000030_000001	In some inexplicable manner he put himself into the scales and weighed himself, and discovered his own weight with fair accuracy.	In some inexplicable manner he put himself into the scales and weighed himself, and discovered his own weight with fair accuracy.	false	741.3	741.69	-6
6188_73024_000030_000002	And he put her into the scales, and he found that she was much the heavier of the two.	And he put her into the scales, and he found that she was much the heavier of the two.	false	741.69	742.14	11
6188_73024_000030_000003	How he did this--how such men as Archie Clavering do do it--I cannot say; but they do weigh themselves, and know their own weight, and shove themselves aside as being too light for any real service in the world.	How he did this-how such men as Archie Clavering do do it-I cannot say; but they do weigh themselves, and know their own weight, and shove themselves aside as being too light for any real service in the world.	false	742.14	743.34	17
6188_73024_000030_000004	This they do, though they may fluster with their voices, and walk about with their noses in the air, and swing their canes, and try to look as large as they may. They do not look large, and they know it; and, consequently, they ring the bells, and look after the horses, and shove themselves on one side, so that the heavier weights may come forth and do the work.	This they do, though they may fluster with their voices, and walk about with their noses in the air, and swing their canes, and try to look as large as they may. They do not look large, and they know it; and, consequently, they ring the bells, and look after the horses, and shove themselves on one side, so that the heavier weights may come forth and do the work.	false	743.34	745.41	19.94995
6188_73024_000030_000005	Archie Clavering, who had duly weighed himself, could hardly bring himself to believe that Lady Ongar would be fool enough to marry him!	Archie Clavering, who had duly weighed himself, could hardly bring himself to believe that Lady Ongar would be fool enough to marry him!	false	745.41	746.58	15.763767
6188_73024_000030_000006	Seven thousand a year, with a park and farm in Surrey, and give it all to him--him, Archie Clavering, who had, so to say, no weight at all!	Seven thousand a year, with a park and farm in Surrey, and give it all to him-him, Archie Clavering, who had, so to say, no weight at all!	false	746.58	748.02	-1
6188_73024_000030_000007	Archie Clavering, for one, could not bring himself to believe it.	Archie Clavering, for one, could not bring himself to believe it.	false	748.02	748.56	6
