6188_73024_000000_000000	Such were the two rival claimants for the hand of Harry Clavering.	Such were the two rival claimants for the hand of Harry Clavering.	false	4.26	14.88	22.497288
6188_73024_000001_000000	Chapter XVIII	Chapter eighteen	true	14.88	16.18	22.922865
6188_73024_000002_000000	"Judge Not That Ye Be Not Judged"	"Judge Not That Ye Be Not Judged"	false	16.46	18.76	23.694418
6188_73024_000003_000000	A week had passed since the evening which Harry had spent in Bolton Street, and he had not again seen Lady Ongar.	A week had passed since the evening which Harry had spent in Bolton Street, and he had not again seen Lady Ongar.	false	19.61	26.95	21.518986
6188_73024_000003_000001	He had professed to himself that his reason for not going there was the non-performance of the commission which Lady Ongar had given him with reference to Count Pateroff.	He had professed to himself that his reason for not going there was the non performance of the commission which Lady Ongar had given him with reference to Count Pateroff.	true	27.38	37.66	21.722136
6188_73024_000003_000002	He had not yet succeeded in catching the Count, though he had twice asked for him in Mount Street and twice at the club in Pall Mall. It appeared that the Count never went to Mount Street, and was very rarely seen at the club.	He had not yet succeeded in catching the Count, though he had twice asked for him in Mount Street and twice at the club in Pall Mall. It appeared that the Count never went to Mount Street, and was very rarely seen at the club.	true	38.24	52.06	22.128231
6188_73024_000003_000003	There was some other club which he frequented, and Harry did not know what club.	There was some other club which he frequented, and Harry did not know what club.	true	52.43	57.04	22.862225
6188_73024_000003_000004	On both the occasions of Harry's calling in Mount Street, the servant had asked him to go up and see madame; but he had declined to do so, pleading that he was hurried.	On both the occasions of Harry's calling in Mount Street, the servant had asked him to go up and see madame; but he had declined to do so, pleading that he was hurried.	true	57.5	67.33	21.101496
6188_73024_000003_000005	He was, however, driven to resolve that he must go direct to Sophie, as otherwise he could find no means of doing as he had promised.	He was, however, driven to resolve that he must go direct to Sophie, as otherwise he could find no means of doing as he had promised.	true	67.94	76.33	21.11251
6188_73024_000003_000006	She probably might put him on the scent of her brother.	She probably might put him on the scent of her brother.	true	77.09	80.14	21.34976
6188_73024_000004_000000	But there had been another reason why Harry had not gone to Bolton Street, though he had not acknowledged it to himself.	But there had been another reason why Harry had not gone to Bolton Street, though he had not acknowledged it to himself.	true	81.2	87.79	23.400225
6188_73024_000004_000001	He did not dare to trust himself with Lady Ongar.	He did not dare to trust himself with Lady Ongar.	false	88.19	91.24	22.831324
6188_73024_000004_000002	He feared that he would be led on to betray himself and to betray Florence--to throw himself at Julia's feet and sacrifice his honesty, in spite of all his resolutions to the contrary.	He feared that he would be led on to betray himself and to betray Florence-to throw himself at Julia's feet and sacrifice his honesty, in spite of all his resolutions to the contrary.	true	91.82	104.47	22.145012
6188_73024_000004_000003	He felt when there as the accustomed but repentant dram-drinker might feel, when, having resolved to abstain, he is called upon to sit with the full glass offered before his lips.	He felt when there as the accustomed but repentant dram drinker might feel, when, having resolved to abstain, he is called upon to sit with the full glass offered before his lips.	true	105.05	117.49	22.077196
6188_73024_000004_000004	From such temptations as that the repentant dram-drinker knows that he must fly. But though he did not go after the fire-water of Bolton Street, neither was he able to satisfy himself with the cool fountain of Onslow Crescent.	From such temptations as that the repentant dram drinker knows that he must fly. But though he did not go after the fire water of Bolton Street, neither was he able to satisfy himself with the cool fountain of Onslow Crescent.	false	118.34	132.67	22.112368
6188_73024_000004_000005	He was wretched at this time--ill-satisfied with himself and others--and was no fitting companion for Cecilia Burton.	He was wretched at this time-ill satisfied with himself and others-and was no fitting companion for Cecilia Burton.	true	133.61	142.06	21.75256
6188_73024_000004_000006	The world, he thought, had used him ill.	The world, he thought, had used him ill.	true	142.91	145.66	23.258942
6188_73024_000004_000007	He could have been true to Julia Brabazon when she was well-nigh penniless.	He could have been true to Julia Brabazon when she was well nigh penniless.	true	146.21	150.43	18
6188_73024_000004_000008	It was not for her money that he had regarded her.	It was not for her money that he had regarded her.	true	150.77	153.73	21.829435
6188_73024_000004_000009	Had he been now a free man--free from those chains with which he had fettered himself at Stratton--he would again have asked this woman for her love, in spite of her past treachery; but it would have been for her love, and not for her money, that he would have sought her.	Had he been now a free man-free from those chains with which he had fettered himself at Stratton-he would again have asked this woman for her love, in spite of her past treachery; but it would have been for her love, and not for her money, that he would have sought her.	true	154.25	170.98	22.854786
6188_73024_000004_000010	Was it his fault that he had loved her, that she had been false to him, and that she had now come back and thrown herself before him?	Was it his fault that he had loved her, that she had been false to him, and that she had now come back and thrown herself before him?	true	171.74	179.29	23.83295
6188_73024_000004_000011	or had he been wrong because he had ventured to think that he loved another when Julia had deserted him?	or had he been wrong because he had ventured to think that he loved another when Julia had deserted him?	true	179.78	185.38	19
6188_73024_000004_000012	Or could he help himself if he now found that his love in truth belonged to her whom he had known first?	Or could he help himself if he now found that his love in truth belonged to her whom he had known first?	false	186.08	192.49	23.624004
6188_73024_000004_000013	The world had been very cruel to him, and he could not go to Onslow Crescent, and behave there prettily, hearing the praises of Florence with all the ardor of a discreet lover.	The world had been very cruel to him, and he could not go to Onslow Crescent, and behave there prettily, hearing the praises of Florence with all the ardor of a discreet lover.	true	193.37	204.13	23.107409
6188_73024_000005_000000	He knew well what would have been his right course, and yet he did not follow it.	He knew well what would have been his right course, and yet he did not follow it.	true	205.19	210.49	19.003506
6188_73024_000005_000001	Let him but once communicate to Lady Ongar the fact of his engagement, and the danger would be over, though much, perhaps, of the misery might remain.	Let him but once communicate to Lady Ongar the fact of his engagement, and the danger would be over, though much, perhaps, of the misery might remain.	true	211.01	220.6	22.02224
6188_73024_000005_000002	Let him write to her, and mention the fact, bringing it up as some little immaterial accident, and she would understand what he meant.	Let him write to her, and mention the fact, bringing it up as some little immaterial accident, and she would understand what he meant.	true	221.39	229.84	23.751219
6188_73024_000005_000003	But this he abstained from doing.	But this he abstained from doing.	true	230.45	232.63	22.201685
6188_73024_000005_000004	Though he swore to himself that he would not touch the dram, he would not dash down the full glass that was held to his lips.	Though he swore to himself that he would not touch the dram, he would not dash down the full glass that was held to his lips.	true	233.15	240.31	22.557436
6188_73024_000005_000005	He went about the town very wretchedly, looking for the Count, and regarding himself as a man specially marked out for sorrow by the cruel hand of misfortune.	He went about the town very wretchedly, looking for the Count, and regarding himself as a man specially marked out for sorrow by the cruel hand of misfortune.	true	241.19	251.8	22.0142
6188_73024_000005_000006	Lady Ongar, in the meantime, was expecting him, and was waxing angry and becoming bitter toward him because he came not.	Lady Ongar, in the meantime, was expecting him, and was waxing angry and becoming bitter toward him because he came not.	true	252.53	260.62	22.835907
6188_73024_000006_000000	Sir Hugh Clavering was now in London, and with him was his brother Archie.	Sir Hugh Clavering was now in London, and with him was his brother Archie.	false	261.62	265.99	23
6188_73024_000006_000001	Sir Hugh was a man who strained an income, that was handsome and sufficient for a country gentleman, to the very utmost, wanting to get out of it more than it could be made to give.	Sir Hugh was a man who strained an income, that was handsome and sufficient for a country gentleman, to the very utmost, wanting to get out of it more than it could be made to give.	true	266.39	277.36	21.589565
6188_73024_000006_000002	He was not a man to be in debt, or indulge himself with present pleasures to be paid for out of the funds of future years.	He was not a man to be in debt, or indulge himself with present pleasures to be paid for out of the funds of future years.	true	278.03	285.67	20.860916
6188_73024_000006_000003	He was possessed of a worldly wisdom which kept him from that folly, and taught him to appreciate fully the value of independence.	He was possessed of a worldly wisdom which kept him from that folly, and taught him to appreciate fully the value of independence.	true	286.19	293.95	20
6188_73024_000006_000004	But he was ever remembering how many shillings there are in a pound, and how many pence in a shilling.	But he was ever remembering how many shillings there are in a pound, and how many pence in a shilling.	true	294.44	300.52	18
6188_73024_000006_000005	He had a great eye to discount, and looked closely into his bills.	He had a great eye to discount, and looked closely into his bills.	true	300.98	305.59	24.672785
6188_73024_000006_000006	He searched for cheap shops; and some men began to say of him that he had found a cheap establishment for such wines as he did not drink himself!	He searched for cheap shops; and some men began to say of him that he had found a cheap establishment for such wines as he did not drink himself!	true	306.38	315.37	21.793625
6188_73024_000006_000007	In playing cards and in betting, he was very careful, never playing high, never risking much, but hoping to turn something by the end of the year, and angry with himself if he had not done so.	In playing cards and in betting, he was very careful, never playing high, never risking much, but hoping to turn something by the end of the year, and angry with himself if he had not done so.	true	316.13	328.81	23.764746
6188_73024_000006_000008	An unamiable man he was, but one whose heir would probably not quarrel with him--if only he would die soon enough.	An unamiable man he was, but one whose heir would probably not quarrel with him-if only he would die soon enough.	true	329.39	337.42	20.31835
6188_73024_000006_000009	He had always had a house in town--a moderate house in Berkeley Square, which belonged to him, and had belonged to his father before him.	He had always had a house in town-a moderate house in Berkeley Square, which belonged to him, and had belonged to his father before him.	true	338.21	346.42	23.833012
6188_73024_000006_000010	Lady Clavering had usually lived there during the season; or, as had latterly been the case, during only a part of the season.	Lady Clavering had usually lived there during the season; or, as had latterly been the case, during only a part of the season.	true	347.09	355.15	21.713713
6188_73024_000006_000011	And now it had come to pass, in this year, that Lady Clavering was not to come to London at all, and that Sir Hugh was meditating whether the house in Berkeley Square might not be let.	And now it had come to pass, in this year, that Lady Clavering was not to come to London at all, and that Sir Hugh was meditating whether the house in Berkeley Square might not be let.	false	355.61	366.07	21.649525
6188_73024_000006_000012	The arrangement would make the difference of considerably more than a thousand a year to him.	The arrangement would make the difference of considerably more than a thousand a year to him.	true	366.71	371.11	21
6188_73024_000006_000013	For himself, he would take lodgings.	For himself, he would take lodgings.	true	371.72	374.35	21.692757
6188_73024_000006_000014	He had no idea of giving up London in the Spring and early Summer.	He had no idea of giving up London in the Spring and early Summer.	true	374.45	378.25	18
6188_73024_000006_000015	But why keep up a house in Berkeley Square, as Lady Clavering did not use it?	But why keep up a house in Berkeley Square, as Lady Clavering did not use it?	true	378.44	383.02	23.396955
6188_73024_000007_000000	He was partly driven to this by a desire to shake off the burden of his brother.	He was partly driven to this by a desire to shake off the burden of his brother.	true	383.66	388.03	21
6188_73024_000007_000001	When Archie chose to go to Clavering, the house was open to him.	When Archie chose to go to Clavering, the house was open to him.	true	388.37	392.11	21.732126
6188_73024_000007_000002	That was the necessity of Sir Hugh's position, and he could not avoid it unless he made it worth his while to quarrel with his brother. Archie was obedient, ringing the bell when he was told, looking after the horses, spying about, and perhaps saving as much money as he cost. But the matter was very different in Berkeley Square.	That was the necessity of Sir Hugh's position, and he could not avoid it unless he made it worth his while to quarrel with his brother. Archie was obedient, ringing the bell when he was told, looking after the horses, spying about, and perhaps saving as much money as he cost. But the matter was very different in Berkeley Square.	true	392.99	413.32	21.374222
6188_73024_000007_000003	No elder brother is bound to find breakfast and bed for a younger brother in London.	No elder brother is bound to find breakfast and bed for a younger brother in London.	true	413.69	418.15	18
6188_73024_000007_000004	And yet, from his boyhood upward, Archie had made good his footing in Berkeley Square.	And yet, from his boyhood upward, Archie had made good his footing in Berkeley Square.	true	419.63	424.63	24.951565
6188_73024_000007_000005	In the matter of the breakfast, Sir Hugh had indeed, of late, got the better of him.	In the matter of the breakfast, Sir Hugh had indeed, of late, got the better of him.	true	425.36	430.63	26.382732
6188_73024_000007_000006	The servants were kept on board wages, and there were no household accounts.	The servants were kept on board wages, and there were no household accounts.	true	431.03	435.4	19.758026
6188_73024_000007_000007	But there was Archie's room, and Sir Hugh felt this to be a hardship.	But there was Archie's room, and Sir Hugh felt this to be a hardship.	true	435.68	440.05	21.514833
6188_73024_000008_000000	The present was not the moment for actually driving forth the intruder, for Archie was now up in London, especially under his brother's auspices.	The present was not the moment for actually driving forth the intruder, for Archie was now up in London, especially under his brother's auspices.	true	440.87	449.38	23.425966
6188_73024_000008_000001	And if the business on which Captain Clavering was now intent could be brought to a successful issue, the standing in the world of that young man would be very much altered.	And if the business on which Captain Clavering was now intent could be brought to a successful issue, the standing in the world of that young man would be very much altered.	true	450.02	459.43	22.688122
6188_73024_000008_000002	Then he would be a brother of whom Sir Hugh might be proud--a brother who would pay his way, and settle his points at whist if he lost them, even to a brother.	Then he would be a brother of whom Sir Hugh might be proud-a brother who would pay his way, and settle his points at whist if he lost them, even to a brother.	true	459.86	469.93	22.161041
6188_73024_000008_000003	If Archie could induce Lady Ongar to marry him, he would not be called upon any longer to ring the bells and look after the stable.	If Archie could induce Lady Ongar to marry him, he would not be called upon any longer to ring the bells and look after the stable.	true	470.63	478.51	21
6188_73024_000008_000004	He would have bells of his own, and stables, too, and perhaps some captain of his own to ring them and look after them.	He would have bells of his own, and stables, too, and perhaps some captain of his own to ring them and look after them.	true	478.94	485.83	22.60316
6188_73024_000008_000005	The expulsion, therefore, was not to take place till Archie should have made his attempt upon Lady Ongar.	The expulsion, therefore, was not to take place till Archie should have made his attempt upon Lady Ongar.	true	486.38	492.58	21
6188_73024_000009_000000	But Sir Hugh would admit of no delay, whereas Archie himself seemed to think that the iron was not yet quite hot enough for striking.	But Sir Hugh would admit of no delay, whereas Archie himself seemed to think that the iron was not yet quite hot enough for striking.	true	493.43	501.07	22
6188_73024_000009_000001	It would be better, he had suggested, to postpone the work till Julia could be coaxed down to Clavering in the Autumn.	It would be better, he had suggested, to postpone the work till Julia could be coaxed down to Clavering in the Autumn.	true	501.62	508.36	21.765112
6188_73024_000009_000002	He could do the work better, he thought; down at Clavering than in London.	He could do the work better, he thought; down at Clavering than in London.	true	508.91	512.8	22.263088
6188_73024_000009_000003	But Sir Hugh was altogether of a different opinion.	But Sir Hugh was altogether of a different opinion.	true	513.32	516.22	23
6188_73024_000009_000004	Though he had already asked his sister-in-law to Clavering, when the idea had first come up, he was glad that she had declined the visit.	Though he had already asked his sister in law to Clavering, when the idea had first come up, he was glad that she had declined the visit.	true	517.22	524.92	21.896362
6188_73024_000009_000005	Her coming might be very well, if she accepted Archie; but he did not want to be troubled with any renewal of his responsibility respecting her, if, as was more probable, she should reject him.	Her coming might be very well, if she accepted Archie; but he did not want to be troubled with any renewal of his responsibility respecting her, if, as was more probable, she should reject him.	true	525.59	537.46	23.68196
6188_73024_000009_000006	The world still looked askance at Lady Ongar, and Hugh did not wish to take up the armor of a paladin in her favor.	The world still looked askance at Lady Ongar, and Hugh did not wish to take up the armor of a paladin in her favor.	true	538.37	545.29	23
6188_73024_000009_000007	If Archie married her, Archie would be the paladin; though, indeed, in that case, no paladin would be needed.	If Archie married her, Archie would be the paladin; though, indeed, in that case, no paladin would be needed.	true	546.05	553.33	24.596382
6188_73024_000010_000000	"She has only been a widow, you know, four months," said Archie, pleading for delay.	"She has only been a widow, you know, four months," said Archie, pleading for delay.	true	554.36	559.9	20.453978
6188_73024_000010_000001	"It won't be delicate, will it?"	"It won't be delicate, will it?"	true	560.42	562.27	25.270897
6188_73024_000011_000000	"Delicate!" said Sir Hugh.	"Delicate!" said Sir Hugh.	true	563	564.76	23.940365
6188_73024_000011_000001	"I don't know whether there is much of delicacy in it at all."	"I don't know whether there is much of delicacy in it at all."	true	564.8	568.09	20.481775
6188_73024_000012_000000	"I don't see why she isn't to be treated like any other woman.	"I don't see why she isn't to be treated like any other woman.	true	569.24	572.5	16
6188_73024_000012_000001	If you were to die, you'd think it very odd if any fellow came up to Hermy before the season was over.	If you were to die, you'd think it very odd if any fellow came up to Hermy before the season was over.	true	572.69	577.87	21
6188_73024_000013_000000	"Archie, you are a fool," said Sir Hugh; and Archie could see, by his brother's brow, that Hugh was angry.	"Archie, you are a fool," said Sir Hugh; and Archie could see, by his brother's brow, that Hugh was angry.	true	578.57	585.7	23.142506
6188_73024_000013_000001	"You say things that, for folly and absurdity, are beyond belief.	"You say things that, for folly and absurdity, are beyond belief.	true	586.13	590.19	21.927254
6188_73024_000013_000002	If you can't see the peculiarities of Julia's position, I am not going to point them out to you."	If you can't see the peculiarities of Julia's position, I am not going to point them out to you."	true	590.19	595.39	17
6188_73024_000014_000000	"She is peculiar, of course--having so much money, and that place near Guilford, all her own for her life.	"She is peculiar, of course-having so much money, and that place near Guilford, all her own for her life.	true	596.45	602.98	23.305288
6188_73024_000014_000001	Of course it's peculiar.	Of course it's peculiar.	true	603.02	604.635	21.870287
6188_73024_000014_000002	But four months, Hugh!"	But four months, Hugh!"	false	604.635	607.14	19.41456
6188_73024_000015_000000	"If it had been four days it need have made no difference.	"If it had been four days it need have made no difference.	true	607.14	610.21	21.172356
6188_73024_000015_000001	A home, with some one to support her, is everything to her.	A home, with some one to support her, is everything to her.	true	610.22	613.51	21
6188_73024_000015_000002	If you wait till lots of fellows are buzzing around her you won't have a chance.	If you wait till lots of fellows are buzzing around her you won't have a chance.	true	613.55	617.77	22
6188_73024_000015_000003	You'll find that by this time next year she'll be the top of the fashion; and if not engaged to you, she will be to some one else.	You'll find that by this time next year she'll be the top of the fashion; and if not engaged to you, she will be to some one else.	true	617.93	625.03	20
6188_73024_000015_000004	I shouldn't be surprised if Harry were after her again."	I shouldn't be surprised if Harry were after her again."	true	625.04	627.97	17
6188_73024_000016_000000	"He's engaged to that girl we saw down at Clavering."	"He's engaged to that girl we saw down at Clavering."	true	629.03	631.69	19.13531
6188_73024_000017_000000	"What of that?	"What of that?	true	632.39	633.36	19.503883
6188_73024_000017_000001	Engagements can be broken as well as made.	Engagements can be broken as well as made.	true	633.36	635.83	18
6188_73024_000017_000002	You have this great advantage over every one, except him, that you can go to her at once without doing anything out of the way.	You have this great advantage over every one, except him, that you can go to her at once without doing anything out of the way.	true	635.87	642.64	20
6188_73024_000017_000003	That girl that Harry has in tow may perhaps keep him away for some time."	That girl that Harry has in tow may perhaps keep him away for some time."	true	642.74	646.99	22
6188_73024_000018_000000	"I tell you what, Hugh, you might as well call with me the first time."	"I tell you what, Hugh, you might as well call with me the first time."	true	648.77	652.21	22.283825
6188_73024_000019_000000	"So that I may quarrel with her, which I certainly should do--or, rather, she with me.	"So that I may quarrel with her, which I certainly should do-or, rather, she with me.	true	653	657.67	21
6188_73024_000019_000001	No, Archie; if you're afraid to go alone, you'd better give it up."	No, Archie; if you're afraid to go alone, you'd better give it up."	true	658.13	661.6	24.106888
6188_73024_000020_000000	"Afraid!	"Afraid!	true	661.79	662.625	19.406763
6188_73024_000020_000001	I'm not afraid!"	I'm not afraid!"	true	662.625	663.97	28.363081
6188_73024_000021_000000	"She can't eat you.	"She can't eat you.	true	664.46	665.89	21.968458
6188_73024_000021_000001	Remember that with her you needn't stand on your p's and q's, as you would with another woman.	Remember that with her you needn't stand on your p's and q's, as you would with another woman.	true	665.93	670.69	17
6188_73024_000021_000002	She knows what she is about, and will understand what she has to get as well as what she is expected to give.	She knows what she is about, and will understand what she has to get as well as what she is expected to give.	true	670.91	676.65	21.774496
6188_73024_000021_000003	All I can say is, that if she accepts you, Hermy will consent that she shall go to Clavering as much as she pleases till the marriage takes place.	All I can say is, that if she accepts you, Hermy will consent that she shall go to Clavering as much as she pleases till the marriage takes place.	false	676.65	684.88	23.25143
