2411_132530_000022_000005	St. Aubert drew forth a pistol, and ordered Michael to proceed as fast as possible; who had not long obeyed, before a horn sounded, that made the mountains ring.	st Aubert drew forth a pistol, and ordered Michael to proceed as fast as possible; who had not long obeyed, before a horn sounded, that made the mountains ring.	false	761.61	771.82	19.549664
2411_132530_000022_000006	He looked again from the window, and then saw a young man spring from the bushes into the road, followed by a couple of dogs.	He looked again from the window, and then saw a young man spring from the bushes into the road, followed by a couple of dogs.	true	772.07	779.56	20.455587
2411_132530_000022_000007	The stranger was in a hunter's dress.	The stranger was in a hunter's dress.	true	779.99	782.08	13.794425
2411_132530_000022_000008	His gun was slung across his shoulders, the hunter's horn hung from his belt, and in his hand was a small pike, which, as he held it, added to the manly grace of his figure, and assisted the agility of his steps.	His gun was slung across his shoulders, the hunter's horn hung from his belt, and in his hand was a small pike, which, as he held it, added to the manly grace of his figure, and assisted the agility of his steps.	false	782.27	795.61	18.80651
2411_132530_000023_000000	After a moment's hesitation, St. Aubert again stopped the carriage, and waited till he came up, that they might enquire concerning the hamlet they were in search of.	After a moment's hesitation, st Aubert again stopped the carriage, and waited till he came up, that they might enquire concerning the hamlet they were in search of.	false	796.55	805.24	19.830837
2411_132530_000023_000001	The stranger informed him, that it was only half a league distant, that he was going thither himself, and would readily shew the way.	The stranger informed him, that it was only half a league distant, that he was going thither himself, and would readily shew the way.	true	806.45	813.78	19.62895
2411_132530_000023_000002	St. Aubert thanked him for the offer, and, pleased with his chevalier-like air and open countenance, asked him to take a seat in the carriage; which the stranger, with an acknowledgment, declined, adding that he would keep pace with the mules.	st Aubert thanked him for the offer, and, pleased with his chevalier like air and open countenance, asked him to take a seat in the carriage; which the stranger, with an acknowledgment, declined, adding that he would keep pace with the mules.	false	813.78	828.34	19.697262
2411_132530_000023_000003	'But I fear you will be wretchedly accommodated,' said he: 'the inhabitants of these mountains are a simple people, who are not only without the luxuries of life, but almost destitute of what in other places are held to be its necessaries.'	'But I fear you will be wretchedly accommodated,' said he: 'the inhabitants of these mountains are a simple people, who are not only without the luxuries of life, but almost destitute of what in other places are held to be its necessaries.'	true	829.07	842.95	18.795868
2411_132530_000024_000000	'I perceive you are not one of its inhabitants, sir,' said St. Aubert.	'I perceive you are not one of its inhabitants, sir,' said st Aubert.	false	844.13	848.49	18
2411_132530_000025_000000	'No, sir, I am only a wanderer here.'	'No, sir, I am only a wanderer here.'	false	848.49	850.87	14
2411_132530_000026_000000	The carriage drove on, and the increasing dusk made the travellers very thankful that they had a guide; the frequent glens, too, that now opened among the mountains, would likewise have added to their perplexity. Emily, as she looked up one of these, saw something at a great distance like a bright cloud in the air.	The carriage drove on, and the increasing dusk made the travellers very thankful that they had a guide; the frequent glens, too, that now opened among the mountains, would likewise have added to their perplexity. Emily, as she looked up one of these, saw something at a great distance like a bright cloud in the air.	true	853.16	872.41	19.708477
2411_132530_000026_000001	'What light is yonder, sir?' said she.	'What light is yonder, sir?' said she.	true	873.14	875.79	19.488462
2411_132530_000027_000000	St. Aubert looked, and perceived that it was the snowy summit of a mountain, so much higher than any around it, that it still reflected the sun's rays, while those below lay in deep shade.	st Aubert looked, and perceived that it was the snowy summit of a mountain, so much higher than any around it, that it still reflected the sun's rays, while those below lay in deep shade.	false	875.79	889.09	20.15906
2411_132530_000028_000000	At length, the village lights were seen to twinkle through the dusk, and, soon after, some cottages were discovered in the valley, or rather were seen by reflection in the stream, on whose margin they stood, and which still gleamed with the evening light.	At length, the village lights were seen to twinkle through the dusk, and, soon after, some cottages were discovered in the valley, or rather were seen by reflection in the stream, on whose margin they stood, and which still gleamed with the evening light.	false	890.96	905.62	19
2411_132530_000029_000000	The stranger now came up, and St. Aubert, on further enquiry, found not only that there was no inn in the place, but not any sort of house of public reception.	The stranger now came up, and st Aubert, on further enquiry, found not only that there was no inn in the place, but not any sort of house of public reception.	false	906.23	915.64	19.908842
2411_132530_000029_000001	The stranger, however, offered to walk on, and enquire for a cottage to accommodate them; for which further civility St. Aubert returned his thanks, and said, that, as the village was so near, he would alight, and walk with him.	The stranger, however, offered to walk on, and enquire for a cottage to accommodate them; for which further civility st Aubert returned his thanks, and said, that, as the village was so near, he would alight, and walk with him.	false	915.89	928.81	18.815256
2411_132530_000029_000002	Emily followed slowly in the carriage.	Emily followed slowly in the carriage.	true	928.97	931.3	19.163149
2411_132530_000030_000000	On the way, St. Aubert asked his companion what success he had had in the chase.	On the way, st Aubert asked his companion what success he had had in the chase.	false	932.96	937.48	14
2411_132530_000030_000001	'Not much, sir,' he replied, 'nor do I aim at it.	'Not much, sir,' he replied, 'nor do I aim at it.	true	937.85	941.41	18
2411_132530_000030_000002	I am pleased with the country, and mean to saunter away a few weeks among its scenes.	I am pleased with the country, and mean to saunter away a few weeks among its scenes.	true	941.69	945.97	18
2411_132530_000030_000003	My dogs I take with me more for companionship than for game. This dress, too, gives me an ostensible business, and procures me that respect from the people, which would, perhaps, be refused to a lonely stranger, who had no visible motive for coming among them.'	My dogs I take with me more for companionship than for game. This dress, too, gives me an ostensible business, and procures me that respect from the people, which would, perhaps, be refused to a lonely stranger, who had no visible motive for coming among them.'	false	946.25	962.73	20.522898
2411_132530_000031_000000	'I admire your taste,' said St. Aubert, 'and, if I was a younger man, should like to pass a few weeks in your way exceedingly.	'I admire your taste,' said st Aubert, 'and, if I was a younger man, should like to pass a few weeks in your way exceedingly.	false	962.73	970.87	18.410334
2411_132530_000031_000001	I, too, am a wanderer, but neither my plan nor pursuits are exactly like yours--I go in search of health, as much as of amusement.' St. Aubert sighed, and paused; and then, seeming to recollect himself, he resumed: 'If I can hear of a tolerable road, that shall afford decent accommodation, it is my intention to pass into Rousillon, and along the sea-shore to Languedoc.	I, too, am a wanderer, but neither my plan nor pursuits are exactly like yours-I go in search of health, as much as of amusement.' st Aubert sighed, and paused; and then, seeming to recollect himself, he resumed: 'If I can hear of a tolerable road, that shall afford decent accommodation, it is my intention to pass into Rousillon, and along the sea shore to Languedoc.	false	971.21	999.16	18.480524
2411_132530_000031_000002	You, sir, seem to be acquainted with the country, and can, perhaps, give me information on the subject.'	You, sir, seem to be acquainted with the country, and can, perhaps, give me information on the subject.'	true	999.44	1004.95	19.872822
2411_132530_000032_000000	The stranger said, that what information he could give was entirely at his service; and then mentioned a road rather more to the east, which led to a town, whence it would be easy to proceed into Rousillon.	The stranger said, that what information he could give was entirely at his service; and then mentioned a road rather more to the east, which led to a town, whence it would be easy to proceed into Rousillon.	true	1006.04	1018.87	18.934107
2411_132530_000033_000000	They now arrived at the village, and commenced their search for a cottage, that would afford a night's lodging.	They now arrived at the village, and commenced their search for a cottage, that would afford a night's lodging.	false	1020.44	1026.61	20
2411_132530_000033_000001	In several, which they entered, ignorance, poverty, and mirth seemed equally to prevail; and the owners eyed St. Aubert with a mixture of curiosity and timidity. Nothing like a bed could be found, and he had ceased to enquire for one, when Emily joined him, who observed the languor of her father's countenance, and lamented, that he had taken a road so ill provided with the comforts necessary for an invalid.	In several, which they entered, ignorance, poverty, and mirth seemed equally to prevail; and the owners eyed st Aubert with a mixture of curiosity and timidity. Nothing like a bed could be found, and he had ceased to enquire for one, when Emily joined him, who observed the languor of her father's countenance, and lamented, that he had taken a road so ill provided with the comforts necessary for an invalid.	false	1027.16	1052.71	19
2411_132530_000033_000002	Other cottages, which they examined, seemed somewhat less savage than the former, consisting of two rooms, if such they could be called; the first of these occupied by mules and pigs, the second by the family, which generally consisted of six or eight children, with their parents, who slept on beds of skins and dried beech leaves, spread upon a mud floor.	Other cottages, which they examined, seemed somewhat less savage than the former, consisting of two rooms, if such they could be called; the first of these occupied by mules and pigs, the second by the family, which generally consisted of six or eight children, with their parents, who slept on beds of skins and dried beech leaves, spread upon a mud floor.	true	1053.86	1077.19	19
2411_132530_000033_000003	Here, light was admitted, and smoke discharged, through an aperture in the roof; and here the scent of spirits (for the travelling smugglers, who haunted the Pyrenees, had made this rude people familiar with the use of liquors) was generally perceptible enough.	Here, light was admitted, and smoke discharged, through an aperture in the roof; and here the scent of spirits (for the travelling smugglers, who haunted the Pyrenees, had made this rude people familiar with the use of liquors) was generally perceptible enough.	true	1078.16	1094.05	20.5227
2411_132530_000033_000004	Emily turned from such scenes, and looked at her father with anxious tenderness, which the young stranger seemed to observe; for, drawing St. Aubert aside, he made him an offer of his own bed.	Emily turned from such scenes, and looked at her father with anxious tenderness, which the young stranger seemed to observe; for, drawing st Aubert aside, he made him an offer of his own bed.	false	1094.72	1107.88	19.807613
2411_132530_000033_000005	'It is a decent one,' said he, 'when compared with what we have just seen, yet such as in other circumstances I should be ashamed to offer you.' St. Aubert acknowledged how much he felt himself obliged by this kindness, but refused to accept it, till the young stranger would take no denial.	'It is a decent one,' said he, 'when compared with what we have just seen, yet such as in other circumstances I should be ashamed to offer you.' st Aubert acknowledged how much he felt himself obliged by this kindness, but refused to accept it, till the young stranger would take no denial.	false	1108.13	1126.69	19.246819
2411_132530_000033_000006	'Do not give me the pain of knowing, sir,' said he, 'that an invalid, like you, lies on hard skins, while I sleep in a bed.	'Do not give me the pain of knowing, sir,' said he, 'that an invalid, like you, lies on hard skins, while I sleep in a bed.	true	1127.09	1135.33	18.231518
2411_132530_000033_000007	Besides, sir, your refusal wounds my pride; I must believe you think my offer unworthy your acceptance.	Besides, sir, your refusal wounds my pride; I must believe you think my offer unworthy your acceptance.	true	1135.58	1142.68	18.978786
2411_132530_000033_000008	Let me shew you the way.	Let me shew you the way.	true	1142.81	1144.28	16.367142
2411_132530_000033_000009	I have no doubt my landlady can accommodate this young lady also.'	I have no doubt my landlady can accommodate this young lady also.'	true	1144.28	1147.95	12
2411_132530_000034_000000	St. Aubert at length consented, that, if this could be done, he would accept his kindness, though he felt rather surprised, that the stranger had proved himself so deficient in gallantry, as to administer to the repose of an infirm man, rather than to that of a very lovely young woman, for he had not once offered the room for Emily.	st Aubert at length consented, that, if this could be done, he would accept his kindness, though he felt rather surprised, that the stranger had proved himself so deficient in gallantry, as to administer to the repose of an infirm man, rather than to that of a very lovely young woman, for he had not once offered the room for Emily.	false	1147.95	1169.74	20.11492
2411_132530_000034_000001	But she thought not of herself, and the animated smile she gave him, told how much she felt herself obliged for the preference of her father.	But she thought not of herself, and the animated smile she gave him, told how much she felt herself obliged for the preference of her father.	true	1170.11	1178.38	20.26072
2411_132530_000035_000000	On their way, the stranger, whose name was Valancourt, stepped on first to speak to his hostess, and she came out to welcome St. Aubert into a cottage, much superior to any he had seen.	On their way, the stranger, whose name was Valancourt, stepped on first to speak to his hostess, and she came out to welcome st Aubert into a cottage, much superior to any he had seen.	false	1179.32	1191.49	21.22643
2411_132530_000035_000001	This good woman seemed very willing to accommodate the strangers, who were soon compelled to accept the only two beds in the place.	This good woman seemed very willing to accommodate the strangers, who were soon compelled to accept the only two beds in the place.	true	1191.89	1200.04	20.278204
2411_132530_000035_000002	Eggs and milk were the only food the cottage afforded; but against scarcity of provisions St. Aubert had provided, and he requested Valancourt to stay, and partake with him of less homely fare; an invitation, which was readily accepted, and they passed an hour in intelligent conversation.	Eggs and milk were the only food the cottage afforded; but against scarcity of provisions st Aubert had provided, and he requested Valancourt to stay, and partake with him of less homely fare; an invitation, which was readily accepted, and they passed an hour in intelligent conversation.	false	1200.56	1217.7	20.291595
2411_132530_000035_000003	St. Aubert was much pleased with the manly frankness, simplicity, and keen susceptibility to the grandeur of nature, which his new acquaintance discovered; and, indeed, he had often been heard to say, that, without a certain simplicity of heart, this taste could not exist in any strong degree.	st Aubert was much pleased with the manly frankness, simplicity, and keen susceptibility to the grandeur of nature, which his new acquaintance discovered; and, indeed, he had often been heard to say, that, without a certain simplicity of heart, this taste could not exist in any strong degree.	false	1217.7	1237.39	18.821339
2411_132530_000036_000000	The conversation was interrupted by a violent uproar without, in which the voice of the muleteer was heard above every other sound.	The conversation was interrupted by a violent uproar without, in which the voice of the muleteer was heard above every other sound.	true	1239.83	1247.26	17
2411_132530_000036_000001	Valancourt started from his seat, and went to enquire the occasion; but the dispute continued so long afterwards, that St. Aubert went himself, and found Michael quarrelling with the hostess, because she had refused to let his mules lie in a little room where he and three of her sons were to pass the night.	Valancourt started from his seat, and went to enquire the occasion; but the dispute continued so long afterwards, that st Aubert went himself, and found Michael quarrelling with the hostess, because she had refused to let his mules lie in a little room where he and three of her sons were to pass the night.	false	1247.81	1266.25	19
2411_132530_000036_000002	The place was wretched enough, but there was no other for these people to sleep in; and, with somewhat more of delicacy than was usual among the inhabitants of this wild tract of country, she persisted in refusing to let the animals have the same BED-CHAMBER with her children.	The place was wretched enough, but there was no other for these people to sleep in; and, with somewhat more of delicacy than was usual among the inhabitants of this wild tract of country, she persisted in refusing to let the animals have the same BED CHAMBER with her children.	false	1266.62	1282.9	18
2411_132530_000036_000003	This was a tender point with the muleteer; his honour was wounded when his mules were treated with disrespect, and he would have received a blow, perhaps, with more meekness.	This was a tender point with the muleteer; his honour was wounded when his mules were treated with disrespect, and he would have received a blow, perhaps, with more meekness.	true	1283.21	1292.68	19.073767
2411_132530_000036_000004	He declared that his beasts were as honest beasts, and as good beasts, as any in the whole province; and that they had a right to be well treated wherever they went.	He declared that his beasts were as honest beasts, and as good beasts, as any in the whole province; and that they had a right to be well treated wherever they went.	true	1293.11	1303.2	20
2411_132530_000036_000005	'They are as harmless as lambs,' said he, 'if people don't affront them.	'They are as harmless as lambs,' said he, 'if people don't affront them.	false	1303.2	1307.57	18.25609
2411_132530_000036_000006	I never knew them behave themselves amiss above once or twice in my life, and then they had good reason for doing so.	I never knew them behave themselves amiss above once or twice in my life, and then they had good reason for doing so.	true	1307.57	1314.46	14
2411_132530_000036_000007	Once, indeed, they kicked at a boy's leg that lay asleep in the stable, and broke it; but I told them they were out there, and by St. Anthony!	Once, indeed, they kicked at a boy's leg that lay asleep in the stable, and broke it; but I told them they were out there, and by saint Anthony!	false	1314.56	1323.53	20
2411_132530_000036_000008	I believe they understood me, for they never did so again.'	I believe they understood me, for they never did so again.'	true	1323.53	1327.51	18
2411_132530_000037_000000	He concluded this eloquent harangue with protesting, that they should share with him, go where he would.	He concluded this eloquent harangue with protesting, that they should share with him, go where he would.	true	1329.23	1335.73	18.398977
2411_132530_000038_000000	The dispute was at length settled by Valancourt, who drew the hostess aside, and desired she would let the muleteer and his beasts have the place in question to themselves, while her sons should have the bed of skins designed for him, for that he would wrap himself in his cloak, and sleep on the bench by the cottage door.	The dispute was at length settled by Valancourt, who drew the hostess aside, and desired she would let the muleteer and his beasts have the place in question to themselves, while her sons should have the bed of skins designed for him, for that he would wrap himself in his cloak, and sleep on the bench by the cottage door.	true	1338.44	1357.23	19.947702
2411_132530_000038_000001	But this she thought it her duty to oppose, and she felt it to be her inclination to disappoint the muleteer.	But this she thought it her duty to oppose, and she felt it to be her inclination to disappoint the muleteer.	false	1357.23	1364.08	20.219624
2411_132530_000038_000002	Valancourt, however, was positive, and the tedious affair was at length settled.	Valancourt, however, was positive, and the tedious affair was at length settled.	false	1364.57	1369.75	21.176302
2411_132530_000039_000000	It was late when St. Aubert and Emily retired to their rooms, and Valancourt to his station at the door, which, at this mild season, he preferred to a close cabin and a bed of skins.	It was late when st Aubert and Emily retired to their rooms, and Valancourt to his station at the door, which, at this mild season, he preferred to a close cabin and a bed of skins.	false	1371.02	1381.65	17
2411_132530_000039_000001	St. Aubert was somewhat surprised to find in his room volumes of Homer, Horace, and Petrarch; but the name of Valancourt, written in them, told him to whom they belonged.	st Aubert was somewhat surprised to find in his room volumes of Homer, Horace, and Petrarch; but the name of Valancourt, written in them, told him to whom they belonged.	false	1381.65	1399.38	20.378803
