2562_133442_000002_000000	'I found the Palace of Green Porcelain, when we approached it about noon, deserted and falling into ruin.	'I found the Palace of Green Porcelain, when we approached it about noon, deserted and falling into ruin.
2562_133442_000002_000002	It lay very high upon a turfy down, and looking north-eastward before I entered it, I was surprised to see a large estuary, or even creek, where I judged Wandsworth and Battersea must once have been.	It lay very high upon a turfy down, and looking north eastward before I entered it, I was surprised to see a large estuary, or even creek, where I judged Wandsworth and Battersea must once have been.
2562_133442_000003_000000	'The material of the Palace proved on examination to be indeed porcelain, and along the face of it I saw an inscription in some unknown character.	'The material of the Palace proved on examination to be indeed porcelain, and along the face of it I saw an inscription in some unknown character.
2562_133442_000003_000001	I thought, rather foolishly, that Weena might help me to interpret this, but I only learned that the bare idea of writing had never entered her head.	I thought, rather foolishly, that Weena might help me to interpret this, but I only learned that the bare idea of writing had never entered her head.
2562_133442_000003_000002	She always seemed to me, I fancy, more human than she was, perhaps because her affection was so human.	She always seemed to me, I fancy, more human than she was, perhaps because her affection was so human.
2562_133442_000004_000000	'Within the big valves of the door--which were open and broken--we found, instead of the customary hall, a long gallery lit by many side windows.	'Within the big valves of the door-which were open and broken-we found, instead of the customary hall, a long gallery lit by many side windows.
2562_133442_000004_000001	At the first glance I was reminded of a museum. The tiled floor was thick with dust, and a remarkable array of miscellaneous objects was shrouded in the same grey covering.	At the first glance I was reminded of a museum. The tiled floor was thick with dust, and a remarkable array of miscellaneous objects was shrouded in the same grey covering.
2562_133442_000004_000003	I recognized by the oblique feet that it was some extinct creature after the fashion of the Megatherium.	I recognized by the oblique feet that it was some extinct creature after the fashion of the Megatherium.
2562_133442_000004_000005	Further in the gallery was the huge skeleton barrel of a Brontosaurus.	Further in the gallery was the huge skeleton barrel of a Brontosaurus.
2562_133442_000004_000006	My museum hypothesis was confirmed.	My museum hypothesis was confirmed.
2562_133442_000004_000007	Going towards the side I found what appeared to be sloping shelves, and clearing away the thick dust, I found the old familiar glass cases of our own time.	Going towards the side I found what appeared to be sloping shelves, and clearing away the thick dust, I found the old familiar glass cases of our own time.
2562_133442_000004_000008	But they must have been air-tight to judge from the fair preservation of some of their contents.	But they must have been air tight to judge from the fair preservation of some of their contents.
2562_133442_000005_000000	'Clearly we stood among the ruins of some latter-day South Kensington!	'Clearly we stood among the ruins of some latter day South Kensington!
2562_133442_000005_000003	And the cases had in some instances been bodily removed--by the Morlocks as I judged.	And the cases had in some instances been bodily removed-by the Morlocks as I judged.
2562_133442_000005_000004	The place was very silent.	The place was very silent.
2562_133442_000005_000005	The thick dust deadened our footsteps.	The thick dust deadened our footsteps.
2562_133442_000005_000006	Weena, who had been rolling a sea urchin down the sloping glass of a case, presently came, as I stared about me, and very quietly took my hand and stood beside me.	Weena, who had been rolling a sea urchin down the sloping glass of a case, presently came, as I stared about me, and very quietly took my hand and stood beside me.
2562_133442_000006_000000	'And at first I was so much surprised by this ancient monument of an intellectual age, that I gave no thought to the possibilities it presented.	'And at first I was so much surprised by this ancient monument of an intellectual age, that I gave no thought to the possibilities it presented.
2562_133442_000006_000001	Even my preoccupation about the Time Machine receded a little from my mind.	Even my preoccupation about the Time Machine receded a little from my mind.
2562_133442_000007_000000	'To judge from the size of the place, this Palace of Green Porcelain had a great deal more in it than a Gallery of Palaeontology; possibly historical galleries; it might be, even a library!	'To judge from the size of the place, this Palace of Green Porcelain had a great deal more in it than a Gallery of Palaeontology; possibly historical galleries; it might be, even a library!
2562_133442_000007_000001	To me, at least in my present circumstances, these would be vastly more interesting than this spectacle of oldtime geology in decay. Exploring, I found another short gallery running transversely to the first.	To me, at least in my present circumstances, these would be vastly more interesting than this spectacle of oldtime geology in decay. Exploring, I found another short gallery running transversely to the first.
2562_133442_000007_000002	This appeared to be devoted to minerals, and the sight of a block of sulphur set my mind running on gunpowder.	This appeared to be devoted to minerals, and the sight of a block of sulphur set my mind running on gunpowder.
2562_133442_000007_000003	But I could find no saltpeter; indeed, no nitrates of any kind.	But I could find no saltpeter; indeed, no nitrates of any kind.
2562_133442_000007_000004	Doubtless they had deliquesced ages ago.	Doubtless they had deliquesced ages ago.
2562_133442_000007_000005	Yet the sulphur hung in my mind, and set up a train of thinking.	Yet the sulphur hung in my mind, and set up a train of thinking.
2562_133442_000007_000006	As for the rest of the contents of that gallery, though on the whole they were the best preserved of all I saw, I had little interest.	As for the rest of the contents of that gallery, though on the whole they were the best preserved of all I saw, I had little interest.
2562_133442_000007_000007	I am no specialist in mineralogy, and I went on down a very ruinous aisle running parallel to the first hall I had entered.	I am no specialist in mineralogy, and I went on down a very ruinous aisle running parallel to the first hall I had entered.
2562_133442_000007_000008	Apparently this section had been devoted to natural history, but everything had long since passed out of recognition.	Apparently this section had been devoted to natural history, but everything had long since passed out of recognition.
2562_133442_000007_000010	I was sorry for that, because I should have been glad to trace the patent readjustments by which the conquest of animated nature had been attained.	I was sorry for that, because I should have been glad to trace the patent readjustments by which the conquest of animated nature had been attained.
2562_133442_000007_000011	Then we came to a gallery of simply colossal proportions, but singularly ill-lit, the floor of it running downward at a slight angle from the end at which I entered.	Then we came to a gallery of simply colossal proportions, but singularly ill lit, the floor of it running downward at a slight angle from the end at which I entered.
2562_133442_000007_000012	At intervals white globes hung from the ceiling--many of them cracked and smashed--which suggested that originally the place had been artificially lit.	At intervals white globes hung from the ceiling-many of them cracked and smashed-which suggested that originally the place had been artificially lit.
2562_133442_000007_000013	Here I was more in my element, for rising on either side of me were the huge bulks of big machines, all greatly corroded and many broken down, but some still fairly complete.	Here I was more in my element, for rising on either side of me were the huge bulks of big machines, all greatly corroded and many broken down, but some still fairly complete.
2562_133442_000007_000014	You know I have a certain weakness for mechanism, and I was inclined to linger among these; the more so as for the most part they had the interest of puzzles, and I could make only the vaguest guesses at what they were for.	You know I have a certain weakness for mechanism, and I was inclined to linger among these; the more so as for the most part they had the interest of puzzles, and I could make only the vaguest guesses at what they were for.
2562_133442_000008_000000	'Suddenly Weena came very close to my side.	'Suddenly Weena came very close to my side.
2562_133442_000008_000001	So suddenly that she startled me.	So suddenly that she startled me.
2562_133442_000008_000002	Had it not been for her I do not think I should have noticed that the floor of the gallery sloped at all.	Had it not been for her I do not think I should have noticed that the floor of the gallery sloped at all.
2562_133442_000008_000004	As you went down the length, the ground came up against these windows, until at last there was a pit like the "area" of a London house before each, and only a narrow line of daylight at the top.	As you went down the length, the ground came up against these windows, until at last there was a pit like the "area" of a London house before each, and only a narrow line of daylight at the top.
2562_133442_000008_000006	Then I saw that the gallery ran down at last into a thick darkness.	Then I saw that the gallery ran down at last into a thick darkness.
2562_133442_000008_000008	Further away towards the dimness, it appeared to be broken by a number of small narrow footprints.	Further away towards the dimness, it appeared to be broken by a number of small narrow footprints.
2562_133442_000008_000009	My sense of the immediate presence of the Morlocks revived at that. I felt that I was wasting my time in the academic examination of machinery.	My sense of the immediate presence of the Morlocks revived at that. I felt that I was wasting my time in the academic examination of machinery.
2562_133442_000008_000011	And then down in the remote blackness of the gallery I heard a peculiar pattering, and the same odd noises I had heard down the well.	And then down in the remote blackness of the gallery I heard a peculiar pattering, and the same odd noises I had heard down the well.
2562_133442_000009_000000	'I took Weena's hand.	'I took Weena's hand.
2562_133442_000009_000001	Then, struck with a sudden idea, I left her and turned to a machine from which projected a lever not unlike those in a signal-box.	Then, struck with a sudden idea, I left her and turned to a machine from which projected a lever not unlike those in a signal box.
2562_133442_000009_000002	Clambering upon the stand, and grasping this lever in my hands, I put all my weight upon it sideways.	Clambering upon the stand, and grasping this lever in my hands, I put all my weight upon it sideways.
2562_133442_000009_000003	Suddenly Weena, deserted in the central aisle, began to whimper.	Suddenly Weena, deserted in the central aisle, began to whimper.
2562_133442_000009_000005	And I longed very much to kill a Morlock or so.	And I longed very much to kill a Morlock or so.
2562_133442_000009_000006	Very inhuman, you may think, to want to go killing one's own descendants!	Very inhuman, you may think, to want to go killing one's own descendants!
2562_133442_000009_000007	But it was impossible, somehow, to feel any humanity in the things.	But it was impossible, somehow, to feel any humanity in the things.
2562_133442_000009_000008	Only my disinclination to leave Weena, and a persuasion that if I began to slake my thirst for murder my Time Machine might suffer, restrained me from going straight down the gallery and killing the brutes I heard.	Only my disinclination to leave Weena, and a persuasion that if I began to slake my thirst for murder my Time Machine might suffer, restrained me from going straight down the gallery and killing the brutes I heard.
2562_133442_000010_000000	'Well, mace in one hand and Weena in the other, I went out of that gallery and into another and still larger one, which at the first glance reminded me of a military chapel hung with tattered flags. The brown and charred rags that hung from the sides of it, I presently recognized as the decaying vestiges of books.	'Well, mace in one hand and Weena in the other, I went out of that gallery and into another and still larger one, which at the first glance reminded me of a military chapel hung with tattered flags. The brown and charred rags that hung from the sides of it, I presently recognized as the decaying vestiges of books.
2562_133442_000010_000001	They had long since dropped to pieces, and every semblance of print had left them.	They had long since dropped to pieces, and every semblance of print had left them.
2562_133442_000010_000003	Had I been a literary man I might, perhaps, have moralized upon the futility of all ambition. But as it was, the thing that struck me with keenest force was the enormous waste of labour to which this sombre wilderness of rotting paper testified.	Had I been a literary man I might, perhaps, have moralized upon the futility of all ambition. But as it was, the thing that struck me with keenest force was the enormous waste of labour to which this sombre wilderness of rotting paper testified.
2562_133442_000011_000000	'Then, going up a broad staircase, we came to what may once have been a gallery of technical chemistry.	'Then, going up a broad staircase, we came to what may once have been a gallery of technical chemistry.
2562_133442_000011_000001	And here I had not a little hope of useful discoveries.	And here I had not a little hope of useful discoveries.
2562_133442_000011_000002	Except at one end where the roof had collapsed, this gallery was well preserved.	Except at one end where the roof had collapsed, this gallery was well preserved.
2562_133442_000011_000003	I went eagerly to every unbroken case.	I went eagerly to every unbroken case.
2562_133442_000011_000004	And at last, in one of the really air-tight cases, I found a box of matches.	And at last, in one of the really air tight cases, I found a box of matches.
2562_133442_000011_000005	Very eagerly I tried them.	Very eagerly I tried them.
2562_133442_000011_000006	They were perfectly good.	They were perfectly good.
2562_133442_000011_000008	I turned to Weena.	I turned to Weena.
2562_133442_000011_000009	"Dance," I cried to her in her own tongue.	"Dance," I cried to her in her own tongue.
2562_133442_000011_000010	For now I had a weapon indeed against the horrible creatures we feared.	For now I had a weapon indeed against the horrible creatures we feared.
2562_133442_000011_000013	For I am naturally inventive, as you know.	For I am naturally inventive, as you know.
2562_133442_000012_000000	'Now, I still think that for this box of matches to have escaped the wear of time for immemorial years was a most strange, as for me it was a most fortunate thing.	'Now, I still think that for this box of matches to have escaped the wear of time for immemorial years was a most strange, as for me it was a most fortunate thing.
2562_133442_000012_000001	Yet, oddly enough, I found a far unlikelier substance, and that was camphor.	Yet, oddly enough, I found a far unlikelier substance, and that was camphor.
2562_133442_000012_000004	In the universal decay this volatile substance had chanced to survive, perhaps through many thousands of centuries.	In the universal decay this volatile substance had chanced to survive, perhaps through many thousands of centuries.
2562_133442_000012_000006	I was about to throw it away, but I remembered that it was inflammable and burned with a good bright flame--was, in fact, an excellent candle--and I put it in my pocket.	I was about to throw it away, but I remembered that it was inflammable and burned with a good bright flame-was, in fact, an excellent candle-and I put it in my pocket.
2562_133442_000012_000007	I found no explosives, however, nor any means of breaking down the bronze doors.	I found no explosives, however, nor any means of breaking down the bronze doors.
2562_133442_000012_000008	As yet my iron crowbar was the most helpful thing I had chanced upon.	As yet my iron crowbar was the most helpful thing I had chanced upon.
2562_133442_000012_000009	Nevertheless I left that gallery greatly elated.	Nevertheless I left that gallery greatly elated.
2562_133442_000013_000001	It would require a great effort of memory to recall my explorations in at all the proper order.	It would require a great effort of memory to recall my explorations in at all the proper order.
2562_133442_000013_000002	I remember a long gallery of rusting stands of arms, and how I hesitated between my crowbar and a hatchet or a sword.	I remember a long gallery of rusting stands of arms, and how I hesitated between my crowbar and a hatchet or a sword.
2562_133442_000013_000003	I could not carry both, however, and my bar of iron promised best against the bronze gates.	I could not carry both, however, and my bar of iron promised best against the bronze gates.
2562_133442_000013_000005	The most were masses of rust, but many were of some new metal, and still fairly sound.	The most were masses of rust, but many were of some new metal, and still fairly sound.
2562_133442_000013_000006	But any cartridges or powder there may once have been had rotted into dust.	But any cartridges or powder there may once have been had rotted into dust.
2562_133442_000013_000007	One corner I saw was charred and shattered; perhaps, I thought, by an explosion among the specimens.	One corner I saw was charred and shattered; perhaps, I thought, by an explosion among the specimens.
2562_133442_000014_000000	'As the evening drew on, my interest waned.	'As the evening drew on, my interest waned.
2562_133442_000014_000001	I went through gallery after gallery, dusty, silent, often ruinous, the exhibits sometimes mere heaps of rust and lignite, sometimes fresher.	I went through gallery after gallery, dusty, silent, often ruinous, the exhibits sometimes mere heaps of rust and lignite, sometimes fresher.
2562_133442_000014_000002	In one place I suddenly found myself near the model of a tin-mine, and then by the merest accident I discovered, in an air-tight case, two dynamite cartridges!	In one place I suddenly found myself near the model of a tin mine, and then by the merest accident I discovered, in an air tight case, two dynamite cartridges!
2562_133442_000014_000003	I shouted "Eureka!" and smashed the case with joy.	I shouted "Eureka!" and smashed the case with joy.
2562_133442_000014_000004	Then came a doubt.	Then came a doubt.
2562_133442_000014_000005	I hesitated.	I hesitated.
2562_133442_000014_000006	Then, selecting a little side gallery, I made my essay.	Then, selecting a little side gallery, I made my essay.
2562_133442_000014_000007	I never felt such a disappointment as I did in waiting five, ten, fifteen minutes for an explosion that never came. Of course the things were dummies, as I might have guessed from their presence.	I never felt such a disappointment as I did in waiting five, ten, fifteen minutes for an explosion that never came. Of course the things were dummies, as I might have guessed from their presence.
2562_133442_000014_000008	I really believe that had they not been so, I should have rushed off incontinently and blown Sphinx, bronze doors, and (as it proved) my chances of finding the Time Machine, all together into non-existence.	I really believe that had they not been so, I should have rushed off incontinently and blown Sphinx, bronze doors, and (as it proved) my chances of finding the Time Machine, all together into non existence.
2562_133442_000015_000000	'It was after that, I think, that we came to a little open court within the palace.	'It was after that, I think, that we came to a little open court within the palace.
2562_133442_000015_000001	It was turfed, and had three fruit-trees.	It was turfed, and had three fruit trees.
2562_133442_000015_000003	Towards sunset I began to consider our position.	Towards sunset I began to consider our position.
2562_133442_000015_000005	But that troubled me very little now.	But that troubled me very little now.
2562_133442_000015_000006	I had in my possession a thing that was, perhaps, the best of all defences against the Morlocks--I had matches!	I had in my possession a thing that was, perhaps, the best of all defences against the Morlocks-I had matches!
2562_133442_000015_000007	I had the camphor in my pocket, too, if a blaze were needed.	I had the camphor in my pocket, too, if a blaze were needed.
2562_133442_000015_000008	It seemed to me that the best thing we could do would be to pass the night in the open, protected by a fire.	It seemed to me that the best thing we could do would be to pass the night in the open, protected by a fire.
2562_133442_000015_000009	In the morning there was the getting of the Time Machine.	In the morning there was the getting of the Time Machine.
2562_133442_000015_000010	Towards that, as yet, I had only my iron mace.	Towards that, as yet, I had only my iron mace.
2562_133442_000015_000011	But now, with my growing knowledge, I felt very differently towards those bronze doors.	But now, with my growing knowledge, I felt very differently towards those bronze doors.
2562_133442_000015_000012	Up to this, I had refrained from forcing them, largely because of the mystery on the other side.	Up to this, I had refrained from forcing them, largely because of the mystery on the other side.
