5740_97593_000060_000002	Now both my pretty quilt and your beautiful doll-baby are spoiled."	Now both my pretty quilt and your beautiful doll baby are spoiled."	false	587.295	591.34	21.78919
5740_97593_000061_000000	That was all Aunt Hannah had said.	That was all Aunt Hannah had said.	true	591.53	593.355	20
5740_97593_000061_000001	She thought she would send John after the quilt and the doll-baby next morning as soon as it was light.	She thought she would send john after the quilt and the doll baby next morning as soon as it was light.	true	593.355	598.41	14
5740_97593_000062_000000	But Jimmy Scarecrow was gone, and the crazy quilt and the doll-baby with him.	But Jimmy Scarecrow was gone, and the crazy quilt and the doll baby with him.	false	598.41	603.045	25.332964
5740_97593_000062_000001	John, the servant-man, searched everywhere, but not a trace of them could he find.	john, the servant man, searched everywhere, but not a trace of them could he find.	true	603.045	608.2	20.886938
5740_97593_000062_000002	"They must have all blown away, mum," he said to Aunt Hannah.	"They must have all blown away, mum," he said to Aunt Hannah.	true	608.36	611.415	16.264284
5740_97593_000063_000000	"We shall have to have another scarecrow next summer," said she.	"We shall have to have another scarecrow next summer," said she.	true	611.415	614.535	19
5740_97593_000064_000000	But the next summer there was no need of a scarecrow, for not a crow came past the fence-post on which Santa Claus had written his notice to crows.	But the next summer there was no need of a scarecrow, for not a crow came past the fence post on which Santa Claus had written his notice to crows.	true	614.535	621.435	21
5740_97593_000064_000001	The cornfield was never so beautiful, and not a single grain was stolen by a crow, and everybody wondered at it, for they could not read the crow-language in which Santa had written.	The cornfield was never so beautiful, and not a single grain was stolen by a crow, and everybody wondered at it, for they could not read the crow language in which Santa had written.	true	621.435	630.735	17
5740_97593_000065_000000	"It is a great mystery to me why the crows don't come into our cornfield, when there is no scarecrow," said Aunt Hannah.	"It is a great mystery to me why the crows don't come into our cornfield, when there is no scarecrow," said Aunt Hannah.	true	630.735	636.34	15
5740_97593_000066_000000	But she had a still greater mystery to solve when Christmas came round again.	But she had a still greater mystery to solve when Christmas came round again.	false	636.77	640.68	17
5740_97593_000066_000001	Then she and Betsey had each a strange present.	Then she and Betsey had each a strange present.	true	640.68	643.215	20
5740_97593_000066_000002	They found them in the sitting-room on Christmas morning.	They found them in the sitting room on Christmas morning.	true	643.215	646.11	12
5740_97593_000066_000003	Aunt Hannah's present was her old crazy quilt, remodelled, with every piece cut square and true, and matched exactly to its neighbour.	Aunt Hannah's present was her old crazy quilt, remodelled, with every piece cut square and true, and matched exactly to its neighbour.	false	646.11	653.34	23
5740_97593_000067_000000	"Why, it's my old crazy quilt, but it isn't crazy now!" cried Aunt Hannah, and her very spectacles seemed to glisten with amazement.	"Why, it's my old crazy quilt, but it isn't crazy now!" cried Aunt Hannah, and her very spectacles seemed to glisten with amazement.	true	653.34	660.735	20
5740_97593_000068_000000	Betsey's present was her doll-baby of the Christmas before; but the doll was a year older.	Betsey's present was her doll baby of the Christmas before; but the doll was a year older.	false	660.735	665.145	20
5740_97593_000068_000001	She had grown an inch, and could walk and say, "mamma," and "how do?" She was changed a good deal, but Betsey knew her at once.	She had grown an inch, and could walk and say, "mamma," and "how do?" She was changed a good deal, but Betsey knew her at once.	true	665.145	671.92	17
5740_97593_000068_000002	"It's my doll-baby!" she cried, and snatched her up and kissed her.	"It's my doll baby!" she cried, and snatched her up and kissed her.	true	672.02	675.06	23
5740_97593_000069_000000	But neither Aunt Hannah nor Betsey ever knew that the quilt and the doll were Jimmy Scarecrow's Christmas presents to them.	But neither Aunt Hannah nor Betsey ever knew that the quilt and the doll were Jimmy Scarecrow's Christmas presents to them.	false	675.06	693.33	18.952177
