5519_39481_000038_000004	With all this Mr. Tebrick so worked upon himself that for the time being he had lost his reason.	With all this mr Tebrick so worked upon himself that for the time being he had lost his reason.	true	603.62	608.05	18
5519_39481_000038_000005	Black was white and white black, and he was resolved that on the morrow he would dig the vile brood of foxes out and shoot them, and so free himself at last from this hellish plague.	Black was white and white black, and he was resolved that on the morrow he would dig the vile brood of foxes out and shoot them, and so free himself at last from this hellish plague.	false	608.39	616.75	19.166908
5519_39481_000039_000000	All that night he was in this mood, and in agony, as if he had broken in the crown of a tooth and bitten on the nerve.	All that night he was in this mood, and in agony, as if he had broken in the crown of a tooth and bitten on the nerve.	true	616.88	623.17	20.378172
5519_39481_000039_000001	But as all things will have an ending so at last Mr. Tebrick, worn out and wearied by this loathed passion of jealousy, fell into an uneasy and tormented sleep.	But as all things will have an ending so at last mr Tebrick, worn out and wearied by this loathed passion of jealousy, fell into an uneasy and tormented sleep.	false	623.48	631.71	18
5519_39481_000040_000000	After an hour or two the procession of confused and jumbled images which first assailed him passed away and subsided into one clear and powerful dream.	After an hour or two the procession of confused and jumbled images which first assailed him passed away and subsided into one clear and powerful dream.	false	631.71	633.93	13.644501
5519_39481_000040_000001	His wife was with him in her own proper shape, walking as they had been on that fatal day before her transformation.	His wife was with him in her own proper shape, walking as they had been on that fatal day before her transformation.	false	633.93	634.74	18.534796
5519_39481_000040_000002	Yet she was changed too, for in her face there were visible tokens of unhappiness, her face swollen with crying, pale and downcast, her hair hanging in disorder, her damp hands wringing a small handkerchief into a ball, her whole body shaken with sobs, and an air of long neglect about her person.	Yet she was changed too, for in her face there were visible tokens of unhappiness, her face swollen with crying, pale and downcast, her hair hanging in disorder, her damp hands wringing a small handkerchief into a ball, her whole body shaken with sobs, and an air of long neglect about her person.	false	634.74	636.66	9
5519_39481_000040_000003	Between her sobs she was confessing to him some crime which she had committed, but he did not catch the broken words, nor did he wish to hear them, for he was dulled by his sorrow.	Between her sobs she was confessing to him some crime which she had committed, but he did not catch the broken words, nor did he wish to hear them, for he was dulled by his sorrow.	false	636.66	637.98	-20
5519_39481_000040_000004	So they continued walking together in sadness as it were for ever, he with his arm about her waist, she turning her head to him and often casting her eyes down in distress.	So they continued walking together in sadness as it were for ever, he with his arm about her waist, she turning her head to him and often casting her eyes down in distress.	false	637.98	639.21	-20
