2074_159371_000002_000000	THERE was once upon a time a king who was passionately fond of a princess; but she could not be married, because she was enchanted.	THERE was once upon a time a king who was passionately fond of a princess; but she could not be married, because she was enchanted.
2074_159371_000002_000001	He went to consult a fairy, to ascertain what he ought to do to make the Princess love him.	He went to consult a fairy, to ascertain what he ought to do to make the Princess love him.
2074_159371_000002_000002	The fairy said to him, "You know that the Princess has a large cat, of which she is very fond; well, she can marry that person only who can succeed in treading on her cat's tail." The King said to himself, "That will not be very difficult to accomplish"; and he quitted the fairy, determined rather to crush the cat's tail than to fail in treading on it.	The fairy said to him, "You know that the Princess has a large cat, of which she is very fond; well, she can marry that person only who can succeed in treading on her cat's tail." The King said to himself, "That will not be very difficult to accomplish"; and he quitted the fairy, determined rather to crush the cat's tail than to fail in treading on it.
2074_159371_000002_000003	He hastened to his mistress's palace; Master Puss came to meet him, very consequentially, as was his wont; the King lifted up his foot, but when he thought to have put it on the cat's tail, Puss turned round so quickly that he trod on nothing but the floor.	He hastened to his mistress's palace; Master Puss came to meet him, very consequentially, as was his wont; the King lifted up his foot, but when he thought to have put it on the cat's tail, Puss turned round so quickly that he trod on nothing but the floor.
2074_159371_000002_000004	He was a week trying to tread on this fatal tail, which appeared to be full of quicksilver, for it was continually moving.	He was a week trying to tread on this fatal tail, which appeared to be full of quicksilver, for it was continually moving.
2074_159371_000002_000005	But, at last, the King had the good fortune to surprise Master Puss while he was asleep, and trod upon his tail with all his weight.	But, at last, the King had the good fortune to surprise Master Puss while he was asleep, and trod upon his tail with all his weight.
2074_159371_000002_000006	Puss awakened, mewing horribly, and immediately took the shape of a tall man, who, looking at the King with eyes full of anger, said to him: "You may now marry the Princess, since you have dissolved the enchantment which prevented you; but I will be revenged.	Puss awakened, mewing horribly, and immediately took the shape of a tall man, who, looking at the King with eyes full of anger, said to him: "You may now marry the Princess, since you have dissolved the enchantment which prevented you; but I will be revenged.
2074_159371_000002_000007	You shall have a son who will always be unfortunate until the time when he shall become aware that his nose is too long; and, if you take any umbrage at what I threaten, you shall immediately be put to death."	You shall have a son who will always be unfortunate until the time when he shall become aware that his nose is too long; and, if you take any umbrage at what I threaten, you shall immediately be put to death."
2074_159371_000004_000000	Although the King was frightened at the sight of this tall man, who was an enchanter, he could not help laughing at his threat.	Although the King was frightened at the sight of this tall man, who was an enchanter, he could not help laughing at his threat.
2074_159371_000004_000001	"If my son's nose should be too long," said he to himself, "unless he should be either blind or silly, he will certainly be able to see or feel it." When the enchanter had disappeared, the King went to find the Princess, who consented to marry him.	"If my son's nose should be too long," said he to himself, "unless he should be either blind or silly, he will certainly be able to see or feel it." When the enchanter had disappeared, the King went to find the Princess, who consented to marry him.
2074_159371_000004_000002	However, he did not live long with her, for he died eight months after the wedding.	However, he did not live long with her, for he died eight months after the wedding.
2074_159371_000004_000003	Shortly after his death, the Queen gave birth to a young Prince, who was called Desire.	Shortly after his death, the Queen gave birth to a young Prince, who was called Desire.
2074_159371_000004_000005	The Queen was inconsolable when she saw this large nose; but the ladies who were with her told her that the nose was not so large as it appeared to her to be; that it was a Roman nose, and that history averred that all heroes had large noses.	The Queen was inconsolable when she saw this large nose; but the ladies who were with her told her that the nose was not so large as it appeared to her to be; that it was a Roman nose, and that history averred that all heroes had large noses.
2074_159371_000004_000006	The Queen, who loved her son to excess, was charmed with this discourse; and, by continually looking at Desire, his nose no longer appeared to be so very long.	The Queen, who loved her son to excess, was charmed with this discourse; and, by continually looking at Desire, his nose no longer appeared to be so very long.
2074_159371_000004_000007	The Prince was brought up very carefully; and, as soon as he could speak, all kinds of shocking stories were told him of people who had short noses.	The Prince was brought up very carefully; and, as soon as he could speak, all kinds of shocking stories were told him of people who had short noses.
2074_159371_000004_000009	When he became old enough to understand it, he was instructed in history; and, whenever any great prince or handsome princess was mentioned to him, he or she was always spoken of as having a long nose.	When he became old enough to understand it, he was instructed in history; and, whenever any great prince or handsome princess was mentioned to him, he or she was always spoken of as having a long nose.
2074_159371_000004_000010	The room was hung round with pictures in which all the figures had large noses; and Desire grew so accustomed to regard length of nose as an ornament, that he would not for an empire have parted with an atom of his.	The room was hung round with pictures in which all the figures had large noses; and Desire grew so accustomed to regard length of nose as an ornament, that he would not for an empire have parted with an atom of his.
2074_159371_000004_000011	When he had reached the age of twenty, it was thought expedient for him to marry; and the portraits of various princesses were submitted to him.	When he had reached the age of twenty, it was thought expedient for him to marry; and the portraits of various princesses were submitted to him.
2074_159371_000004_000012	He was in raptures with that of Mignonetta, the daughter of a great king, and heiress to several kingdoms; of the kingdoms, however, Desire thought not at all, he was so much struck with her beauty.	He was in raptures with that of Mignonetta, the daughter of a great king, and heiress to several kingdoms; of the kingdoms, however, Desire thought not at all, he was so much struck with her beauty.
2074_159371_000005_000000	The Princess Mignonetta, although he was thus charmed with her, had a little turned-up nose which harmonized admirably with her other features, but which very much perplexed the courtiers.	The Princess Mignonetta, although he was thus charmed with her, had a little turned up nose which harmonized admirably with her other features, but which very much perplexed the courtiers.
2074_159371_000005_000001	They had acquired such a habit of ridiculing small noses, that they sometimes could not forbear laughing at that of the Princess; but Desire would not suffer a jest on this subject; and he banished two courtiers from his presence, who dared to make insinuations against Mignonetta's nose.	They had acquired such a habit of ridiculing small noses, that they sometimes could not forbear laughing at that of the Princess; but Desire would not suffer a jest on this subject; and he banished two courtiers from his presence, who dared to make insinuations against Mignonetta's nose.
2074_159371_000006_000002	The horse presently came to a large plain, which he traversed the whole day without seeing a single house.	The horse presently came to a large plain, which he traversed the whole day without seeing a single house.
2074_159371_000006_000003	Both horse and rider were ready to die with hunger; at last, as night was about to set in, they discovered a cave in which a light was burning. Desire entered, and saw a little old woman, who appeared to be more than a hundred years old.	Both horse and rider were ready to die with hunger; at last, as night was about to set in, they discovered a cave in which a light was burning. Desire entered, and saw a little old woman, who appeared to be more than a hundred years old.
2074_159371_000006_000004	She put on her spectacles to look at the Prince; but she was a long time adjusting them, for her nose was too short.	She put on her spectacles to look at the Prince; but she was a long time adjusting them, for her nose was too short.
2074_159371_000007_000000	"With all my heart," answered the fairy.	"With all my heart," answered the fairy.
2074_159371_000007_000001	"Although your nose is ridiculous, you are not the less the son of my best friend.	"Although your nose is ridiculous, you are not the less the son of my best friend.
2074_159371_000007_000002	I loved the King, your father, like my own brother; but he had a very handsome nose." "And what is there wanting in mine?" asked Desire.	I loved the King, your father, like my own brother; but he had a very handsome nose." "And what is there wanting in mine?" asked Desire.
2074_159371_000007_000004	I was saying, then, that I was your father's friend; at that time he frequently came to see me; and you must know that in those days I was very pretty; your father told me so.	I was saying, then, that I was your father's friend; at that time he frequently came to see me; and you must know that in those days I was very pretty; your father told me so.
2074_159371_000007_000007	A long tongue is still more insufferable than a large nose; and I remember, when I was young, that I was admired for not being a great talker; the Queen, my mother, used frequently to have it mentioned to her; for, such as you see me, I am a great king's daughter.	A long tongue is still more insufferable than a large nose; and I remember, when I was young, that I was admired for not being a great talker; the Queen, my mother, used frequently to have it mentioned to her; for, such as you see me, I am a great king's daughter.
2074_159371_000007_000008	My father--" "Your father ate when he was hungry," said the Prince, interrupting her.	My father-" "Your father ate when he was hungry," said the Prince, interrupting her.
2074_159371_000007_000010	He checked himself, however, for he wanted something of the fairy, and said: "I know that the pleasure I should take in listening to you would make me forget my own hunger; but my horse, who will not understand you, is in need of some food." This compliment made the fairy blush prettily.	He checked himself, however, for he wanted something of the fairy, and said: "I know that the pleasure I should take in listening to you would make me forget my own hunger; but my horse, who will not understand you, is in need of some food." This compliment made the fairy blush prettily.
2074_159371_000007_000012	One must be very stupid not to perceive one's own defects; that comes of her being born a princess: flatterers have spoiled her, and persuaded her that she is a little talker."	One must be very stupid not to perceive one's own defects; that comes of her being born a princess: flatterers have spoiled her, and persuaded her that she is a little talker."
2074_159371_000008_000000	While that was passing in the Prince's mind, the servants laid the table; and the Prince wondered at the fairy, who kept asking them a thousand questions, solely to have the pleasure of talking: he was especially surprised at a waiting woman, who, in everything that she saw, praised her mistress for her discretion.	While that was passing in the Prince's mind, the servants laid the table; and the Prince wondered at the fairy, who kept asking them a thousand questions, solely to have the pleasure of talking: he was especially surprised at a waiting woman, who, in everything that she saw, praised her mistress for her discretion.
2074_159371_000008_000003	With regard to himself, he did not say a word, but ate away as fast as he could. "Prince," said the fairy to him, when he began to be satisfied, "move a little I entreat you; your nose makes so large a shadow that it prevents me from seeing what is on my plate.	With regard to himself, he did not say a word, but ate away as fast as he could. "Prince," said the fairy to him, when he began to be satisfied, "move a little I entreat you; your nose makes so large a shadow that it prevents me from seeing what is on my plate.
2074_159371_000008_000006	In my time they used to go on the same day to the promenade, to the assembly, to the theater, to the ball--But how long your nose is!	In my time they used to go on the same day to the promenade, to the assembly, to the theater, to the ball-But how long your nose is!
2074_159371_000008_000007	I cannot grow used to it." "In truth, madam," answered Desire, "do not say any more about my nose; it is as it is, and in what does it concern you?	I cannot grow used to it." "In truth, madam," answered Desire, "do not say any more about my nose; it is as it is, and in what does it concern you?
2074_159371_000009_000000	Desire, who had finished his supper, grew so tired of the fairy's tedious prattle about his nose that he sprang on his horse and rode away from the cavern.	Desire, who had finished his supper, grew so tired of the fairy's tedious prattle about his nose that he sprang on his horse and rode away from the cavern.
2074_159371_000009_000001	He continued his journey; and wherever he went, he thought that everybody was mad, for everybody talked about his nose; nevertheless, he had been so accustomed to hear it asserted that his nose was handsome, that he could not reconcile to himself the idea that it was too long.	He continued his journey; and wherever he went, he thought that everybody was mad, for everybody talked about his nose; nevertheless, he had been so accustomed to hear it asserted that his nose was handsome, that he could not reconcile to himself the idea that it was too long.
2074_159371_000010_000000	The old fairy, who wished to do him a service in spite of himself, determined to shut up Mignonetta in a crystal palace, and place this palace in the Prince's road.	The old fairy, who wished to do him a service in spite of himself, determined to shut up Mignonetta in a crystal palace, and place this palace in the Prince's road.
2074_159371_000010_000001	Desire, transported with joy, strove to break it; but he could not succeed: in despair, he wished to approach near it, so as at least to speak to the Princess, who, on her part, stretched her hand close to the crystal wall of the palace.	Desire, transported with joy, strove to break it; but he could not succeed: in despair, he wished to approach near it, so as at least to speak to the Princess, who, on her part, stretched her hand close to the crystal wall of the palace.
2074_159371_000010_000002	He was very anxious to kiss her hand; but turn his head which way he would, he could not place his mouth near it, his nose constantly preventing him.	He was very anxious to kiss her hand; but turn his head which way he would, he could not place his mouth near it, his nose constantly preventing him.
2074_159371_000010_000005	In this way self-love conceals from us all the defects of our minds and bodies.	In this way self love conceals from us all the defects of our minds and bodies.
2074_159371_000010_000006	In vain reason endeavors to unveil them to us; we can never perceive them until the same self-love that blinds us to them finds them to be opposed to its interests." Desire, whose nose had become an ordinary nose, profited by this lesson.	In vain reason endeavors to unveil them to us; we can never perceive them until the same self love that blinds us to them finds them to be opposed to its interests." Desire, whose nose had become an ordinary nose, profited by this lesson.
