1028_133393_000002_000000	The gates of the Monastery stood wide open, the world lay beyond, and all was ready for departure.	The gates of the Monastery stood wide open, the world lay beyond, and all was ready for departure.
1028_133393_000002_000001	Baron Conrad and his men-at-arms sat foot in stirrup, the milk-white horse that had been brought for Otto stood waiting for him beside his father's great charger.	Baron Conrad and his men at arms sat foot in stirrup, the milk white horse that had been brought for Otto stood waiting for him beside his father's great charger.
1028_133393_000003_000000	"Farewell, Otto," said the good old Abbot, as he stooped and kissed the boy's cheek.	"Farewell, Otto," said the good old Abbot, as he stooped and kissed the boy's cheek.
1028_133393_000004_000000	"Farewell," answered Otto, in his simple, quiet way, and it brought a pang to the old man's heart that the child should seem to grieve so little at the leave-taking.	"Farewell," answered Otto, in his simple, quiet way, and it brought a pang to the old man's heart that the child should seem to grieve so little at the leave taking.
1028_133393_000005_000000	"Farewell, Otto," said the brethren that stood about, "farewell, farewell."	"Farewell, Otto," said the brethren that stood about, "farewell, farewell."
1028_133393_000006_000000	Then poor brother John came forward and took the boy's hand, and looked up into his face as he sat upon his horse.	Then poor brother john came forward and took the boy's hand, and looked up into his face as he sat upon his horse.
1028_133393_000006_000001	"We will meet again," said he, with his strange, vacant smile, "but maybe it will be in Paradise, and there perhaps they will let us lie in the father's belfry, and look down upon the angels in the court-yard below."	"We will meet again," said he, with his strange, vacant smile, "but maybe it will be in Paradise, and there perhaps they will let us lie in the father's belfry, and look down upon the angels in the court yard below."
1028_133393_000007_000000	"Aye," answered Otto, with an answering smile.	"Aye," answered Otto, with an answering smile.
1028_133393_000009_000000	Down the steep winding pathway they rode, and out into the great wide world beyond, upon which Otto and brother John had gazed so often from the wooden belfry of the White Cross on the hill.	Down the steep winding pathway they rode, and out into the great wide world beyond, upon which Otto and brother john had gazed so often from the wooden belfry of the White Cross on the hill.
1028_133393_000011_000000	"Nay," said Otto; "we had no horse to ride, but only to bring in the harvest or the grapes from the further vineyards to the vintage."	"Nay," said Otto; "we had no horse to ride, but only to bring in the harvest or the grapes from the further vineyards to the vintage."
1028_133393_000013_000000	"Nay," said Otto, with a smile, "I am not afeared."	"Nay," said Otto, with a smile, "I am not afeared."
1028_133393_000014_000001	But perhaps Otto's thought of fear and Baron Conrad's thought of fear were two very different matters.	But perhaps Otto's thought of fear and Baron Conrad's thought of fear were two very different matters.
1028_133393_000015_000000	The afternoon had passed by the time they had reached the end of their journey.	The afternoon had passed by the time they had reached the end of their journey.
1028_133393_000015_000001	Up the steep, stony path they rode to the drawbridge and the great gaping gateway of Drachenhausen, where wall and tower and battlement looked darker and more forbidding than ever in the gray twilight of the coming night.	Up the steep, stony path they rode to the drawbridge and the great gaping gateway of Drachenhausen, where wall and tower and battlement looked darker and more forbidding than ever in the gray twilight of the coming night.
1028_133393_000015_000002	Little Otto looked up with great, wondering, awe-struck eyes at this grim new home of his.	Little Otto looked up with great, wondering, awe struck eyes at this grim new home of his.
1028_133393_000016_000000	The next moment they clattered over the drawbridge that spanned the narrow black gulph between the roadway and the wall, and the next were past the echoing arch of the great gateway and in the gray gloaming of the paved court-yard within.	The next moment they clattered over the drawbridge that spanned the narrow black gulph between the roadway and the wall, and the next were past the echoing arch of the great gateway and in the gray gloaming of the paved court yard within.
1028_133393_000017_000000	Otto looked around upon the many faces gathered there to catch the first sight of the little baron; hard, rugged faces, seamed and weather-beaten; very different from those of the gentle brethren among whom he had lived, and it seemed strange to him that there was none there whom he should know.	Otto looked around upon the many faces gathered there to catch the first sight of the little baron; hard, rugged faces, seamed and weather beaten; very different from those of the gentle brethren among whom he had lived, and it seemed strange to him that there was none there whom he should know.
1028_133393_000018_000000	As he climbed the steep, stony steps to the door of the Baron's house, old Ursela came running down to meet him.	As he climbed the steep, stony steps to the door of the Baron's house, old Ursela came running down to meet him.
1028_133393_000018_000002	"My little child," she cried, and then fell to sobbing as though her heart would break.	"My little child," she cried, and then fell to sobbing as though her heart would break.
1028_133393_000020_000000	His new home was all very strange and wonderful to Otto; the armors, the trophies, the flags, the long galleries with their ranges of rooms, the great hall below with its vaulted roof and its great fireplace of grotesquely carved stone, and all the strange people with their lives and thoughts so different from what he had been used to know.	His new home was all very strange and wonderful to Otto; the armors, the trophies, the flags, the long galleries with their ranges of rooms, the great hall below with its vaulted roof and its great fireplace of grotesquely carved stone, and all the strange people with their lives and thoughts so different from what he had been used to know.
1028_133393_000021_000000	And it was a wonderful thing to explore all the strange places in the dark old castle; places where it seemed to Otto no one could have ever been before.	And it was a wonderful thing to explore all the strange places in the dark old castle; places where it seemed to Otto no one could have ever been before.
1028_133393_000023_000000	It was the chapel into which Otto had made his way, now long since fallen out of use excepting as a burial place of the race.	It was the chapel into which Otto had made his way, now long since fallen out of use excepting as a burial place of the race.
1028_133393_000024_000000	At another time he clambered up into the loft under the high peaked roof, where lay numberless forgotten things covered with the dim dust of years.	At another time he clambered up into the loft under the high peaked roof, where lay numberless forgotten things covered with the dim dust of years.
1028_133393_000024_000001	There a flock of pigeons had made their roost, and flapped noisily out into the sunlight when he pushed open the door from below. Here he hunted among the mouldering things of the past until, oh, joy of joys! in an ancient oaken chest he found a great lot of worm-eaten books, that had belonged to some old chaplain of the castle in days gone by.	There a flock of pigeons had made their roost, and flapped noisily out into the sunlight when he pushed open the door from below. Here he hunted among the mouldering things of the past until, oh, joy of joys! in an ancient oaken chest he found a great lot of worm eaten books, that had belonged to some old chaplain of the castle in days gone by.
1028_133393_000024_000002	They were not precious and beautiful volumes, such as the Father Abbot had showed him, but all the same they had their quaint painted pictures of the blessed saints and angels.	They were not precious and beautiful volumes, such as the Father Abbot had showed him, but all the same they had their quaint painted pictures of the blessed saints and angels.
1028_133393_000025_000000	Again, at another time, going into the court-yard, Otto had found the door of Melchior's tower standing invitingly open, for old Hilda, Schwartz Carl's wife, had come down below upon some business or other.	Again, at another time, going into the court yard, Otto had found the door of Melchior's tower standing invitingly open, for old Hilda, Schwartz Carl's wife, had come down below upon some business or other.
1028_133393_000026_000000	Then upon the shaky wooden steps Otto ran without waiting for a second thought, for he had often gazed at those curious buildings hanging so far up in the air, and had wondered what they were like.	Then upon the shaky wooden steps Otto ran without waiting for a second thought, for he had often gazed at those curious buildings hanging so far up in the air, and had wondered what they were like.
1028_133393_000026_000001	Round and round and up and up Otto climbed, until his head spun.	Round and round and up and up Otto climbed, until his head spun.
1028_133393_000026_000002	At last he reached a landing-stage, and gazing over the edge and down, beheld the stone pavement far, far below, lit by a faint glimmer of light that entered through the arched doorway.	At last he reached a landing stage, and gazing over the edge and down, beheld the stone pavement far, far below, lit by a faint glimmer of light that entered through the arched doorway.
1028_133393_000026_000003	Otto clutched tight hold of the wooden rail, he had no thought that he had climbed so far.	Otto clutched tight hold of the wooden rail, he had no thought that he had climbed so far.
1028_133393_000028_000000	Then Otto turned and crept down the stairs, frightened at the height to which he had climbed.	Then Otto turned and crept down the stairs, frightened at the height to which he had climbed.
1028_133393_000029_000000	At the doorway he met Mother Hilda.	At the doorway he met Mother Hilda.
1028_133393_000030_000000	Old Ursela seemed nearer to the boy than anyone else about the castle, excepting it was his father, and it was a newfound delight to Otto to sit beside her and listen to her quaint stories, so different from the monkish tales that he had heard and read at the monastery.	Old Ursela seemed nearer to the boy than anyone else about the castle, excepting it was his father, and it was a newfound delight to Otto to sit beside her and listen to her quaint stories, so different from the monkish tales that he had heard and read at the monastery.
1028_133393_000031_000000	But one day it was a tale of a different sort that she told him, and one that opened his eyes to what he had never dreamed of before.	But one day it was a tale of a different sort that she told him, and one that opened his eyes to what he had never dreamed of before.
1028_133393_000032_000000	The mellow sunlight fell through the window upon old Ursela, as she sat in the warmth with her distaff in her hands while Otto lay close to her feet upon a bear skin, silently thinking over the strange story of a brave knight and a fiery dragon that she had just told him.	The mellow sunlight fell through the window upon old Ursela, as she sat in the warmth with her distaff in her hands while Otto lay close to her feet upon a bear skin, silently thinking over the strange story of a brave knight and a fiery dragon that she had just told him.
1028_133393_000032_000001	Suddenly Ursela broke the silence.	Suddenly Ursela broke the silence.
1028_133393_000034_000000	"Nay," said Otto, "but tell me, Ursela, how it was."	"Nay," said Otto, "but tell me, Ursela, how it was."
1028_133393_000036_000000	Otto listened with eyes that grew wider and wider, though not all with wonder; he no longer lay upon the bear skin, but sat up with his hands clasped.	Otto listened with eyes that grew wider and wider, though not all with wonder; he no longer lay upon the bear skin, but sat up with his hands clasped.
1028_133393_000036_000001	For a moment or two after the old woman had ended her story, he sat staring silently at her.	For a moment or two after the old woman had ended her story, he sat staring silently at her.
1028_133393_000036_000002	Then he cried out, in a sharp voice, "And is this truth that you tell me, Ursela? and did my father seek to rob the towns people of their goods?"	Then he cried out, in a sharp voice, "And is this truth that you tell me, Ursela? and did my father seek to rob the towns people of their goods?"
1028_133393_000037_000002	Ah! me, those day's are all gone now." And she fetched a deep sigh.	Ah! me, those day's are all gone now." And she fetched a deep sigh.
1028_133393_000037_000003	"Then we lived in plenty and had both silks and linens and velvets besides in the store closets and were able to buy good wines and live in plenty upon the best.	"Then we lived in plenty and had both silks and linens and velvets besides in the store closets and were able to buy good wines and live in plenty upon the best.
1028_133393_000037_000005	But there is one comfort in it all, and that is that our good Baron paid back the score he owed the Trutz-Drachen people not only for that, but for all that they had done from the very first."	But there is one comfort in it all, and that is that our good Baron paid back the score he owed the Trutz Drachen people not only for that, but for all that they had done from the very first."
1028_133393_000039_000000	Poor little Otto had never dreamed that such cruelty and wickedness could be.	Poor little Otto had never dreamed that such cruelty and wickedness could be.
1028_133393_000039_000001	He listened to the old woman's story with gaping horror, and when the last came and she told him, with a smack of her lips, how his father had killed his enemy with his own hand, he gave a gasping cry and sprang to his feet.	He listened to the old woman's story with gaping horror, and when the last came and she told him, with a smack of her lips, how his father had killed his enemy with his own hand, he gave a gasping cry and sprang to his feet.
1028_133393_000040_000000	"Oh, father!" he cried, "oh, father!	"Oh, father!" he cried, "oh, father!
1028_133393_000041_000000	"Aye," said the Baron, grimly, "it is true enough, and I think me I have killed many more than one.	"Aye," said the Baron, grimly, "it is true enough, and I think me I have killed many more than one.
1028_133393_000041_000001	But what of that, Otto?	But what of that, Otto?
1028_133393_000043_000001	Once he reached out his hand as though to stroke the boy's hair, but drew it back again.	Once he reached out his hand as though to stroke the boy's hair, but drew it back again.
1028_133393_000044_000000	Turning angrily upon the old woman, "Ursela," said he, "thou must tell the child no more such stories as these; he knowest not at all of such things as yet.	Turning angrily upon the old woman, "Ursela," said he, "thou must tell the child no more such stories as these; he knowest not at all of such things as yet.
1028_133393_000045_000000	That night the father and son sat together beside the roaring fire in the great ball.	That night the father and son sat together beside the roaring fire in the great ball.
1028_133393_000046_000000	Otto looked for a while into his father's face.	Otto looked for a while into his father's face.
